,id,congress,chamber,rollnumber,voteview_id,voteview_id_1,voteview_id_2,date,year,month,day,session,clerk_rollnumber,yea_count,nay_count,nominate_mid_1,nominate_mid_2,nominate_spread_1,nominate_spread_2,nominate_log_likelihood,bill_number,vote_result,vote_desc,vote_question,dtl_desc,pap_description,pap_majortopic,pap_subtopic,majortopic,subtopic
1,242,80,1,118,RH0800118,"'RH0800118',","RH0800118,",4/30/48,1948,4,30,NA,NA,257,29,-0.343,-0.103,-0.183,-0.187,-75.879,HR5992,NA,NA,NA,HR 5992. TIDELANDS. CONFIRM AND ESTABLISH THE TITLES OF THE STATES TO LANDS BENEATH NAVIGABLE WATERS WITHIN STATE BOUNDARIES AND NATURAL RESOURCES WITHIN SUCH LANDS AND WATERS AND PROVIDE FOR THE USE AND CONTROL OF SAID LANDS AND RESOURCES. PASSAGE.,HR 5992. TIDELANDS. CONFIRM AND ESTABLISH THE TITLES OF THE STATES TO LANDS BENEATH NAVIGABLE WATERS WITHIN STATE BOUNDARIES AND NATURAL RESOURCES WITHIN SUCH LANDS AND WATERS AND PROVIDE FOR THE USE AND CONTROL OF SAID LANDS AND RESOURCES. PASSAGE.,7,710,7,701
2,1265,82,1,22,RH0820022,"'RH0820022',","RH0820022,",5/2/51,1951,5,2,NA,NA,249,148,-0.12,0.048,-0.174,-0.103,-152.61,HR3790,NA,NA,NA,"HR 3790. ON PICKETT AMEND. (BUREAU OF LAND MANAGEMENT-STRIKE OUT $7,700000 AND INS ERT $6,900,000 OF WHICH $1,200,000 FOR SOIL AND MOISTURE CONSERVATION.)","HR 3790. ON PICKETT AMEND. BUREAU OF LAND MANAGEMENT-- STRIKE OUT $7,700000 AND INS ERT $6,900,000 OF WHICH $1,200,000 FOR SOIL AND MOISTURE CONSERVATION",7,711,7,711
3,1519,82,1,181,RH0820181,"'RH0820181',","RH0820181,",7/4/52,1952,7,4,NA,NA,119,181,-0.143,0.012,0.149,-0.027,-123.755,HR7289,NA,NA,NA,"HR 7289. APPROPRIATIONS FOR THE DEPTS. OF STATE, JUSTICE, COMMERCE, AND THE JUDICIARY FOR THE FISCAL YEAR ENDING JUNE 30, 1953. CONFERENCE REPORT ON MOTION TO RECEDE AND CONCUR IN SENATE AMEND NO. 24 W ITH AN AMENDMENT. (SUIT IN COURT--WATER RIGHTS--CAMP PENDLETON)","HR 7289. APPROPRIATIONS FOR THE DEPTS. OF STATE, JUSTICE, COMMERCE, AND THE JUDICIARY FOR THE FISCAL YEAR ENDING JUNE 30, 1953. CONFERENCE REPORT ON MOTION TO RECEDE AND CON- CUR IN SENATE AMEND NO. 24 W ITH AN AMENDMENT. SUIT IN COURT--WATER RIGHT",7,799,7,799
4,1668,83,1,26,RH0830026,"'RH0830026',","RH0830026,",5/20/53,1953,5,20,NA,NA,196,201,-0.221,-0.001,-0.031,0.486,-186.75,HR5227,NA,NA,NA,"HR 5227. APPROPRIATIONS FOR THE DEPT. OF AGRICULTURE FOR THE FISCAL YEAR ENDING JUNE 30, 1954. ON KING (PENN.) AMEND. (SOIL CONSERVATION--STRIKE OUT $195,000,000 AND INSERT $140,000,000)","HR 5227. APPROPRIATIONS FOR THE DEPT. OF AGRICULTURE FOR THE FISCAL YEAR ENDING JUNE 30, 1954. ON KING PENN AMEND. SOIL CONSERVATION--STRIKE OUT $195,000,000 AND IN- SERT $140,000,000)",7,711,7,711
5,1695,83,1,39,RH0830039,"'RH0830039',","RH0830039,",6/25/53,1953,6,25,NA,NA,58,316,-0.34,0.115,0.257,0.193,-74.294,HR5728,NA,NA,NA,HR 5728. AUTHORIZE THE DISPOSAL OF THE GOV'T-OWNED RUBBERPRODUCING FACILITIES. ON MOTION TO RECOMMIT.,HR 5728. AUTHORIZE THE DISPOSAL OF THE GOV'T-OWNED RUBBER- PRODUCING FACILITIES. ON MOTION TO RECOMMIT.,7,704,7,704
6,2239,84,1,112,RH0840112,"'RH0840112',","RH0840112,",6/13/56,1956,6,13,NA,NA,165,213,0.076,0.014,-0.26,-0.045,-108.151,HR9540,NA,NA,NA,HR 9540. WATER POLLUTION. EXTEND AND STRENGTHEN THE WATER POLLUTION CONTROL ACT. MOTION TO RECOMMIT. REJECTED.,HR 9540. WATER POLLUTION. EXTEND AND STRENGTHEN THE WATER POLLUTION CONTROL ACT. MOTION TO RECOMMIT. REJECTED.,7,701,7,701
7,2241,84,1,113,RH0840113,"'RH0840113',","RH0840113,",6/13/56,1956,6,13,NA,NA,338,31,0.421,0.54,0.181,0.161,-81.785,HR9540,NA,NA,NA,HR 9540. EXTEND AND STRENGTHEN WATER POLLUTION CONTROL ACT. PASSED.,HR 9540. EXTEND AND STRENGTHEN WATER POLLUTION CONTROL ACT. PASSED.,7,701,7,701
8,2405,84,1,98,RH0840098,"'RH0840098',","RH0840098,",5/3/56,1956,5,3,NA,NA,184,211,-0.292,-0.741,-0.331,0.72,-39.386,HR10875,NA,NA,NA,HR 10875. FARM PROGRAM. MOTION TO RECOMMIT TO AGRICULTURE COMMITTEE WITH INSTRUCTIONS TO WRITE IN AN ADVANCE PAYMENT PROVISION FOR SOIL BANK PROGRAM. REJECTED.,HR 10875. FARM PROGRAM. MOTION TO RECOMMIT TO AGRICULTURE COMMITTEE WITH INSTRUCTIONS TO WRITE IN AN ADVANCE PAYMENT PROVISION FOR SOIL BANK PROGRAM. REJECTED.,7,711,7,711
9,2461,85,1,26,RH0850026,"'RH0850026',","RH0850026,",4/4/57,1957,4,4,NA,NA,185,231,0.069,0.046,-0.226,-0.115,-139.809,HR6287,NA,NA,NA,"HR 6287. FISCAL 1958 APPROPRIATIONS FOR DRPARTMENTS OF LABOR, AND HEALTH EDUCATION AN D WELFARE. AMENDMENT TO CUT FUNDDS FOR SEWAGE PLANT CONSTRUCTION BY STATES. REJECTED. NAY SUPPORTS PRESIDENT'S POSITION.","HR 6287. FISCAL 1958 APPROPRIATIONS FOR DRPARTMENTS OF LA- BOR, AND HEALTH EDUCATION AN D WELFARE. AMENDMENT TO CUT FUNDDS FOR SEWAGE PLANT CONSTRUCTION BY STATES. REJECTED. NAY SUPPORTS PRESIDENT'S POSITION.",7,703,7,703
10,3063,86,1,29,RH0860029,"'RH0860029',","RH0860029,",6/9/59,1959,6,9,NA,NA,156,240,0.01,0.089,-0.302,-0.001,-77.74,HR3610,NA,NA,NA,HR 3610. BILL TO AMEND 1948 WATER POLLUTION CONTROL ACT TO DOUBLE FEDERAL CONTRIBUTIONS FOR SEWAGE PLANT CONSTRUCTION. MOTION TO RECOMMIT WITH INSTRUCTIONS TO AMEND TO REQUIRE STATES TO MATCH FEDERAL GRANTS. REJECTED.,HR 3610. BILL TO AMEND 1948 WATER POLLUTION CONTROL ACT TO DOUBLE FEDERAL CONTRIBUTIONS FOR SEWAGE PLANT CONSTRUCTION. MOTION TO RECOMMIT WITH INSTRUCTIONS TO AMEND TO REQUIRE STATES TO MATCH FEDERAL GRANTS. REJECTED.,7,703,7,703
11,3067,86,1,30,RH0860030,"'RH0860030',","RH0860030,",6/9/59,1959,6,9,NA,NA,255,143,0.067,-0.03,0.242,0.051,-104.316,HR3610,NA,NA,NA,HR 3610. AMEND WATER POLLUTION CONTROL ACT. PASSED. NAY SUPPORTS PRESIDENT'S POSITION.,HR 3610. AMEND WATER POLLUTION CONTROL ACT. PASSED. NAY SUPPORTS PRESIDENT'S POSITION.,7,701,7,701
12,3493,86,1,92,RH0860092,"'RH0860092',","RH0860092,",2/25/60,1960,2,25,NA,NA,249,157,0.031,-0.218,0.31,0.033,-85.629,HR3610,NA,NA,NA,HR 3610. AMEND 1948 WATER POLUTION CONTROL ACT BY RAISING T/ $90 MILLION ANNUALLY THE FEDERAL CONTRIBUTIONS FOR SEWAGE PLANT CONSTRUCTION. PASSAGE OVER PRESIDENT'S VETO. FAILED.,HR 3610. AMEND 1948 WATER POLUTION CONTROL ACT BY RAISING T/ $90 MILLION ANNUALLY THE FEDERAL CONTRIBUTIONS FOR SEWAGE PLANT CONSTRUCTION. PASSAGE OVER PRESIDENT'S VETO. FAILED.,7,703,7,703
13,3671,87,1,24,RH0870024,"'RH0870024',","RH0870024,",5/3/61,1961,5,3,NA,NA,165,256,0.052,0.006,-0.274,0.03,-90.396,HR6441,NA,NA,NA,H.R. 6441. FEDERAL WATER POLLUTION CONTROL ACT AMENDMENTS OF 1961. INCREASE AND EXTEND FEDERAL GRANTS TO HELP STATES CONSTRUCT SEWAGE PLANTS. CRAMER MOTION TO RECOMMIT WITH INSTRUCTIONS TO REDUCE ANNUAL AUTHORIZATION AND REQUIRE STATES TO MATCH FEDERAL GRANTS WHICH EXCEED ORIGINAL ALLOTMENT. REJECTED.,H.R. 6441. FEDERAL WATER POLLUTION CONTROL ACT AMENDMENTS OF 1961. INCREASE AND EXTEND FEDERAL GRANTS TO HELP STATES CONSTRUCT SEWAGE PLANTS. CRAMER MOTION TO RECOMMIT WITH INSTRUCTIONS TO REDUCE ANNUAL AUTHORIZATION AND REQUIRE STATES TO MATCH FEDER,7,703,7,703
14,3673,87,1,25,RH0870025,"'RH0870025',","RH0870025,",5/3/61,1961,5,3,NA,NA,308,110,0.172,0.22,0.226,0.188,-127.062,HR6441,NA,NA,NA,H.R. 6441. FEDERAL WATER POLLUTION CONTROL ACT AMENDMENTS OF 1961. PASSED. YEA SUPPORTS PRESIDENT'S POSITION.,H.R. 6441. FEDERAL WATER POLLUTION CONTROL ACT AMENDMENTS OF 1961. PASSED. YEA SUPPORTS PRESIDENT'S POSITION.,7,701,7,701
15,4199,88,1,104,RH0880104,"'RH0880104',","RH0880104,",12/10/63,1963,12,10,NA,NA,273,109,0.184,0.085,0.236,0.138,-123.178,HR6518,NA,NA,NA,H.R. 6518. THE CLEAN AIR ACT. ADOPTION OF CONFERENCE REPORT.,H.R. 6518. THE CLEAN AIR ACT. ADOPTION OF CONFERENCE REPORT.,7,705,7,705
16,4404,88,1,47,RH0880047,"'RH0880047',","RH0880047,",7/24/63,1963,7,24,NA,NA,273,102,0.198,0.063,0.221,0.087,-118.816,HR6518,NA,NA,NA,H.R. 6518. THE CLEAN AIR ACT. PASSAGE.,H.R. 6518. THE CLEAN AIR ACT. PASSAGE.,7,705,7,705
17,4597,88,1,187,RH0880187,"'RH0880187',","RH0880187,",7/22/64,1964,7,22,NA,NA,338,8,0,0,0,0,0,HR3846,NA,NA,NA,"H.R. 3846. ESTABLISH A LAND AND WATER CONSERVATION FUND. ADOPTION OF H. RES. 738 PROVIDING AN OPEN RULE FOR CONSIDERATION OF ALL OF H.R. 3846 BUT SECTION 7 AND TITLE II, WHICH WERE TO BE CONSIDERED UNDER A CLOSED RULE.","H.R. 3846. ESTABLISH A LAND AND WATER CONSERVATION FUND. ADOPTION OF H. RES. 738 PROVIDING AN OPEN RULE FOR CONSIDERATION OF ALL OF H.R. 3846 BUT SECTION 7 AND TITLE II, WHICH WERE TO BE CONSIDERED UNDER A CLOSED RULE.",7,711,7,711
18,4633,88,1,223,RH0880223,"'RH0880223',","RH0880223,",9/1/64,1964,9,1,NA,NA,235,111,0.148,0.196,0.139,0.273,-157.971,HR4487,NA,NA,NA,"H.R. 4487. PROVIDE FOR COORDINATION OF INTERIOR AND AGRICULTURE DEPARTMENT PROGRAMS DESIGNED TO MINIMIZE THE EFFECTS OF INSECTICIDES AND PESTICIDES ON FISH AND WILDLIFE, AND INCREASE THE INTERIOR DEPARTMENT'S ANNUAL AUTHORIZATION FOR PESTICIDE RESEARCH. BONNER MOTION TO PASS THE BILL UNDER SUSPENSION OF THE RULES.","H.R. 4487. PROVIDE FOR COORDINATION OF INTERIOR AND AGRICULTURE DEPARTMENT PROGRAMS DESIGNED TO MINIMIZE THE EFFECTS OF INSECTICIDES AND PESTICIDES ON FISH AND WILD- LIFE, AND INCREASE THE INTERIOR DEPARTMENT'S ANNUAL AUTHORIZATION FOR PESTICIDE RESEAR",7,704,7,704
19,5081,89,1,161,RH0890161,"'RH0890161',","RH0890161,",9/21/65,1965,9,21,NA,NA,381,0,0,0,0,0,0,S4,NA,NA,NA,"TO AGREE TO CONFERENCE REPORT ON S. 4, WATER QUALITY ACT OF 1965.","TO AGREE TO CONFERENCE REPORT ON S. 4, WATER QUALITY ACT OF 1965.",7,701,7,701
20,5090,89,1,166,RH0890166,"'RH0890166',","RH0890166,",9/23/65,1965,9,23,NA,NA,280,70,0.263,0.488,0.256,-0.182,-63.823,HR10232,NA,NA,NA,"TO ORDER THE PREVIOUS QUESTION ON H. RES. 580, THE OPEN RULE PROVIDING FOR 2 HOURS OF DEBATE ON H.R. 10232, A BILL TO DEVELOP WATER AND SANITATION SYSTEMS IN RURAL AREAS.","TO ORDER THE PREVIOUS QUESTION ON H. RES. 580, THE OPEN RULE PROVIDING FOR 2 HOURS OF DEBATE ON H.R. 10232, A BILL TO DEVELOP WATER AND SANITATION SYSTEMS IN RURAL AREAS.",7,701,7,701
21,5092,89,1,167,RH0890167,"'RH0890167',","RH0890167,",9/23/65,1965,9,23,NA,NA,326,10,0.514,-0.788,0.122,-0.427,-41.749,HR10232,NA,NA,NA,"TO PASS H.R. 10232, A BILL TO DEVELOP WATER SANITATION SYSTEMS IN RURAL AREAS.","TO PASS H.R. 10232, A BILL TO DEVELOP WATER SANITATION SYSTEMS IN RURAL AREAS.",7,701,7,701
22,5094,89,1,168,RH0890168,"'RH0890168',","RH0890168,",9/24/65,1965,9,24,NA,NA,80,220,0.166,-0.231,-0.257,-0.205,-79.416,S306,NA,NA,NA,"TO RECOMMIT S. 306, A PROGRAM TO CLEAN AIR POLLUTION, WITH INSTRUCTIONS TO DELETE THE PROVISIONS FOR SOLID WASTE DISPOSAL.","TO RECOMMIT S. 306, A PROGRAM TO CLEAN AIR POLLUTION, WITH INSTRUCTIONS TO DELETE THE PROVISIONS FOR SOLID WASTE DISPOSAL.",7,703,7,703
23,5096,89,1,169,RH0890169,"'RH0890169',","RH0890169,",9/24/65,1965,9,24,NA,NA,294,4,0,0,0,0,0,S306,NA,NA,NA,"TO PASS S. 306, A PROGRAM TO CLEAN AIR POLLUTION.","TO PASS S. 306, A PROGRAM TO CLEAN AIR POLLUTION.",7,705,7,705
24,5269,89,1,41,RH0890041,"'RH0890041',","RH0890041,",4/28/65,1965,4,28,NA,NA,396,0,0,0,0,0,0,S4,NA,NA,NA,"TO PASS S. 4, THE WATER QUALITY ACT OF 1965.","TO PASS S. 4, THE WATER QUALITY ACT OF 1965.",7,701,7,701
25,5655,89,1,354,RH0890354,"'RH0890354',","RH0890354,",9/30/66,1966,9,30,NA,NA,313,0,0,0,0,0,0,HR16076,NA,NA,NA,"TO PASS H.R. 16076, THE WATER POLUTION CONTROL AMENDMENTS AND CLEAN RIVERS RESTORATION ACT.","TO PASS H.R. 16076, THE WATER POLUTION CONTROL AMENDMENTS AND CLEAN RIVERS RESTORATION ACT.",7,701,7,701
26,5693,89,1,374,RH0890374,"'RH0890374',","RH0890374,",10/17/66,1966,10,17,NA,NA,247,0,0,0,0,0,0,S2947,NA,NA,NA,"TO ADOPT THE CONFERENCE REPORT ON S. 2947, THE CLEAN WATER RESTORATION ACT OF 1966.","TO ADOPT THE CONFERENCE REPORT ON S. 2947, THE CLEAN WATER RESTORATION ACT OF 1966.",7,701,7,701
27,5897,90,1,122,RH0900122,"'RH0900122',","RH0900122,",8/28/67,1967,8,28,NA,NA,118,109,0.086,-0.66,0.104,0.058,-125.061,HR8965,NA,NA,NA,"TO PASS H.R. 8965, A BILL TO INCREASE THE FEDERAL CONTRIBUTION TO THE POTOMAC INTERCEPTOR SEWER FROM DULLES AIRPORT IN ORDER TO PROTECT THE POTOMAC FROM POLLUTION.","TO PASS H.R. 8965, A BILL TO INCREASE THE FEDERAL CONTRIBUTION TO THE POTOMAC INTERCEPTOR SEWER FROM DULLES AIRPORT IN ORDER TO PROTECT THE POTOMAC FROM POLLUTION.",7,703,7,703
28,6043,90,1,190,RH0900190,"'RH0900190',","RH0900190,",11/2/67,1967,11,2,NA,NA,362,0,0,0,0,0,0,S780,NA,NA,NA,"TO PASS S. 780, AMENDMENTS TO THE CLEAN AIR ACT, PROVIDING FOR PLANNING GRANTS TO AIR POLLUTION CONTROL AGENCIES, EXPANSION OF RESEARCH PROVISIONS RELATING TO FUELS AND VEHICLES, INTERSTATE AIR POLLUTION CONTROL AGENCIES, AND THE ESTABLISHMENT OF AIR QUALITY STANDARDS.","TO PASS S. 780, AMENDMENTS TO THE CLEAN AIR ACT, PROVIDING FOR PLANNING GRANTS TO AIR POLLUTION CONTROL AGENCIES, EXPANSION OF RESEARCH PROVISIONS RELATING TO FUELS AND VEHICLES, INTERSTATE AIR POLLUTION CONTROL AGENCIES, AND THE ESTABLISHMENT OF AIR QU",7,705,7,705
29,6270,90,1,44,RH0900044,"'RH0900044',","RH0900044,",4/27/67,1967,4,27,NA,NA,158,231,0.065,0.086,-0.196,-0.013,-125.487,HR9029,NA,NA,NA,"TO RECOMMIT H.R. 9029, DEPT. OF THE INTERIOR AND RELATED AGENCIES APPROPRIATION BILL, 1968, WITH INSTRUCTIONS TO LIMIT THE EXPENDITURES OF THE DEPT. OF INTERIOR TO 95% OF THE TOTAL FUNDS APPROPRIATED FOR THAT DEPARTMENT IN THE BUDGET FOR FISCAL 1968.","TO RECOMMIT H.R. 9029, DEPT. OF THE INTERIOR AND RELATED AGENCIES APPROPRIATION BILL, 1968, WITH INSTRUCTIONS TO LIMIT THE EXPENDITURES OF THE DEPT. OF INTERIOR TO 95% OF THE TOTAL FUNDS APPROPRIATED FOR THAT DEPARTMENT IN THE BUDGET FOR FISCAL 1968.",7,701,7,701
30,6331,90,1,77,RH0900077,"'RH0900077',","RH0900077,",6/19/67,1967,6,19,NA,NA,329,8,0,0,0,0,0,HR480,NA,NA,NA,"TO SUSPEND THE RULES AND PASS H.R. 480, AMENDING THE WETLANDS ACQUISITION ACT OF 1961.","TO SUSPEND THE RULES AND PASS H.R. 480, AMENDING THE WETLANDS ACQUISITION ACT OF 1961.",7,710,7,701
31,6333,90,1,78,RH0900078,"'RH0900078',","RH0900078,",6/19/67,1967,6,19,NA,NA,238,97,-0.332,0.88,0.032,0.303,-174.842,HR482,NA,NA,NA,"TO SUSPEND THE RULES AND PASS H.R. 482, RELATING TO THE PRICE OF HUNTING STAMPS FOR THE TAKING OF MIGRATORY WATERFOWL.","TO SUSPEND THE RULES AND PASS H.R. 482, RELATING TO THE PRICE OF HUNTING STAMPS FOR THE TAKING OF MIGRATORY WATERFOWL.",7,709,7,709
32,6443,90,1,285,RH0900285,"'RH0900285',","RH0900285,",4/1/68,1968,4,1,NA,NA,334,25,0.504,0.539,0.154,0.973,-54.546,HR15979,NA,NA,NA,"TO SUSPEND THE RULES AND PASS H.R. 15979, A BILL TO AMEND PESTICIDE ACT OF AUG. 1, 1958, IN ORDER TO MINIMIZE INJURY TO FISH AND WILDLIFE FROM THE USE OF INSECTICIDES, HERBICIDES, FUNGICIDES AND PESTICIDES. THE BILL AMENDS THE PESTICIDE ACT BY AUTHORIZING A CONTINUATION OF THE PROGRAM THEREIN SET UP FOR 3 YEARS.","TO SUSPEND THE RULES AND PASS H.R. 15979, A BILL TO AMEND PESTICIDE ACT OF AUG. 1, 1958, IN ORDER TO MINIMIZE INJURY TO FISH AND WILDLIFE FROM THE USE OF INSECTICIDES, HERBICIDES, FUNGICIDES AND PESTICIDES. THE BILL AMENDS THE PESTICIDE ACT BY AUTHORIZ",7,704,7,704
33,6493,90,1,326,RH0900326,"'RH0900326',","RH0900326,",5/23/68,1968,5,23,NA,NA,336,13,0.549,0.453,0.19,0.633,-38.254,HR8578,NA,NA,NA,"TO PASS H.R. 8578, A BILL WHICH AMENDS TITLE 1 OF THE LAND AND WATER CONSERVATION FUND ACT OF 1965 BY INCREASING MONEY IN THE FUND, RETURNING TO A SYSTEM WHEREBY EACH PARK FACILITY OF THE U.S. MAY FIX ITS OWN USER FEES, AUTHORIZING CONTRACTS FOR LAND ACQUISITION IN ADVANCE OF APPROPRIATIONS AND AUTHORIZING THE SEC'Y OF INTERIOR TO LEASE OR SELL LAND ADMINISTERED BY THE NATIONAL PARK SERVICE.","TO PASS H.R. 8578, A BILL WHICH AMENDS TITLE 1 OF THE LAND AND WATER CONSERVATION FUND ACT OF 1965 BY INCREASING MONEY IN THE FUND, RETURNING TO A SYSTEM WHEREBY EACH PARK FACILITY OF THE U.S. MAY FIX ITS OWN USER FEES, AUTHORIZING CONTRACTS FOR LAND AC",7,711,7,711
34,6543,90,1,352,RH0900352,"'RH0900352',","RH0900352,",6/18/68,1968,6,18,NA,NA,136,228,0.073,-0.085,-0.172,0.305,-100.467,S1028,NA,NA,NA,"TO RECOMMIT S. 1028, A BILL TO EXTEND CERTAIN BENEFITS TO FORMER EMPLOYEES OF COUNTY COMMITTEES ESTABLISHED PURSUANT TO SECTION 8(B) OF THE SOIL CONSERVATION AND DOMESTIC ALLOTMENT ACT, WITH INSTRUCTIONS REGARDING CIVIL SERVICE STATUS FOR COUNTY COMMITTEES.","TO RECOMMIT S. 1028, A BILL TO EXTEND CERTAIN BENEFITS TO FORMER EMPLOYEES OF COUNTY COMMITTEES ESTABLISHED PURSUANT TO SECTION 8B) OF THE SOIL CONSERVATION AND DOMESTIC ALLOTMENT ACT, WITH INSTRUCTIONS REGARDING CIVIL SERVICE STATUS FOR COUNTY COMMITTE",7,711,7,711
35,6545,90,1,353,RH0900353,"'RH0900353',","RH0900353,",6/18/68,1968,6,18,NA,NA,353,13,-0.624,-0.608,-0.109,-0.559,-51.888,S1028,NA,NA,NA,"TO PASS S. 1028, A BILL TO EXTEND CERTAIN BENEFITS TO FORMER EMPLOYEES OF COUNTY COMMITTEES ESTABLISHED PURSUANT TO SECTION 8(B) OF THE SOIL CONSERVATION AND DOMESTIC ALLOTMENT ACT.","TO PASS S. 1028, A BILL TO EXTEND CERTAIN BENEFITS TO FORMER EMPLOYEES OF COUNTY COMMITTEES ESTABLISHED PURSUANT TO SECTION 8B) OF THE SOIL CONSERVATION AND DOMESTIC ALLOTMENT ACT.",7,711,7,711
36,6692,90,1,430,RH0900430,"'RH0900430',","RH0900430,",9/16/68,1968,9,16,NA,NA,271,22,0.993,-0.121,0.168,-0.061,-71,HR16771,NA,NA,NA,"TO SUSPEND THE RULES AND PASS H.R. 16771, TO DESIGNATE CERTAIN LANDS IN THE GREAT SWAMP NATIONAL WILDLIFE REFUGE, MORRIS COUNTY, N. J., AS WILDERNESS.","TO SUSPEND THE RULES AND PASS H.R. 16771, TO DESIGNATE CERTAIN LANDS IN THE GREAT SWAMP NATIONAL WILDLIFE REFUGE, MORRIS COUNTY, N. J., AS WILDERNESS.",7,709,7,709
37,6749,90,1,461,RH0900461,"'RH0900461',","RH0900461,",10/7/68,1968,10,7,NA,NA,277,0,0,0,0,0,0,S3206,NA,NA,NA,"TO SUSPEND THE RULES AND PASS S. 3206, THE WATER QUALITY IMPROVEMENT ACT OF 1968.","TO SUSPEND THE RULES AND PASS S. 3206, THE WATER QUALITY IMPROVEMENT ACT OF 1968.",7,701,7,701
38,7093,91,1,19,RH0910019,"'RH0910019',","RH0910019,",4/16/69,1969,4,16,NA,NA,392,1,0,0,0,0,0,HR4148,NA,NA,NA,"TO PASS H.R. 4148 TO AMEND THE FEDERAL WATER POLLUTION CONTROL ACT, AS AMENDED.","TO PASS H.R. 4148 TO AMEND THE FEDERAL WATER POLLUTION CONTROL ACT, AS AMENDED.",7,701,7,701
39,7272,91,1,77,RH0910077,"'RH0910077',","RH0910077,",9/4/69,1969,9,4,NA,NA,332,0,0,0,0,0,0,HR12085,NA,NA,NA,"TO PASS H.R. 12085, TO AMEND THE CLEAN AIR ACT TO EXTEND THE PROGRAM OF RESEARCH RELATING TO FUEL AND VEHICLES.","TO PASS H.R. 12085, TO AMEND THE CLEAN AIR ACT TO EXTEND THE PROGRAM OF RESEARCH RELATING TO FUEL AND VEHICLES.",7,705,7,705
40,7290,91,1,85,RH0910085,"'RH0910085',","RH0910085,",9/23/69,1969,9,23,NA,NA,372,15,0.77,-0.369,0.492,1.102,-37.12,HR12549,NA,NA,NA,"TO PASS H.R. 12549, A BILL TO AMEND THE FISH AND WILDLIFE COORDINATION ACT SO AS TO PROVIDE FOR THE ESTABLISHMENT OF A COUNCIL ON ENVIRONMENTAL QUALITY.","TO PASS H.R. 12549, A BILL TO AMEND THE FISH AND WILDLIFE COORDINATION ACT SO AS TO PROVIDE FOR THE ESTABLISHMENT OF A COUNCIL ON ENVIRONMENTAL QUALITY.",7,700,7,700
41,7373,91,1,212,RH0910212,"'RH0910212',","RH0910212,",3/25/70,1970,3,25,NA,NA,358,0,0,0,0,0,0,HR4148,NA,NA,NA,"TO ADOPT THE CONFERENCE REPORT ON H.R. 4148, TO AMEND THE FEDERAL WATER POLLUTION CONTROL ACT.","TO ADOPT THE CONFERENCE REPORT ON H.R. 4148, TO AMEND THE FEDERAL WATER POLLUTION CONTROL ACT.",7,701,7,701
42,7426,91,1,256,RH0910256,"'RH0910256',","RH0910256,",5/25/70,1970,5,25,NA,NA,287,7,0,0,0,0,0,HJRES1117,NA,NA,NA,"TO PASS H.J.RES. 1117, TO ESTABLISH A JOINT COMMITTEE ON THE ENVIRONMENT.","TO PASS H.J.RES. 1117, TO ESTABLISH A JOINT COMMITTEE ON THE ENVIRONMENT.",7,700,7,700
43,7448,91,1,267,RH0910267,"'RH0910267',","RH0910267,",6/10/70,1970,6,10,NA,NA,336,40,-0.38,-0.403,-0.186,-0.479,-66.9,HR17255,NA,NA,NA,"TO ADOPT H.RES. 1069, THE RULE UNDER WHICH THE HOUSE CONSIDERED H.R. 17255, TO AMEND THE CLEAN AIR ACT.","TO ADOPT H.RES. 1069, THE RULE UNDER WHICH THE HOUSE CONSIDERED H.R. 17255, TO AMEND THE CLEAN AIR ACT.",7,701,7,701
44,7450,91,1,268,RH0910268,"'RH0910268',","RH0910268,",6/10/70,1970,6,10,NA,NA,375,1,0,0,0,0,0,HR17255,NA,NA,NA,TO PASS H.R. 17255.,TO PASS H.R. 17255.,7,701,7,701
45,7468,91,1,277,RH0910277,"'RH0910277',","RH0910277,",6/22/70,1970,6,22,NA,NA,314,1,0,0,0,0,0,S2315,NA,NA,NA,"TO PASS S. 2315, TO RESTORE THE GOLDEN EAGLE PROGRAM TO THE LAND AND WATER CONSERVATION FUND ACT.","TO PASS S. 2315, TO RESTORE THE GOLDEN EAGLE PROGRAM TO THE LAND AND WATER CONSERVATION FUND ACT.",7,711,7,711
46,7470,91,1,278,RH0910278,"'RH0910278',","RH0910278,",6/23/70,1970,6,23,NA,NA,339,0,0,0,0,0,0,HR11833,NA,NA,NA,"TO PASS H.R. 11833, AMENDING THE SOLID WASTE DISPOSAL ACT TO PROVIDE FINANCIAL ASSISTANCE FOR THE CONSTRUCTION OF SOLID WASTE DISPOSAL FACILITIES, TO IMPROVE RESEARCH PROGRAMS PURSUANT TO SUCH ACT.","TO PASS H.R. 11833, AMENDING THE SOLID WASTE DISPOSAL ACT TO PROVIDE FINANCIAL ASSISTANCE FOR THE CONSTRUCTION OF SOLID WASTE DISPOSAL FACILITIES, TO IMPROVE RESEARCH PROGRAMS PURSUANT TO SUCH ACT.",7,703,7,703
47,7559,91,1,323,RH0910323,"'RH0910323',","RH0910323,",8/6/70,1970,8,6,NA,NA,358,0,0,0,0,0,0,S1933,NA,NA,NA,"TO PASS S. 1933, PROVIDING FOR FEDERAL RAILROAD SAFETY AND HAZARDOUS MATERIALS CONTROL.","TO PASS S. 1933, PROVIDING FOR FEDERAL RAILROAD SAFETY AND HAZARDOUS MATERIALS CONTROL.",7,704,7,704
48,7625,91,1,357,RH0910357,"'RH0910357',","RH0910357,",9/28/70,1970,9,28,NA,NA,310,0,0,0,0,0,0,S1933,NA,NA,NA,TO AGREE TO CONFERENCE REPORT ON S. 1933. MEASURE FOR SENATE ACTION.,TO AGREE TO CONFERENCE REPORT ON S. 1933. MEASURE FOR SENATE ACTION.,7,704,7,704
49,8012,91,1,183,RH0910183,"'RH0910183',","RH0910183,",2/17/70,1970,2,17,NA,NA,59,288,0.196,0.662,-0.146,-0.236,-116.466,HR15062,NA,NA,NA,"TO STRIKE TITLE I (H.R. 3723) OF H.R. 15062, AN OMNIBUS PRIVATE CLAIMS BILL.","TO STRIKE TITLE I H.R. 3723) OF H.R. 15062, AN OMNIBUS PRIVATE CLAIMS BILL.",7,709,7,709
50,8034,92,1,102,RH0920102,"'RH0920102',","RH0920102,",6/23/71,1971,6,23,NA,NA,129,278,-0.2,-0.112,0.102,0.535,-162.423,HR9270,NA,NA,NA,"TO AMEND AN AMENDMENT TO H.R. 9270 SEEKING TO FORBID CHANNELIZATION OF STREAMS, BY FORBIDDING THE FUNDING OF ANY STREAM CHANNELIZATION PROJECT ADMINISTERED UNDER THE SECRETARY OF AGRICULTURE AND UNDER CONSTRUCTION LATER THAN JULY 1, 1971.","TO AMEND AN AMENDMENT TO H.R. 9270 SEEKING TO FORBID CHANNELIZATION OF STREAMS, BY FORBIDDING THE FUNDING OF ANY STREAM CHANNELIZATION PROJECT ADMINISTERED UNDER THE SECRETARY OF AGRICULTURE AND UNDER CONSTRUCTION LATER THAN JULY 1, 1971.",7,711,7,711
51,8071,92,1,120,RH0920120,"'RH0920120',","RH0920120,",7/8/71,1971,7,8,NA,NA,325,0,0,0,0,0,0,HR9093,NA,NA,NA,"TO PASS H.R. 9093, TO EXPAND AND EXTEND THE WATER DESALTING PROGRAM BEING CONDUCTED BY THE SECRETARY OF THE INTERIOR.","TO PASS H.R. 9093, TO EXPAND AND EXTEND THE WATER DESALTING PROGRAM BEING CONDUCTED BY THE SECRETARY OF THE INTERIOR.",7,701,7,701
52,8081,92,1,125,RH0920125,"'RH0920125',","RH0920125,",7/15/71,1971,7,15,NA,NA,162,207,-0.819,0.183,0.021,0.185,-240.439,HR9388,NA,NA,NA,"TO AMEND H.R. 9388, ATOMIC ENERGY COMMISSION AUTHORIZATION BILL, BY STRIKING OUT LANGUAGE PROVIDING FUNDS FOR A NATIONAL WASTE REPOSITORY AT LYONS, KANSAS.","TO AMEND H.R. 9388, ATOMIC ENERGY COMMISSION AUTHORIZATION BILL, BY STRIKING OUT LANGUAGE PROVIDING FUNDS FOR A NATIONAL WASTE REPOSITORY AT LYONS, KANSAS.",7,704,7,704
53,8089,92,1,129,RH0920129,"'RH0920129',","RH0920129,",7/20/71,1971,7,20,NA,NA,372,18,0.565,0.061,0.219,0.189,-51.907,HJRES424,NA,NA,NA,"TO ADOPT H. RES. 424, THE RULE PERMITTING CONSIDERATION OF H.J. RES. 3, TO ESTABLISH A JOINT COMMITTEE ON THE ENVIRONMENT.","TO ADOPT H. RES. 424, THE RULE PERMITTING CONSIDERATION OF H.J. RES. 3, TO ESTABLISH A JOINT COMMITTEE ON THE ENVIRON- MENT.",7,700,7,700
54,8124,92,1,145,RH0920145,"'RH0920145',","RH0920145,",7/29/71,1971,7,29,NA,NA,108,275,-0.218,-0.134,0.18,0.746,-106.906,HR10090,NA,NA,NA,"TO AMEND H.R. 10090, PUBLIC WORKS APPROPRIATIONS, BY FORBIDDING FUNDS FOR ANY TESTING OF NUCLEAR WEAPONS IN THE ALEUTIAN ISLANDS.","TO AMEND H.R. 10090, PUBLIC WORKS APPROPRIATIONS, BY FOR- BIDDING FUNDS FOR ANY TESTING OF NUCLEAR WEAPONS IN THE ALEUTIAN ISLANDS.",7,704,7,704
55,8173,92,1,168,RH0920168,"'RH0920168',","RH0920168,",9/9/71,1971,9,9,NA,NA,305,3,0,0,0,0,0,HR9727,NA,NA,NA,"TO PASS H.R. 9727, A BILL TO REGULATE THE DUMPING OF MATERIAL IN THE OCEANS AND OTHER WATERS.","TO PASS H.R. 9727, A BILL TO REGULATE THE DUMPING OF MATERIAL IN THE OCEANS AND OTHER WATERS.",7,710,7,701
56,8338,92,1,247,RH0920247,"'RH0920247',","RH0920247,",11/9/71,1971,11,9,NA,NA,152,221,-0.19,0.069,0.181,0.55,-117.171,HR10729,NA,NA,NA,"TO AMEND BY STRIKING LANGUAGE CONCERNING REGISTRATION OF PESTICIDES, KYL (IOWA) SUBSTITUTE AMENDMENT FOR DOW (N.Y.) AMENDMENT IN THE NATURE OF A SUBSTITUTE FOR H.R. 10729, TO AMEND THE FEDERAL INSECTICIDE, FUNGICIDE, AND RODENTICIDE ACT.","TO AMEND BY STRIKING LANGUAGE CONCERNING REGISTRATION OF PESTICIDES, KYL IOWA) SUBSTITUTE AMENDMENT FOR DOW N.Y AMENDMENT IN THE NATURE OF A SUBSTITUTE FOR H.R. 10729, TO AMEND THE FEDERAL INSECTICIDE, FUNGICIDE, AND RODENTICIDE ACT.",7,704,7,704
57,8340,92,1,248,RH0920248,"'RH0920248',","RH0920248,",11/9/71,1971,11,9,NA,NA,167,209,-0.095,-0.001,0.194,0.708,-115.354,HR10729,NA,NA,NA,"TO AMEND KYL (IOWA) SUBSTITUTE AMENDMENT FOR DOW (N.Y.) AMENDMENT IN THE NATURE OF A SUBSTITUTE FOR H.R. 10729, BY EXTENDING LANGUAGE RELATIVE TO JUDICIAL REVIEW.","TO AMEND KYL IOWA) SUBSTITUTE AMENDMENT FOR DOW N.Y AMENDMENT IN THE NATURE OF A SUBSTITUTE FOR H.R. 10729, BY EXTENDING LANGUAGE RELATIVE TO JUDICIAL REVIEW.",7,704,7,704
58,8342,92,1,249,RH0920249,"'RH0920249',","RH0920249,",11/9/71,1971,11,9,NA,NA,168,203,-0.087,-0.007,0.148,0.444,-142.546,HR10729,NA,NA,NA,"TO AMEND KYL (IOWA) SUBSTITUTE AMENDMENT FOR DOW (N.Y.) AMENDMENT IN THE NATURE OF A SUBSTITUTE FOR H.R. 10729, BY FORBIDDING FOR ANY PESTICIDE REMOVED FROM THE MARKET UNLESS THE PRODUCER SHOWS THAT ADVERSE ENVIRONMENTAL EFFECTS WERE UNKNOWN.","TO AMEND KYL IOWA) SUBSTITUTE AMENDMENT FOR DOW N.Y AMENDMENT IN THE NATURE OF A SUBSTITUTE FOR H.R. 10729, BY FORBIDDING FOR ANY PESTICIDE REMOVED FROM THE MARKET UNLESS THE PRODUCER SHOWS THAT ADVERSE ENVIRONMENTAL EFFECTS WERE UNKNOWN.",7,704,7,704
59,8346,92,1,250,RH0920250,"'RH0920250',","RH0920250,",11/9/71,1971,11,9,NA,NA,288,91,-0.177,-0.529,-0.165,-0.381,-111.091,HR10729,NA,NA,NA,TO PASS H.R. 10729.,TO PASS H.R. 10729.,7,704,7,704
60,8444,92,1,296,RH0920296,"'RH0920296',","RH0920296,",12/6/71,1971,12,6,NA,NA,199,150,-0.567,-0.013,-0.017,-0.116,-231.725,HR10420,NA,NA,NA,"TO SUSPEND THE RULES AND PASS H.R. 10420, TO ESTABLISH A MARINE MAMMAL COMMISSION. (TWO-THIRDS HAVING FAILED TO VOTE IN THE AFFIRMATIVE, THE MOTION WAS REJECTED.)","TO SUSPEND THE RULES AND PASS H.R. 10420, TO ESTABLISH A MARINE MAMMAL COMMISSION. TWO-THIRDS HAVING FAILED TO VOTE IN THE AFFIRMATIVE, THE MOTION WAS REJECTED",7,709,7,709
61,8643,92,1,55,RH0920055,"'RH0920055',","RH0920055,",5/17/71,1971,5,17,NA,NA,305,18,0.294,0.851,0.183,0.377,-47.808,HR56,NA,NA,NA,"TO SUSPEND THE RULES AND PASS H.R. 56, TO PROVIDE FOR A NATIONAL ENVIRONMENTAL DATA SYSTEM, AMENDING THE NATIONAL ENVIRONMENTAL POLICY ACT OF 1969.","TO SUSPEND THE RULES AND PASS H.R. 56, TO PROVIDE FOR A NATIONAL ENVIRONMENTAL DATA SYSTEM, AMENDING THE NATIONAL ENVIRONMENTAL POLICY ACT OF 1969.",7,700,7,700
62,8645,92,1,56,RH0920056,"'RH0920056',","RH0920056,",5/17/71,1971,5,17,NA,NA,307,8,0.656,-0.754,0.22,-0.041,-42.972,HR5060,NA,NA,NA,"TO SUSPEND THE RULES AND PASS H.R. 5060, PROVIDING A CRIMINAL PENALTY FOR SHOOTING AT CERTAIN BIRDS, FISH, AND OTHER ANIMALS FROM AN AIRCRAFT.","TO SUSPEND THE RULES AND PASS H.R. 5060, PROVIDING A CRIMINAL PENALTY FOR SHOOTING AT CERTAIN BIRDS, FISH, AND OTHER ANIMALS FROM AN AIRCRAFT.",7,709,7,709
63,8647,92,1,57,RH0920057,"'RH0920057',","RH0920057,",5/17/71,1971,5,17,NA,NA,293,10,0.688,-0.08,0.221,0.145,-33.829,HR2587,NA,NA,NA,"TO SUSPEND THE RULES AND PASS H.R. 2587, TO ESTABLISH THE NATIONAL ADVISORY COMMITTEE ON THE OCEANS AND ATMOSPHERE.","TO SUSPEND THE RULES AND PASS H.R. 2587, TO ESTABLISH THE NATIONAL ADVISORY COMMITTEE ON THE OCEANS AND ATMOSPHERE.",7,700,7,700
64,8789,92,1,339,RH0920339,"'RH0920339',","RH0920339,",2/7/72,1972,2,7,NA,NA,361,8,0,0,0,0,0,HR7088,NA,NA,NA,"TO PASS H.R. 7088, A BILL TO ESTABLISH THE TINICUM NATIONAL ENVIRONMENTAL CENTER.","TO PASS H.R. 7088, A BILL TO ESTABLISH THE TINICUM NATIONAL ENVIRONMENTAL CENTER.",7,799,7,799
65,8790,92,1,340,RH0920340,"'RH0920340',","RH0920340,",2/7/72,1972,2,7,NA,NA,352,7,0,0,0,0,0,HR12186,NA,NA,NA,"TO PASS H.R. 12186, A BILL TO STRENGTHEN THE PENALTIES FOR VIOLATION OF THE BALD EAGLE PROTECTION ACT.","TO PASS H.R. 12186, A BILL TO STRENGTHEN THE PENALTIES FOR VIOLATION OF THE BALD EAGLE PROTECTION ACT.",7,709,7,709
66,8791,92,1,341,RH0920341,"'RH0920341',","RH0920341,",2/7/72,1972,2,7,NA,NA,340,7,0,0,0,0,0,HR12741,NA,NA,NA,"TO PASS H.R. 12741, TO EXTEND THE FEDERAL WATER POLLUTION CONTROL ACT THROUGH JUNE 30, 1972.","TO PASS H.R. 12741, TO EXTEND THE FEDERAL WATER POLLUTION CONTROL ACT THROUGH JUNE 30, 1972.",7,701,7,701
67,8802,92,1,352,RH0920352,"'RH0920352',","RH0920352,",2/29/72,1972,2,29,NA,NA,356,32,0.066,0.802,0.22,1.187,-45.218,HR11021,NA,NA,NA,"TO PASS H.R. 11021, A BILL TO CONTROL THE EMISSION OF NOISE DETRIMENTAL TO THE HUMAN ENVIRONMENT.","TO PASS H.R. 11021, A BILL TO CONTROL THE EMISSION OF NOISE DETRIMENTAL TO THE HUMAN ENVIRONMENT.",7,705,7,705
68,8812,92,1,362,RH0920362,"'RH0920362',","RH0920362,",3/9/72,1972,3,9,NA,NA,362,10,0.442,0.735,0.173,0.582,-27.525,HR10420,NA,NA,NA,"TO PASS H.R. 10420, A BILL TO PROTECT MARINE MAMMALS AND ESTABLISH A MARINE MAMMAL COMMISSION.","TO PASS H.R. 10420, A BILL TO PROTECT MARINE MAMMALS AND ESTABLISH A MARINE MAMMAL COMMISSION.",7,709,7,709
69,8825,92,1,375,RH0920375,"'RH0920375',","RH0920375,",3/28/72,1972,3,28,NA,NA,140,249,0.009,-0.326,0.12,0.454,-165.165,HR11896,NA,NA,NA,"TO AMEND H.R. 11896, A BILL TO AMEND THE FEDERAL WATER POLLUTION CONTROL ACT, BY REQUIRING INDUSTRY TO USE BY 1981, THE BEST AVAILABLE WASTE TREATMENT TECHNOLOGY.","TO AMEND H.R. 11896, A BILL TO AMEND THE FEDERAL WATER POLLUTION CONTROL ACT, BY REQUIRING INDUSTRY TO USE BY 1981, THE BEST AVAILABLE WASTE TREATMENT TECHNOLOGY.",7,703,7,703
70,8826,92,1,376,RH0920376,"'RH0920376',","RH0920376,",3/28/72,1972,3,28,NA,NA,125,268,0.01,-0.314,0.092,0.553,-162,HR11896,NA,NA,NA,"TO AMEND H.R. 11896, TO EMPOWER THE EPA TO REVIEW AND VETO INDIVIDUAL DISCHARGE PERMITS ISSUED BY THE STATES.","TO AMEND H.R. 11896, TO EMPOWER THE EPA TO REVIEW AND VETO INDIVIDUAL DISCHARGE PERMITS ISSUED BY THE STATES.",7,703,7,703
71,8827,92,1,377,RH0920377,"'RH0920377',","RH0920377,",3/28/72,1972,3,28,NA,NA,66,337,0.298,0.489,-0.171,-0.089,-122.807,HR11896,NA,NA,NA,"TO AMEND H.R. 11896, BY REQUIRING PRIVATE FIRMS WHICH DISCHARGE INTO MUNICIPAL TREATMENT SYSTEMS TO PAY USER CHARGES FOR THEIR SHARE OF THE CAPITAL COSTS OF ANY FEDERALLY FUNDED MUNICIPAL TREATMENT FACILITY.","TO AMEND H.R. 11896, BY REQUIRING PRIVATE FIRMS WHICH DIS- CHARGE INTO MUNICIPAL TREATMENT SYSTEMS TO PAY USER CHARGES FOR THEIR SHARE OF THE CAPITAL COSTS OF ANY FEDERALLY FUNDED MUNICIPAL TREATMENT FACILITY.",7,703,7,703
72,8828,92,1,378,RH0920378,"'RH0920378',","RH0920378,",3/28/72,1972,3,28,NA,NA,154,251,0.016,-0.278,0.118,0.493,-170.33,HR11896,NA,NA,NA,TO AMEND H.R. 11896 SO AS TO REQUIRE PERMITS TO CONTROL THE DISCHARGE OF WASTE INTO U.S. WATERWAYS.,TO AMEND H.R. 11896 SO AS TO REQUIRE PERMITS TO CONTROL THE DISCHARGE OF WASTE INTO U.S. WATERWAYS.,7,701,7,701
73,8829,92,1,379,RH0920379,"'RH0920379',","RH0920379,",3/29/72,1972,3,29,NA,NA,161,232,0.045,0.118,-0.099,-0.242,-203.656,HR11896,NA,NA,NA,"TO AMEND H.R. 11896 SO AS TO STRIKE THE CONTRACT AUTHORITY PROVISION FOR $18 BILLION FOR WASTE TREATMENT GRANTS AND TO SUBSTITUTE AUTHORIZATION FOR """"""""""""""""NO YEAR"""""""""""""""" APPROPRIATIONS BUT ON A ONE YEAR ADVANCE BASIS.",APPROPRIATIONS BUT ON A ONE YEAR ADVANCE BASIS.,7,703,7,703
74,8831,92,1,381,RH0920381,"'RH0920381',","RH0920381,",3/29/72,1972,3,29,NA,NA,251,130,-0.419,0.21,-0.054,0.373,-191.278,HR11896,NA,NA,NA,TO AMEND H.R. 11896 SO AS TO DIRECT THE EPA TO ENCOURAGE REGIONAL RESOURCE MANAGEMENT THAT UTILIZES SPRAY IRRIGATION AND RECYCLING OF WASTES.,TO AMEND H.R. 11896 SO AS TO DIRECT THE EPA TO ENCOURAGE RE- GIONAL RESOURCE MANAGEMENT THAT UTILIZES SPRAY IRRIGATION AND RECYCLING OF WASTES.,7,703,7,703
75,8832,92,1,382,RH0920382,"'RH0920382',","RH0920382,",3/29/72,1972,3,29,NA,NA,210,173,-0.604,0.285,0.011,0.385,-223.062,HR11896,NA,NA,NA,TO AMEND H.R. 11896 BY PRESERVING RIGHTS OF STATES TO CONTROL DISCHARGES FROM VESSELS.,TO AMEND H.R. 11896 BY PRESERVING RIGHTS OF STATES TO CON- TROL DISCHARGES FROM VESSELS.,7,703,7,703
76,8833,92,1,383,RH0920383,"'RH0920383',","RH0920383,",3/29/72,1972,3,29,NA,NA,380,14,0.59,0.14,0.231,0.262,-33.537,HR11896,NA,NA,NA,TO PASS H.R. 11896.,TO PASS H.R. 11896.,7,701,7,701
77,8917,92,1,446,RH0920446,"'RH0920446',","RH0920446,",6/5/72,1972,6,5,NA,NA,314,0,0,0,0,0,0,HR10310,NA,NA,NA,"TO SUSPEND THE RULES AND PASS H.R. 10310, A BILL TO ESTABLISH THE SEAL BEACH NATIONAL WILDLIFE REFUGE.","TO SUSPEND THE RULES AND PASS H.R. 10310, A BILL TO ESTAB- LISH THE SEAL BEACH NATIONAL WILDLIFE REFUGE.",7,709,7,709
78,8919,92,1,447,RH0920447,"'RH0920447',","RH0920447,",6/5/72,1972,6,5,NA,NA,312,5,0,0,0,0,0,HR14731,NA,NA,NA,"TO SUSPEND THE RULES AND PASS H.R. 14731, A BILL TO PROVIDE FOR THE EFFECTIVE ENFORCEMENT OF THE PROVISIONS OF THE FISH AND WILDLIFE ACT OF 1956 PROHIBITING THE SHOOTING AT BIRDS, FISH, AND OTHER ANIMALS FROM AIRCRAFT.","TO SUSPEND THE RULES AND PASS H.R. 14731, A BILL TO PROVIDE FOR THE EFFECTIVE ENFORCEMENT OF THE PROVISIONS OF THE FISH AND WILDLIFE ACT OF 1956 PROHIBITING THE SHOOTING AT BIRDS, FISH, AND OTHER ANIMALS FROM AIRCRAFT.",7,709,7,709
79,9024,92,1,501,RH0920501,"'RH0920501',","RH0920501,",7/17/72,1972,7,17,NA,NA,279,73,0.221,0.44,0.063,0.472,-136.588,HR13152,NA,NA,NA,"TO SUSPEND THE RULES AND PASS H.R. 13152, A BILL FOR THE CONTROL AND CONSERVATION OF PREDATORY ANIMALS.","TO SUSPEND THE RULES AND PASS H.R. 13152, A BILL FOR THE CONTROL AND CONSERVATION OF PREDATORY ANIMALS.",7,709,7,709
80,9045,92,1,512,RH0920512,"'RH0920512',","RH0920512,",7/24/72,1972,7,24,NA,NA,270,77,-0.35,-0.328,-0.084,-0.189,-187.56,HRES1024,NA,NA,NA,"TO AGREE TO H. RES. 1024, THE RULE UNDER WHICH H.R. 13366, A BILL TO PROVIDE PAYMENT FOR LOSSES RESULTING FROM THE BAN ON CYCLAMATES, WAS CONSIDERED.","TO AGREE TO H. RES. 1024, THE RULE UNDER WHICH H.R. 13366, A BILL TO PROVIDE PAYMENT FOR LOSSES RESULTING FROM THE BAN ON CYCLAMATES, WAS CONSIDERED.",7,704,7,704
81,9046,92,1,513,RH0920513,"'RH0920513',","RH0920513,",7/24/72,1972,7,24,NA,NA,177,170,-0.355,0.35,-0.032,-0.157,-247.806,HR13366,NA,NA,NA,TO PASS H.R. 13366.,TO PASS H.R. 13366.,7,704,7,704
82,9051,92,1,518,RH0920518,"'RH0920518',","RH0920518,",7/31/72,1972,7,31,NA,NA,325,2,0,0,0,0,0,HR5741,NA,NA,NA,"TO SUSPEND THE RULES AND PASS H.R. 5741, A BILL TO AUTHORIZE THE SECRETARY OF COMMERCE TO TRANSFER SURPLUS LIBERTY SHIPS TO STATES FOR USE IN MARINE LIFE CONSERVATION PROGRAMS.","TO SUSPEND THE RULES AND PASS H.R. 5741, A BILL TO AUTHORIZE THE SECRETARY OF COMMERCE TO TRANSFER SURPLUS LIBERTY SHIPS TO STATES FOR USE IN MARINE LIFE CONSERVATION PROGRAMS.",7,710,7,701
83,9052,92,1,519,RH0920519,"'RH0920519',","RH0920519,",7/31/72,1972,7,31,NA,NA,332,1,0,0,0,0,0,HR11300,NA,NA,NA,"TO SUSPEND THE RULES AND PASS H.R. 11300, A BILL TO AMEND SECTION 509 OF THE MERCHANT MARINE ACT, 1936.","TO SUSPEND THE RULES AND PASS H.R. 11300, A BILL TO AMEND SECTION 509 OF THE MERCHANT MARINE ACT, 1936.",7,710,7,701
84,9226,92,1,610,RH0920610,"'RH0920610',","RH0920610,",10/4/72,1972,10,4,NA,NA,366,11,0.387,0.633,0.268,0.591,-23.016,S2770,NA,NA,NA,"TO AGREE TO THE CONFERENCE REPORT ON S. 2770, A BILL TO AMEND THE WATER POLLUTION CONTROL ACT.","TO AGREE TO THE CONFERENCE REPORT ON S. 2770, A BILL TO AMEND THE WATER POLLUTION CONTROL ACT.",7,701,7,701
85,9269,92,1,633,RH0920633,"'RH0920633',","RH0920633,",10/12/72,1972,10,12,NA,NA,198,99,-0.188,-0.186,-0.132,-0.262,-118.855,HR10729,NA,NA,NA,"TO AGREE TO THE CONFERENCE REPORT ON H.R. 10729, A BILL TO AMEND THE FEDERAL INSECTICIDE, FUNGICIDE, AND RODENTICIDE ACT.","TO AGREE TO THE CONFERENCE REPORT ON H.R. 10729, A BILL TO AMEND THE FEDERAL INSECTICIDE, FUNGICIDE, AND RODENTICIDE ACT.",7,704,7,704
86,9275,92,1,636,RH0920636,"'RH0920636',","RH0920636,",10/13/72,1972,10,13,NA,NA,240,61,0.212,0.246,0.182,0.512,-88.203,S1478,NA,NA,NA,"TO SUSPEND THE RULES AND PASS S. 1478, A BILL TO REGULATE COMMERCE BY REQUIRING PREMARKET TESTING OF NEW CHEMICAL SUBSTANCES AND TO PROVIDE FOR SCREENING OF THE RESULTS OF SUCH TESTING PRIOR TO COMMERCIAL PRODUCTION, TO REQUIRE TESTING OF CERTAIN CHEMICAL SUBSTANCES, TO AUTHORIZE THE REGULATION OF THE USE AND DISTRIBUTION OF CHEMICAL SUBSTANCES.","TO SUSPEND THE RULES AND PASS S. 1478, A BILL TO REGULATE COMMERCE BY REQUIRING PREMARKET TESTING OF NEW CHEMICAL SUBSTANCES AND TO PROVIDE FOR SCREENING OF THE RESULTS OF SUCH TESTING PRIOR TO COMMERCIAL PRODUCTION, TO REQUIRE TESTING OF CERTAIN CHEMIC",7,704,7,704
87,9298,92,1,648,RH0920648,"'RH0920648',","RH0920648,",10/18/72,1972,10,18,NA,NA,247,23,0.315,0.392,0.169,0.389,-63.455,S2770,NA,NA,NA,"TO OVERRIDE THE PRESIDENT'S VETO OF S. 2770, THE 1972 AMENDMENTS TO THE FEDERAL WATER POLLUTION CONTROL ACT.","TO OVERRIDE THE PRESIDENT'S VETO OF S. 2770, THE 1972 AMENDMENTS TO THE FEDERAL WATER POLLUTION CONTROL ACT.",7,701,7,701
88,9775,93,1,166,RH0930166,"'RH0930166',","RH0930166,",6/19/73,1973,6,19,NA,NA,389,4,0,0,0,0,0,HRES434,NA,NA,NA,"TO PASS H. RES. 434, THE RULE UNDER WHICH H.R. 5464, A BILL TO AUTHORIZE APPROPRIATIONS FOR THE SALINE WATER PROGRAM FOR FISCAL 1974, WAS CONSIDERED.","TO PASS H. RES. 434, THE RULE UNDER WHICH H.R. 5464, A BILL TO AUTHORIZE APPROPRIATIONS FOR THE SALINE WATER PROGRAM FOR FISCAL 1974, WAS CONSIDERED.",7,701,7,701
89,9777,93,1,167,RH0930167,"'RH0930167',","RH0930167,",6/19/73,1973,6,19,NA,NA,281,125,0.07,0.629,0.139,0.149,-172.86,HR5464,NA,NA,NA,"TO AGREE TO A COMMITTEE AMENDMENT TO H.R. 5464, RAISING FUNDS AUTHORIZED FROM $2.5 MILLION TO $9.1 MILLION.","TO AGREE TO A COMMITTEE AMENDMENT TO H.R. 5464, RAISING FUNDS AUTHORIZED FROM $2.5 MILLION TO $9.1 MILLION.",7,701,7,701
90,9779,93,1,168,RH0930168,"'RH0930168',","RH0930168,",6/19/73,1973,6,19,NA,NA,399,4,0,0,0,0,0,HR5464,NA,NA,NA,TO PASS H. R. 5464.,TO PASS H. R. 5464.,7,701,7,701
91,9839,93,1,195,RH0930195,"'RH0930195',","RH0930195,",6/25/73,1973,6,25,NA,NA,136,265,-0.331,0.009,0.077,0.417,-194.043,HR8662,NA,NA,NA,"TO AMEND H.R. 8662, A BILL TO AUTHORIZE APPROPRIATIONS TO THE A.E.C., SO AS TO PERMIT STATES TO SET STANDARDS FOR RADIATION EMISSIONS STRICTER THAN THOSE ESTABLISHED BY THE AEC.","TO AMEND H.R. 8662, A BILL TO AUTHORIZE APPROPRIATIONS TO THE A.E.C., SO AS TO PERMIT STATES TO SET STANDARDS FOR RADIATION EMISSIONS STRICTER THAN THOSE ESTABLISHED BY THE AEC.",7,704,7,704
92,9988,93,1,263,RH0930263,"'RH0930263',","RH0930263,",7/23/73,1973,7,23,NA,NA,193,192,-0.169,0.378,0.181,0.396,-133.361,HR8658,NA,NA,NA,"TO AMEND H.R. 8658 SO AS TO DIRECT THE ADMINISTRATOR TO USE THE WATER POLLUTION CONTROL ACT, CLEAN AIR ACT, OR ANOTHER ACT UNDER HIS JURISDICTION, WHERE APPROPRIATE, TO REGULATE CHEMICAL SUBSTANCES. (THIS VOTE WAS TAKEN IN COMMITTEE OF THE WHOLE).","TO AMEND H.R. 8658 SO AS TO DIRECT THE ADMINISTRATOR TO USE THE WATER POLLUTION CONTROL ACT, CLEAN AIR ACT, OR ANOTHER ACT UNDER HIS JURISDICTION, WHERE APPROPRIATE, TO REGULATE CHEMICAL SUBSTANCES. THIS VOTE WAS TAKEN IN COMMITTEE OF THE WHOLE).",7,700,7,700
93,9992,93,1,265,RH0930265,"'RH0930265',","RH0930265,",7/23/73,1973,7,23,NA,NA,189,202,-0.224,0.404,0.187,0.453,-135.357,HR8658,NA,NA,NA,"TO AMEND H.R. 8658 SO AS TO DIRECT THE ADMINISTRATOR TO USE THE WATER POLLUTION CONTROL ACT, CLEAN AIR ACT, OR ANOTHER ACT UNDER HIS JURISDICTION, WHERE APPROPRIATE, TO REGULATE CHEMICAL SUBSTANCES.","TO AMEND H.R. 8658 SO AS TO DIRECT THE ADMINISTRATOR TO USE THE WATER POLLUTION CONTROL ACT, CLEAN AIR ACT, OR ANOTHER ACT UNDER HIS JURISDICTION, WHERE APPROPRIATE, TO REGULATE CHEMICAL SUBSTANCES.",7,700,7,700
94,10105,93,1,316,RH0930316,"'RH0930316',","RH0930316,",9/5/73,1973,9,5,NA,NA,368,11,0.552,0.071,0.461,0.809,-15.18,HR8920,NA,NA,NA,"TO PASS H.R. 8920, A BILL TO AMEND THE LEAD-BASED PAINT POISONING PREVENTION ACT.","TO PASS H.R. 8920, A BILL TO AMEND THE LEAD-BASED PAINT POISONING PREVENTION ACT.",7,704,7,704
95,10113,93,1,32,RH0930032,"'RH0930032',","RH0930032,",3/21/73,1973,3,21,NA,NA,392,2,0,0,0,0,0,HR5446,NA,NA,NA,"TO PASS H.R. 5446, A BILL TO EXTEND THE SOLID WASTE DISPOSAL ACT FOR 1 YEAR.","TO PASS H.R. 5446, A BILL TO EXTEND THE SOLID WASTE DISPOSAL ACT FOR 1 YEAR.",7,703,7,703
96,10155,93,1,339,RH0930339,"'RH0930339',","RH0930339,",9/18/73,1973,9,18,NA,NA,390,12,0.285,0.948,0.205,0.518,-30.51,HR37,NA,NA,NA,"TO SUSPEND THE RULES AND PASS H.R. 37, THE ENDANGERED AND THREATENED SPECIES ACT OF 1973.","TO SUSPEND THE RULES AND PASS H.R. 37, THE ENDANGERED AND THREATENED SPECIES ACT OF 1973.",7,709,7,709
97,10157,93,1,34,RH0930034,"'RH0930034',","RH0930034,",3/22/73,1973,3,22,NA,NA,387,1,0,0,0,0,0,HR5445,NA,NA,NA,"TO PASS H.R. 5445, A BILL TO EXTEND THE CLEAN AIR ACT FOR 1 YEAR.","TO PASS H.R. 5445, A BILL TO EXTEND THE CLEAN AIR ACT FOR 1 YEAR.",7,705,7,705
98,10212,93,1,368,RH0930368,"'RH0930368',","RH0930368,",10/3/73,1973,10,3,NA,NA,376,2,0,0,0,0,0,HR10088,NA,NA,NA,"TO PASS H. R. 10088, TO ESTABLISH THE BIG CYPRESS NATIONAL PRESERVE IN FLORIDA.","TO PASS H. R. 10088, TO ESTABLISH THE BIG CYPRESS NATIONAL PRESERVE IN FLORIDA.",7,709,7,709
99,10238,93,1,38,RH0930038,"'RH0930038',","RH0930038,",4/2/73,1973,4,2,NA,NA,303,52,0.296,0.664,0.083,0.283,-131.083,HRES330,NA,NA,NA,"TO SUSPEND THE RULES AND PASS H. RES. 330, A RESOLUTION ON U. S. OCEANS POLICY AT THE LAW OF THE SEA CONFERENCE.","TO SUSPEND THE RULES AND PASS H. RES. 330, A RESOLUTION ON U. S. OCEANS POLICY AT THE LAW OF THE SEA CONFERENCE.",7,710,7,701
100,10286,93,1,400,RH0930400,"'RH0930400',","RH0930400,",10/24/73,1973,10,24,NA,NA,369,15,0.472,0.324,0.285,0.668,-29.197,HRES600,NA,NA,NA,"TO AGREE TO H. RES. 600, THE RULE FOR CONSIDERATION OF H. R. 3927, A BILL TO EXTEND THE ENVIRONMENTAL EDUCATION ACT FOR THREE YEARS.","TO AGREE TO H. RES. 600, THE RULE FOR CONSIDERATION OF H. R. 3927, A BILL TO EXTEND THE ENVIRONMENTAL EDUCATION ACT FOR THREE YEARS.",7,799,7,799
101,10288,93,1,401,RH0930401,"'RH0930401',","RH0930401,",10/24/73,1973,10,24,NA,NA,140,252,0.138,0.018,-0.185,-0.357,-140.609,HR3927,NA,NA,NA,"TO AMEND H.R. 3927, BY PROVIDING A 1-YEAR, INSTEAD OF 3-YEAR AUTHORIZATION.","TO AMEND H.R. 3927, BY PROVIDING A 1-YEAR, INSTEAD OF 3-YEAR AUTHORIZATION.",7,799,7,799
102,10290,93,1,402,RH0930402,"'RH0930402',","RH0930402,",10/24/73,1973,10,24,NA,NA,334,60,0.429,-0.207,0.299,0.564,-81.72,HR3927,NA,NA,NA,TO PASS H.R. 3927.,TO PASS H.R. 3927.,7,799,7,799
103,10468,93,1,489,RH0930489,"'RH0930489',","RH0930489,",12/13/73,1973,12,13,NA,NA,199,180,-0.026,-0.034,-0.154,-0.349,-150.453,HR11450,NA,NA,NA,"TO AMEND THE COMMITTEE AMENDMENT TO H.R. 11450, BY EXTENDING THE DATE FOR COMPLIANCE WITH VEHICLE EMISSION STANDARDS THROUGH 1977.","TO AMEND THE COMMITTEE AMENDMENT TO H.R. 11450, BY EXTENDING THE DATE FOR COMPLIANCE WITH VEHICLE EMISSION STANDARDS THROUGH 1977.",7,705,7,705
104,10474,93,1,491,RH0930491,"'RH0930491',","RH0930491,",12/14/73,1973,12,14,NA,NA,180,210,0.049,0.025,-0.117,-0.485,-171.439,HR11450,NA,NA,NA,"TO AMEND THE COMMITTEE AMENDMENT TO H. R. 11450, BY RESCINDING THE REQUIREMENT FOR EMISSION CONTROL DEVICES ON VEHICLES THROUGHOUT THE NATION UNTIL JAN. 1, 1977, EXCEPT FOR CERTAIN AREAS WHICH HAVE SIGNIFICANTLY HIGH POLLUTION LEVELS.","TO AMEND THE COMMITTEE AMENDMENT TO H. R. 11450, BY RESCINDING THE REQUIREMENT FOR EMISSION CONTROL DEVICES ON VEHICLES THROUGHOUT THE NATION UNTIL JAN. 1, 1977, EXCEPT FOR CERTAIN AREAS WHICH HAVE SIGNIFICANTLY HIGH POLLUTION LEVELS.",7,705,7,705
105,10503,93,1,505,RH0930505,"'RH0930505',","RH0930505,",12/14/73,1973,12,14,NA,NA,349,8,0,0,0,0,0,HR11450,NA,NA,NA,TO AMEND THE COMMITTEE AMENDMENT TO H.R. 11450 BY ELIMINATING DISCRIMINATION AGAINST THE SHIPMENT OF RECYCLED MATERIALS.,TO AMEND THE COMMITTEE AMENDMENT TO H.R. 11450 BY ELIMINATING DISCRIMINATION AGAINST THE SHIPMENT OF RECYCLED MATERIALS.,7,707,7,707
106,10508,93,1,508,RH0930508,"'RH0930508',","RH0930508,",12/14/73,1973,12,14,NA,NA,170,205,0.06,0.028,-0.118,-0.512,-162.517,HR11450,NA,NA,NA,"TO AMEND THE COMMITTEE AMENDMENT TO H.R. 11450 BY RESCINDING THE REQUIREMENT FOR EMISSION CONTROL DEVICES ON VEHICLES THROUGHOUT THE NATION UNTIL JAN. 1, 1976 EXCEPT FOR CERTAIN AREAS HAVING SIGNIFICANTLY HIGH POLLUTION LEVELS.","TO AMEND THE COMMITTEE AMENDMENT TO H.R. 11450 BY RESCINDING THE REQUIREMENT FOR EMISSION CONTROL DEVICES ON VEHICLES THROUGHOUT THE NATION UNTIL JAN. 1, 1976 EXCEPT FOR CERTAIN AREAS HAVING SIGNIFICANTLY HIGH POLLUTION LEVELS.",7,705,7,705
107,10556,93,1,531,RH0930531,"'RH0930531',","RH0930531,",12/20/73,1973,12,20,NA,NA,355,4,0,0,0,0,0,S1983,NA,NA,NA,"TO AGREE TO THE CONFERENCE REPORT ON S. 1983, TO PROVIDE FOR THE CONSERVATION, PROTECTION, RESTORATION AND PROPAGATION OF THREATENED AND ENDANGERED SPECIES OF WILDLIFE, FISH, AND PLANTS.","TO AGREE TO THE CONFERENCE REPORT ON S. 1983, TO PROVIDE FOR THE CONSERVATION, PROTECTION, RESTORATION AND PROPAGATION OF THREATENED AND ENDANGERED SPECIES OF WILDLIFE, FISH, AND PLANTS.",7,709,7,709
108,10684,93,1,81,RH0930081,"'RH0930081',","RH0930081,",5/8/73,1973,5,8,NA,NA,370,1,0,0,0,0,0,HR5451,NA,NA,NA,"TO SUSPEND THE RULES AND PASS H.R. 5451, THE OIL POLLUTION ACT AMENDMENTS OF 1973.","TO SUSPEND THE RULES AND PASS H.R. 5451, THE OIL POLLUTION ACT AMENDMENTS OF 1973.",7,704,7,704
109,10708,93,1,93,RH0930093,"'RH0930093',","RH0930093,",5/15/73,1973,5,15,NA,NA,164,216,0.367,-0.262,-0.194,-0.942,-139.762,HR6768,NA,NA,NA,"TO AMEND H. R. 6768 SO AS TO REDUCE FUNDS FROM $40 MILLION, UNTIL EXPENDED, TO $2.5 MILLION, AVAILABLE FOR FISCAL 1974 ONLY. H.R. 6768 IS A BILL TO PROVIDE FOR PARTICIPATION BY THE U.S. IN THE U.N. ENVIRONMENTAL PROGRAM.","TO AMEND H. R. 6768 SO AS TO REDUCE FUNDS FROM $40 MILLION, UNTIL EXPENDED, TO $2.5 MILLION, AVAILABLE FOR FISCAL 1974 ONLY. H.R. 6768 IS A BILL TO PROVIDE FOR PARTICIPATION BY THE U.S. IN THE U.N. ENVIRONMENTAL PROGRAM.",7,700,7,700
110,10710,93,1,94,RH0930094,"'RH0930094',","RH0930094,",5/15/73,1973,5,15,NA,NA,200,184,0.206,-0.248,-0.134,-0.625,-158.907,HR6768,NA,NA,NA,"TO AMEND H.R. 6768, BY REDUCING FUNDS FROM $40 MILLION, AVAILABLE TILL EXPENDED, TO $5 MILLION, AVAILABLE FOR FISCAL 1974 ONLY (VOTED WHILE IN THE COMMITTEE OF THE WHOLE).","TO AMEND H.R. 6768, BY REDUCING FUNDS FROM $40 MILLION, AVAILABLE TILL EXPENDED, TO $5 MILLION, AVAILABLE FOR FISCAL 1974 ONLY VOTED WHILE IN THE COMMITTEE OF THE WHOLE).",7,700,7,700
111,10712,93,1,95,RH0930095,"'RH0930095',","RH0930095,",5/15/73,1973,5,15,NA,NA,192,198,0.06,-0.037,-0.156,-0.713,-145.267,HR6768,NA,NA,NA,"TO AMEND H.R. 6768 BY REDUCING FUNDS FROM $40 MILLION, AVAILABLE TILL EXPENDED, TO $5 MILLION, AVAILABLE FOR FISCAL 1974 ONLY (VOTED ON A DEMAND FOR A SEPARATE VOTE).","TO AMEND H.R. 6768 BY REDUCING FUNDS FROM $40 MILLION, AVAILABLE TILL EXPENDED, TO $5 MILLION, AVAILABLE FOR FISCAL 1974 ONLY VOTED ON A DEMAND FOR A SEPARATE VOTE).",7,700,7,700
112,10714,93,1,96,RH0930096,"'RH0930096',","RH0930096,",5/15/73,1973,5,15,NA,NA,266,123,0.232,0.065,0.289,1.55,-103.025,HR6768,NA,NA,NA,TO PASS H.R. 6768.,TO PASS H.R. 6768.,7,700,7,700
113,10778,93,1,1006,RH0931006,"'RH0931006',","RH0931006,",11/19/74,1974,11,19,NA,NA,296,83,0.052,0.493,0.146,0.527,-119.241,HR13002,NA,NA,NA,"TO PASS H.R. 13002, AMENDING THE PUBLIC HEALTH SERVICE ACT TO ASSURE THAT THE PUBLIC IS PROVIDED WITH SAFE DRINKING WATER.","TO PASS H.R. 13002, AMENDING THE PUBLIC HEALTH SERVICE ACT TO ASSURE THAT THE PUBLIC IS PROVIDED WITH SAFE DRINK- ING WATER.",7,701,7,701
114,10844,93,1,1040,RH0931040,"'RH0931040',","RH0931040,",12/12/74,1974,12,12,NA,NA,282,90,-0.076,-0.418,-0.13,-0.626,-116.618,HR16901,NA,NA,NA,"TO INSIST ON ITS DISAGREEMENT TO SENATE AMENDMENT NO. 8 TO H.R. 16901, THE AGRICULTURE-ENVIRONMENTAL AND CONSUMER PROTECTION APPROPRIATIONS FOR FISCAL 1975. SENATE AMENDMENT NO. 8 PROVIDES THAT NO FUNDS MAY BE USED BY THE EPA TO ADMINISTER ANY PROGRAM REGULATING PARKING FACILITIES.","TO INSIST ON ITS DISAGREEMENT TO SENATE AMENDMENT NO. 8 TO H.R. 16901, THE AGRICULTURE-ENVIRONMENTAL AND CONSUMER PROTECTION APPROPRIATIONS FOR FISCAL 1975. SENATE AMENDMENT NO. 8 PROVIDES THAT NO FUNDS MAY BE USED BY THE EPA TO ADMINISTER ANY PROGRAM",7,799,7,799
115,11223,93,1,696,RH0930696,"'RH0930696',","RH0930696,",5/21/74,1974,5,21,NA,NA,396,3,0,0,0,0,0,HR13221,NA,NA,NA,"TO SUSPEND THE RULES AND PASS H.R. 13221, A BILL TO AUTHORIZE APPROPRIATIONS FOR THE SALINE WATER PROGRAM.","TO SUSPEND THE RULES AND PASS H.R. 13221, A BILL TO AUTHORIZE APPROPRIATIONS FOR THE SALINE WATER PROGRAM.",7,701,7,701
116,11902,94,1,124,RH0940124,"'RH0940124',","RH0940124,",5/5/75,1975,5,5,NA,NA,222,132,-0.12,0.493,0.177,0.34,-122.907,HR5272,NA,NA,NA,"TO SUSPEND THE RULES AND PASS H.R. 5272, AUTHORIZING ADDITIONAL APPROPRIATIONS UNDER THE NOISE CONTROL ACT OF 1972.","TO SUSPEND THE RULES AND PASS H.R. 5272, AUTHORIZING ADDITIONAL APPROPRIATIONS UNDER THE NOISE CONTROL ACT OF 1972.",7,705,7,705
117,11975,94,1,158,RH0940158,"'RH0940158',","RH0940158,",5/19/75,1975,5,19,NA,NA,377,17,0.323,0.946,0.17,0.313,-50.005,HR5710,NA,NA,NA,"TO SUSPEND THE RULES AND PASS H.R. 5710, MARINE PROTECTION,","TO SUSPEND THE RULES AND PASS H.R. 5710, MARINE PROTECTION,",7,710,7,701
118,12137,94,1,233,RH0940233,"'RH0940233',","RH0940233,",6/19/75,1975,6,19,NA,NA,249,170,-0.051,0.201,0.092,0.16,-222.493,HR6860,NA,NA,NA,TO AMEND H.R. 6860 BY STRIKING LANGUAGE WHICH EXTENDS A TAX INVESTMENT CREDIT FOR RECYCLING.,TO AMEND H.R. 6860 BY STRIKING LANGUAGE WHICH EXTENDS A TAX INVESTMENT CREDIT FOR RECYCLING.,7,707,7,707
119,12209,94,1,268,RH0940268,"'RH0940268',","RH0940268,",7/8/75,1975,7,8,NA,NA,400,0,0,0,0,0,0,HR5608,NA,NA,NA,"TO SUSPEND THE RULES AND PASS H.R. 5608, TO EXTEND THE WETLANDS LOAN ACT.","TO SUSPEND THE RULES AND PASS H.R. 5608, TO EXTEND THE WET- LANDS LOAN ACT.",7,710,7,701
120,12232,94,1,279,RH0940279,"'RH0940279',","RH0940279,",7/10/75,1975,7,10,NA,NA,383,15,0.49,0.246,0.248,0.479,-30.124,HR7108,NA,NA,NA,"TO PASS H.R. 7108, AUTHORIZING FUNDS FOR ENVIRONMENTAL RESEARCH DEVELOPMENT AND DEMONSTRATION.","TO PASS H.R. 7108, AUTHORIZING FUNDS FOR ENVIRONMENTAL RESEARCH DEVELOPMENT AND DEMONSTRATION.",7,798,7,798
121,12242,94,1,284,RH0940284,"'RH0940284',","RH0940284,",7/14/75,1975,7,14,NA,NA,307,86,0.253,0.161,0.112,0.192,-164.089,HR8561,NA,NA,NA,"TO AMEND H.R. 8561, FISCAL 1976 APPROPRIATIONS FOR AGRICULTURE AND RELATED AGENCIES BY ADDING $250 MILLION TO THE FARMERS HOME ADMINISTRATION REVOLVING LOAN FUND TO HELP SMALL FARMERS MEET FEDERALLY IMPOSED WATER POLLUTION STANDARDS.","TO AMEND H.R. 8561, FISCAL 1976 APPROPRIATIONS FOR AGRICULTURE AND RELATED AGENCIES BY ADDING $250 MILLION TO THE FARMERS HOME ADMINISTRATION REVOLVING LOAN FUND TO HELP SMALL FARMERS MEET FEDERALLY IMPOSED WATER POLLUTION STANDARDS.",7,701,7,701
122,12298,94,1,310,RH0940310,"'RH0940310',","RH0940310,",7/23/75,1975,7,23,NA,NA,220,203,0.277,-0.415,0.063,0.265,-253.084,HR8773,NA,NA,NA,"TO AMEND H.R. 8773, MAKING APPROPRIATIONS FOR THE DEPT. OF THE INTERIOR FOR THE PERIOD ENDING SEPT. 30, 1976, BY ADDING $9 MILLION FOR THE ACCELERATED WETLANDS PROGRAM.","TO AMEND H.R. 8773, MAKING APPROPRIATIONS FOR THE DEPT. OF THE INTERIOR FOR THE PERIOD ENDING SEPT. 30, 1976, BY ADDING $9 MILLION FOR THE ACCELERATED WETLANDS PROGRAM.",7,710,7,701
123,12350,94,1,335,RH0940335,"'RH0940335',","RH0940335,",7/29/75,1975,7,29,NA,NA,279,143,0.255,-0.005,0.086,0.507,-186.45,HR3130,NA,NA,NA,"TO AGREE TO THE CONFERENCE REPORT ON H.R. 3130, A BILL AMENDING THE NATIONAL ENVIRONMENTAL POLICY ACT TO CLARIFY THE PROCEDURES THEREIN WITH RESPECT TO THE PREPARATION OF ENVIRONMENTAL IMPACT STATEMENTS.","TO AGREE TO THE CONFERENCE REPORT ON H.R. 3130, A BILL AMENDING THE NATIONAL ENVIRONMENTAL POLICY ACT TO CLARIFY THE PROCEDURES THEREIN WITH RESPECT TO THE PREPARATION OF ENVIRONMENTAL IMPACT STATEMENTS.",7,700,7,700
124,12356,94,1,338,RH0940338,"'RH0940338',","RH0940338,",7/29/75,1975,7,29,NA,NA,390,35,0.307,0.372,0.217,0.703,-62.073,HR5272,NA,NA,NA,"TO PASS H.R. 5272, THE NOISE CONTROL ACT EXTENSION.","TO PASS H.R. 5272, THE NOISE CONTROL ACT EXTENSION.",7,705,7,705
125,12397,94,1,36,RH0940036,"'RH0940036',","RH0940036,",3/18/75,1975,3,18,NA,NA,374,30,0.182,0.979,0.1,0.347,-86.345,HRES258,NA,NA,NA,"TO SUSPEND THE RULES AND PASS H.R. RES. 258, DESIGNATING MARCH 21, 1975, AS EARTH DAY.","TO SUSPEND THE RULES AND PASS H.R. RES. 258, DESIGNATING MARCH 21, 1975, AS EARTH DAY.",7,799,7,799
126,12508,94,1,412,RH0940412,"'RH0940412',","RH0940412,",9/26/75,1975,9,26,NA,NA,369,0,0,0,0,0,0,HRES734,NA,NA,NA,"TO AGREE TO H.RES. 734, A BILL EXTENDING AND AMENDING THE FEDERAL INSECTICIDE, FUNGICIDE AND RODENTICIDE ACT.","TO AGREE TO H.RES. 734, A BILL EXTENDING AND AMENDING THE FEDERAL INSECTICIDE, FUNGICIDE AND RODENTICIDE ACT.",7,704,7,704
127,12512,94,1,414,RH0940414,"'RH0940414',","RH0940414,",9/26/75,1975,9,26,NA,NA,325,2,0,0,0,0,0,HR8841,NA,NA,NA,"TO RESOLVE INTO COMMITTEE OF THE WHOLE TO CONSIDER H.R. 8841, A BILL EXTENDING AND AMENDING THE FEDERAL INSECTICIDE, FUNGICIDE AND RODENTICIDE ACT.","TO RESOLVE INTO COMMITTEE OF THE WHOLE TO CONSIDER H.R. 8841, A BILL EXTENDING AND AMENDING THE FEDERAL INSECTICIDE, FUNGICIDE AND RODENTICIDE ACT.",7,704,7,704
128,12514,94,1,415,RH0940415,"'RH0940415',","RH0940415,",9/26/75,1975,9,26,NA,NA,239,66,-0.036,-0.999,0.067,-0.211,-137.428,HR8841,NA,NA,NA,"TO AGREE THAT THE COMMITTEE NOW RISE, WHILE CONSIDERING H.R. 8841, A BILL EXTENDING AND AMENDING THE FEDERAL INSECTICIDE, FUNGICIDE AND RODENTICIDE ACT.","TO AGREE THAT THE COMMITTEE NOW RISE, WHILE CONSIDERING H.R. 8841, A BILL EXTENDING AND AMENDING THE FEDERAL INSECTICIDE, FUNGICIDE AND RODENTICIDE ACT.",7,704,7,704
129,12560,94,1,437,RH0940437,"'RH0940437',","RH0940437,",10/3/75,1975,10,3,NA,NA,167,175,-0.136,0.12,-0.256,-0.885,-84.366,HR8841,NA,NA,NA,"TO AMEND THE BROWN OF CALIF. AMENMENT TO H.R. 8841, A BILL TO EXTEND THE FEDERAL INSECTICIDE, FUNGICIDE AND RODENTICIDE ACT FOR ONE YEAR. THE BROWN AMENDMENT IN THE NATURE OF A SUBSTITUTE EXTENDS THE CURRENT PROGRAM FOR ONE YEAR. THE SYMMS AMENDMENT THERETO WOULD GIVE THE SEC'Y OF AGRIC. VETO POWER OVER ANY DECISIONS MADE ON THE BANNING OF INSECTICIDE.","TO AMEND THE BROWN OF CALIF. AMENMENT TO H.R. 8841, A BILL TO EXTEND THE FEDERAL INSECTICIDE, FUNGICIDE AND RODENTICIDE ACT FOR ONE YEAR. THE BROWN AMENDMENT IN THE NATURE OF A SUBSTITUTE EXTENDS THE CURRENT PROGRAM FOR ONE YEAR. THE SYMMS AMENDMENT TH",7,704,7,704
130,12562,94,1,438,RH0940438,"'RH0940438',","RH0940438,",10/3/75,1975,10,3,NA,NA,66,272,-0.314,-0.388,0.117,0.455,-117.385,HR8841,NA,NA,NA,"TO AMEND H.R. 8841 BY SUBSTITUTING A PROVISION THAT EXTENDS THE PRESENT PROGRAM FOR ONE YEAR, INSTEAD OF ALTERING EXISTING LAW BY REQUIRING THE EPA TO SEEK AND PUBLISH THE VIEWS OF THE AGRICULTURE DEPARTMENT BEFORE BANNING A PESTICIDE.","TO AMEND H.R. 8841 BY SUBSTITUTING A PROVISION THAT EXTENDS THE PRESENT PROGRAM FOR ONE YEAR, INSTEAD OF ALTERING EXISTING LAW BY REQUIRING THE EPA TO SEEK AND PUBLISH THE VIEWS OF THE AGRICULTURE DEPARTMENT BEFORE BANNING A PESTICIDE.",7,704,7,704
131,12573,94,1,443,RH0940443,"'RH0940443',","RH0940443,",10/7/75,1975,10,7,NA,NA,360,47,-0.577,0.531,-0.13,0.145,-137.612,HRES760,NA,NA,NA,"TO AGREE TO H. RES. 760, PROVIDING FOR THE CONSIDERATION OF H.R. 200, THE MARINES FISHERIES CONSERVATION ACT OF 1975.","TO AGREE TO H. RES. 760, PROVIDING FOR THE CONSIDERATION OF H.R. 200, THE MARINES FISHERIES CONSERVATION ACT OF 1975.",7,709,7,709
132,12591,94,1,452,RH0940452,"'RH0940452',","RH0940452,",10/9/75,1975,10,9,NA,NA,164,233,-0.055,0.1,-0.236,-0.632,-107.767,HR8841,NA,NA,NA,TO AMEND H.R. 8841 BY REQUIRING THE ADMINISTRATOR TO HAVE THE CONCURRENCE OF THE SECRETARY OF AGRICULTURE BEFORE HE ISSUES NOTICE OF SUSPENSION OF A PESTICIDE REGISTRATION.,TO AMEND H.R. 8841 BY REQUIRING THE ADMINISTRATOR TO HAVE THE CONCURRENCE OF THE SECRETARY OF AGRICULTURE BEFORE HE ISSUES NOTICE OF SUSPENSION OF A PESTICIDE REGISTRATION.,7,704,7,704
133,12593,94,1,453,RH0940453,"'RH0940453',","RH0940453,",10/9/75,1975,10,9,NA,NA,250,155,0.015,0.014,0.156,0.295,-156.927,HR8841,NA,NA,NA,"TO AMEND H.R. 8841 BY ALLOWING THE ADMINISTRATOR TO REQUIRE PRIVATE APPLICATORS TO BE LICENSED BY THE STATES AND TO COMPLETE TRAINING PROGRAMS PRIOR TO THEIR CERTICATION, BUT DOES NOT REQUIRE AN EXAMINATION FOR CERTIFICATION.","TO AMEND H.R. 8841 BY ALLOWING THE ADMINISTRATOR TO REQUIRE PRIVATE APPLICATORS TO BE LICENSED BY THE STATES AND TO COMPLETE TRAINING PROGRAMS PRIOR TO THEIR CERTICATION, BUT DOES NOT REQUIRE AN EXAMINATION FOR CERTIFICATION.",7,704,7,704
134,12594,94,1,454,RH0940454,"'RH0940454',","RH0940454,",10/9/75,1975,10,9,NA,NA,329,80,0.229,0.128,0.146,0.276,-147.409,HR8841,NA,NA,NA,TO PASS H.R. 8841.,TO PASS H.R. 8841.,7,704,7,704
135,12735,94,1,521,RH0940521,"'RH0940521',","RH0940521,",11/14/75,1975,11,14,NA,NA,341,10,-0.925,-0.116,-0.202,0.177,-44.563,HR5512,NA,NA,NA,"TO PASS H.R. 5512, TO SUSPEND THE NATIONAL WILDLIFE REFUGE SYSTEM ADMINISTRATION ACT OF 1966.","TO PASS H.R. 5512, TO SUSPEND THE NATIONAL WILDLIFE REFUGE SYSTEM ADMINISTRATION ACT OF 1966.",7,709,7,709
136,12756,94,1,532,RH0940532,"'RH0940532',","RH0940532,",11/18/75,1975,11,18,NA,NA,334,76,0.257,0.099,0.164,0.296,-127.923,HR8841,NA,NA,NA,"TO SUSPEND THE RULES AND AGREE TO THE CONFERENCE REPORT ON H.R. 8841, A BILL TO EXTEND THE FEDERAL INSECTICIDE, FUNGICIDE AND RODENTICIDE ACT.","TO SUSPEND THE RULES AND AGREE TO THE CONFERENCE REPORT ON H.R. 8841, A BILL TO EXTEND THE FEDERAL INSECTICIDE, FUNGICIDE AND RODENTICIDE ACT.",7,704,7,704
137,12809,94,1,557,RH0940557,"'RH0940557',","RH0940557,",12/8/75,1975,12,8,NA,NA,176,217,-0.189,-0.002,0.125,0.511,-158.457,HR8631,NA,NA,NA,"TO AMEND H.R. 8631, A BILL REVISING THE METHOD OF PROVIDING FOR PUBLIC REMUNERATION IN THE EVENT OF A NUCLEAR INCIDENT, BY ELIMINATING THE $560 MILLION LIMITATION OF LIBABILITY AND REQUIRING THE INDUSTRY TO CARRY FULL PROTECTION FOR LOSSES.","TO AMEND H.R. 8631, A BILL REVISING THE METHOD OF PROVIDING FOR PUBLIC REMUNERATION IN THE EVENT OF A NUCLEAR INCIDENT, BY ELIMINATING THE $560 MILLION LIMITATION OF LIBABILITY AND REQUIRING THE INDUSTRY TO CARRY FULL PROTECTION FOR LOSSES.",7,704,7,704
138,12810,94,1,558,RH0940558,"'RH0940558',","RH0940558,",12/8/75,1975,12,8,NA,NA,161,225,-0.1,-0.184,0.139,0.503,-152.3,HR8631,NA,NA,NA,"TO AMEND H.R. 8631, BY GIVING THE PUBLIC THE RIGHT TO CHALLENGE THE CONSTITUTIONALITY OF THE LIABILITY LIMIT IN THE COURT.","TO AMEND H.R. 8631, BY GIVING THE PUBLIC THE RIGHT TO CHALLENGE THE CONSTITUTIONALITY OF THE LIABILITY LIMIT IN THE COURT.",7,704,7,704
139,12812,94,1,559,RH0940559,"'RH0940559',","RH0940559,",12/8/75,1975,12,8,NA,NA,329,61,-0.131,-0.685,-0.095,-0.511,-119.975,HR8631,NA,NA,NA,TO PASS H.R. 8631.,TO PASS H.R. 8631.,7,704,7,704
140,12988,94,1,89,RH0940089,"'RH0940089',","RH0940089,",4/21/75,1975,4,21,NA,NA,370,5,0,0,0,0,0,HR3130,NA,NA,NA,"TO SUSPEND THE RULES AND PASS H.R. 3130, AMENDING THE NATIONAL ENVIRONMENTAL POLICY ACT OF 1969 IN ORDER TO CLARIFY THE PROCEDURES THEREIN WITHIN RESPECT TO THE PREPARATION OF ENVIRONMENTAL IMPACT STATEMENTS.","TO SUSPEND THE RULES AND PASS H.R. 3130, AMENDING THE NATIONAL ENVIRONMENTAL POLICY ACT OF 1969 IN ORDER TO CLARIFY THE PROCEDURES THEREIN WITHIN RESPECT TO THE PREPARATION OF ENVIRONMENTAL IMPACT STATEMENTS.",7,700,7,700
141,13199,94,1,1065,RH0941065,"'RH0941065',","RH0941065,",8/3/76,1976,8,3,NA,NA,347,33,0.459,-0.262,0.228,0.152,-62.268,HR12944,NA,NA,NA,"TO PASS H.R. 12944, TO EXTEND THE FEDERAL INSECTICIDE, FUNGICIDE AND RODENTICIDE ACT, AS AMENDED, FOR 6 MONTHS.","TO PASS H.R. 12944, TO EXTEND THE FEDERAL INSECTICIDE, FUNGICIDE AND RODENTICIDE ACT, AS AMENDED, FOR 6 MONTHS.",7,704,7,704
142,13207,94,1,1069,RH0941069,"'RH0941069',","RH0941069,",8/4/76,1976,8,4,NA,NA,382,2,0,0,0,0,0,HRES1430,NA,NA,NA,"TO AGREE TO H. RES. 1430, THE RULE TO CONSIDER H.R. 10498, TO AMEND THE CLEAN AIR ACT.","TO AGREE TO H. RES. 1430, THE RULE TO CONSIDER H.R. 10498, TO AMEND THE CLEAN AIR ACT.",7,705,7,705
143,13264,94,1,1098,RH0941098,"'RH0941098',","RH0941098,",8/23/76,1976,8,23,NA,NA,210,157,-0.514,0.845,-0.153,-0.299,-181.122,HR14032,NA,NA,NA,"TO AMEND H. R. 14032, TOXIC SUBSTANCES CONTROL ACT. BY ALLOWING EITHER THE SENATE OR THE HOUSE TO INVALIDATE ANY SUCH REGULATION WITHIN 60 DAYS OF THE ISSUANCE BY THE ENVIRONMENTAL PROTECTION AGENCY.","TO AMEND H. R. 14032, TOXIC SUBSTANCES CONTROL ACT. BY ALLOWING EITHER THE SENATE OR THE HOUSE TO INVALIDATE ANY SUCH REGULATION WITHIN 60 DAYS OF THE ISSUANCE BY THE ENVIRONMENTAL PROTECTION AGENCY.",7,704,7,704
144,13266,94,1,1099,RH0941099,"'RH0941099',","RH0941099,",8/23/76,1976,8,23,NA,NA,319,45,0.453,-0.205,0.208,0.339,-83.101,HR14032,NA,NA,NA,TO PASS H.R. 14032.,TO PASS H.R. 14032.,7,704,7,704
145,13346,94,1,1140,RH0941140,"'RH0941140',","RH0941140,",9/8/76,1976,9,8,NA,NA,107,247,-0.089,-0.407,0.127,0.49,-143.818,HR10498,NA,NA,NA,"TO AMEND THE ROGERS AMENDMENT (SEE R.C. 697) TO H.R. 10498, BY DELETING THE CLASS III CATEGORIES, THUS REQUIRING MORE STRICT CONTROL IN AREAS WHERE THE AIR QUALITY HAD NOT YET REACHED MINIMUM LEVELS.","TO AMEND THE ROGERS AMENDMENT SEE R.C. 697) TO H.R. 10498, BY DELETING THE CLASS III CATEGORIES, THUS REQUIRING MORE STRICT CONTROL IN AREAS WHERE THE AIR QUALITY HAD NOT YET REACHED MINIMUM LEVELS.",7,705,7,705
146,13348,94,1,1141,RH0941141,"'RH0941141',","RH0941141,",9/8/76,1976,9,8,NA,NA,301,57,0.259,0.044,0.25,0.288,-72.158,HR10498,NA,NA,NA,"TO AMEND H.R. 10498, BY ESTABLISHING A NATIONAL COMMISSION ON AIR QUALITY FOR THE PURPOSE OF THE ON GOING STUDY OF THE IMPLEMENTATION OF THE ACT.","TO AMEND H.R. 10498, BY ESTABLISHING A NATIONAL COMMISSION ON AIR QUALITY FOR THE PURPOSE OF THE ON GOING STUDY OF THE IMPLEMENTATION OF THE ACT.",7,705,7,705
147,13350,94,1,1142,RH0941142,"'RH0941142',","RH0941142,",9/8/76,1976,9,8,NA,NA,156,199,0.264,-0.417,-0.199,-0.743,-124.69,HR10498,NA,NA,NA,"TO AMEND H.R. 10498, BY DELETING A SECTION ON SIGNIFICANT DETERIORATION AND REQUIRING THE NATIONAL COMMISSION ON AIR QUALITY TO CONDUCT A ONE-YEAR STUDY OF DETERIORATION.","TO AMEND H.R. 10498, BY DELETING A SECTION ON SIGNIFICANT DETERIORATION AND REQUIRING THE NATIONAL COMMISSION ON AIR QUALITY TO CONDUCT A ONE-YEAR STUDY OF DETERIORATION.",7,705,7,705
148,13362,94,1,1148,RH0941148,"'RH0941148',","RH0941148,",9/9/76,1976,9,9,NA,NA,103,198,-0.853,-0.249,0.063,-0.28,-178.756,HR14496,NA,NA,NA,"TO AMEND H.R. 14496, BY EXTENDING UNTIL 1982 CONSTRUCTION AND EXPANSION OF FACILITIES IN AIR QUALITY CONTROL REGIONS EXCEEDING NATIONAL AMBIENT AIR QUALITY STANDARDS.","TO AMEND H.R. 14496, BY EXTENDING UNTIL 1982 CONSTRUCTION AND EXPANSION OF FACILITIES IN AIR QUALITY CONTROL REGIONS EXCEEDING NATIONAL AMBIENT AIR QUALITY STANDARDS.",7,705,7,705
149,13364,94,1,1149,RH0941149,"'RH0941149',","RH0941149,",9/9/76,1976,9,9,NA,NA,32,263,0.303,0.346,-0.154,-0.566,-67.125,HR14469,NA,NA,NA,"TO AMEND H.R. 14469, BY STRIKING LANGUAGE WHICH PROVIDES FOR LOCAL GOVERNMENT INVOLVEMENT IN THE DESIGNATION PROCESS.","TO AMEND H.R. 14469, BY STRIKING LANGUAGE WHICH PROVIDES FOR LOCAL GOVERNMENT INVOLVEMENT IN THE DESIGNATION PROCESS.",7,705,7,705
150,13366,94,1,1150,RH0941150,"'RH0941150',","RH0941150,",9/9/76,1976,9,9,NA,NA,100,183,-0.28,0.594,-0.187,-0.71,-93.163,HR14469,NA,NA,NA,"TO AMEND H.R. 14469, BY RESTORING THE 100% LEVEL FOR PRIMARY AIR QUALITY STANDARDS SET BY THE ADMINISTRATION IN MORE HEAVILY POLLUTED AREAS.","TO AMEND H.R. 14469, BY RESTORING THE 100% LEVEL FOR PRIMARY AIR QUALITY STANDARDS SET BY THE ADMINISTRATION IN MORE HEAVILY POLLUTED AREAS.",7,705,7,705
151,13397,94,1,1168,RH0941168,"'RH0941168',","RH0941168,",9/15/76,1976,9,15,NA,NA,75,313,-0.399,-0.227,0.187,0.383,-114.812,HR10498,NA,NA,NA,"TO AGREE TO A SUBSTITUTE AMENDMENT FOR THE DINGELL AMENDMENT (SEE R.C. 731) TO H.R. 10498. THE WAXMAN AMENDMENT REQUIRES FULL 90% REUCTION OF CARBON MONOXIDE, HYDROCARBONS, AND NITROGEN OXIDE IN 1981 AND REQUIRES, IN THE INTERIM, THE NATIONWIDE IMPLEMENTATION OF 1976 AND 1977 CALIFORNIA STANDARDS.","TO AGREE TO A SUBSTITUTE AMENDMENT FOR THE DINGELL AMENDMENT SEE R.C. 731) TO H.R. 10498. THE WAXMAN AMENDMENT REQUIRES FULL 90% REUCTION OF CARBON MONOXIDE, HYDROCARBONS, AND NITROGEN OXIDE IN 1981 AND REQUIRES, IN THE INTERIM, THE NATIONWIDE IMPLEME",7,705,7,705
152,13399,94,1,1169,RH0941169,"'RH0941169',","RH0941169,",9/15/76,1976,9,15,NA,NA,224,169,0.067,-0.382,-0.173,-0.645,-136.305,HR10498,NA,NA,NA,"TO AMEND H.R. 10498, BY FREEZING CURRENT AUTO EMISSION STANDARDS THROUGH 1979, REDUCING THE LEVELS DURING 1980-81 TO THE CURRENT CALIFORNIA STANDARDS, REQUIRING THE FULL 90% REDUCTION FOR CARBON MONOXIDE AND HYDROCARBONS BEGINNING IN 1982, WITH NITROGEN OXIDE STANDARDS TO BE SET BY THE EPA.","TO AMEND H.R. 10498, BY FREEZING CURRENT AUTO EMISSION STANDARDS THROUGH 1979, REDUCING THE LEVELS DURING 1980-81 TO THE CURRENT CALIFORNIA STANDARDS, REQUIRING THE FULL 90% REDUCTION FOR CARBON MONOXIDE AND HYDROCARBONS BEGINNING IN 1982, WITH NITROGEN",7,705,7,705
153,13401,94,1,1170,RH0941170,"'RH0941170',","RH0941170,",9/15/76,1976,9,15,NA,NA,231,156,0.019,-0.138,0.221,0.341,-109.064,HR10498,NA,NA,NA,"TO AGREE TO A SUBSTITUTE AMENDMENT FOR THE BUTLER AMENDMENT TO H.R. 10498. THE PREYER SUBSTITUTE ALLOWS THE EPA TO REPRESENT ITSELF IN CIVIL ACTIONS IN COURTS OF ORIGINAL JURISDICTION, BUT RESERVES JUSTICE DEPARTMENT CONTROL OF APPELLATE LITIGATION. THE BUTLER AMENDMENT WOULD HAVE RETAINED JUSTICE DEPARTMENT CONTROL OVER ALL EPA LITIGATION.","TO AGREE TO A SUBSTITUTE AMENDMENT FOR THE BUTLER AMENDMENT TO H.R. 10498. THE PREYER SUBSTITUTE ALLOWS THE EPA TO REPRESENT ITSELF IN CIVIL ACTIONS IN COURTS OF ORIGINAL JURISDICTION, BUT RESERVES JUSTICE DEPARTMENT CONTROL OF APPELLATE LITIGATION.",7,700,7,700
154,13403,94,1,1171,RH0941171,"'RH0941171',","RH0941171,",9/15/76,1976,9,15,NA,NA,117,272,-0.129,0.485,-0.299,-1.021,-88.784,HR10498,NA,NA,NA,"TO RECOMMIT TO THE COMMITTEE ON INTERSTATE AND FOREIGN COMMERCE H.R. 10498, WITH INSTRUCTIONS TO REPORT IT BACK CONTAINING AMENDMENTS PREVIOUSLY REJECTD IN THE COMMITTEE OF THE WHOLE.","TO RECOMMIT TO THE COMMITTEE ON INTERSTATE AND FOREIGN COMMERCE H.R. 10498, WITH INSTRUCTIONS TO REPORT IT BACK CONTAINING AMENDMENTS PREVIOUSLY REJECTD IN THE COMMITTEE OF THE WHOLE.",7,705,7,705
155,13405,94,1,1172,RH0941172,"'RH0941172',","RH0941172,",9/15/76,1976,9,15,NA,NA,324,68,0.3,0.145,0.148,0.384,-113.068,HR10498,NA,NA,NA,TO PASS H.R. 10498.,TO PASS H.R. 10498.,7,705,7,705
156,13435,94,1,1187,RH0941187,"'RH0941187',","RH0941187,",9/20/76,1976,9,20,NA,NA,337,40,0.351,0.057,0.28,0.382,-61.186,HR13374,NA,NA,NA,"LI SUSPEND THE RULES AND PASS H.R. 13374, TO CREATE A RECREATION AREA AND A WILDLIFE REFUGE IN THE LOWER MINNESOTA RIVER VALLEY.","LI SUSPEND THE RULES AND PASS H.R. 13374, TO CREATE A RECREATION AREA AND A WILDLIFE REFUGE IN THE LOWER MINNESOTA RIVER VALLEY.",7,709,7,709
157,13437,94,1,1188,RH0941188,"'RH0941188',","RH0941188,",9/20/76,1976,9,20,NA,NA,152,228,-0.248,-0.021,0.115,0.087,-199.929,HR14418,NA,NA,NA,"TO SUSPEND THE RULES AND PASS H.R. 14418, TO ESTABLISH A PILOT PROGRAM TO COMPENSATE PERSONS WHO SUFFERED LOSS OR DAMAGE FROM PREDATION BY ENDANGERED SPECIES, SPECIFICALLY WITH REGARD TO THE EASTERN TIMBER WOLF IN MINNESOTA.","TO SUSPEND THE RULES AND PASS H.R. 14418, TO ESTABLISH A PILOT PROGRAM TO COMPENSATE PERSONS WHO SUFFERED LOSS OR DAMAGE FROM PREDATION BY ENDANGERED SPECIES, SPECIFICALLY WITH REGARD TO THE EASTERN TIMBER WOLF IN MINNESOTA.",7,709,7,709
158,13447,94,1,1193,RH0941193,"'RH0941193',","RH0941193,",9/20/76,1976,9,20,NA,NA,314,70,0.505,-0.185,0.19,0.63,-116.35,HR15445,NA,NA,NA,"TO SUSPEND THE RULES AND PASS H.R. 15445, REQUIRING THE SECRETARY OF COMMERCE TO MAKE A STUDY ON THE GRAY WHALE AND THE BOWHEAD WHALE AND REPORT MEASURES FOR THEIR CONSERVATION BY JAN. 1, 1980.","TO SUSPEND THE RULES AND PASS H.R. 15445, REQUIRING THE SECRETARY OF COMMERCE TO MAKE A STUDY ON THE GRAY WHALE AND THE BOWHEAD WHALE AND REPORT MEASURES FOR THEIR CONSERVATION BY JAN. 1, 1980.",7,709,7,709
159,13467,94,1,1203,RH0941203,"'RH0941203',","RH0941203,",9/20/76,1976,9,20,NA,NA,346,39,0.337,0.36,0.166,0.378,-80.951,HR13124,NA,NA,NA,"TO SUSPEND THE RULES AND PASS H.R. 13124, TO AUTHORIZE APPROPRIATIONS TO THE DEPARTMENT OF COMMERCE TO MONITOR AND REGULATE THE TRANSPORT OF HAZARDOUS MATERIALS.","TO SUSPEND THE RULES AND PASS H.R. 13124, TO AUTHORIZE APPROPRIATIONS TO THE DEPARTMENT OF COMMERCE TO MONITOR AND REGULATE THE TRANSPORT OF HAZARDOUS MATERIALS.",7,704,7,704
160,13515,94,1,1234,RH0941234,"'RH0941234',","RH0941234,",9/27/76,1976,9,27,NA,NA,374,0,0,0,0,0,0,HRES1553,NA,NA,NA,"TO AGREE TO H. RES. 1533, THE RULE TO CONSIDER H.R. 14496, RESOURCE CONSERVATION AND RECOVERY ACT OF 1976.","TO AGREE TO H. RES. 1533, THE RULE TO CONSIDER H.R. 14496, RESOURCE CONSERVATION AND RECOVERY ACT OF 1976.",7,707,7,707
161,13517,94,1,1235,RH0941235,"'RH0941235',","RH0941235,",9/27/76,1976,9,27,NA,NA,367,8,0,0,0,0,0,HR14496,NA,NA,NA,"TO PASS H.R. 14496, TO PROVIDE TECHNICAL AND FINANCIAL ASSISTANCE FOR THE DEVELOPMENT OF MANAGEMENT PLANS AND FACILITIES FOR THE RECOVERY OF ENERGY AND OTHER RESOURCES FROM DISCARDED MATERIALS. ALSO TO PROVIDE ASSISTANCE FOR THE SAFE DISPOSAL OF DISCARDED MATERIALS AND FOR THE REGULATION OF THE MANAGEMENT OF HAZARDOUS WASTE.","TO PASS H.R. 14496, TO PROVIDE TECHNICAL AND FINANCIAL ASSISTANCE FOR THE DEVELOPMENT OF MANAGEMENT PLANS AND FACILITIES FOR THE RECOVERY OF ENERGY AND OTHER RESOURCES FROM DISCARDED MATERIALS. ALSO TO PROVIDE ASSISTANCE FOR THE SAFE DISPOSAL OF DISCA",7,700,7,700
162,13523,94,1,1240,RH0941240,"'RH0941240',","RH0941240,",9/28/76,1976,9,28,NA,NA,360,35,0.421,0.123,0.218,0.553,-66.647,S3149,NA,NA,NA,"TO AGREE TO THE CONFERENCE REPORT ON S. 3147, TOXIC SUBSTANCES CONTROL ACT.","TO AGREE TO THE CONFERENCE REPORT ON S. 3147, TOXIC SUBSTANCES CONTROL ACT.",7,704,7,704
163,13669,94,1,644,RH0940644,"'RH0940644',","RH0940644,",2/9/76,1976,2,9,NA,NA,335,34,-0.021,0.947,0.073,0.459,-85.836,HR5808,NA,NA,NA,TO PASS H.R. 5808.,TO PASS H.R. 5808.,7,709,7,709
164,13743,94,1,681,RH0940681,"'RH0940681',","RH0940681,",3/11/76,1976,3,11,NA,NA,370,14,0.609,-0.24,0.243,0.278,-45.614,HR3981,NA,NA,NA,"TO PASS H.R. 3981, AMENDING THE COASTAL ZONE MANAGEMENT ACT OF 1972 TO AUTHORIZE AND ASSIST THE COASTAL STATES TO STUDY , PLAN FOR, MANAGE, AND CONTROL THE IMPACT OF ENERGY RESOURCE DEVELOPMENT AND PRODUCTION WHICH AFFECTS THE COASTAL ZONE.","TO PASS H.R. 3981, AMENDING THE COASTAL ZONE MANAGEMENT ACT OF 1972 TO AUTHORIZE AND ASSIST THE COASTAL STATES TO STUDY , PLAN FOR, MANAGE, AND CONTROL THE IMPACT OF ENERGY RESOURCE DEVELOPMENT AND PRODUCTION WHICH AFFECTS THE COASTAL ZONE.",7,710,7,701
165,13881,94,1,750,RH0940750,"'RH0940750',","RH0940750,",4/12/76,1976,4,12,NA,NA,338,23,0.54,0.134,0.262,-0.364,-48.953,HRES1032,NA,NA,NA,"TO APPROVE H. RES. 1032, DISAPPROVING SOIL CONSERVATION SERVICE APPROPRIATIONS DEFERRALS PROPOSED BY THE PRESIDENT.","TO APPROVE H. RES. 1032, DISAPPROVING SOIL CONSERVATION SERVICE APPROPRIATIONS DEFERRALS PROPOSED BY THE PRESIDENT.",7,711,7,711
166,13934,94,1,777,RH0940777,"'RH0940777',","RH0940777,",5/3/76,1976,5,3,NA,NA,360,0,0,0,0,0,0,HR5523,NA,NA,NA,"TO SUSPEND THE RULES AND PASS H.R. 5523, CONCERNING ADMINISTRATION OF FISH AND WILDLIFE PROGRAMS.","TO SUSPEND THE RULES AND PASS H.R. 5523, CONCERNING ADMINISTRATION OF FISH AND WILDLIFE PROGRAMS.",7,709,7,709
167,13936,94,1,778,RH0940778,"'RH0940778',","RH0940778,",5/3/76,1976,5,3,NA,NA,362,0,0,0,0,0,0,HR11505,NA,NA,NA,"TO SUSPEND THE RULES AND PASS H.R. 11505, AS AMENDED, THE MARINE PROTECTION, RESEARCH, AND SANCTUARIES ACT AUTHORIZATION FOR FISCAL YEAR 1977.","TO SUSPEND THE RULES AND PASS H.R. 11505, AS AMENDED, THE MARINE PROTECTION, RESEARCH, AND SANCTUARIES ACT AUTHORIZATION FOR FISCAL YEAR 1977.",7,710,7,701
168,13948,94,1,784,RH0940784,"'RH0940784',","RH0940784,",5/4/76,1976,5,4,NA,NA,228,167,-0.121,-0.183,-0.13,-0.35,-164.191,HR12704,NA,NA,NA,"TO AMEND H.R. 12704, TO AUTHORIZE APPROPRIATIONS TO THE OFFICE OF RESEARCH AND DEVELOPMENT IN THE ENVIRONMENTAL PROTECTION AGENCY, BY REQUIRING THAT RULES OR REGULATIONS MADE IN CONNECTION WITH RESEARCH, DEVELOPMENT, OR DEMONSTRATION BE SUBJECT TO CONGRESSIONAL DISAPPROVAL.","TO AMEND H.R. 12704, TO AUTHORIZE APPROPRIATIONS TO THE OFFICE OF RESEARCH AND DEVELOPMENT IN THE ENVIRONMENTAL PROTECTION AGENCY, BY REQUIRING THAT RULES OR REGULATIONS MADE IN CONNECTION WITH RESEARCH, DEVELOPMENT, OR DEMONSTRATION BE SUBJECT TO CONGR",7,798,7,798
169,13950,94,1,785,RH0940785,"'RH0940785',","RH0940785,",5/4/76,1976,5,4,NA,NA,381,16,0.715,-0.699,0.37,0.441,-33.705,HR12704,NA,NA,NA,"TO PASS H.R. 12704, AUTHORIZING APPROPRIATIONS FOR ENVIRONMENTAL RESEARCH DEVELOPMENT AND DEMONSTRATION.","TO PASS H.R. 12704, AUTHORIZING APPROPRIATIONS FOR ENVIRONMENTAL RESEARCH DEVELOPMENT AND DEMONSTRATION.",7,798,7,798
170,13952,94,1,786,RH0940786,"'RH0940786',","RH0940786,",5/5/76,1976,5,5,NA,NA,111,282,-0.103,0.679,-0.128,-0.325,-153.688,HR12234,NA,NA,NA,"TO AMEND H.R. 12234, THE LAND AND WATER CONSERVATION FUND ACT AMENDMENTS AND NATIONAL HISTORIC PRESERVATION ACT AMENDMENTS, BY REDUCING THE AUTHORIZATION LEVEL OF THE FUND TO $500 MILLION IN 1979 AND $600 MILLION IN 1980.","TO AMEND H.R. 12234, THE LAND AND WATER CONSERVATION FUND ACT AMENDMENTS AND NATIONAL HISTORIC PRESERVATION ACT AMENDMENTS, BY REDUCING THE AUTHORIZATION LEVEL OF THE FUND TO $500 MILLION IN 1979 AND $600 MILLION IN 1980.",7,711,7,711
171,13954,94,1,787,RH0940787,"'RH0940787',","RH0940787,",5/5/76,1976,5,5,NA,NA,177,221,-0.429,0.181,0.053,0.281,-233.29,HR12234,NA,NA,NA,"TO AMEND H.R. 12234, BY LOWERING THE THRESHOLD FOR THE IMPLEMENTATION OF THE 20-75-5 RATIO FROM $240 MILLION TO $180 MILLION, THEREBY HASTENING THE POINT AT WHICH THE ALLOCATION FORMULA GIVES ADVANTAGE TO POPULOUS STATES.","TO AMEND H.R. 12234, BY LOWERING THE THRESHOLD FOR THE IMPLEMENTATION OF THE 20-75-5 RATIO FROM $240 MILLION TO $180 MILLION, THEREBY HASTENING THE POINT AT WHICH THE ALLOCATION FORMULA GIVES ADVANTAGE TO POPULOUS STATES.",7,711,7,711
172,13958,94,1,789,RH0940789,"'RH0940789',","RH0940789,",5/5/76,1976,5,5,NA,NA,392,3,0,0,0,0,0,HR12234,NA,NA,NA,"TO PASS, AS AMENDED, H.R. 12234.","TO PASS, AS AMENDED, H.R. 12234.",7,711,7,711
173,14059,94,1,842,RH0940842,"'RH0940842',","RH0940842,",6/1/76,1976,6,1,NA,NA,220,154,-0.186,-0.134,-0.132,-0.296,-169.402,HR12169,NA,NA,NA,"TO AMEND H.R. 12169, BY STRIKING THE AUTHORIZATION OF $37.4 MILLION FOR THE OFFICE OF CONSERVATION AND ENVIRONMENT.","TO AMEND H.R. 12169, BY STRIKING THE AUTHORIZATION OF $37.4 MILLION FOR THE OFFICE OF CONSERVATION AND ENVIRONMENT.",7,700,7,700
174,14075,94,1,852,RH0940852,"'RH0940852',","RH0940852,",6/3/76,1976,6,3,NA,NA,234,121,-0.625,0.148,-0.1,-0.65,-168.137,HR9560,NA,NA,NA,"TO AGREE TO AN AMENDMENT IN THE NATURE OF A SUBSTITUTE FOR THE CLEVELAND AMENDMENT, AS AMENDED, TO H. R. 9560, THE FEDERAL WATER POLLUTION CONTROL AMENDMENTS OF 1976. THE WRIGHT AMENDMENT LIMITS DREDGING AND FILL MATERIAL PERMIT REGULATION TO NAVIGABLE WATERS AND ADJACENT WETLANDS, AUTHORIZES ISSUANCE OF GENERAL PERMITS, AUTHORIZES STATE PROTECTION OF ENVIRONMENTALLY IMPORTANT AREAS, AND EXCLUDES NORMAL FARMING OPERATIONS AND CERTAIN OTHER ACTIVITIES FROM REGULATION.","TO AGREE TO AN AMENDMENT IN THE NATURE OF A SUBSTITUTE FOR THE CLEVELAND AMENDMENT, AS AMENDED, TO H. R. 9560, THE FEDERAL WATER POLLUTION CONTROL AMENDMENTS OF 1976. THE WRIGHT AMENDMENT LIMITS DREDGING AND FILL MATERIAL PERMIT REGULATION TO NAVIGABL",7,701,7,701
175,14077,94,1,853,RH0940853,"'RH0940853',","RH0940853,",6/3/76,1976,6,3,NA,NA,339,5,0,0,0,0,0,HR9560,NA,NA,NA,"TO PASS H.R. 9560, THE FEDERAL WATER POLLUTION CONTROL ACT AMENDMENTS OF 1976.","TO PASS H.R. 9560, THE FEDERAL WATER POLLUTION CONTROL ACT AMENDMENTS OF 1976.",7,701,7,701
176,14272,94,1,959,RH0940959,"'RH0940959',","RH0940959,",6/28/76,1976,6,28,NA,NA,126,269,-0.26,-0.197,0.116,0.377,-164.109,HR14234,NA,NA,NA,"TO AMEND H.R. 14234, BY PROHIBITING COMMERCIAL FLIGHTS OF SST AIRCRAFT TO UNITED STATES AIRPORTS THAT DO NOT MEET ESTABLISHED NOISE STANDARDS.","TO AMEND H.R. 14234, BY PROHIBITING COMMERCIAL FLIGHTS OF SST AIRCRAFT TO UNITED STATES AIRPORTS THAT DO NOT MEET ESTABLISHED NOISE STANDARDS.",7,705,7,705
177,14274,94,1,960,RH0940960,"'RH0940960',","RH0940960,",6/28/76,1976,6,28,NA,NA,170,228,-0.057,-0.219,0.101,0.404,-182.742,HR14234,NA,NA,NA,"TO AMEND H.R. 14234, BY PROHIBITING COMMERCIAL FLIGHTS OF SST AIRCRAFT TO JOHN F. KENNEDY INTERNATIONAL AIRPORT UNLESS SUCH FLIGHTS COMPLY WITH ESTABLISHED NOISE STANDARDS.","TO AMEND H.R. 14234, BY PROHIBITING COMMERCIAL FLIGHTS OF SST AIRCRAFT TO JOHN F. KENNEDY INTERNATIONAL AIRPORT UNLESS SUCH FLIGHTS COMPLY WITH ESTABLISHED NOISE STANDARDS.",7,705,7,705
178,14321,94,1,984,RH0940984,"'RH0940984',","RH0940984,",6/30/76,1976,6,30,NA,NA,391,14,0.651,-0.252,0.244,0.215,-38.963,S586,NA,NA,NA,"TO AGREE TO THE CONFERENCE REPORT ON S. 586, COASTAL ZONE MANAGEMENT ACT AMENDMENTS OF 1976.","TO AGREE TO THE CONFERENCE REPORT ON S. 586, COASTAL ZONE MANAGEMENT ACT AMENDMENTS OF 1976.",7,710,7,701
179,14455,95,1,110,RH0950110,"'RH0950110',","RH0950110,",4/5/77,1977,4,5,NA,NA,348,60,-0.272,-0.579,-0.094,-0.512,-113.211,HRES468,NA,NA,NA,"TO AGREE TO H. RES. 468, THE RULE TO CONSIDER H.R. 3199, A BIL AMENDING THE FEDERAL WATER POLLUTION CONTROL ACT OF 1972 SO AS TO ALLOW FOR ADDITIONAL AUTHORIZATIONS.","TO AGREE TO H. RES. 468, THE RULE TO CONSIDER H.R. 3199, A BIL AMENDING THE FEDERAL WATER POLLUTION CONTROL ACT OF 1972 SO AS TO ALLOW FOR ADDITIONAL AUTHORIZATIONS.",7,701,7,701
180,14457,95,1,111,RH0950111,"'RH0950111',","RH0950111,",4/5/77,1977,4,5,NA,NA,361,43,-0.366,-0.57,-0.132,-0.598,-78.364,HR3199,NA,NA,NA,TO PASS H.R. 3199 (SEE RC 128).,TO PASS H.R. 3199 SEE RC 128).,7,701,7,701
181,14475,95,1,120,RH0950120,"'RH0950120',","RH0950120,",4/19/77,1977,4,19,NA,NA,358,31,0.448,0.156,0.19,0.455,-67.347,HR5101,NA,NA,NA,"TO PASS H.R. 5101, THE BILL AUTHORIZING OF $313 MILLION FOR RESEARCH AND DEVELOPMENT OF THE ENVIRONMENTAL PROTECTION AGENCY FOR FISCAL YEAR 1978.","TO PASS H.R. 5101, THE BILL AUTHORIZING OF $313 MILLION FOR RESEARCH AND DEVELOPMENT OF THE ENVIRONMENTAL PROTECTION AGENCY FOR FISCAL YEAR 1978.",7,798,7,798
182,14617,95,1,196,RH0950196,"'RH0950196',","RH0950196,",5/10/77,1977,5,10,NA,NA,374,32,0.29,0.493,0.154,0.608,-66.268,HR2817,NA,NA,NA,"TO SUSPEND THE RULES AND PASS H.R. 2817, A BILL TO PROVIDE FUNDS FOR CERTAIN ADDITIONS TO THE TINICUM NATIONAL ENVIRONMENTAL CENTER IN PENNSYLVANIA.","TO SUSPEND THE RULES AND PASS H.R. 2817, A BILL TO PROVIDE FUNDS FOR CERTAIN ADDITIONS TO THE TINICUM NATIONAL ENVIRONMENTAL CENTER IN PENNSYLVANIA.",7,799,7,799
183,14621,95,1,198,RH0950198,"'RH0950198',","RH0950198,",5/10/77,1977,5,10,NA,NA,402,9,0,0,0,0,0,HR6206,NA,NA,NA,"TO SUSPEND THE RULES AND PASS, AS AMENDED, H.R. 6206, A BILL AUTHORIZING APPROPRIATIONS FOR FISCAL YEARS 1978-1980 FOR THE EFFECTIVE ENACTMENT OF THE COMMERCIAL FISHERIES RESEARCH AND DEVELOPMENT ACT OF 1964.","TO SUSPEND THE RULES AND PASS, AS AMENDED, H.R. 6206, A BILL AUTHORIZING APPROPRIATIONS FOR FISCAL YEARS 1978-1980 FOR THE EFFECTIVE ENACTMENT OF THE COMMERCIAL FISHERIES RESEARCH AND DEVELOPMENT ACT OF 1964.",7,798,7,798
184,14658,95,1,214,RH0950214,"'RH0950214',","RH0950214,",5/16/77,1977,5,16,NA,NA,384,4,0,0,0,0,0,HR5493,NA,NA,NA,"TO SUSPEND THE RULES AND PASS H.R. 5493, A BILL TO EXTEND UNTIL OCT. 1, 1980 THE APPROPRIATIONS FOR SEAL BEACH, GREAT DISMAL SWAMP, AND SAN FRANCISCO BAY NATIONAL WILDLIFE REFUGE.","TO SUSPEND THE RULES AND PASS H.R. 5493, A BILL TO EXTEND UNTIL OCT. 1, 1980 THE APPROPRIATIONS FOR SEAL BEACH, GREAT DISMAL SWAMP, AND SAN FRANCISCO BAY NATIONAL WILDLIFE REFUGE.",7,709,7,709
185,14692,95,1,230,RH0950230,"'RH0950230',","RH0950230,",5/17/77,1977,5,17,NA,NA,395,2,0,0,0,0,0,S1279,NA,NA,NA,"TO SUSPEND THE RULES AND PASS S. 1279, THE SENATE BILL TO TEMPORARILY PROVIDE THE SECRETARY OF COMMERCE WITH THE AUTHORITY TO FACILITATE EMERGENCY ACTIONS NECESSITATED BY THE 1976-1977 U.S. DROUGHT.","TO SUSPEND THE RULES AND PASS S. 1279, THE SENATE BILL TO TEMPORARILY PROVIDE THE SECRETARY OF COMMERCE WITH THE AUTHORITY TO FACILITATE EMERGENCY ACTIONS NECESSITATED BY THE 1976-1977 U.S. DROUGHT.",7,701,7,701
186,14733,95,1,25,RH0950025,"'RH0950025',","RH0950025,",2/28/77,1977,2,28,NA,NA,206,136,-0.022,0.865,0.048,0.07,-215.574,HR2329,NA,NA,NA,"TO SUSPEND THE RULES AND PASS H.R. 2329, A BILL IMPROVING THE ADMINISTRATION OF FISH AND WILDLIFE PROGRAMS.","TO SUSPEND THE RULES AND PASS H.R. 2329, A BILL IMPROVING THE ADMINISTRATION OF FISH AND WILDLIFE PROGRAMS.",7,709,7,709
187,14755,95,1,260,RH0950260,"'RH0950260',","RH0950260,",5/24/77,1977,5,24,NA,NA,383,1,0,0,0,0,0,HRES589,NA,NA,NA,"TO AGREE TO H. RES. 589, THE RULE TO CONSIDER H.R. 6161, CLEAN AIR ACT AMENDMENTS OF 1977.","TO AGREE TO H. RES. 589, THE RULE TO CONSIDER H.R. 6161, CLEAN AIR ACT AMENDMENTS OF 1977.",7,705,7,705
188,14757,95,1,261,RH0950261,"'RH0950261',","RH0950261,",5/25/77,1977,5,25,NA,NA,369,1,0,0,0,0,0,HR6161,NA,NA,NA,THAT THE HOUSE RESOLVE ITSELF INTO THE COMMITTEE OF THE WHOLE FOR THE CONSIDERATION OF H.R. 6161.,THAT THE HOUSE RESOLVE ITSELF INTO THE COMMITTEE OF THE WHOLE FOR THE CONSIDERATION OF H.R. 6161.,7,705,7,705
189,14759,95,1,262,RH0950262,"'RH0950262',","RH0950262,",5/25/77,1977,5,25,NA,NA,170,237,-0.113,-0.206,0.136,0.389,-169.946,HR6161,NA,NA,NA,TO AGREE TO A SUBSTITUTE AMENDMENT TO THE BREAUX AMENDMENT TO H.R. 6161. THE MCKAY AMENDMENT ALLOWS STATES TO GRANT A 5% VARIANCE OF THE THREE HOUR TIME LIMIT ON SULFUR DIOXIDE EMISSION STANDARDS IN CLASS II HIGH TERRAIN AREAS FOR UP TO 18 DAYS OF THE YEAR.,TO AGREE TO A SUBSTITUTE AMENDMENT TO THE BREAUX AMENDMENT TO H.R. 6161. THE MCKAY AMENDMENT ALLOWS STATES TO GRANT A 5% VARIANCE OF THE THREE HOUR TIME LIMIT ON SULFUR DIOXIDE EMISSION STANDARDS IN CLASS II HIGH TERRAIN AREAS FOR UP TO 18 DAYS OF THE,7,705,7,705
190,14762,95,1,264,RH0950264,"'RH0950264',","RH0950264,",5/25/77,1977,5,25,NA,NA,162,242,-0.145,0.255,-0.115,-0.44,-172.903,HR6161,NA,NA,NA,TO AMEND H.R. 6161 BY ALLOWING THE EPA ADMINISTRATOR TO GRANT WAIVERS OF THE CLEAN AIR REQUIREMENTS IN CERTAIN STATES IF THOSE STATES HAVE A PROGRAM STRIVING FOR THE YEARLY REDUCTION OF OXIDANTS IN THE STATE UNTIL NATIONAL STANDARDS ARE MET.,TO AMEND H.R. 6161 BY ALLOWING THE EPA ADMINISTRATOR TO GRANT WAIVERS OF THE CLEAN AIR REQUIREMENTS IN CERTAIN STATES IF THOSE STATES HAVE A PROGRAM STRIVING FOR THE YEARLY REDUCTION OF OXIDANTS IN THE STATE UNTIL NATIONAL STANDARDS ARE MET.,7,705,7,705
191,14764,95,1,265,RH0950265,"'RH0950265',","RH0950265,",5/26/77,1977,5,26,NA,NA,380,1,0,0,0,0,0,HR6161,NA,NA,NA,THAT THE HOUSE RESOLVE ITSELF INTO THE COMMITTEE OF THE WHOLE FOR THE FURTHER CONSIDERATION OF H.R. 6161.,THAT THE HOUSE RESOLVE ITSELF INTO THE COMMITTEE OF THE WHOLE FOR THE FURTHER CONSIDERATION OF H.R. 6161.,7,705,7,705
192,14766,95,1,266,RH0950266,"'RH0950266',","RH0950266,",5/26/77,1977,5,26,NA,NA,189,202,0.236,-0.608,0.129,0.426,-187.339,HR6161,NA,NA,NA,"TO PASS AN AMENDMENT OFFERED AS A SUBSTITUTE TO THE MODIFIED DINGELL AMENDMENT TO H.R. 6161. THE PREYER AMENDMENT WOULD DELAY THE EFFECTIVE DATE OF THE AUTO EMISSION STANDARDS UNTIL 1980 AND WOULD OFFER A WAIVER OF CERTAIN STANDARDS FOR VEHICLES OF A GROSS WEIGHT OF 3,000 POUNDS OR MORE. REPRESENTATIVE BROWN, MICH. ANNOUNCED ON JUNE 21, 1977 THAT HE WAS INCORRECTLY RECORDED AS VOTING """"""""""""""""YES"""""""""""""""" ON THIS ROLL CALL. HIS VOTE IN OUR FILES HAS SUBSEQUENTLY BEEN CHANGED FROM A """"""""""""""""YES"""""""""""""""" TO AN """"""""""""""""ANNOUNCED NO"""""""""""""""", AND THE VOTE TOTALS SHOWN IN THE CODEBOOK REFLECT THIS CHANGE.",TO PASS AN AMENDMENT OFFERED AS A SUBSTITUTE TO THE MODIFIED DINGELL AMENDMENT TO H.R. 6161. THE PREYER AMENDMENT WOULD DELAY THE EFFECTIVE DATE OF THE AUTO EMISSION STANDARDS UNTIL 1980 AND WOULD OFFER A WAIVER OF CERTAIN STANDARDS FOR VEHICLES OF A G,7,705,7,705
193,14768,95,1,267,RH0950267,"'RH0950267',","RH0950267,",5/26/77,1977,5,26,NA,NA,255,139,-0.128,-0.279,-0.127,-0.525,-153.539,HR6161,NA,NA,NA,"TO AMEND THE PROVISION OF H.R. 6161 THAT RELATES TO POLLUTION FROM MOBILE SOURCES. THE DINGELL AMENDMENT RELAXES AUTO EMISSIONS STANDARDS FOR CARBON MONOXIDE AND NITROGEN OXIDE, AND CHANGES SOME OF THE PROVISIONS DEALING WITH CAR INSPECTION AND WARRANTY.","TO AMEND THE PROVISION OF H.R. 6161 THAT RELATES TO POLLUTION FROM MOBILE SOURCES. THE DINGELL AMENDMENT RELAXES AUTO EMISSIONS STANDARDS FOR CARBON MONOXIDE AND NITROGEN OXIDE, AND CHANGES SOME OF THE PROVISIONS DEALING WITH CAR INSPECTION AND WARRAN",7,705,7,705
194,14770,95,1,268,RH0950268,"'RH0950268',","RH0950268,",5/26/77,1977,5,26,NA,NA,326,49,0.805,0.593,0.153,-0.19,-139.275,HR6161,NA,NA,NA,TO PASS H.R. 6161.,TO PASS H.R. 6161.,7,705,7,705
195,14776,95,1,270,RH0950270,"'RH0950270',","RH0950270,",6/1/77,1977,6,1,NA,NA,244,109,0.271,0.244,0.036,0.358,-191.967,HR6970,NA,NA,NA,"TO AMEND H.R. 6970, THE MARINE MAMMAL PROTECTION ACT AMENDMENTS, BY REDUCING THE QUOTA OF ACCIDENTAL PORPOISE DEATHS TO 68,910 IN 1977, AND REQUIRING FURTHER REDUCTIONS OF 50% OF THE QUOTA EVERY TWO YEARS THEREAFTER.","TO AMEND H.R. 6970, THE MARINE MAMMAL PROTECTION ACT AMENDMENTS, BY REDUCING THE QUOTA OF ACCIDENTAL PORPOISE DEATHS TO 68,910 IN 1977, AND REQUIRING FURTHER REDUCTIONS OF 50% OF THE QUOTA EVERY TWO YEARS THEREAFTER.",7,709,7,709
196,14778,95,1,271,RH0950271,"'RH0950271',","RH0950271,",6/1/77,1977,6,1,NA,NA,158,194,0.406,-0.045,-0.005,0.444,-209.403,HR6970,NA,NA,NA,TO AMEND H.R. 6970 BY INSTITUTING A FINE OF $32 PER PORPOISE ACCIDENTALLY KILLED DURING COMMERCIAL TUNA FISHING OPERATIONS.,TO AMEND H.R. 6970 BY INSTITUTING A FINE OF $32 PER PORPOISE ACCIDENTALLY KILLED DURING COMMERCIAL TUNA FISHING OPERATIONS.,7,709,7,709
197,14779,95,1,272,RH0950272,"'RH0950272',","RH0950272,",6/1/77,1977,6,1,NA,NA,334,20,-0.803,-0.048,-0.168,-0.253,-75.363,HR6970,NA,NA,NA,TO PASS H.R. 6970.,TO PASS H.R. 6970.,7,709,7,709
198,14802,95,1,284,RH0950284,"'RH0950284',","RH0950284,",6/6/77,1977,6,6,NA,NA,365,16,0.63,-0.776,0.32,0.242,-37.653,HR75,NA,NA,NA,"TO SUSPEND THE RULES AND PASS, AS AMENDED, H.R. 75, THE SOIL AND WATER RESOURCES CONSERVATION ACT OF 1977. THIS BILL BROVIDES FOR THE DEVELOPMENT OF A NATIONAL SOIL AND WATER CONSERVATION PROGRAM BY DEC. 31, 1979.","TO SUSPEND THE RULES AND PASS, AS AMENDED, H.R. 75, THE SOIL AND WATER RESOURCES CONSERVATION ACT OF 1977. THIS BILL BROVIDES FOR THE DEVELOPMENT OF A NATIONAL SOIL AND WATER CONSERVATION PROGRAM BY DEC. 31, 1979.",7,711,7,711
199,15243,95,1,504,RH0950504,"'RH0950504',","RH0950504,",9/12/77,1977,9,12,NA,NA,332,59,-0.009,0.633,0.07,0.561,-108.374,HR6803,NA,NA,NA,"TO SUSPEND THE RULES AND PASS, AS AMENDED, H.R. 6803, THE COMPREHENSIVE OIL POLLUTION LIABILITY AND COMPENSATION ACT.","TO SUSPEND THE RULES AND PASS, AS AMENDED, H.R. 6803, THE COMPREHENSIVE OIL POLLUTION LIABILITY AND COMPENSATION ACT.",7,704,7,704
200,15299,95,1,532,RH0950532,"'RH0950532',","RH0950532,",9/21/77,1977,9,21,NA,NA,383,10,0.635,0.123,0.237,0.029,-29.1,HRES620,NA,NA,NA,"TO AGREE TO H. RES. 620, THE RULE TO CONSIDER H.R. 7073, THE BILL EXTENDING THROUGH FISCAL YEAR 1978 THE AUTHORIZATIONS FOR THE PROGRAMS ESTABLISHED UNDER THE FEDERAL INSECTICIDE, FUNGICIDE AND RODENTICIDE ACT.","TO AGREE TO H. RES. 620, THE RULE TO CONSIDER H.R. 7073, THE BILL EXTENDING THROUGH FISCAL YEAR 1978 THE AUTHORIZATIONS FOR THE PROGRAMS ESTABLISHED UNDER THE FEDERAL INSECTICIDE, FUNGICIDE AND RODENTICIDE ACT.",7,704,7,704
201,15414,95,1,587,RH0950587,"'RH0950587',","RH0950587,",10/6/77,1977,10,6,NA,NA,388,2,0,0,0,0,0,HRES798,NA,NA,NA,"TO AGREE TO H. RES. 798, THE RULE TO CONSIDER H.R. 4297, THE BILL AUTHORIZING APPROPRIATIONS FOR FISCAL 1978 FOR PROGRAMS AND SERVICES FUNDED UNDER THE MARINE PROTECTION, RESEARCH, AND SANCTUARIES ACT OF 1972.","TO AGREE TO H. RES. 798, THE RULE TO CONSIDER H.R. 4297, THE BILL AUTHORIZING APPROPRIATIONS FOR FISCAL 1978 FOR PROGRAMS AND SERVICES FUNDED UNDER THE MARINE PROTECTION, RESEARCH, AND SANCTUARIES ACT OF 1972.",7,710,7,701
202,15459,95,1,607,RH0950607,"'RH0950607',","RH0950607,",10/14/77,1977,10,14,NA,NA,359,1,0,0,0,0,0,HR4297,NA,NA,NA,"TO PASS H.R. 4297, THE BILL AUTHORIZING APPROPRIATIONS FOR FISCAL 1978 FOR MARINE PROTECTION, RESEARCH AND SANCTUARIES PROGRAMS.","TO PASS H.R. 4297, THE BILL AUTHORIZING APPROPRIATIONS FOR FISCAL 1978 FOR MARINE PROTECTION, RESEARCH AND SANCTUARIES PROGRAMS.",7,710,7,701
203,15524,95,1,639,RH0950639,"'RH0950639',","RH0950639,",10/25/77,1977,10,25,NA,NA,343,19,0.541,0.042,0.222,0.294,-40.978,HR5101,NA,NA,NA,"TO AGREE TO THE CONFERENCE REPORT ON H.R. 5101, THE BILL AUTHORIZING APPROPRIATIONS FOR PROGRAMS OF THE ENVIRONMENTAL PROTECTION AGENCY FOR FISCAL YEAR 1978.","TO AGREE TO THE CONFERENCE REPORT ON H.R. 5101, THE BILL AUTHORIZING APPROPRIATIONS FOR PROGRAMS OF THE ENVIRONMENTAL PROTECTION AGENCY FOR FISCAL YEAR 1978.",7,700,7,700
204,15555,95,1,664,RH0950664,"'RH0950664',","RH0950664,",10/31/77,1977,10,31,NA,NA,368,21,-0.351,-0.814,-0.116,-0.591,-51.315,HR7073,NA,NA,NA,"TO PASS H.R. 7073, THE BILL AMENDING THE FEDERAL INSECTICIDE, FUNGICIDE AND RODENTICIDE ACT WITH A COMMITTEE SUBSTITUTE THAT ALLOWS CONDITIONAL REGISTRATION OF NEW PESTICIDES.","TO PASS H.R. 7073, THE BILL AMENDING THE FEDERAL INSECTICIDE, FUNGICIDE AND RODENTICIDE ACT WITH A COMMITTEE SUBSTITUTE THAT ALLOWS CONDITIONAL REGISTRATION OF NEW PESTICIDES.",7,704,7,704
205,15602,95,1,703,RH0950703,"'RH0950703',","RH0950703,",12/15/77,1977,12,15,NA,NA,326,6,0,0,0,0,0,HRES935,NA,NA,NA,"TO AGREE TO H. RES. 935, THE RULE TO CONSIDER THE CONFERENCE REPORT ON H.R. 3199, THE BILL AMENDING THE FEDERAL WATER POLLUTION CONTROL ACT OF 1972.","TO AGREE TO H. RES. 935, THE RULE TO CONSIDER THE CONFERENCE REPORT ON H.R. 3199, THE BILL AMENDING THE FEDERAL WATER POLLUTION CONTROL ACT OF 1972.",7,701,7,701
206,15603,95,1,704,RH0950704,"'RH0950704',","RH0950704,",12/15/77,1977,12,15,NA,NA,346,2,0,0,0,0,0,HR3199,NA,NA,NA,"TO AGREE TO THE CONFERENCE REPORT ON H.R. 3199, THE BILL AMENDING THE FEDERAL WATER POLLUTION CONTROL ACT OF 1972 AND AUTHORIZING APPROPRIATIONS FOR A NATIONAL SEWAGE TREATMENT PROGRAM.","TO AGREE TO THE CONFERENCE REPORT ON H.R. 3199, THE BILL AMENDING THE FEDERAL WATER POLLUTION CONTROL ACT OF 1972 AND AUTHORIZING APPROPRIATIONS FOR A NATIONAL SEWAGE TREATMENT PROGRAM.",7,703,7,703
207,15674,95,1,263,RH0950263,"'RH0950263',","RH0950263,",5/25/77,1977,5,25,NA,NA,237,172,-0.133,-0.118,-0.155,-0.535,-150.967,HR6161,NA,NA,NA,"TO AGREE TO AN AMENDMENT, AS MODIFIED BY THE EMERY SUBSTITUTE AMENDMENT, TO H.R. 6161. THE BREAUX AMENDMENT ALLOWS STATES TO GRANT A 5% VARIANCE OF POLLUTION LEVELS IN CLASS I AND CLASS II AREAS FOR UP TO 18 DAYS A YEAR.","TO AGREE TO AN AMENDMENT, AS MODIFIED BY THE EMERY SUBSTITUTE AMENDMENT, TO H.R. 6161. THE BREAUX AMENDMENT ALLOWS STATES TO GRANT A 5% VARIANCE OF POLLUTION LEVELS IN CLASS I AND CLASS II AREAS FOR UP TO 18 DAYS A YEAR.",7,705,7,705
208,15868,95,1,1053,RH0951053,"'RH0951053',","RH0951053,",6/5/78,1978,6,5,NA,NA,344,1,0,0,0,0,0,HR188,NA,NA,NA,"TO SUSPEND THE RULES AND PASS, AS AMENDED, H.R. 188, THE BILL AMENDING THE INTERVENTION ON THE HIGH SEAS ACT AND IMPLEMENTING THE 1973 PROTOCOL RELATING TO INTERVENTION ON THE HIGH SEAS IN CASES OF MARINE POLLUTION BY NOXIOUS SUBSTANCES, LIQUIFIED GAS, AND RADIOACTIVE WASTES.","TO SUSPEND THE RULES AND PASS, AS AMENDED, H.R. 188, THE BILL AMENDING THE INTERVENTION ON THE HIGH SEAS ACT AND IMPLEMENTING THE 1973 PROTOCOL RELATING TO INTERVENTION ON THE HIGH SEAS IN CASES OF MARINE POLLUTION BY NOXIOUS SUBSTANCES, LIQUIFIED GAS,",7,704,7,704
209,15870,95,1,1054,RH0951054,"'RH0951054',","RH0951054,",6/5/78,1978,6,5,NA,NA,338,9,0.577,0.245,0.517,1.463,-10.162,HR12140,NA,NA,NA,"TO SUSPEND THE RULES AND PASS H.R. 12140, THE BILL PROVIDING ADDITIONAL AUTHORIZATIONS FOR FISCAL YEARS 1979 AND 1980 FOR GREAT LAKES WATER QUALITY MONITORING AND FOR OTHER WATER QUALITY SURVEILLANCE AND INFORMATION DISSEMINATION ACTIVITIES.","TO SUSPEND THE RULES AND PASS H.R. 12140, THE BILL PROVIDING ADDITIONAL AUTHORIZATIONS FOR FISCAL YEARS 1979 AND 1980 FOR GREAT LAKES WATER QUALITY MONITORING AND FOR OTHER WATER QUALITY SURVEILLANCE AND INFORMATION DISSEMINATION ACTIVITIES.",7,710,7,701
210,15881,95,1,1060,RH0951060,"'RH0951060',","RH0951060,",6/6/78,1978,6,6,NA,NA,340,28,0.649,0.761,0.166,0.002,-90.606,HR8394,NA,NA,NA,"TO SUSPEND THE RULES AND PASS, AS AMENDED, H.R. 8394, THE BILL PROVIDING FOR FEDERAL PAYMENTS TO U.S. COUNTIES THAT HOUSE NATIONAL WILDLIFE REFUGES.","TO SUSPEND THE RULES AND PASS, AS AMENDED, H.R. 8394, THE BILL PROVIDING FOR FEDERAL PAYMENTS TO U.S. COUNTIES THAT HOUSE NATIONAL WILDLIFE REFUGES.",7,709,7,709
211,15885,95,1,1062,RH0951062,"'RH0951062',","RH0951062,",6/6/78,1978,6,6,NA,NA,268,103,0.034,0.829,0.092,0.135,-182.674,HR12668,NA,NA,NA,"TO SUSPEND THE RULES AND PASS, AS AMENDED, H.R. 12668, THE BILL AUTHORIZING THE SECREATRY OF COMMERCE TO ACQUIRE AN APPROPRIATELY EQUIPPED FISHERIES VESSEL FOR ASSESSMENT OF THE MARINE ENVIRONMENT OF THE NORTH AND SOUTH POLES.","TO SUSPEND THE RULES AND PASS, AS AMENDED, H.R. 12668, THE BILL AUTHORIZING THE SECREATRY OF COMMERCE TO ACQUIRE AN APPROPRIATELY EQUIPPED FISHERIES VESSEL FOR ASSESSMENT OF THE MARINE ENVIRONMENT OF THE NORTH AND SOUTH POLES.",7,709,7,709
212,15924,95,1,1082,RH0951082,"'RH0951082',","RH0951082,",6/12/78,1978,6,12,NA,NA,190,188,-0.116,0.053,0.147,0.353,-161.876,HR12441,NA,NA,NA,"TO SUSPEND THE RULES AND PASS H.R. 12441, THE BILL INCREASING THE FISCAL YEAR 1979 AUTHORIZATION OF APPROPRIATIONS FOR IMPLEMENTATION OF THE TOXIC SUBSTANCES CONTROL ACT.","TO SUSPEND THE RULES AND PASS H.R. 12441, THE BILL INCREASING THE FISCAL YEAR 1979 AUTHORIZATION OF APPROPRIATIONS FOR IMPLEMENTATION OF THE TOXIC SUBSTANCES CONTROL ACT.",7,704,7,704
213,15985,95,1,1113,RH0951113,"'RH0951113',","RH0951113,",6/19/78,1978,6,19,NA,NA,173,211,-0.07,0.047,-0.165,-0.307,-146.349,HR12936,NA,NA,NA,TO AMEND H.R. 12936 BY DECREASING THE APPROPRIATION FOR EPA ABATEMENT AND CONTROL ACTIVITES BY $114.6 MILLION AND THE APPROPRIATION FOR EPA ENFORCEMENT ACITIVITIES BY $18.9 MILLION.,TO AMEND H.R. 12936 BY DECREASING THE APPROPRIATION FOR EPA ABATEMENT AND CONTROL ACTIVITES BY $114.6 MILLION AND THE APPROPRIATION FOR EPA ENFORCEMENT ACITIVITIES BY $18.9 MILLION.,7,700,7,700
214,16364,95,1,1469,RH0951469,"'RH0951469',","RH0951469,",10/4/78,1978,10,4,NA,NA,387,15,0.255,0.839,0.159,0.539,-36.628,HR11302,NA,NA,NA,"TO AGREE TO THE CONFERENCE REPORT ON H.R. 11302, THE BILL AUTHORIZING APPROPRIATIONS FOR RESEARCH, DEVELOPMENT, AND DEMONSTRATION PROGRAMS OF THE ENVIROMENTAL PROTECTION AGENCY FOR FISCAL YEAR 1979.","TO AGREE TO THE CONFERENCE REPORT ON H.R. 11302, THE BILL AUTHORIZING APPROPRIATIONS FOR RESEARCH, DEVELOPMENT, AND DEMONSTRATION PROGRAMS OF THE ENVIROMENTAL PROTECTION AGENCY FOR FISCAL YEAR 1979.",7,798,7,798
215,16414,95,1,1519,RH0951519,"'RH0951519',","RH0951519,",10/14/78,1978,10,14,NA,NA,231,157,-0.111,-0.166,-0.122,-0.581,-148.99,HR14104,NA,NA,NA,"TO AMEND H.R. 14104, THE BILL EXTENDING APPROPRIATIONS FOR THE ENDANGERED SPECIES ACT THROUGH FISCAL YEAR 1981. THE DUNCAN AMENDMENT EXEMPTS THE TELLICO DAM AND RESERVOIR PROJECT FROM THE PROVISIONS OF THE ENDANGERED SPECIES ACT.","TO AMEND H.R. 14104, THE BILL EXTENDING APPROPRIATIONS FOR THE ENDANGERED SPECIES ACT THROUGH FISCAL YEAR 1981. THE DUNCAN AMENDMENT EXEMPTS THE TELLICO DAM AND RESERVOIR PROJECT FROM THE PROVISIONS OF THE ENDANGERED SPECIES ACT.",7,709,7,709
216,16415,95,1,1520,RH0951520,"'RH0951520',","RH0951520,",10/14/78,1978,10,14,NA,NA,384,12,-0.72,0,-0.287,-0.332,-30.739,HR14104,NA,NA,NA,"TO PASS H.R. 14104, THE BILL EXTENDING PROGRAMS OF THE ENDANGERED SPECIES ACT THROUGH FISCAL YEAR 1981.","TO PASS H.R. 14104, THE BILL EXTENDING PROGRAMS OF THE ENDANGERED SPECIES ACT THROUGH FISCAL YEAR 1981.",7,709,7,709
217,16464,95,1,707,RH0950707,"'RH0950707',","RH0950707,",1/19/78,1978,1,19,NA,NA,215,131,-0.934,0.133,-0.024,0.314,-211.833,HR2329,NA,NA,NA,"TO AMEND H.R. 2329, A BILL IMPROVING THE ADMINISTRATION OF FISH AND WILDLIFE PROGRAMS, BY STATING THAT SEARCH WITHOUT A WARRANT CAN OCCUR ONLY WHEN THERE ARE """"""""""""""""REASONABLE GROUNDS TO BELIEVE A PERSON HAS COMMITTED OR IS ATTEMPTING TO COMMIT AN OFFENSE"""""""""""""""" OF PRESENT FISH AND WILDLIFE LAWS IN THE OFFICER'S PRESENCE.",OF,7,709,7,709
218,16466,95,1,708,RH0950708,"'RH0950708',","RH0950708,",1/19/78,1978,1,19,NA,NA,292,59,0.326,0.011,0.204,0.553,-86.627,HR2329,NA,NA,NA,"TO PASS H.R. 2329, THE FISH AND WILDLIFE IMPROVEMENT ACT OF 1977.","TO PASS H.R. 2329, THE FISH AND WILDLIFE IMPROVEMENT ACT OF 1977.",7,709,7,709
219,16512,95,1,750,RH0950750,"'RH0950750',","RH0950750,",2/9/78,1978,2,9,NA,NA,333,44,0.386,0.042,0.224,0.504,-73.124,HR3454,NA,NA,NA,"TO AGREE TO THE CONFERENCE REPORT ON H.R. 3454, THE ENDANGERED AMERICAN WILDERNESS ACT OF 1978.","TO AGREE TO THE CONFERENCE REPORT ON H.R. 3454, THE ENDANGERED AMERICAN WILDERNESS ACT OF 1978.",7,709,7,709
220,16714,95,1,871,RH0950871,"'RH0950871',","RH0950871,",4/10/78,1978,4,10,NA,NA,380,5,0,0,0,0,0,HR10730,NA,NA,NA,"TO SUSPEND THE RULES AND PASS, AS AMENDED, H.R. 10730, THE BILL AUTHORIZING APPROPRIATIONS THROUGH FISCAL YEAR 1981 FOR THE MARINE MAMMAL PROTECTION ACT.","TO SUSPEND THE RULES AND PASS, AS AMENDED, H.R. 10730, THE BILL AUTHORIZING APPROPRIATIONS THROUGH FISCAL YEAR 1981 FOR THE MARINE MAMMAL PROTECTION ACT.",7,709,7,709
221,16722,95,1,875,RH0950875,"'RH0950875',","RH0950875,",4/10/78,1978,4,10,NA,NA,307,76,-0.036,0.585,0.117,0.483,-118.095,HR10884,NA,NA,NA,"TO SUSPEND THE RULES AND PASS, AS AMENDED, H.R. 10884, THE BILL AUTHORIZING APPROPRIATIONS THROUGH FISCAL YEAR 1981 TO THE COUNCIL ON ENVIRONMENTAL QUALITY.","TO SUSPEND THE RULES AND PASS, AS AMENDED, H.R. 10884, THE BILL AUTHORIZING APPROPRIATIONS THROUGH FISCAL YEAR 1981 TO THE COUNCIL ON ENVIRONMENTAL QUALITY.",7,700,7,700
222,16810,95,1,923,RH0950923,"'RH0950923',","RH0950923,",4/27/78,1978,4,27,NA,NA,384,5,0,0,0,0,0,HR11302,NA,NA,NA,"THAT THE HOUSE RESOLVE ITSELF INTO THE COMMITTEE OF THE WHOLE FOR THE CONSIDERATION OF H.R. 11302, THE BILL AUTHORIZING APPROPRIATIONS TO THE OFFICE OF RESEARCH AND DEVELOPMENT IN THE ENVIRONMENTAL PROTECTION AGENCY FOR FISCAL YEAR 1979.","THAT THE HOUSE RESOLVE ITSELF INTO THE COMMITTEE OF THE WHOLE FOR THE CONSIDERATION OF H.R. 11302, THE BILL AUTHORIZING APPROPRIATIONS TO THE OFFICE OF RESEARCH AND DEVELOPMENT IN THE ENVIRONMENTAL PROTECTION AGENCY FOR FISCAL YEAR 1979.",7,798,7,798
223,16812,95,1,924,RH0950924,"'RH0950924',","RH0950924,",4/27/78,1978,4,27,NA,NA,367,33,0.302,0.462,0.163,0.501,-67.953,HR11302,NA,NA,NA,"TO PASS H.R. 11302, THE BILL AUTHORIZING APPROPRIATIONS TO THE OFFICE OF RESEARCH AND DEVELOPMENT IN THE ENVIRONMENTAL PROTECTION AGENCY FOR FISCAL YEAR 1979.","TO PASS H.R. 11302, THE BILL AUTHORIZING APPROPRIATIONS TO THE OFFICE OF RESEARCH AND DEVELOPMENT IN THE ENVIRONMENTAL PROTECTION AGENCY FOR FISCAL YEAR 1979.",7,798,7,798
224,17391,96,1,228,RH0960228,"'RH0960228',","RH0960228,",6/15/79,1979,6,15,NA,NA,34,252,-0.449,-0.425,0.128,0.509,-70.544,HR4388,NA,NA,NA,"TO AMEND H.R. 4388, THE ENERGY AND WATER APPROPRIATIONS BILL, BY REDUCING BY $5.3 MILLION THE APPROPRIATION FOR THE COLORADO RIVER BASIN SALINITY CENTRAL PROJECT PLANT AT YUMA, ARIZONA. (MOTION FAILED)","TO AMEND H.R. 4388, THE ENERGY AND WATER APPROPRIATIONS BILL, BY REDUCING BY $5.3 MILLION THE APPROPRIATION FOR THE COLORADO RIVER BASIN SALINITY CENTRAL PROJECT PLANT AT YUMA, ARIZONA. MOTION FAILED)",7,709,7,709
225,17446,96,1,254,RH0960254,"'RH0960254',","RH0960254,",6/22/79,1979,6,22,NA,NA,129,237,-0.006,-0.396,0.066,0.308,-210.329,HR4394,NA,NA,NA,"TO AMEND H.R. 4394, HUD APPROPRIATIONS, BY INCREASING EPA RESEARCH AND DEVELOPMENT APPROPRIATIONS BY $10 MILLION. (MOTION FAILED)","TO AMEND H.R. 4394, HUD APPROPRIATIONS, BY INCREASING EPA RESEARCH AND DEVELOPMENT APPROPRIATIONS BY $10 MILLION. MOTION FAILED)",7,798,7,798
226,17448,96,1,255,RH0960255,"'RH0960255',","RH0960255,",6/22/79,1979,6,22,NA,NA,136,219,-0.091,-0.253,0.07,0.296,-207.24,HR4394,NA,NA,NA,"TO AMEND H.R. 4394, HUD APPROPRIATIONS, BY INCREASING EPA RESEARCH AND DEVELOPMENT APPROPRIATIONS BY $20 MILLION. (MOTION FAILED)","TO AMEND H.R. 4394, HUD APPROPRIATIONS, BY INCREASING EPA RESEARCH AND DEVELOPMENT APPROPRIATIONS BY $20 MILLION. MOTION FAILED)",7,798,7,798
227,17642,96,1,360,RH0960360,"'RH0960360',","RH0960360,",7/30/79,1979,7,30,NA,NA,318,76,0.325,0.063,0.156,0.313,-124.79,HR3509,NA,NA,NA,"TO PASS H.R. 3509, EXTENDING FOR 3 FISCAL YEARS THE AUTHORIZATIONS FOR APPROPRIATIONS UNDER THE SAFE DRINKING WATER ACT. (MOTION PASSED)","TO PASS H.R. 3509, EXTENDING FOR 3 FISCAL YEARS THE AUTHORIZATIONS FOR APPROPRIATIONS UNDER THE SAFE DRINKING WATER ACT. MOTION PASSED)",7,701,7,701
228,17928,96,1,518,RH0960518,"'RH0960518',","RH0960518,",10/18/79,1979,10,18,NA,NA,208,197,-0.078,-0.173,-0.102,-0.077,-212.164,HR3000,NA,NA,NA,"TO AMEND H.R. 3000, DOE CIVILIAN AUTHORIZATIONS, BY MAKING THE PRIMARY CONSIDERATION IN SITE RELOCATION FOR A PERMANENT GEOLOGICAL REPOSITARY FOR NUCLEAR HIGH-LEVEL WASTES BE THAT THE SITE BE ON SUITABLE FEDERAL LAND. (MOTION PASSED)","TO AMEND H.R. 3000, DOE CIVILIAN AUTHORIZATIONS, BY MAKING THE PRIMARY CONSIDERATION IN SITE RELOCATION FOR A PERMANENT GEOLOGICAL REPOSITARY FOR NUCLEAR HIGH-LEVEL WASTES BE THAT THE SITE BE ON SUITABLE FEDERAL LAND. MOTION PASSED)",7,704,7,704
229,17933,96,1,523,RH0960523,"'RH0960523',","RH0960523,",10/19/79,1979,10,19,NA,NA,358,0,0,0,0,0,0,HR595,NA,NA,NA,"TO AGREE THAT CONFERENCE COMMITTEE MEETINGS OF H.R. 595, DISPOSING OF TIN, BE CLOSED TO THE PUBLIC AT SUCH TIMES AS CLASSIFIED NATIONAL SECURITY INFORMATION IS UNDER CONSIDERATION. (MOTION PASSED)","TO AGREE THAT CONFERENCE COMMITTEE MEETINGS OF H.R. 595, DISPOSING OF TIN, BE CLOSED TO THE PUBLIC AT SUCH TIMES AS CLASSIFIED NATIONAL SECURITY INFORMATION IS UNDER CONSIDERATION. MOTION PASSED)",7,704,7,704
230,17934,96,1,524,RH0960524,"'RH0960524',","RH0960524,",10/19/79,1979,10,19,NA,NA,320,9,0.957,0.289,0.298,-0.399,-34.103,HRES417,NA,NA,NA,"TO AGREE TO H. RES. 417, PROVIDING FOR THE CONSIDERATION OF H.R. 2218, TO AUTHORIZE APPROPRIATIONS TO CARRY OUT THE ENDANGERED SPECIES ACT OF 1973 DURING FISCAL YEARS 1980 1982. (MOTION PASSED)","TO AGREE TO H. RES. 417, PROVIDING FOR THE CONSIDERATION OF H.R. 2218, TO AUTHORIZE APPROPRIATIONS TO CARRY OUT THE ENDANGERED SPECIES ACT OF 1973 DURING FISCAL YEARS 1980 1982. MOTION PASSED)",7,709,7,709
231,18013,96,1,600,RH0960600,"'RH0960600',","RH0960600,",11/16/79,1979,11,16,NA,NA,333,0,0,0,0,0,0,HRES473,NA,NA,NA,"TO AGREE TO H. RES. 473, PROVIDING FOR FLOOR CONSIDERATION OF H.R. 3994, RESOURCE CONSERVATION AND RECOVERY. (MOTION PASSED)","TO AGREE TO H. RES. 473, PROVIDING FOR FLOOR CONSIDERATION OF H.R. 3994, RESOURCE CONSERVATION AND RECOVERY. MOTION PASSED)",7,704,7,704
232,18014,96,1,601,RH0960601,"'RH0960601',","RH0960601,",11/16/79,1979,11,16,NA,NA,328,1,0,0,0,0,0,HRES416,NA,NA,NA,"TO AGREE TO H. RES. 416, THE RULE PROVIDING FOR CONSIDERATION OF H.R 3546, EXTENDING FOR ONE YEAR THE FEDERAL INSECTICIDE, FUNGICIDE, AND RODENTICIDE ACT. (MOTION PASSED)","TO AGREE TO H. RES. 416, THE RULE PROVIDING FOR CONSIDERATION OF H.R 3546, EXTENDING FOR ONE YEAR THE FEDERAL INSECTICIDE, FUNGICIDE, AND RODENTICIDE ACT. MOTION PASSED)",7,704,7,704
233,18024,96,1,610,RH0960610,"'RH0960610',","RH0960610,",11/28/79,1979,11,28,NA,NA,167,224,0.029,-0.017,-0.176,-0.669,-125.692,HR3546,NA,NA,NA,"TO AGREE TO COMMITTEE AMENDMENT NO. 2 TO H.R. 3546, EXTENDING THE FEDERAL INSECTICIDE, FUNGICIDE, AND RODENTICIDE ACT, THAT PERMITS THE USE OF PESTICIDE MIREX TO CONTROL FIRE ANTS UNTIL DEC. 31, 1980, SUBJECT TO RESTRICTIONS. (MOTION FAILED)","TO AGREE TO COMMITTEE AMENDMENT NO. 2 TO H.R. 3546, EXTENDING THE FEDERAL INSECTICIDE, FUNGICIDE, AND RODENTICIDE ACT, THAT PERMITS THE USE OF PESTICIDE MIREX TO CONTROL FIRE ANTS UNTIL DEC. 31, 1980, SUBJECT TO RESTRICTIONS. MOTION FAILED)",7,704,7,704
234,18025,96,1,611,RH0960611,"'RH0960611',","RH0960611,",11/28/79,1979,11,28,NA,NA,278,121,-0.269,-0.174,-0.236,-0.373,-106.599,HR3546,NA,NA,NA,"TO AGREE TO COMMITTEE AMENDMENT NO. 3 TO H.R. 3546, FIFRA, PROVIDING FOR CONGRESSIONAL REVIEW AND DISAPPROVAL OF EPA REGULATIONS PROMULGATED UNDER THE ACT. (MOTION PASSED)","TO AGREE TO COMMITTEE AMENDMENT NO. 3 TO H.R. 3546, FIFRA, PROVIDING FOR CONGRESSIONAL REVIEW AND DISAPPROVAL OF EPA REGULATIONS PROMULGATED UNDER THE ACT. MOTION PASSED)",7,704,7,704
235,18063,96,1,645,RH0960645,"'RH0960645',","RH0960645,",12/13/79,1979,12,13,NA,NA,133,262,0.099,0.011,-0.18,-0.092,-125.987,HR3282,NA,NA,NA,"TO AGREE TO A SUBSTITUTE FOR H.R. 3282, ASBESTOS SCHOOL HAZARD CONTROL, THAT PERMITS STATES TO USE UP TO 1% OF THEIR FEDERAL ELEMENTARY AND SECONDARY EDUCATION FUNDS FOR PROJECTS TO DETECT AND REMENDY ASBESTOS RELATED HEALTH HAZARDS IN SCHOOLS. (MOTION FAILED)","TO AGREE TO A SUBSTITUTE FOR H.R. 3282, ASBESTOS SCHOOL HAZARD CONTROL, THAT PERMITS STATES TO USE UP TO 1% OF THEIR FEDERAL ELEMENTARY AND SECONDARY EDUCATION FUNDS FOR PROJECTS TO DETECT AND REMENDY ASBESTOS RELATED HEALTH HAZARDS IN SCHOOLS. MOTION F",7,708,7,708
236,18064,96,1,646,RH0960646,"'RH0960646',","RH0960646,",12/13/79,1979,12,13,NA,NA,336,63,0.351,0.127,0.153,0.326,-118.593,HR3282,NA,NA,NA,"TO PASS H.R. 3282, ASBESTOS SCHOOL HAZARD CONTROL. (MOTION PASSED)","TO PASS H.R. 3282, ASBESTOS SCHOOL HAZARD CONTROL. MOTION PASSED)",7,708,7,708
237,18389,96,1,1061,RH0961061,"'RH0961061',","RH0961061,",7/25/80,1980,7,25,NA,NA,176,184,-0.101,0.08,-0.181,-0.261,-123.378,HR7631,NA,NA,NA,"TO AMEND H.R. 7631, HUD APPROPRIATONS, BY REDUCING THE APPRORIATIONS FOR THE NATIONAL COMMISSION ON AIR QUALITY BY $542,000. (MOTION FAILED)","TO AMEND H.R. 7631, HUD APPROPRIATONS, BY REDUCING THE APPRORIATIONS FOR THE NATIONAL COMMISSION ON AIR QUALITY BY $542,000. MOTION FAILED)",7,705,7,705
238,18472,96,1,1147,RH0961147,"'RH0961147',","RH0961147,",9/15/80,1980,9,15,NA,NA,244,0,0,0,0,0,0,HR6865,NA,NA,NA,"TO ORDER A SECOND ON THE MCCORMACK MOTION TO SUSPEND THE RULES ON H.R. 6865, TO AUTHORIZE THE DEPARTMENT OF ENERGY TO CARRY OUT A HIGH LEVEL NUCLEAR WASTE MANAGEMENT DEMONSTRATION PROJECT AT THE WESTERN NEW YORK SERVICE CENTER IN WEST VALLEY, NY. (MOTION PASSED)","TO ORDER A SECOND ON THE MCCORMACK MOTION TO SUSPEND THE RULES ON H.R. 6865, TO AUTHORIZE THE DEPARTMENT OF ENERGY TO CARRY OUT A HIGH LEVEL NUCLEAR WASTE MANAGEMENT DEMONSTRATION PROJECT AT THE WESTERN NEW YORK SERVICE CENTER IN WEST VALLEY, NY. MOTION",7,704,7,704
239,18495,96,1,1170,RH0961170,"'RH0961170',","RH0961170,",9/19/80,1980,9,19,NA,NA,307,1,0,0,0,0,0,HR7020,NA,NA,NA,"TO RESOLVE INTO THE COMMITTEE OF THE WHOLE FOR THE CONSIDERATION OF H.R. 7020, TO AMEND THE SOLID WASTE DISPOSAL ACT. (MOTION PASSED)","TO RESOLVE INTO THE COMMITTEE OF THE WHOLE FOR THE CONSIDERATION OF H.R. 7020, TO AMEND THE SOLID WASTE DISPOSAL ACT. MOTION PASSED)",7,703,7,703
240,18501,96,1,1176,RH0961176,"'RH0961176',","RH0961176,",9/23/80,1980,9,23,NA,NA,300,97,0.483,0.317,0.122,-0.245,-177.718,HR7039,NA,NA,NA,"TO SUSPEND THE RULES AND PASS H.R. 7039, PROVIDING FOR COMPREHENSIVE RESEARCH AND DEVELOPMENT REGARDING U.S. FISHERIES, TO EXPAND THE FISHING VESSEL AND FISH PROCESSING CAPACITY OF THE U.S. (MOTION PASSED; 2/3 REQUIRED)","TO SUSPEND THE RULES AND PASS H.R. 7039, PROVIDING FOR COMPREHENSIVE RESEARCH AND DEVELOPMENT REGARDING U.S. FISHERIES, TO EXPAND THE FISHING VESSEL AND FISH PROCESSING CAPACITY OF THE U.S. MOTION PASSED; 2/3 REQUIRED)",7,709,7,709
241,18507,96,1,1182,RH0961182,"'RH0961182',","RH0961182,",9/23/80,1980,9,23,NA,NA,351,23,0.494,0.288,0.192,0.378,-48.347,HR7020,NA,NA,NA,"TO PASS H.R. 7020, AMENDING THE SOLID WASTE DISPOSAL ACT.(MOTION PASSED)","TO PASS H.R. 7020, AMENDING THE SOLID WASTE DISPOSAL ACT.MOTION PASSED)",7,703,7,703
242,18536,96,1,1212,RH0961212,"'RH0961212',","RH0961212,",10/1/80,1980,10,1,NA,NA,162,247,-0.485,0.685,0.208,0.441,-157.182,HR7103,NA,NA,NA,"TO SUSPEND THE RULES AND PASS H.R. 7103, TO AMEND THE HAZARDOUS MATERIALS TRANSPORTATION ACT AND THE INDEPENDENT SAFETY BOARD ACT OF 1974 TO AUTHORIZE ADDITIONAL APPROPRIATIONS. (MOTION FAILED; 2/3 REQUIRED)","TO SUSPEND THE RULES AND PASS H.R. 7103, TO AMEND THE HAZARDOUS MATERIALS TRANSPORTATION ACT AND THE INDEPENDENT SAFETY BOARD ACT OF 1974 TO AUTHORIZE ADDITIONAL APPROPRIATIONS. MOTION FAILED; 2/3 REQUIRED)",7,704,7,704
243,18578,96,1,1258,RH0961258,"'RH0961258',","RH0961258,",12/3/80,1980,12,3,NA,NA,161,218,-0.491,0.258,0.049,0.183,-249.233,HR8378,NA,NA,NA,"TO AMEND H.R. 8378, NUCLEAR WASTE POLICY, BY PERMITTING A STATE REVIEW BOARD TO DISAPPROVE THE LOCATION OF A WASTE REPOSITORY UNLESS BOTH HOUSES OF CONGRESS VOTED TO OVERRIDE THAT DISAPPOVAL WITHIN 90 DAYS. (MOTION FAILED)","TO AMEND H.R. 8378, NUCLEAR WASTE POLICY, BY PERMITTING A STATE REVIEW BOARD TO DISAPPROVE THE LOCATION OF A WASTE REPOSITORY UNLESS BOTH HOUSES OF CONGRESS VOTED TO OVERRIDE THAT DISAPPOVAL WITHIN 90 DAYS. MOTION FAILED)",7,704,7,704
244,18579,96,1,1259,RH0961259,"'RH0961259',","RH0961259,",12/3/80,1980,12,3,NA,NA,274,94,0.068,0.38,0.13,0.358,-140.488,HR7020,NA,NA,NA,"TO SUSPEND THE RULES AND PASS H.R. 7020, HAZARDOUS WASTE CONTAINMENT. (MOTION PASSED; 2/3 REQUIRED)","TO SUSPEND THE RULES AND PASS H.R. 7020, HAZARDOUS WASTE CONTAINMENT. MOTION PASSED; 2/3 REQUIRED)",7,704,7,704
245,18586,96,1,1266,RH0961266,"'RH0961266',","RH0961266,",12/4/80,1980,12,4,NA,NA,334,13,0.585,-0.203,0.27,-0.103,-27.788,HR7018,NA,NA,NA,"TO ADOPT THE CONFERENCE REPORT ON H.R. 7018, EXTENDING THE FEDERAL INSECTICIDE, FUNGICIDE, AND RODENTICIDE ACT UNTIL SEPT. 30, 1981. (MOTION PASSED)","TO ADOPT THE CONFERENCE REPORT ON H.R. 7018, EXTENDING THE FEDERAL INSECTICIDE, FUNGICIDE, AND RODENTICIDE ACT UNTIL SEPT. 30, 1981. MOTION PASSED)",7,704,7,704
246,18734,96,1,704,RH0960704,"'RH0960704',","RH0960704,",2/7/80,1980,2,7,NA,NA,83,286,-0.036,-0.594,0.081,0.482,-136.795,HR2609,NA,NA,NA,"TO AMEND H.R. 2609, COLORADO RIVER SALINITY CONTROL, BY DIRECTING THE SECRETARY OF INTERIOR TO REVIEW AND REPORT TO CONGRESS ON THE AUTHORIZED DESALTING COMPLEX AND PROHIBITING EXPENDITURE OF FUNDS AUTHORIZED FOR THE COMPLEX UNTIL 90 DAYS FOLLOWING THE SUBMITTAL OF THE REPORT. (MOTION FAILED)","TO AMEND H.R. 2609, COLORADO RIVER SALINITY CONTROL, BY DIRECTING THE SECRETARY OF INTERIOR TO REVIEW AND REPORT TO CONGRESS ON THE AUTHORIZED DESALTING COMPLEX AND PROHIBITING EXPENDITURE OF FUNDS AUTHORIZED FOR THE COMPLEX UNTIL 90 DAYS FOLLOWING THE",7,709,7,709
247,18735,96,1,705,RH0960705,"'RH0960705',","RH0960705,",2/7/80,1980,2,7,NA,NA,275,94,-0.566,-0.141,-0.068,-0.416,-175.847,HR2609,NA,NA,NA,"TO PASS H.R. 2609, INCREASING THE APPROPRIATIONS CEILING FOR TITLE I OF THE COLORADO RIVER BASIN SALINITY CONTROL ACT. (MOTION PASSED)","TO PASS H.R. 2609, INCREASING THE APPROPRIATIONS CEILING FOR TITLE I OF THE COLORADO RIVER BASIN SALINITY CONTROL ACT. MOTION PASSED)",7,709,7,709
248,18742,96,1,712,RH0960712,"'RH0960712',","RH0960712,",2/12/80,1980,2,12,NA,NA,150,205,-0.229,0.779,-0.204,-0.315,-122.971,HR3995,NA,NA,NA,"TO AGREE TO COMMITTEE AMENDMENT TO H.R. 3995, NOISE CONTROL AUTHORIZATION, THAT PROVIDES FOR A ONE YEAR AUTHORIZATION $12.953 MILLION FOR FISCAL 1980. (MOTION FAILED)","TO AGREE TO COMMITTEE AMENDMENT TO H.R. 3995, NOISE CONTROL AUTHORIZATION, THAT PROVIDES FOR A ONE YEAR AUTHORIZATION $12.953 MILLION FOR FISCAL 1980. MOTION FAILED)",7,705,7,705
249,18744,96,1,713,RH0960713,"'RH0960713',","RH0960713,",2/12/80,1980,2,12,NA,NA,253,103,-0.352,0.042,-0.263,-0.35,-93.331,HR3995,NA,NA,NA,"TO AGREE TO COMMITTEE AMENDMENT TO H.R. 3995, NOISE CONTROL AUTHORIZATION, THAT PROVIDES FOR CONGRESSIONAL VETO OF REGULATIONS PROMULGATED BY EPA UNDER THE NOISE CONTROL ACT. (MOTION PASSED)","TO AGREE TO COMMITTEE AMENDMENT TO H.R. 3995, NOISE CONTROL AUTHORIZATION, THAT PROVIDES FOR CONGRESSIONAL VETO OF REGULATIONS PROMULGATED BY EPA UNDER THE NOISE CONTROL ACT. MOTION PASSED)",7,705,7,705
250,18746,96,1,714,RH0960714,"'RH0960714',","RH0960714,",2/12/80,1980,2,12,NA,NA,288,70,0.264,0.176,0.137,0.292,-122.734,HR3995,NA,NA,NA,"TO PASS H.R. 3995, AUTHORIZING APPROPRIATIONS FOR THE NOISE CONTROL ACT FOR FISCAL 1980 AND 1981. (MOTION PASSED)","TO PASS H.R. 3995, AUTHORIZING APPROPRIATIONS FOR THE NOISE CONTROL ACT FOR FISCAL 1980 AND 1981. MOTION PASSED)",7,705,7,705
251,18767,96,1,725,RH0960725,"'RH0960725',","RH0960725,",2/20/80,1980,2,20,NA,NA,386,10,0.622,0.046,0.295,0.441,-22.199,HR3994,NA,NA,NA,"TO PASS H.R. 3994, A BILL AMENDING THE SOLID WASTE DISPOSAL ACT TO AUTHORIZE APPROPRIATIONS FOR FISCAL 1980, TO MAKE CERTAIN TECHNICAL CHANGES, AND TO STRENGTHEN THE REGULATORY AND ENFORCEMENT MECHANISMS. (MOTION PASSED)","TO PASS H.R. 3994, A BILL AMENDING THE SOLID WASTE DISPOSAL ACT TO AUTHORIZE APPROPRIATIONS FOR FISCAL 1980, TO MAKE CERTAIN TECHNICAL CHANGES, AND TO STRENGTHEN THE REGULATORY AND ENFORCEMENT MECHANISMS. MOTION PASSED)",7,703,7,703
252,18772,96,1,728,RH0960728,"'RH0960728',","RH0960728,",2/21/80,1980,2,21,NA,NA,384,2,0,0,0,0,0,HRES579,NA,NA,NA,"TO AGREE TO H. RES. 579, THE RULE PROVIDING FOR THE CONSIDERATION OF H.R. 3789, PROVIDING FOR A GREAT PLAINS CONSERVATION PROGRAM. (MOTION PASSED)","TO AGREE TO H. RES. 579, THE RULE PROVIDING FOR THE CONSIDERATION OF H.R. 3789, PROVIDING FOR A GREAT PLAINS CONSERVATION PROGRAM. MOTION PASSED)",7,709,7,709
253,19019,96,1,879,RH0960879,"'RH0960879',","RH0960879,",5/13/80,1980,5,13,NA,NA,372,24,0.763,0.063,0.164,0.136,-83.619,HR6616,NA,NA,NA,"TO PASS H.R. 6616, APPROPRIATION AUTHORIZATION TO CARRY OUT THE PROVISIONS OF THE MARINE PROTECTION, RESEARCH, AND SANCTUARIES ACT FOR FISCAL 1981. (MOTION PASSED)","TO PASS H.R. 6616, APPROPRIATION AUTHORIZATION TO CARRY OUT THE PROVISIONS OF THE MARINE PROTECTION, RESEARCH, AND SANCTUARIES ACT FOR FISCAL 1981. MOTION PASSED)",7,709,7,709
254,19168,96,1,973,RH0960973,"'RH0960973',","RH0960973,",6/17/80,1980,6,17,NA,NA,199,215,-0.13,0.002,0.148,0.058,-175.374,HR7018,NA,NA,NA,"TO SUSPEND THE RULES AND PASS H.R. 7018, EXTENDING THE FEDERAL INSECTICIDE, FUNGICIDE, AND RODENTICIDE ACT UNTIL SEPT. 30, 1981. (MOTION FAILED; 2/3 REQUIRED)","TO SUSPEND THE RULES AND PASS H.R. 7018, EXTENDING THE FEDERAL INSECTICIDE, FUNGICIDE, AND RODENTICIDE ACT UNTIL SEPT. 30, 1981. MOTION FAILED; 2/3 REQUIRED)",7,704,7,704
255,19208,96,1,998,RH0960998,"'RH0960998',","RH0960998,",6/24/80,1980,6,24,NA,NA,392,22,0.628,0.636,0.249,-0.075,-49.701,HR7018,NA,NA,NA,"TO PASS H.R. 7018, EXTENDING THE FEDERAL INSECTICIDE, FUNGICIDE, AND RODENTICIDE ACT UNTIL SEPT. 30, 1981. (MOTION PASSED)","TO PASS H.R. 7018, EXTENDING THE FEDERAL INSECTICIDE, FUNGICIDE, AND RODENTICIDE ACT UNTIL SEPT. 30, 1981. MOTION PASSED)",7,704,7,704
256,19463,97,1,101,RH0970101,"'RH0970101',","RH0970101,",6/26/81,1981,6,26,NA,NA,412,4,0,0,0,0,0,HR3520,NA,NA,NA,"TO AGREE TO THE CONFERENCE REPORT ON H.R. 3520, AMENDING THE CLEAN AIR ACT TO PROVIDE COMPLIANCE DATE EXTENSIONS FOR STEELMAKING FACILITIES ON A CASE-BY- CASE BASIS TO FACILITATE MODERNIZATION. (MOTION AGREED TO)","TO AGREE TO THE CONFERENCE REPORT ON H.R. 3520, AMENDING THE CLEAN AIR ACT TO PROVIDE COMPLIANCE DATE EXTENSIONS FOR STEELMAKING FACILITIES ON A CASE-BY- CASE BASIS TO FACILITATE MODERNIZATION. MOTION AGREED TO)",7,705,7,705
257,19534,97,1,135,RH0970135,"'RH0970135',","RH0970135,",7/17/81,1981,7,17,NA,NA,177,184,0.038,-0.115,-0.143,-0.379,-148.495,HR4034,NA,NA,NA,"TO AGREE TO AMENDMENTS EN BLOC TO H.R. 4034, FISCAL 1982 APPROPRIATIONS FOR HOUSING AND URBAN DEVELOPMENT, THAT PROHIBIT THE USE OF EPA POLLUTION ABATEMENT AND COMPLIANCE FUNDS TO REQUIRE STATES TO ADOPT, IMPLEMENT OR ENFORCE A VEHICLE EMISSION CONTROL INSPECTION AND MAINTENANCE PROGRAM. (MOTION FAILED)","TO AGREE TO AMENDMENTS EN BLOC TO H.R. 4034, FISCAL 1982 APPROPRIATIONS FOR HOUSING AND URBAN DEVELOPMENT, THAT PROHIBIT THE USE OF EPA POLLUTION ABATEMENT AND COMPLIANCE FUNDS TO REQUIRE STATES TO ADOPT, IMPLEMENT OR ENFORCE A VEHICLE EMISSION CONTROL",7,705,7,705
258,19568,97,1,151,RH0970151,"'RH0970151',","RH0970151,",7/24/81,1981,7,24,NA,NA,157,213,0.099,-0.449,0.135,0.378,-155.366,HR4144,NA,NA,NA,"TO AMEND H.R. 4144, ENERGY AND WATER DEVELOPMENT APPROPRIATIONS, BY DELETING $10 MILLION FOR THE BARNWELL NUCLEAR FUEL PLANT AND INCREASING THE FUNDS FOR THE SAVANNAH RIVER NUCLEAR WASTE SOLIDIFICATION PROJECT IN SOUTH CAROLINA BY $10 MILLION. (MOTION FAILED)","TO AMEND H.R. 4144, ENERGY AND WATER DEVELOPMENT APPROPRIATIONS, BY DELETING $10 MILLION FOR THE BARNWELL NUCLEAR FUEL PLANT AND INCREASING THE FUNDS FOR THE SAVANNAH RIVER NUCLEAR WASTE SOLIDIFICATION PROJECT IN SOUTH CAROLINA BY $10 MILLION. MOTION F",7,704,7,704
259,19670,97,1,202,RH0970202,"'RH0970202',","RH0970202,",9/22/81,1981,9,22,NA,NA,360,42,0.461,0.122,0.19,0.32,-85.472,HR1953,NA,NA,NA,"TO SUSPEND THE RULES AND PASS H.R. 1953, TO AUTHORIZE APPROPRIATIONS FOR OPERATIONS OF THE OFFICE OF ENVIROMENTAL QUALITY AND THE COUNCIL ON ENVIROMENTAL QUALITY DURING FISCAL YEARS 1982, 1983, AND 1984. (MOTION PASSED)","TO SUSPEND THE RULES AND PASS H.R. 1953, TO AUTHORIZE APPROPRIATIONS FOR OPERATIONS OF THE OFFICE OF ENVIROMENTAL QUALITY AND THE COUNCIL ON ENVIROMENTAL QUALITY DURING FISCAL YEARS 1982, 1983, AND 1984. MOTION PASSED)",7,700,7,700
260,19765,97,1,251,RH0970251,"'RH0970251',","RH0970251,",10/20/81,1981,10,20,NA,NA,392,5,0,0,0,0,0,HR3403,NA,NA,NA,"TO RESOLVE INTO THE COMMITTEE OF THE WHOLE FOR CONSIDERATION OF H.R. 3403, AUTHORIZING $8,332,000 ANNUALLY FOR FISCAL 1982 AND 1983 FOR FEDERAL HAZARDOUS MATERIALS TRANSPORTATION ACTIVITIES AND FOR THE ESTABLISHMENT OF REGIONAL TRAINING CENTERS FOR STATE, LOCAL AND PERSONNEL TO IMPROVE ENFORCEMENT OF REGULATIONS GOVERNING THE TRANSPORTATION OF HAZARDOUS MATERIALS AND EMERGENCY RESPONSE CAPABILITY. (MOTION AGREED TO)","TO RESOLVE INTO THE COMMITTEE OF THE WHOLE FOR CONSIDERATION OF H.R. 3403, AUTHORIZING $8,332,000 ANNUALLY FOR FISCAL 1982 AND 1983 FOR FEDERAL HAZARDOUS MATERIALS TRANSPORTATION ACTIVITIES AND FOR THE ESTABLISHMENT OF REGIONAL TRAINING CENTERS FOR STAT",7,704,7,704
261,19767,97,1,252,RH0970252,"'RH0970252',","RH0970252,",10/20/81,1981,10,20,NA,NA,410,2,0,0,0,0,0,HR3403,NA,NA,NA,"TO PASS H.R. 3403, AUTHORIZING $8,332,000 ANNUALLY FOR FISCAL 1982 AND 1983 FOR FEDERAL HAZARDOUS MATERIALS TRANSPORTATION ACTIVITIES AND TO ESTABLISH REGIONAL TRAINING CENTERS FOR STATE, LOCAL AND OTHER PERSONNEL TO IMPROVE ENFORCEMENT OF REGULATIONS GOVERNING THE TRANSPORTATION OF HAZARDOUS MATERIALS AND EMERGENCY RESPONSE CAPABILITY. (MOTION AGREED TO)","TO PASS H.R. 3403, AUTHORIZING $8,332,000 ANNUALLY FOR FISCAL 1982 AND 1983 FOR FEDERAL HAZARDOUS MATERIALS TRANSPORTATION ACTIVITIES AND TO ESTABLISH REGIONAL TRAINING CENTERS FOR STATE, LOCAL AND OTHER PERSONNEL TO IMPROVE ENFORCEMENT OF REGULATIONS G",7,704,7,704
262,19794,97,1,265,RH0970265,"'RH0970265',","RH0970265,",10/27/81,1981,10,27,NA,NA,382,4,0,0,0,0,0,HR4503,NA,NA,NA,"TO RESOLVE INTO THE COMMITTEE OF THE WHOLE HOUSE FOR THE CONSIDERATION OF H.R. 4503, A BILL TO AMEND THE FEDERAL WATER POLLUTION CONTROL ACT BY AUTHORIZING FUNDS FOR FISCAL YEAR 1982. (MOTION AGREED TO)","TO RESOLVE INTO THE COMMITTEE OF THE WHOLE HOUSE FOR THE CONSIDERATION OF H.R. 4503, A BILL TO AMEND THE FEDERAL WATER POLLUTION CONTROL ACT BY AUTHORIZING FUNDS FOR FISCAL YEAR 1982. MOTION AGREED TO)",7,701,7,701
263,19796,97,1,266,RH0970266,"'RH0970266',","RH0970266,",10/27/81,1981,10,27,NA,NA,382,18,0.579,-0.073,0.319,-0.136,-32.576,HR4503,NA,NA,NA,"TO PASS H.R. 4503, AUTHORIZING FUNDS FOR FISCAL YEAR 1982 UNDER THE FEDERAL WATER POLLUTION CONTROL ACT. (MOTION AGREED TO)","TO PASS H.R. 4503, AUTHORIZING FUNDS FOR FISCAL YEAR 1982 UNDER THE FEDERAL WATER POLLUTION CONTROL ACT. MOTION AGREED TO)",7,701,7,701
264,20076,97,1,46,RH0970046,"'RH0970046',","RH0970046,",5/28/81,1981,5,28,NA,NA,322,3,0,0,0,0,0,HR3520,NA,NA,NA,"TO SUSPEND THE RULES AND PASS H.R. 3520, A BILL TO GRANT THE STEEL INDUSTRY A THREE-YEAR EXTENSION OF THE 1982 DEADLINE FOR MEETING NATIONAL CLEAN AIR STANDARDS. (MOTION AGREED TO)","TO SUSPEND THE RULES AND PASS H.R. 3520, A BILL TO GRANT THE STEEL INDUSTRY A THREE-YEAR EXTENSION OF THE 1982 DEADLINE FOR MEETING NATIONAL CLEAN AIR STANDARDS. MOTION AGREED TO)",7,705,7,705
265,20150,97,1,67,RH0970067,"'RH0970067',","RH0970067,",6/11/81,1981,6,11,NA,NA,233,122,0.36,-0.87,0.126,0.104,-190.024,HR3413,NA,NA,NA,"TO AMEND H.R. 3413, FISCAL 1982 DEPARTMENT OF JUSTICE AUTHORIZATION, BY PROHIBITING THE OBLIGATION OR EXPENDITURE OF FUNDS FOR THE PURPOSE OF PREPARING ENVIROMENTAL IMPACT STATEMENTS NOT ALREADY IN THE PROCESS OF PREPARATION, UNLESS THE PREPARATION OF SUCH STATEMENTS IS REQUIRED BY STATUTE. (MOTION AGREED TO)","TO AMEND H.R. 3413, FISCAL 1982 DEPARTMENT OF JUSTICE AUTHORIZATION, BY PROHIBITING THE OBLIGATION OR EXPENDITURE OF FUNDS FOR THE PURPOSE OF PREPARING ENVIROMENTAL IMPACT STATEMENTS NOT ALREADY IN THE PROCESS OF PREPARATION, UNLESS THE PREPARATION OF S",7,700,7,700
266,20528,97,1,554,RH0970554,"'RH0970554',","RH0970554,",7/23/82,1982,7,23,NA,NA,301,2,0,0,0,0,0,HRES528,NA,NA,NA,"TO AGREE TO H. RES. 528, THE RULE UNDER WHICH H.R. 5203 IS TO BE CONSIDERED. H.R. 5203 AMENDS THE FEDERAL INSECTICIDE, FUNGICIDE, AND RODENTICIDE ACT. (MOTION PASSED)","TO AGREE TO H. RES. 528, THE RULE UNDER WHICH H.R. 5203 IS TO BE CONSIDERED. H.R. 5203 AMENDS THE FEDERAL INSECTICIDE, FUNGICIDE, AND RODENTICIDE ACT. MOTION PASSED)",7,704,7,704
267,20620,97,1,605,RH0970605,"'RH0970605',","RH0970605,",8/11/82,1982,8,11,NA,NA,250,154,0.132,0.001,0.13,0.315,-175.671,HR5203,NA,NA,NA,"TO AMEND H.R. 5203, A BILL AMENDING THE FEDERAL INSECTICIDE, FUNGICIDE, AND RODENTICIDE ACT. THE HARKIN AMENDMENT STRIKES LANGUAGE REGARDING A STATE'S AUTHORITY TO REQUEST HEALTH AND SAFETY DATA AND REGARDING THE TIME REQUIREMENTS TO REACH CERTAIN DECISIONS. (MOTION PASSED)","TO AMEND H.R. 5203, A BILL AMENDING THE FEDERAL INSECTICIDE, FUNGICIDE, AND RODENTICIDE ACT. THE HARKIN AMENDMENT STRIKES LANGUAGE REGARDING A STATE'S AUTHORITY TO REQUEST HEALTH AND SAFETY DATA AND REGARDING THE TIME REQUIREMENTS TO REACH CERTAIN DECI",7,704,7,704
268,20622,97,1,606,RH0970606,"'RH0970606',","RH0970606,",8/11/82,1982,8,11,NA,NA,352,56,0.405,0.181,0.177,0.186,-101.936,HR5203,NA,NA,NA,"TO PASS H.R. 5203, A BILL AMENDING THE FEDERAL INSECTICIDE, FUNGICIDE, AND RODENTICIDE ACT. (MOTION PASSED)","TO PASS H.R. 5203, A BILL AMENDING THE FEDERAL INSECTICIDE, FUNGICIDE, AND RODENTICIDE ACT. MOTION PASSED)",7,704,7,704
269,20652,97,1,623,RH0970623,"'RH0970623',","RH0970623,",8/17/82,1982,8,17,NA,NA,244,153,0.096,0.066,0.241,0.293,-95.937,HR6323,NA,NA,NA,"TO AMEND THE CARNEY SUBSTITUTE AMENDMENT TO H.R. 6323, A BILL AUTHORIZING APPROPRIATIONS FOR ENVIRONMENTAL RESEARCH, DEVELOPMENT, AND DEMONSTRATION FOR FISCAL YEARS 1983 AND 1984. THE CARNEY SUBSTITUTE AMENDMENT REDUCES AUTHORIZATIONS FOR THE ENVIRONMENTAL PROTECTION AGENCY FROM $296.8 MILLION TO $225.5 MILLION FOR FISCAL YEAR 1983. THE FUQUA AMENDMENT REDUCES AUTHORIZATIONS FOR THE ENVIRONMENTAL PROTECTION AGENCY FROM $296.8 MILLION TO $277.9 MILLION FOR FISCAL YEAR 1983, AND IT AUTHORIZES $291 MILLION FOR THE AGENCY FOR FISCAL YEAR 1984. (MOTION PASSED)","TO AMEND THE CARNEY SUBSTITUTE AMENDMENT TO H.R. 6323, A BILL AUTHORIZING APPROPRIATIONS FOR ENVIRONMENTAL RESEARCH, DEVELOPMENT, AND DEMONSTRATION FOR FISCAL YEARS 1983 AND 1984. THE CARNEY SUBSTITUTE AMENDMENT REDUCES AUTHORIZATIONS FOR THE ENVIRONME",7,798,7,798
270,20654,97,1,624,RH0970624,"'RH0970624',","RH0970624,",8/17/82,1982,8,17,NA,NA,394,7,0,0,0,0,0,HR6323,NA,NA,NA,"TO AGREE TO THE CARNEY SUBSTITUTE AMENDMENT TO H.R. H.R. 6323 AS AMENDED BY THE FUQUA AMENDMENT. H.R. 6323 IS A BILL AUTHORIZING APPRORIATIONS FOR ENVIRONMENTAL RESEARCH, DEVELOPMENT, AND DEMONSTRATION FOR FISCAL YEARS 1983 AND 1984. THE CARNEY SUBSTITUTE AMENDMENT REDUCES AUTHORIZATIONS FOR THE ENVIRONMENTAL PROTECTION AGENCY FROM $296.8 MILLION TO $225.5 MILLION FOR FISCAL YEAR 1983. THE FUQUA AMENDMENT REDUCES AUTHORIZATIONS FOR THE ENVIRONMENTAL PROTECTION AGENCY FROM $296.8 MILLION TO $277.9 MILLION FOR FISCAL YEAR 1983, AND IT AUTHORIZES $291 MILLION FOR THE AGENCY FOR FISCAL YEAR 1984. (MOTION PASSED)","TO AGREE TO THE CARNEY SUBSTITUTE AMENDMENT TO H.R. H.R. 6323 AS AMENDED BY THE FUQUA AMENDMENT. H.R. 6323 IS A BILL AUTHORIZING APPRORIATIONS FOR ENVIRONMENTAL RESEARCH, DEVELOPMENT, AND DEMONSTRATION FOR FISCAL YEARS 1983 AND 1984. THE CARNEY SUBSTI",7,798,7,798
271,20656,97,1,625,RH0970625,"'RH0970625',","RH0970625,",8/17/82,1982,8,17,NA,NA,314,92,0.339,-0.164,0.244,0.421,-101.384,HR6323,NA,NA,NA,"TO PASS H.R. 6323, A BILL AUTHORIZING APPROPRIATIONS FOR ENVIRONMENTAL RESEARCH, DEVELOPMENT, AND DEMONSTRATION FOR FISCAL YEARS 1983 AND 1984. (MOTION PASSED)","TO PASS H.R. 6323, A BILL AUTHORIZING APPROPRIATIONS FOR ENVIRONMENTAL RESEARCH, DEVELOPMENT, AND DEMONSTRATION FOR FISCAL YEARS 1983 AND 1984. MOTION PASSED)",7,798,7,798
272,20695,97,1,646,RH0970646,"'RH0970646',","RH0970646,",9/8/82,1982,9,8,NA,NA,148,183,-0.019,0.098,-0.239,-0.661,-88.03,HR6307,NA,NA,NA,"TO AMEND THE FLORIO SUBSTITUTE AMENDMENT TO H.R. 6307, A BILL AMENDING THE SOLID WASTE DISPOSAL ACT TO AUTHORIZE APPROPRIATIONS FOR THE FISCAL YEARS 1983 AND 1984. THE FLORIO AMENDMENT MAKES SUNDRY TECHNICAL AND CLARIFYING CHANGES IN THE ORIGINAL BILL AND INCORPORATES THE PUBLIC WORKS COMMITTEE AMENDMENTS. THE GRAMM AMENDMENT STRIKES PROVISIONS WHICH APPLY RCRA REGULATIONS TO SMALL QUANTITY GENERATORS AND REQUIRES THE EPA TO STUDY AND REPORT TO CONGRESS ON THE ADVISABILITY OF APPLYING REGULATIONS TO OPERATIONS GENERATING LESS THAN 1,000 KILOGRAMS PER MONTH. (MOTION FAILED)","TO AMEND THE FLORIO SUBSTITUTE AMENDMENT TO H.R. 6307, A BILL AMENDING THE SOLID WASTE DISPOSAL ACT TO AUTHORIZE APPROPRIATIONS FOR THE FISCAL YEARS 1983 AND 1984. THE FLORIO AMENDMENT MAKES SUNDRY TECHNICAL AND CLARIFYING CHANGES IN THE ORIGINAL BILL",7,703,7,703
273,20697,97,1,647,RH0970647,"'RH0970647',","RH0970647,",9/8/82,1982,9,8,NA,NA,85,255,0.187,0.196,-0.192,-0.455,-108.398,HR6307,NA,NA,NA,"TO AMEND THE FLORIO SUBSTITUTE AMENDMENT TO H.R. 6307, A BILL AMENDING THE SOLID WASTE DISPOSAL ACT TO AUTHORIZE APPROPRIATIONS FOR THE FISCAL YEARS 1983 AND 1984. THE FLORIO AMENDMENT MAKES SUNDRY TECHNICAL AND CLARIFYING CHANGES IN THE ORIGINAL BILL AND INCORPORATES THE PUBLIC WORKS COMMITTEE AMENDMENTS. THE DANNEMEYER AMENDMENT STRIKES LANGUAGE PRESERVING THE RIGHTS OF LITIGANTS UNDER ANY STATUTE OF COMMON LAW. (MOTION FAILED)","TO AMEND THE FLORIO SUBSTITUTE AMENDMENT TO H.R. 6307, A BILL AMENDING THE SOLID WASTE DISPOSAL ACT TO AUTHORIZE APPROPRIATIONS FOR THE FISCAL YEARS 1983 AND 1984. THE FLORIO AMENDMENT MAKES SUNDRY TECHNICAL AND CLARIFYING CHANGES IN THE ORIGINAL BILL",7,703,7,703
274,20699,97,1,648,RH0970648,"'RH0970648',","RH0970648,",9/8/82,1982,9,8,NA,NA,317,32,0.41,0.135,0.287,0.604,-53.366,HR6307,NA,NA,NA,"TO PASS H.R. 6307, A BILL AMENDING THE SOLID WASTE DISPOSAL ACT TO AUTHORIZE APPROPRIATIONS FOR THE FISCAL YEARS 1983 AND 1984.","TO PASS H.R. 6307, A BILL AMENDING THE SOLID WASTE DISPOSAL ACT TO AUTHORIZE APPROPRIATIONS FOR THE FISCAL YEARS 1983 AND 1984.",7,703,7,703
275,20728,97,1,664,RH0970664,"'RH0970664',","RH0970664,",9/15/82,1982,9,15,NA,NA,131,263,-0.115,-0.332,0.101,0.327,-176.796,HR6956,NA,NA,NA,"TO AMEND H.R. 6956, FISCAL 1983 HUD APPROPRIATIONS, BY INCREASING THE FUNDING FOR EPA RESEARCH AND DEVELOPMENT ACTIVITIES BY $25 MILLION. (MOTION FAILED)","TO AMEND H.R. 6956, FISCAL 1983 HUD APPROPRIATIONS, BY INCREASING THE FUNDING FOR EPA RESEARCH AND DEVELOPMENT ACTIVITIES BY $25 MILLION. MOTION FAILED)",7,798,7,798
276,20732,97,1,666,RH0970666,"'RH0970666',","RH0970666,",9/15/82,1982,9,15,NA,NA,200,184,-0.032,-0.061,-0.128,-0.487,-156.048,HR6956,NA,NA,NA,"TO AMEND H.R. 6956, FISCAL 1983 HUD APPROPRIATIONS, BY PROHIBITING THE USE OF FUNDS BY EPA TO IMPLEMENT A MANDATORY INSPECTION AND MAINTENANCE PROGRAM FOR VEHICLE EMISSIONS. (MOTION PASSED)","TO AMEND H.R. 6956, FISCAL 1983 HUD APPROPRIATIONS, BY PROHIBITING THE USE OF FUNDS BY EPA TO IMPLEMENT A MANDATORY INSPECTION AND MAINTENANCE PROGRAM FOR VEHICLE EMISSIONS. MOTION PASSED)",7,705,7,705
277,20744,97,1,673,RH0970673,"'RH0970673',","RH0970673,",9/16/82,1982,9,16,NA,NA,342,8,0,0,0,0,0,HRES555,NA,NA,NA,"TO ADOPT H. RES. 555, THE RULE UNDER WHICH H.R. 5543 IS TO BE CONSIDERED. H.R. 5543 IS A BILL ESTABLISHING AN OCEAN AND COASTAL RESOURCES MANAGEMENT AND DEVELOPMENT FUND AND REQUIRING THE SECRETARY OF COMMERCE TO PROVIDE TO COASTAL STATES NATIONAL OCEAN AND RESOURCES MANAGEMENT AND DEVELOPMENT BLOCK GRANTS FROM SUMS IN THE FUND. (MOTION PASSED)","TO ADOPT H. RES. 555, THE RULE UNDER WHICH H.R. 5543 IS TO BE CONSIDERED. H.R. 5543 IS A BILL ESTABLISHING AN OCEAN AND COASTAL RESOURCES MANAGEMENT AND DEVELOPMENT FUND AND REQUIRING THE SECRETARY OF COMMERCE TO PROVIDE TO COASTAL STATES NATIONAL OCEAN",7,711,7,711
278,20811,97,1,709,RH0970709,"'RH0970709',","RH0970709,",9/29/82,1982,9,29,NA,NA,260,134,0.173,0.041,0.149,0.096,-153.117,HR5543,NA,NA,NA,"TO PASS H.R. 5543, A BILL ESTABLISHING AN OCEAN AND COASTAL RESOURCES MANAGEMENT AND DEVELOPMENT FUND. H.R. 5543 ALSO REQUIRES THE SECRETARY OF COMMERCE TO PROVIDE TO COASTAL STATES NATIONAL OCEAN AND RESOURCES MANAGEMENT AND DEVELOPMENT BLOCK GRANTS FROM SUMS IN THE FUND. (MOTION PASSED)","TO PASS H.R. 5543, A BILL ESTABLISHING AN OCEAN AND COASTAL RESOURCES MANAGEMENT AND DEVELOPMENT FUND. H.R. 5543 ALSO REQUIRES THE SECRETARY OF COMMERCE TO PROVIDE TO COASTAL STATES NATIONAL OCEAN AND RESOURCES MANAGEMENT AND DEVELOPMENT BLOCK GRANTS F",7,711,7,711
279,20835,97,1,722,RH0970722,"'RH0970722',","RH0970722,",11/29/82,1982,11,29,NA,NA,333,4,0,0,0,0,0,HR3809,NA,NA,NA,"TO RESOLVE INTO THE COMMITTEE OF THE WHOLE FOR CONSIDERATION OF H.R. 3809, THE NUCLEAR WASTE POLICY ACT OF 1982. (MOTION PASSED)","TO RESOLVE INTO THE COMMITTEE OF THE WHOLE FOR CONSIDERATION OF H.R. 3809, THE NUCLEAR WASTE POLICY ACT OF 1982. MOTION PASSED)",7,704,7,704
280,20837,97,1,723,RH0970723,"'RH0970723',","RH0970723,",11/29/82,1982,11,29,NA,NA,181,194,-0.008,-0.042,-0.101,-0.136,-187.854,HR3809,NA,NA,NA,TO AMEND H.R. 3809 SO AS TO REQUIRE A STATE'S NOTICE OF DISAPPROVAL TO SITING OF INTERIM STORAGE FACILITIES WITHIN THEIR BOUNDARIES BE SUSTAINED BY A MAJORITY VOTE OF ONE HOUSE OF CONGRESS BEFORE IT COULD BECOME EFFECTIVE INSTEAD OF THE BILL'S REQUIREMENT OF A TWO-HOUSE OVERRIDE. (MOTION FAILED),TO AMEND H.R. 3809 SO AS TO REQUIRE A STATE'S NOTICE OF DISAPPROVAL TO SITING OF INTERIM STORAGE FACILITIES WITHIN THEIR BOUNDARIES BE SUSTAINED BY A MAJORITY VOTE OF ONE HOUSE OF CONGRESS BEFORE IT COULD BECOME EFFECTIVE INSTEAD OF THE BILL'S REQUIREME,7,704,7,704
281,20838,97,1,724,RH0970724,"'RH0970724',","RH0970724,",11/29/82,1982,11,29,NA,NA,81,296,0.009,1,-0.118,-0.254,-149.879,HR3809,NA,NA,NA,"TO AMEND H.R. 3809 SO AS TO DISQUALIFY HIGHLY POPULATED AREAS OR AREAS CONTAINING 1,000 OR MORE PEOPLE PER SQUARE MILE FROM CONSIDERATION AS POTENTIAL WASTE SITES. (MOTION FAILED)","TO AMEND H.R. 3809 SO AS TO DISQUALIFY HIGHLY POPULATED AREAS OR AREAS CONTAINING 1,000 OR MORE PEOPLE PER SQUARE MILE FROM CONSIDERATION AS POTENTIAL WASTE SITES. MOTION FAILED)",7,704,7,704
282,20839,97,1,725,RH0970725,"'RH0970725',","RH0970725,",11/29/82,1982,11,29,NA,NA,190,184,-0.086,0.165,-0.113,-0.166,-179,HR3809,NA,NA,NA,TO AMEND H.R. 3809 WITH AN AMENDMENT THAT SUBSTITUTES A ONE-HOUSE RATIFICATION FOR THE BILL'S TWO-HOUSE OVERRIDE PROVISION OF A STATE'S NOTICE OF DISAPPROVAL TO SITING OF INTERIM STORAGE FACILITIES WITHIN THEIR BOUNDARIES. (MOTION FAILED),TO AMEND H.R. 3809 WITH AN AMENDMENT THAT SUBSTITUTES A ONE-HOUSE RATIFICATION FOR THE BILL'S TWO-HOUSE OVERRIDE PROVISION OF A STATE'S NOTICE OF DISAPPROVAL TO SITING OF INTERIM STORAGE FACILITIES WITHIN THEIR BOUNDARIES. MOTION FAILED),7,704,7,704
283,20840,97,1,726,RH0970726,"'RH0970726',","RH0970726,",11/30/82,1982,11,30,NA,NA,84,308,-0.542,0.121,0.151,0.425,-132.506,HR3809,NA,NA,NA,TO AMEND H.R. 3809 SO AS TO ELIMINATE THE DOE REQUIREMENT FOR INTERIM STORAGE FOR AN ADDITIONAL 200 METRIC TONS OF SPENT FUEL. (MOTION FAILED),TO AMEND H.R. 3809 SO AS TO ELIMINATE THE DOE REQUIREMENT FOR INTERIM STORAGE FOR AN ADDITIONAL 200 METRIC TONS OF SPENT FUEL. MOTION FAILED),7,704,7,704
284,20842,97,1,727,RH0970727,"'RH0970727',","RH0970727,",11/30/82,1982,11,30,NA,NA,109,293,-0.118,-0.492,0.171,0.406,-116.965,HR3809,NA,NA,NA,TO AMEND H.R. 3809 TO REQUIRE THE SECRETARY TO SET POPULATION GUIDELINES THAT DISQUALIFY CANDIDATE SURFACE REPOSITORY SITES IN HIGHLY POPULATED AREAS. (MOTION FAILED),TO AMEND H.R. 3809 TO REQUIRE THE SECRETARY TO SET POPULATION GUIDELINES THAT DISQUALIFY CANDIDATE SURFACE REPOSITORY SITES IN HIGHLY POPULATED AREAS. MOTION FAILED),7,704,7,704
285,20856,97,1,734,RH0970734,"'RH0970734',","RH0970734,",12/2/82,1982,12,2,NA,NA,345,6,0,0,0,0,0,HR3809,NA,NA,NA,"TO RESOLVE INTO THE COMMITTEE OF THE WHOLE FOR CONSIDERATION OF H.R. 3809, NUCLEAR WASTE POLICY ACT.","TO RESOLVE INTO THE COMMITTEE OF THE WHOLE FOR CONSIDERATION OF H.R. 3809, NUCLEAR WASTE POLICY ACT.",7,704,7,704
286,20862,97,1,737,RH0970737,"'RH0970737',","RH0970737,",12/2/82,1982,12,2,NA,NA,213,179,-0.064,-0.087,-0.103,-0.194,-195.148,HR3809,NA,NA,NA,TO AMEND H.R. 3809 BY SUBSTITUTING A ONE-HOUSE RATIFICATION FOR THE BILL'S TWO-HOUSE OVERRIDE PROVISION OF A STATE'S NOTICE OF DISAPPROVAL OF THE FINAL REPOSITORY SITE SELECTION. (MOTION PASSED),TO AMEND H.R. 3809 BY SUBSTITUTING A ONE-HOUSE RATIFICATION FOR THE BILL'S TWO-HOUSE OVERRIDE PROVISION OF A STATE'S NOTICE OF DISAPPROVAL OF THE FINAL REPOSITORY SITE SELECTION. MOTION PASSED),7,704,7,704
287,20864,97,1,738,RH0970738,"'RH0970738',","RH0970738,",12/2/82,1982,12,2,NA,NA,241,148,0.013,0.4,-0.026,0.195,-239.75,HR2330,NA,NA,NA,"TO AMEND H.R. 2330, A BILL AUTHORIZING APPROPRIATIONS TO THE NUCLEAR REGULATORY COMMISSION, BY DELETING A SECTION RELATING TO THE PROTECTION OF THE DOMESTIC URANIUM INDUSTRY THROUGH REGULATION OF FEEDSTOCK INTO UNITED STATES URANIUM ENRICHMENT FACILITIES. (MOTION PASSED)","TO AMEND H.R. 2330, A BILL AUTHORIZING APPROPRIATIONS TO THE NUCLEAR REGULATORY COMMISSION, BY DELETING A SECTION RELATING TO THE PROTECTION OF THE DOMESTIC URANIUM INDUSTRY THROUGH REGULATION OF FEEDSTOCK INTO UNITED STATES URANIUM ENRICHMENT FACILITIE",7,704,7,704
288,20866,97,1,739,RH0970739,"'RH0970739',","RH0970739,",12/2/82,1982,12,2,NA,NA,107,281,-0.189,0.718,-0.113,-0.449,-163.266,HR2330,NA,NA,NA,"TO AMEND H.R. 2330, A BILL AUTHORIZING APPROPRIATIONS TO THE NUCLEAR REGULATORY COMMISSION BY DELETING PROVISIONS BARRING THE USE OF SPECIAL NUCLEAR MATERIAL (OR SPENT FUEL) FROM LICENSED NUCLEAR POWER REACTORS FOR THE PRODUCTION OF NUCLEAR EXPLOSIVE DEVICES; LIMITING AUTHORITY OF DOE TO WITHHOLD CERTAIN UNCLASSIFIED INFORMATION; AND CHANGING THE SCHEDULES FOR ISSUING REGULATONS CONCERNING CLEANUPS OF URANIUM TAILINGS. (MOTION FAILED)","TO AMEND H.R. 2330, A BILL AUTHORIZING APPROPRIATIONS TO THE NUCLEAR REGULATORY COMMISSION BY DELETING PROVISIONS BARRING THE USE OF SPECIAL NUCLEAR MATERIAL OR SPENT FUEL) FROM LICENSED NUCLEAR POWER REACTORS FOR THE PRODUCTION OF NUCLEAR EXPLOSIVE DEV",7,704,7,704
289,20971,97,1,797,RH0970797,"'RH0970797',","RH0970797,",12/16/82,1982,12,16,NA,NA,259,105,0.076,0.997,0.231,0.168,-104.187,HRES623,NA,NA,NA,"TO AGREE TO H. RES. 623, A MEASURE PROVIDING THAT THE SPEAKER OF THE HOUSE CERTIFY THE REPORT OF THE COMMITTEE ON PUBLIC WORKS AND TRANSPORTATION WITH RESPECT TO THE PROCEEDINGS AGAINST ANNE M. GORSUCH, ADMINISTRATOR, UNITED STATES ENVIRONMENTAL PROTECTION AGENCY, TO THE UNITED STATES ATTORNEY FOR THE DISTRICT OF COLUMBIA. (MOTION PASSED)","TO AGREE TO H. RES. 623, A MEASURE PROVIDING THAT THE SPEAKER OF THE HOUSE CERTIFY THE REPORT OF THE COMMITTEE ON PUBLIC WORKS AND TRANSPORTATION WITH RESPECT TO THE PROCEEDINGS AGAINST ANNE M. GORSUCH, ADMINISTRATOR, UNITED STATES ENVIRONMENTAL PROTECT",7,799,7,799
290,20996,97,1,810,RH0970810,"'RH0970810',","RH0970810,",12/20/82,1982,12,20,NA,NA,256,32,-0.376,-0.751,-0.118,-0.284,-78.684,HRES636,NA,NA,NA,"TO AGREE TO H. RES. 636, THE RULES UNDER WHICH H.R. 3809, NUCLEAR WASTE POLICY ACT, IS TO BE CONSIDERED. (MOTION PASSED)","TO AGREE TO H. RES. 636, THE RULES UNDER WHICH H.R. 3809, NUCLEAR WASTE POLICY ACT, IS TO BE CONSIDERED. MOTION PASSED)",7,704,7,704
291,21193,97,1,713,RH0970713,"'RH0970713',","RH0970713,",9/30/82,1982,9,30,NA,NA,370,1,0,0,0,0,0,HR3809,NA,NA,NA,"TO RESOLVE INTO THE COMMITTEE OF THE WHOLE FOR CONSIDERATION H.R. 3809, THE NUCLEAR WASTE POLICY ACT OF 1982. (MOTION PASSED)","TO RESOLVE INTO THE COMMITTEE OF THE WHOLE FOR CONSIDERATION H.R. 3809, THE NUCLEAR WASTE POLICY ACT OF 1982. MOTION PASSED)",7,704,7,704
292,21304,98,1,139,RH0980139,"'RH0980139',","RH0980139,",6/2/83,1983,6,2,NA,NA,200,167,0.283,-0.605,0.177,0.438,-146.973,HR3133,NA,NA,NA,"TO AMEND H.R. 3133 TO INCREASE APPROPRIATIONS FOR EPA SALARIES, EXPENSES, RESEARCH AND DEVELOPMENT, ABATEMENT, CONTROL, AND COMPLIANCE FROM $1.08 BILLION TO $1.3 BILLION. (MOTION PASSED)","TO AMEND H.R. 3133 TO INCREASE APPROPRIATIONS FOR EPA SALARIES, EXPENSES, RESEARCH AND DEVELOPMENT, ABATEMENT, CONTROL, AND COMPLIANCE FROM $1.08 BILLION TO $1.3 BILLION. MOTION PASSED)",7,700,7,700
293,21310,98,1,141,RH0980141,"'RH0980141',","RH0980141,",6/2/83,1983,6,2,NA,NA,227,136,0.614,-0.789,-0.019,-0.26,-233.829,HR3133,NA,NA,NA,TO AMEND H.R. 3133 TO PROHIBIT THE USE OF FUNDS TO IMPOSE SANCTIONS UNDER THE CLEAN AIR ACT WITH RESPECT TO ANY AREA FOR FAILURE TO ATTAIN ANY NATIONAL AMBIENT AIR QUALITY STANDARD DEADLINE. (MOTION PASSED),TO AMEND H.R. 3133 TO PROHIBIT THE USE OF FUNDS TO IMPOSE SANCTIONS UNDER THE CLEAN AIR ACT WITH RESPECT TO ANY AREA FOR FAILURE TO ATTAIN ANY NATIONAL AMBIENT AIR QUALITY STANDARD DEADLINE. MOTION PASSED),7,705,7,705
294,21382,98,1,179,RH0980179,"'RH0980179',","RH0980179,",6/14/83,1983,6,14,NA,NA,379,38,0.468,0.135,0.202,0.177,-79.618,HR2062,NA,NA,NA,"TO SUSPEND THE RULES AND PASS H.R. 2062, TO AMEND TITLE II OF THE MARINE PROTECTION, RESEARCH, AND SANCTUARIES ACT OF 1972. (MOTION PASSED;2/3 REQUIRED)","TO SUSPEND THE RULES AND PASS H.R. 2062, TO AMEND TITLE II OF THE MARINE PROTECTION, RESEARCH, AND SANCTUARIES ACT OF 1972. MOTION PASSED;2/3 REQUIRED)",7,710,7,701
295,21635,98,1,308,RH0980308,"'RH0980308',","RH0980308,",8/4/83,1983,8,4,NA,NA,236,180,0.115,-0.257,0.188,0.382,-135.944,HR2867,NA,NA,NA,"TO AMEND THE SHELBY AMENDMENT TO H.R. 2867, A BILL AMENDING THE SOLID WASTE DISPOSAL ACT TO AUTHORIZE $484 MILLION IN APPROPRIATIONS FOR THE FISCAL YEARS 1984 THROUGH 1986 FOR THE DISPOSAL OF HAZARDOUS WASTE. THE SHELBY AMENDMENT EXEMPTS SMALL QUANTITY GENERATORS FROM THE REQUIREMENT OF NOTIFYING THE PUBLIC THAT THEIR WASTE IS 2300 HAZARDOUS IF THEY GENERATE LESS THAN 100-KILOGRAMS (OR 220 POUNDS) OF HAZARDOUS WASTE PER MONTH, AND IT EXTENDS THE NOTIFICATION REQUIREMENTS FROM 24 TO 30 MONTHS FOR SMALL QUANTITY GENERATORS, AND PROVIDES FOR A PROGRAM OF EDUCATION TO HELP SMALL QUANTITY GENERATORS TO LEARN WHAT THEIR RESPONSIBILITIES ARE. THE FLORIO AMENDMENT REQUIRES SMALL QUANTITY GENERATORS TO PROVIDE NOTIFICATION THAT THEIR WASTE IS HAZARDOUS AND WHERE THEY ARE DISPOSING IT.","TO AMEND THE SHELBY AMENDMENT TO H.R. 2867, A BILL AMENDING THE SOLID WASTE DISPOSAL ACT TO AUTHORIZE $484 MILLION IN APPROPRIATIONS FOR THE FISCAL YEARS 1984 THROUGH 1986 FOR THE DISPOSAL OF HAZARDOUS WASTE. THE SHELBY AMENDMENT EXEMPTS SMALL QUANTITY",7,704,7,704
296,21637,98,1,309,RH0980309,"'RH0980309',","RH0980309,",8/4/83,1983,8,4,NA,NA,218,192,-0.105,-0.047,-0.191,-0.269,-127.596,HR2867,NA,NA,NA,"TO AMEND THE SHELBY AMENDMENT TO H.R. 2867, A BILL AMENDING THE SOLID WASTE DISPOSAL ACT TO AUTHORIZE $484 MILLION IN APPROPRIATIONS FOR THE FISCAL YEARS 1984 THROUGH 1986 FOR THE DISPOSAL OF HAZARDOUS WASTE. THE SHELBY AMENDMENT EXEMPTS SMALL QUANTITY GENERATORS FROM THE REQUIREMENT OF NOTIFYING THE PUBLIC THAT THEIR WASTE IS HAZARDOUS IF THEY GENERATE LESS THAN 100-KILOGRAMS (OR 220 POUNDS) OF HAZARDOUS WASTE PER MONTH, AND IT EXTENDS THE NOTIFICATION REQUIREMENT FROM 24 TO 30 MONTHS FOR SMALL QUANTITY GENRERATORS, AND PROVIDES FOR A PROGRAM OF EDUCATION TO HELP SMALL QUANTITY GENERATORS TO LEARN WHAT THEIR RESPONSIBILITIES ARE. THE HILER AMENDMENT PHASES IN THE NOTIFICATION REQUIREMENT. UNDER THIS AMENDMENT, THOSE GENERATORS OF HAZARDOUS WASTE THAT EXCEED 250 KILOGRAMS BUT ARE LESS THAN 1,000 KILOGRAMS WOULD HAVE 270 DAYS TO BEGIN COMPLIANCE. THOSE GENERATORS OF BETWEEN 100 TO 250 KILOGRAMS WOULD HAVE 540 DAYS, AND THOSE GENERATORS OF GREATER THAN 25 KILOGRAMS AND LESS THAN 100 KILOGRAMS WOULD HAVE 810 DAYS TO COMPLY WITH THE NOTIFICATION REQUIREMENT. (MOTION PASSED)","TO AMEND THE SHELBY AMENDMENT TO H.R. 2867, A BILL AMENDING THE SOLID WASTE DISPOSAL ACT TO AUTHORIZE $484 MILLION IN APPROPRIATIONS FOR THE FISCAL YEARS 1984 THROUGH 1986 FOR THE DISPOSAL OF HAZARDOUS WASTE. THE SHELBY AMENDMENT EXEMPTS SMALL QUANTITY G",7,704,7,704
297,21646,98,1,317,RH0980317,"'RH0980317',","RH0980317,",9/14/83,1983,9,14,NA,NA,301,93,0.256,0.548,0.163,0.041,-129.313,HR5,NA,NA,NA,"TO PASS H.R. 5, A BILL ESTABLISHING AN OCEAN AND COASTAL RESOURCES MANAGEMENT AND DEVELOPMENT FUND FROM WHICH COASTAL STATES SHALL RECEIVE BLOCK GRANTS. (MOTION PASSED)","TO PASS H.R. 5, A BILL ESTABLISHING AN OCEAN AND COASTAL RESOURCES MANAGEMENT AND DEVELOPMENT FUND FROM WHICH COASTAL STATES SHALL RECEIVE BLOCK GRANTS. MOTION PASSED)",7,710,7,701
298,21779,98,1,404,RH0980404,"'RH0980404',","RH0980404,",10/31/83,1983,10,31,NA,NA,215,165,0.244,-0.97,-0.113,-0.237,-197.52,HR2867,NA,NA,NA,"TO AGREE TO A JUDICIARY COMMITTEE AMENDMENT TO H.R. 2867, A BILL AMENDING THE SOLID WASTE DISPOSAL ACT TO AUTHORIZE APPROPRIATIONS FOR THE FISCAL YEARS 1984 THROUGH 1986. THE JUDICIARY COMMITTEE AMENDMENT STRIKES PROVISIONS EMPOWERING EPA TO LITIGATE CASES IF THE JUSTICE DEPARTMENT FAILS TO ACT WITHIN 150 DAYS. (MOTION PASSED)","TO AGREE TO A JUDICIARY COMMITTEE AMENDMENT TO H.R. 2867, A BILL AMENDING THE SOLID WASTE DISPOSAL ACT TO AUTHORIZE APPROPRIATIONS FOR THE FISCAL YEARS 1984 THROUGH 1986. THE JUDICIARY COMMITTEE AMENDMENT STRIKES PROVISIONS EMPOWERING EPA TO LITIGATE C",7,703,7,703
299,21791,98,1,418,RH0980418,"'RH0980418',","RH0980418,",11/3/83,1983,11,3,NA,NA,292,125,-0.212,0.977,-0.09,0.092,-233.086,HR2867,NA,NA,NA,"TO AMEND THE JUDICIARY COMMITTEE AMENDMENT TO H.R. 2867 WITH A PERFECTING AMENDMENT. H.R. 2867 AMENDS THE SOLID WASTE DISPOSAL ACT TO AUTHORIZE APPROPRIATIONS FOR THE FISCAL YEARS 1984 THROUGH 1986. THE HUGHES AMENDMENT DIRECTS THE ATTORNEY GENERAL, AT THE REQUEST OF THE ADMINISTRATOR AND ON THE BASIS OF A SHOWING OF NEED, TO DEPUTIZE QUALIFIED EMPLOYEES OF THE EPA AS SPECIAL DEPUTY UNITED STATES MARSHALS IN CRIMINAL INVESTIGATIONS WITH RESPECT TO VIOLATIONS OF THE CRIMINAL PROVISIONS IN THE BILL. (MOTION PASSED)","TO AMEND THE JUDICIARY COMMITTEE AMENDMENT TO H.R. 2867 WITH A PERFECTING AMENDMENT. H.R. 2867 AMENDS THE SOLID WASTE DISPOSAL ACT TO AUTHORIZE APPROPRIATIONS FOR THE FISCAL YEARS 1984 THROUGH 1986. THE HUGHES AMENDMENT DIRECTS THE ATTORNEY GENERAL, A",7,703,7,703
300,21792,98,1,419,RH0980419,"'RH0980419',","RH0980419,",11/3/83,1983,11,3,NA,NA,198,195,-0.078,-0.024,-0.229,-0.474,-104.001,HR2867,NA,NA,NA,TO AMEND H.R. 2867 TO PROVIDE A CONGRESSIONAL REVIEW MECHANISM FOR RULES ISSUED BY THE EPA GOVERNING SMALL QUANTITY GENERATORS. (MOTION PASSED),TO AMEND H.R. 2867 TO PROVIDE A CONGRESSIONAL REVIEW MECHANISM FOR RULES ISSUED BY THE EPA GOVERNING SMALL QUANTITY GENERATORS. MOTION PASSED),7,703,7,703
301,21795,98,1,420,RH0980420,"'RH0980420',","RH0980420,",11/3/83,1983,11,3,NA,NA,189,204,-0.064,0.016,-0.274,-0.562,-86.195,HR2867,NA,NA,NA,TO AMEND H.R. 2867 TO PROVIDE A CONGRESSIONAL REVIEW MECHANISM FOR RULES ISSUED BY THE EPA GOVERNING SMALL QUANTITY GENERATORS. THE AMENDMENT HAD BEEN AGREED TO BY THE COMMITTEE OF THE WHOLE (SEE VOTE 451). (MOTION FAILED),TO AMEND H.R. 2867 TO PROVIDE A CONGRESSIONAL REVIEW MECHANISM FOR RULES ISSUED BY THE EPA GOVERNING SMALL QUANTITY GENERATORS. THE AMENDMENT HAD BEEN AGREED TO BY THE COMMITTEE OF THE WHOLE SEE VOTE 451). MOTION FAILED),7,703,7,703
302,22318,98,1,520,RH0980520,"'RH0980520',","RH0980520,",2/9/84,1984,2,9,NA,NA,378,0,0,0,0,0,0,HR2899,NA,NA,NA,"TO AGREE TO H. RES. 429, THE RULE UNDER WHICH H.R. 2899 IS TO BE CONSIDERED. H.R. 2899 AUTHORIZES $283.5 MILLION FOR FISCAL YEAR 1984 AND $297.7 MILLION FOR FISCAL YEAR 1985 FOR ENVIRONMENTAL RESEARCH, DEVELOPMENT, AND DEMONSTRATION. (MOTION PASSED)","TO AGREE TO H. RES. 429, THE RULE UNDER WHICH H.R. 2899 IS TO BE CONSIDERED. H.R. 2899 AUTHORIZES $283.5 MILLION FOR FISCAL YEAR 1984 AND $297.7 MILLION FOR FISCAL YEAR 1985 FOR ENVIRONMENTAL RESEARCH, DEVELOPMENT, AND DEMONSTRATION. MOTION PASSED)",7,798,7,798
303,22319,98,1,521,RH0980521,"'RH0980521',","RH0980521,",2/9/84,1984,2,9,NA,NA,362,9,0,0,0,0,0,HR2899,NA,NA,NA,"TO PASS H.R. 2899, A BILL AUTHORIZING $283.5 MILLION FOR FISCAL YEAR 1984 AND $297.7 MILLION FOR FISCAL YEAR 1985 FOR ENVIRONMENTAL RESEARCH, DEVELOPMENT, AND DEMONSTRATION. (MOTION PASSED)","TO PASS H.R. 2899, A BILL AUTHORIZING $283.5 MILLION FOR FISCAL YEAR 1984 AND $297.7 MILLION FOR FISCAL YEAR 1985 FOR ENVIRONMENTAL RESEARCH, DEVELOPMENT, AND DEMONSTRATION. MOTION PASSED)",7,798,7,798
304,22396,98,1,598,RH0980598,"'RH0980598',","RH0980598,",5/1/84,1984,5,1,NA,NA,412,4,0,0,0,0,0,HR4585,NA,NA,NA,"TO SUSPEND THE RULES AND PASS H.R. 4595, A BILL AUTHORIZING APPROPRIATIONS FOR THE OFFICE OF ENVIRONMENTAL QUALITY AND THE COUNCIL ON ENVIRONMENTAL QUALITY FOR FISCAL YEARS 1985, 1986, AND 1987. (MOTION PASSED;2/3 REQUIRED)","TO SUSPEND THE RULES AND PASS H.R. 4595, A BILL AUTHORIZING APPROPRIATIONS FOR THE OFFICE OF ENVIRONMENTAL QUALITY AND THE COUNCIL ON ENVIRONMENTAL QUALITY FOR FISCAL YEARS 1985, 1986, AND 1987. MOTION PASSED;2/3 REQUIRED)",7,700,7,700
305,22397,98,1,599,RH0980599,"'RH0980599',","RH0980599,",5/1/84,1984,5,1,NA,NA,416,0,0,0,0,0,0,HJR537,NA,NA,NA,"TO SUSPEND THE RULES AND PASS H. J. RES. 537, A BILL DESIGNATING THE BRIGANTINE AND BARNEGAT UNITS OF THE NATIONAL WILDLIFE REFUGE SYSTEM AS THE EDWIN B. FORSYTHE NATIONAL WILDLIFE REFUGE. (MOTION PASSED;2/3 REQUIRED)","TO SUSPEND THE RULES AND PASS H. J. RES. 537, A BILL DESIGNATING THE BRIGANTINE AND BARNEGAT UNITS OF THE NATIONAL WILDLIFE REFUGE SYSTEM AS THE EDWIN B. FORSYTHE NATIONAL WILDLIFE REFUGE. MOTION PASSED;2/3 REQUIRED)",7,709,7,709
306,22398,98,1,600,RH0980600,"'RH0980600',","RH0980600,",5/1/84,1984,5,1,NA,NA,309,104,0.263,-0.069,0.175,-0.067,-122.433,HR5050,NA,NA,NA,"TO SUSPEND THE RULES AND PASS H.R. 5050, A BILL EXTENDING UNTIL OCT. 1, 1986, THE AUTHORITY AND AUTHORIZATION OF APPROPRIATIONS FOR CERTAIN PROGRAMS UNDER THE FISH AND WILDLIFE ACT OF 1956. (MOTION PASSED;2/3 REQUIRED)","TO SUSPEND THE RULES AND PASS H.R. 5050, A BILL EXTENDING UNTIL OCT. 1, 1986, THE AUTHORITY AND AUTHORIZATION OF APPROPRIATIONS FOR CERTAIN PROGRAMS UNDER THE FISH AND WILDLIFE ACT OF 1956. MOTION PASSED;2/3 REQUIRED)",7,709,7,709
307,22534,98,1,738,RH0980738,"'RH0980738',","RH0980738,",6/26/84,1984,6,26,NA,NA,405,11,0.582,0.002,0.427,0.198,-17.926,HR3282,NA,NA,NA,"TO PASS H.R. 3282, A BILL AMENDING THE FEDERAL WATER POLLUTION CONTROL ACT TO PROVIDE FOR THE RENEWAL OF THE QUALITY OF THE NATION'S WATERS. (MOTION PASSED)","TO PASS H.R. 3282, A BILL AMENDING THE FEDERAL WATER POLLUTION CONTROL ACT TO PROVIDE FOR THE RENEWAL OF THE QUALITY OF THE NATION'S WATERS. (MOTION PASSED)",7,701,7,701
308,22587,98,1,791,RH0980791,"'RH0980791',","RH0980791,",7/26/84,1984,7,26,NA,NA,128,231,0.115,-0.1,-0.126,0.04,-153.533,HR4784,NA,NA,NA,"TO RECOMMIT H.R. 4784 TO THE COMMITTEE ON WAYS AND MEANS WITH INSTRUCTIONS TO REPORT IT BACK FORTHWITH CONTAINING AN AMENDMENT IN THE NATURE OF A SUBSTITUTE THAT SOUGHT TO MAKE CHANGES CONCERNING DOWNSTREAM DUMPING PROVISIONS, IMPORT MONITORING PROVISIONS, AND NATURAL RESOURCE PROVISIONS. H.R. 4784 REFORMS THE REMEDIES AVAILABLE TO UNITED STATES PRODUCERS REGARDING UNFAIR IMPORT COMPETITION. (MOTION FAILED)","TO RECOMMIT H.R. 4784 TO THE COMMITTEE ON WAYS AND MEANS WITH INSTRUCTIONS TO REPORT IT BACK FORTHWITH CONTAINING AN AMENDMENT IN THE NATURE OF A SUBSTITUTE THAT SOUGHT TO MAKE CHANGES CONCERNING DOWNSTREAM DUMPING PROVISIONS, IMPORT MONITORING PROVISIO",7,701,7,701
309,22617,98,1,821,RH0980821,"'RH0980821',","RH0980821,",8/9/84,1984,8,9,NA,NA,218,199,-0.094,-0.043,0.204,-0.038,-116.695,HR5640,NA,NA,NA,"TO AGREE TO H. RES. 570, THE RULE UNDER WHICH H.R. 5640 IS TO BE CONSIDERED. H.R. 5640 AMENDS THE COMPREHENSIVE ENVIRONMENTAL RESPONSE, COMPENSATION, AND LIABILITY ACT OF 1980. (MOTION PASSED)","TO AGREE TO H. RES. 570, THE RULE UNDER WHICH H.R. 5640 IS TO BE CONSIDERED. H.R. 5640 AMENDS THE COMPREHENSIVE ENVIRONMENTAL RESPONSE, COMPENSATION, AND LIABILITY ACT OF 1980. (MOTION PASSED)",7,700,7,700
310,22618,98,1,822,RH0980822,"'RH0980822',","RH0980822,",8/9/84,1984,8,9,NA,NA,208,200,-0.077,-0.066,-0.178,-0.291,-135.027,HR5640,NA,NA,NA,"TO AMEND H.R. 5640 TO STRIKE TITLE II LANGUAGE, FEDERAL CAUSE OF ACTION. (MOTION PASSED)","TO AMEND H.R. 5640 TO STRIKE TITLE II LANGUAGE, FEDERAL CAUSE OF ACTION. (MOTION PASSED)",7,700,7,700
311,22619,98,1,823,RH0980823,"'RH0980823',","RH0980823,",8/9/84,1984,8,9,NA,NA,141,248,0.068,0.095,-0.177,-0.367,-129.992,HR5640,NA,NA,NA,TO AMEND H.R. 5640 TO STRIKE LANGUAGE PROVIDING FOR CITIZEN SUITS. (MOTION FAILED),TO AMEND H.R. 5640 TO STRIKE LANGUAGE PROVIDING FOR CITIZEN SUITS. (MOTION FAILED),7,700,7,700
312,22620,98,1,824,RH0980824,"'RH0980824',","RH0980824,",8/9/84,1984,8,9,NA,NA,391,0,0,0,0,0,0,HR5640,NA,NA,NA,TO AMEND H.R. 5640 TO LIMIT CERTAIN CITIZEN SUITS. (MOTION PASSED),TO AMEND H.R. 5640 TO LIMIT CERTAIN CITIZEN SUITS. (MOTION PASSED),7,700,7,700
313,22625,98,1,829,RH0980829,"'RH0980829',","RH0980829,",8/10/84,1984,8,10,NA,NA,159,200,-0.048,-0.228,0.137,0.385,-142.044,HR5640,NA,NA,NA,"TO AMEND H.R. 5640, A BILL AMENDING THE COMPREHENSIVE ENVIRONMENTAL RESPONSE, COMPENSATION, AND LIABILITY ACT OF 1980. THE LEVITAS AMENDMENT PROVIDES AN ADMINISTRATIVE MECHANISM TO PROVIDE FOR COMPENSATION FOR VICTIMS OF HAZARDOUS WASTE EXPOSURE AND IT SETS ASIDE 12 PERCENT OF THE SUPERFUND FOR SUCH PURPOSE. (MOTION FAILED)","TO AMEND H.R. 5640, A BILL AMENDING THE COMPREHENSIVE ENVIRONMENTAL RESPONSE, COMPENSATION, AND LIABILITY ACT OF 1980. THE LEVITAS AMENDMENT PROVIDES AN ADMINISTRATIVE MECHANISM TO PROVIDE FOR COMPENSATION FOR VICTIMS OF HAZARDOUS WASTE EXPOSURE AND IT",7,704,7,704
314,22626,98,1,830,RH0980830,"'RH0980830',","RH0980830,",8/10/84,1984,8,10,NA,NA,142,205,0.007,0.095,-0.182,-0.297,-120.752,HR5640,NA,NA,NA,"TO AMEND H.R. 5640, A BILL AMENDING THE COMPREHENSIVE ENVIRONMENTAL RESPONSE, COMPENSATION, AND LIABILITY ACT OF 1980. THE CONABLE AMENDMENT TERMINATES THE TAX PROVISIONS ON SEPT. 30, 1986. (MOTION FAILED)","TO AMEND H.R. 5640, A BILL AMENDING THE COMPREHENSIVE ENVIRONMENTAL RESPONSE, COMPENSATION, AND LIABILITY ACT OF 1980. THE CONABLE AMENDMENT TERMINATES THE TAX PROVISIONS ON SEPT. 30, 1986. (MOTION FAILED)",7,700,7,700
315,22627,98,1,831,RH0980831,"'RH0980831',","RH0980831,",8/10/84,1984,8,10,NA,NA,323,33,0.328,0.394,0.222,0.399,-61.888,HR5640,NA,NA,NA,"TO PASS H.R. 5640, A BILL ENDING THE COMPREHENSIVE ENVIRONMENTAL RESPONSE, COMPENSATION, AND LIABILITY ACT OF 1980. THE CONABLE AMENDMENT TERMINATES THE TAX PROVISIONS ON SEPT. 30, 1980. (MOTION PASSED)","TO PASS H.R. 5640, A BILL ENDING THE COMPREHENSIVE ENVIRONMENTAL RESPONSE, COMPENSATION, AND LIABILITY ACT OF 1980. THE CONABLE AMENDMENT TERMINATES THE TAX PROVISIONS ON SEPT. 30, 1980. (MOTION PASSED)",7,700,7,700
316,22647,98,1,851,RH0980851,"'RH0980851',","RH0980851,",9/18/84,1984,9,18,NA,NA,366,27,0.446,0.16,0.309,0.434,-44.718,HR5959,NA,NA,NA,"TO SUSPEND THE RULES AND PASS H.R. 5959, A BILL AMENDING THE SAFE DRINKING WATER ACT. (MOTION PASSED;2/3 REQUIRED)","TO SUSPEND THE RULES AND PASS H.R. 5959, A BILL AMENDING THE SAFE DRINKING WATER ACT. (MOTION PASSED;2/3 REQUIRED)",7,701,7,701
317,22651,98,1,855,RH0980855,"'RH0980855',","RH0980855,",9/19/84,1984,9,19,NA,NA,398,0,0,0,0,0,0,HRE579,NA,NA,NA,"TO AGREE TO H. RES. 579, THE RULE UNDER WHICH H.R. 3082 IS TO BE CONSIDERED. H.R. 3082 PROMOTES THE CONSERVATION OF MIGRATORY WATERFOWL AND OFFSETS OR PREVENTS THE SERIOUS LOSS OF WETLANDS BY THE ACQUISITION OF WETLANDS AND OTHER ESSENTIAL HABITAT. (MOTION PASSED)","TO AGREE TO H. RES. 579, THE RULE UNDER WHICH H.R. 3082 IS TO BE CONSIDERED. H.R. 3082 PROMOTES THE CONSERVATION OF MIGRATORY WATERFOWL AND OFFSETS OR PREVENTS THE SERIOUS LOSS OF WETLANDS BY THE ACQUISITION OF WETLANDS AND OTHER ESSENTIAL HABITAT. (MO",7,710,7,701
318,22653,98,1,857,RH0980857,"'RH0980857',","RH0980857,",9/20/84,1984,9,20,NA,NA,194,203,-0.366,0.006,0.021,0.538,-207.213,HR3082,NA,NA,NA,"TO AMEND H.R. 3082, A BILL PROMOTING CONSERVATION OF MIGRATORY WATERFOWL AND OFFSETTING OR PREVENTING THE SERIOUS LOSS OF WETLANDS BY THE ACQUISITION OF WETLANDS AND OTHER ESSENTIAL HABITAT. THE SEIBERLING AMENDMENT STRIKES THE AUTHORITY TO USE CERTAIN FEDERAL LANDS FOR THE MANTEO BAY PROJECT IN NORTH CAROLINA. (MOTION FAILED)","TO AMEND H.R. 3082, A BILL PROMOTING CONSERVATION OF MIGRATORY WATERFOWL AND OFFSETTING OR PREVENTING THE SERIOUS LOSS OF WETLANDS BY THE ACQUISITION OF WETLANDS AND OTHER ESSENTIAL HABITAT. THE SEIBERLING AMENDMENT STRIKES THE AUTHORITY TO USE CERTAIN",7,710,7,701
319,22654,98,1,858,RH0980858,"'RH0980858',","RH0980858,",9/20/84,1984,9,20,NA,NA,351,45,0.665,0.584,0.131,0.024,-131.203,HR3082,NA,NA,NA,"TO PASS H.R. 3082, A BILL PROMOTING CONSERVATION OF MIGRATORY WATERFOWL AND OFFSETTING OR PREVENTING THE SERIOUS LOSS OF WETLANDS BY THE ACQUISITION OF WETLANDS AND OTHER ESSENTIAL HABITAT. (MOTION PASSED)","TO PASS H.R. 3082, A BILL PROMOTING CONSERVATION OF MIGRATORY WATERFOWL AND OFFSETTING OR PREVENTING THE SERIOUS LOSS OF WETLANDS BY THE ACQUISITION OF WETLANDS AND OTHER ESSENTIAL HABITAT. (MOTION PASSED)",7,710,7,701
320,22660,98,1,864,RH0980864,"'RH0980864',","RH0980864,",9/25/84,1984,9,25,NA,NA,242,162,0.03,-0.038,0.175,0.037,-127.977,HJR648,NA,NA,NA,TO AMEND H. J. RES. 648 TO PROHIBIT THE FEDERAL GOVERNMENT FROM CONTRACTING OUT THE ADMINISTRATION OF 30 JOB CORPS CIVILIAN CONSERVATION CENTERS THAT ARE NOW ADMINISTERED BY THE DEPARTMENTS OF AGRICULTURE AND THE INTERIOR. (MOTION PASSED),TO AMEND H. J. RES. 648 TO PROHIBIT THE FEDERAL GOVERNMENT FROM CONTRACTING OUT THE ADMINISTRATION OF 30 JOB CORPS CIVILIAN CONSERVATION CENTERS THAT ARE NOW ADMINISTERED BY THE DEPARTMENTS OF AGRICULTURE AND THE INTERIOR. (MOTION PASSED),7,711,7,711
321,22684,98,1,888,RH0980888,"'RH0980888',","RH0980888,",10/4/84,1984,10,4,NA,NA,98,307,0.176,0.656,-0.127,-0.132,-164.199,HR5492,NA,NA,NA,"TO AMEND H.R. 5492, A BILL PROVIDING FOR CONSERVATION AND MANAGEMENT OF ATLANTIC STRIPED BASS. THE BATEMAN AMENDMENT EXEMPTS FROM THE MORATORIUM STATES THAT THE SECRETARY DETERMINED HAD MADE SUBSTANTIAL PROGRESS IN IMPLEMENTING THE GUIDELINES SET FORTH IN THE PLAN. (MOTION FAILED)","TO AMEND H.R. 5492, A BILL PROVIDING FOR CONSERVATION AND MANAGEMENT OF ATLANTIC STRIPED BASS. THE BATEMAN AMENDMENT EXEMPTS FROM THE MORATORIUM STATES THAT THE SECRETARY DETERMINED HAD MADE SUBSTANTIAL PROGRESS IN IMPLEMENTING THE GUIDELINES SET FORTH",7,709,7,709
322,23010,99,1,224,RH0990224,"'RH0990224',","RH0990224,",7/23/85,1985,7,23,NA,NA,167,257,0.074,0.055,-0.203,-0.262,-113.68,HR8,NA,NA,NA,"TO AMEND H R 8, A BILL APPROPRIATING $21 BILLION OVER 5 YEARS IN GRANTS AND LOANS FOR LOCAL SEWAGE TREATMENT, TO ALLOW UP TO 40 LOCALITIES TO DESIGN AND OPERATE THEIR OWN PROGRAMS FOR TREATMENT OF INDUSTRIAL WASTE, PROVIDED THAT THE LOCAL PROJECTS ARE AS EFFICIENT AS EPA PROGRAMS. (MOTION FAILED)","TO AMEND H R 8, A BILL APPROPRIATING $21 BILLION OVER 5 YEARS IN GRANTS AND LOANS FOR LOCAL SEWAGE TREATMENT, TO ALLOW UP TO 40 LOCALITIES TO DESIGN AND OPERATE THEIR OWN PROGRAMS FOR TREATMENT OF INDUSTRIAL WASTE, PROVIDED THAT THE LOCAL PROJECTS ARE A",7,703,7,703
323,23012,99,1,226,RH0990226,"'RH0990226',","RH0990226,",7/23/85,1985,7,23,NA,NA,340,83,0.372,-0.058,0.215,-0.112,-109.309,HR8,NA,NA,NA,"TO AGREE TO H R 8, A BILL APPROPRIATING $21 BILLION OVER 5 YEARS IN GRANTS AND LOANS FOR LOCAL SEWAGE TREATMENT. (MOTION PASSED)","TO AGREE TO H R 8, A BILL APPROPRIATING $21 BILLION OVER 5 YEARS IN GRANTS AND LOANS FOR LOCAL SEWAGE TREATMENT. (MOTION PASSED)",7,703,7,703
324,23137,99,1,305,RH0990305,"'RH0990305',","RH0990305,",10/3/85,1985,10,3,NA,NA,313,90,0.063,0.633,0.135,0.325,-143.643,HR2100,NA,NA,NA,"AN AMENDMENT TO H R 2100 FOOD AND SECURITY ACT REQUIRING FARMERS OF ERODED LAND TO APPLY A CONSERVATION PLAN TO THEIR SOIL IN ORDER TO BE ELIGIBLE FOR GOVERNMENT FARM AID. THE FARMERS MUST ACT BY 1990 OR WITHIN TWO YEARS AFTER THE SOIL CONSERVATION SERVICE HAS MAPPED THE LAND, WHICHEVER COMES FIRST. THE AMENDMENT APPLYS TO LAND CULTIVATED OR SET ASIDE UNDER SUBSIDIES BETWEEN 1981 AND 1985.",AN AMENDMENT TO H R 2100 FOOD AND SECURITY ACT REQUIRING FARMERS OF ERODED LAND TO APPLY A CONSERVATION PLAN TO THEIR SOIL IN ORDER TO BE ELIGIBLE FOR GOVERNMENT FARM AID. THE FARMERS MUST ACT BY 1990 OR WITHIN TWO YEARS AFTER THE SOIL CONSERVATION SER,7,711,7,711
325,23146,99,1,31,RH0990031,"'RH0990031',","RH0990031,",3/19/85,1985,3,19,NA,NA,268,133,0.18,0.081,0.146,0.02,-152.364,HR1025,NA,NA,NA,"TO SUSPEND THE RULES AND PASS H R 1025, A BILL AUTHORIZING APPROPRIATIONS TO CARRY OUT THE ANADROMOUS FISH CONSERVATION ACT DURING FISCAL YEARS 1986, 1987, AND 1988. (MOTION PASSED;2/3 REQUIRED)","TO SUSPEND THE RULES AND PASS H R 1025, A BILL AUTHORIZING APPROPRIATIONS TO CARRY OUT THE ANADROMOUS FISH CONSERVATION ACT DURING FISCAL YEARS 1986, 1987, AND 1988. (MOTION PASSED;2/3 REQUIRED)",7,709,7,709
326,23163,99,1,32,RH0990032,"'RH0990032',","RH0990032,",3/19/85,1985,3,19,NA,NA,252,149,0.132,-0.007,0.137,-0.009,-160.241,HR1028,NA,NA,NA,"TO SUSPEND THE RULES AND PASS H R 1028, A BILL PROMOTING AND ENCOURAGING MANAGEMENT OF PRIORITY INTERJURISDICTIONAL FISHERY RESOURCES. (MOTION PASSED;2/3 REQUIRED)","TO SUSPEND THE RULES AND PASS H R 1028, A BILL PROMOTING AND ENCOURAGING MANAGEMENT OF PRIORITY INTERJURISDICTIONAL FISHERY RESOURCES. (MOTION PASSED;2/3 REQUIRED)",7,709,7,709
327,23179,99,1,329,RH0990329,"'RH0990329',","RH0990329,",10/22/85,1985,10,22,NA,NA,225,185,-0.014,0.359,0.19,0.056,-119.395,HR463,NA,NA,NA,"MOTION TO SUSPEND THE RULES AND PASS H R 463 NATIONAL TOPSOIL PRESERVATION ACT, A BILL AUTHORIZING THE SECRETARY OF THE INTERIOR TO CREATE A CONSERVATION PROGRAM FOR TOPSOIL THAT IS THREATENED WITH EROSION FROM MINING, RECLAMATION AND OTHER FEDERALLY FUNDED PROJECTS. (MOTION FAILED;2/3 REQUIRED)","MOTION TO SUSPEND THE RULES AND PASS H R 463 NATIONAL TOPSOIL PRESERVATION ACT, A BILL AUTHORIZING THE SECRETARY OF THE INTERIOR TO CREATE A CONSERVATION PROGRAM FOR TOPSOIL THAT IS THREATENED WITH EROSION FROM MINING, RECLAMATION AND OTHER FEDERALLY FU",7,711,7,711
328,23234,99,1,370,RH0990370,"'RH0990370',","RH0990370,",11/13/85,1985,11,13,NA,NA,358,60,0.059,-0.786,0.057,-0.444,-135.371,HR6,NA,NA,NA,"TO APPROVE H R 6 WATER RESOURCES CONSERVATION, DEVELOPMENT AND INFRASTRUCTURE, A BILL THAT FUNDS PROJECTS TO IMPROVE METHODS OF CONSERVING WATER. (MOTION PASSED)","TO APPROVE H R 6 WATER RESOURCES CONSERVATION, DEVELOPMENT AND INFRASTRUCTURE, A BILL THAT FUNDS PROJECTS TO IMPROVE METHODS OF CONSERVING WATER. (MOTION PASSED)",7,701,7,701
329,23263,99,1,394,RH0990394,"'RH0990394',","RH0990394,",12/5/85,1985,12,5,NA,NA,376,33,0.492,0.063,0.315,0.097,-56.16,HR2817,NA,NA,NA,"TO APPROVE H RES 331 WHICH CONSIDERS H R 2817 SUPERFUND REAUTHORIZATION, A BIL THAT PROVIDES $10 BILLION TO FUND EFFORTS TO CLEAN THE NATION'S WORST ABANDONED HAZARDOUS WASTE SITES OVER THE NEXT FIVE YEARS.","TO APPROVE H RES 331 WHICH CONSIDERS H R 2817 SUPERFUND REAUTHORIZATION, A BIL THAT PROVIDES $10 BILLION TO FUND EFFORTS TO CLEAN THE NATION'S WORST ABANDONED HAZARDOUS WASTE SITES OVER THE NEXT FIVE YEARS.",7,704,7,704
330,23264,99,1,395,RH0990395,"'RH0990395',","RH0990395,",12/5/85,1985,12,5,NA,NA,62,330,0.397,0.088,-0.197,-0.062,-103.062,HR2817,NA,NA,NA,AN AMENDMENT TO H R 2817 SUPERFUND REAUTHORIZATION THAT EXEMPTS PERSONS FROM LIABILITY FOR THE COSTS OF CLEANING UP AN AREA WITH HAZARDOUS WASTES IF THEY CAN PROVE THAT THEY ARE NOT RESPONSIBLE FOR THE LEAKAGE OF THE WASTES.,AN AMENDMENT TO H R 2817 SUPERFUND REAUTHORIZATION THAT EXEMPTS PERSONS FROM LIABILITY FOR THE COSTS OF CLEANING UP AN AREA WITH HAZARDOUS WASTES IF THEY CAN PROVE THAT THEY ARE NOT RESPONSIBLE FOR THE LEAKAGE OF THE WASTES.,7,704,7,704
331,23266,99,1,398,RH0990398,"'RH0990398',","RH0990398,",12/6/85,1985,12,6,NA,NA,142,256,-0.16,-0.938,-0.027,0.129,-250.916,HR2817,NA,NA,NA,AN AMENDMENT TO H R 2817 SUPERFUND REAUTHORIZATION THAT ALLOWS EIGHT STATES TO CONTINUE TO MAINTAIN THEIR OWN FUNDS THAT PAY FOR REMOVING OIL SLICKS.,AN AMENDMENT TO H R 2817 SUPERFUND REAUTHORIZATION THAT ALLOWS EIGHT STATES TO CONTINUE TO MAINTAIN THEIR OWN FUNDS THAT PAY FOR REMOVING OIL SLICKS.,7,704,7,704
332,23269,99,1,400,RH0990400,"'RH0990400',","RH0990400,",12/9/85,1985,12,9,NA,NA,378,0,0,0,0,0,0,HR1083,NA,NA,NA,"MOTION TO SUSPEND THE RULES AND PASS H R 1083 LOW-LEVEL RADIOACTIVE WASTE POLICY AMENDMENTS, A BILL THAT ESTABLISHES A SYSTEM FOR ALLOCATING SITES IN THE COUNTRY WHERE LOW-LEVEL RADIOACTIVE WASTES WILL BE DISPOSED. THERE ARE CURRENTLY THREE STATES THAT ACCEPT SUCH WASTES, BUT THE BILL DISTRIBUTES THE BURDEN TO ALL STATES. (MOTION PASSED)","MOTION TO SUSPEND THE RULES AND PASS H R 1083 LOW-LEVEL RADIOACTIVE WASTE POLICY AMENDMENTS, A BILL THAT ESTABLISHES A SYSTEM FOR ALLOCATING SITES IN THE COUNTRY WHERE LOW-LEVEL RADIOACTIVE WASTES WILL BE DISPOSED. THERE ARE CURRENTLY THREE STATES THAT",7,704,7,704
333,23273,99,1,405,RH0990405,"'RH0990405',","RH0990405,",12/10/85,1985,12,10,NA,NA,74,349,0.227,0.796,-0.179,-0.195,-124.125,HR2817,NA,NA,NA,"AN AMENDMENT TO H R 2817, THE SUPERFUND REAUTHORIZATION BILL FOR FISCAL 1986-90, WHICH MODIFIES THAT BILL TO DISPENSE WITH THE VALUE-ADDED TAX; TO AUTHORIZE TAX INCREASES ON CHEMICAL FEEDSTOCKS, CRUDE OIL, HAZARDOUS WASTE, GASOLINE, AND CHEMICAL DERIVATIVES; AND TO CREATE A TRIGGER MECHANISM FOR IMPOSING AN ENVIRONMENTAL SURCHARGE TAX ON CORPORATIONS AFTER A 3-YEAR PERIOD UNDER CERTAIN CONDITIONS. (MOTION FAILED)","AN AMENDMENT TO H R 2817, THE SUPERFUND REAUTHORIZATION BILL FOR FISCAL 1986-90, WHICH MODIFIES THAT BILL TO DISPENSE WITH THE VALUE-ADDED TAX; TO AUTHORIZE TAX INCREASES ON CHEMICAL FEEDSTOCKS, CRUDE OIL, HAZARDOUS WASTE, GASOLINE, AND CHEMICAL DERIVAT",7,704,7,704
334,23274,99,1,406,RH0990406,"'RH0990406',","RH0990406,",12/10/85,1985,12,10,NA,NA,220,206,-0.159,0.103,0.064,0.36,-235.275,HR2817,NA,NA,NA,"AN AMENDMENT TO H R 2817, THE SUPERFUND REAUTHORIZATION BILL FOR FISCAL 1986-1990, WHICH ALTERS THAT BILL TO ELIMINATE PROVISION FOR THE VALUE- ADDED TAX AND TO INCREASES $10 BILLION OVER FIVE YEARS FOR THE HAZARDOUS- WASTE CLEANUP PROGRAM THROUGH INCREASED TAXES ON CHEMICAL FEEDSTOCKS, OIL, AND HAZARDOUS WASTES AND INCREASED GENERAL REVENUES. (MOTION PASSED)","AN AMENDMENT TO H R 2817, THE SUPERFUND REAUTHORIZATION BILL FOR FISCAL 1986-1990, WHICH ALTERS THAT BILL TO ELIMINATE PROVISION FOR THE VALUE- ADDED TAX AND TO INCREASES $10 BILLION OVER FIVE YEARS FOR THE HAZARDOUS- WASTE CLEANUP PROGRAM THROUGH INCRE",7,704,7,704
335,23275,99,1,407,RH0990407,"'RH0990407',","RH0990407,",12/10/85,1985,12,10,NA,NA,162,261,0.123,-0.592,0.194,0.591,-133.983,HR2817,NA,NA,NA,AN AMENDMENT TO H R 2817 THAT ALLOWS PERSONS HARMED BY THE RELEASE OF TOXIC SUBSTANCES TO BRING LAWSUITS AGAINST THE RESPONSIBLE PARTIES IN FEDERAL COURT. (MOTION FAILED),AN AMENDMENT TO H R 2817 THAT ALLOWS PERSONS HARMED BY THE RELEASE OF TOXIC SUBSTANCES TO BRING LAWSUITS AGAINST THE RESPONSIBLE PARTIES IN FEDERAL COURT. (MOTION FAILED),7,704,7,704
336,23276,99,1,408,RH0990408,"'RH0990408',","RH0990408,",12/10/85,1985,12,10,NA,NA,212,211,0.273,-0.632,0.183,0.498,-155.346,HR2817,NA,NA,NA,"AN AMENDMENT TO H R 2817 WHICH ORDERS THAT COMPANIES PROVIDE TO THE PUBLIC AN INVENTORY OF CHEMICAL EMISSIONS THAT ARE KNOWN OR SUSPECTED CAUSES OF CANCER, BIRTH DEFECTS, OR OTHER CHRONIC DISEASES. (MOTION PASSED)","AN AMENDMENT TO H R 2817 WHICH ORDERS THAT COMPANIES PROVIDE TO THE PUBLIC AN INVENTORY OF CHEMICAL EMISSIONS THAT ARE KNOWN OR SUSPECTED CAUSES OF CANCER, BIRTH DEFECTS, OR OTHER CHRONIC DISEASES. (MOTION PASSED)",7,704,7,704
337,23277,99,1,409,RH0990409,"'RH0990409',","RH0990409,",12/10/85,1985,12,10,NA,NA,391,33,0.408,0.219,0.267,0.756,-58.099,HR2817,NA,NA,NA,"TO PASS H R 2817, THE SUPERFUND REAUTHORIZATION BILL FOR FISCAL 1986-90, WHICH AMENDS AND REAUTHORIZES THE """"""""""""""""SUPERFUND"""""""""""""""" HAZARDOUS-WASTE CLEANUP PROGRAM UNDER THE COMPREHENSIVE ENVIRONMENTAL RESPONSE, COMPENSATION AND LIABILITY ACT OF 1980 AT A COST OF $10 BILLION. (MOTION PASSED)","HAZARDOUS-WASTE CLEANUP PROGRAM UNDER THE COMPREHENSIVE ENVIRONMENTAL RESPONSE, COMPENSATION AND LIABILITY ACT OF 1980 AT A COST OF $1",7,704,7,704
338,23291,99,1,439,RH0990439,"'RH0990439',","RH0990439,",12/19/85,1985,12,19,NA,NA,137,211,-0.507,0.267,-0.005,-0.312,-212.941,HR3128,NA,NA,NA,A MOTION TO ACCEPT THE SENATE AMENDMENT TO THE HOUSE AMENDMENT TO A PRIOR SENATE AMENDMENT TO H R 3128. THE MOTION WOULD REINSTATE THE CONFERENCE REPORT. (MOTION FAILED),A MOTION TO ACCEPT THE SENATE AMENDMENT TO THE HOUSE AMENDMENT TO A PRIOR SENATE AMENDMENT TO H R 3128-AN OBNIBUS BUDGET RECONCILIATION BILL. AMENDMENT INSISTS ON HOUSE PROVISION STRIKING A PROVISION FOR NEW MANUFACTURERS EXCISE TAXES TO FINANCE SUPERF,7,704,7,704
339,23440,99,1,225,RH0990225,"'RH0990225',","RH0990225,",7/23/85,1985,7,23,NA,NA,207,219,-0.085,-0.454,-0.1,0.066,-217.26,HR8,NA,NA,NA,"TO AMEND H R 8, A BILL APPROPRIATING $21 BILLION OVER 5 YEARS IN GRANTS AND LOANS FOR LOCAL SEWAGE TREATMENT, TO FREEZE 1986 FUNDING AT THE 1985 LEVEL OF $2.6 BILLION AND LIMIT INCREASES IN FUNDING TO INFLATION ADJUSTMENTS FOR FISCAL 1987-1990. (MOTION FAILED)","TO AMEND H R 8, A BILL APPROPRIATING $21 BILLION OVER 5 YEARS IN GRANTS AND LOANS FOR LOCAL SEWAGE TREATMENT, TO FREEZE 1986 FUNDING AT THE 1985 LEVEL OF $2.6 BILLION AND LIMIT INCREASES IN FUNDING TO INFLATION ADJUSTMENTS FOR FISCAL 1987-1990. (MOTION",7,703,7,703
340,23806,99,1,549,RH0990549,"'RH0990549',","RH0990549,",5/13/86,1986,5,13,NA,NA,382,21,0.534,0.127,0.249,0.324,-50.289,S124,NA,NA,NA,"TO ACCEPT THE CONFERENCE REPORT ON S 124, THE SAFE DRINKING WATER AMENDMENTS OF 1985, A BILL APPROVING APPROPRIATIONS TO IMPLEMENT THE SAFE DRINKING WATER ACT OF 1974 FOR FISCAL 1987-1991 AND TO REVISE CERTAIN SECTIONS REGULATING SAFETY OF DRINKING WATER.","TO ACCEPT THE CONFERENCE REPORT ON S 124, THE SAFE DRINKING WATER AMENDMENTS OF 1985, A BILL APPROVING APPROPRIATIONS TO IMPLEMENT THE SAFE DRINKING WATER ACT OF 1974 FOR FISCAL 1987-1991 AND TO REVISE CERTAIN SECTIONS REGULATING SAFETY OF DRINKING WATE",7,701,7,701
341,23974,99,1,656,RH0990656,"'RH0990656',","RH0990656,",7/23/86,1986,7,23,NA,NA,68,351,-0.669,-0.743,0.118,0.004,-176.305,HR5162,NA,NA,NA,"TO AMEND HR 5162, TO REDUCE THE FUNDING FOR THE NUCLEAR WASTE DISPOSAL FUND BY $291.2 MILLION, ELIMINATING STUDY OF POTENTIAL NUCLEAR-WASTE REPOSITORY SITING IN WASHINGTON STATE, NEVADA AND TEXAS.","TO AMEND HR 5162, TO REDUCE THE FUNDING FOR THE NUCLEAR WASTE DISPOSAL FUND BY $291.2 MILLION, ELIMINATING STUDY OF POTENTIAL NUCLEAR-WASTE REPOSITORY SITING IN WASHINGTON STATE, NEVADA AND TEXAS.",7,704,7,704
342,24083,99,1,744,RH0990744,"'RH0990744',","RH0990744,",8/13/86,1986,8,13,NA,NA,416,4,0,0,0,0,0,HR2631,NA,NA,NA,"TO SUSPEND THE RULES AND PASS HR 2631, A BILL TO PROVIDE FOR STUDY AND RESEARCH ON THE DECLINE IN UNITED STATES FOREST PRODUCTIVITY AND TO DETERMINE THE EFFECTS OF ATMOSPHERIC POLLUTANTS ON FOREST ENVIRONMENTS. (MOTION PASSED; TWO-THIRDS OF THOSE PRESENT VOTING IN FAVOR.)","TO SUSPEND THE RULES AND PASS HR 2631, A BILL TO PROVIDE FOR STUDY AND RESEARCH ON THE DECLINE IN UNITED STATES FOREST PRODUCTIVITY AND TO DETERMINE THE EFFECTS OF ATMOSPHERIC POLLUTANTS ON FOREST ENVIRONMENTS. (MOTION PASSED; TWO-THIRDS OF THOSE PRESEN",7,705,7,705
343,24136,99,1,806,RH0990806,"'RH0990806',","RH0990806,",9/19/86,1986,9,19,NA,NA,329,4,0,0,0,0,0,HR2482,NA,NA,NA,"TO PASS HR 2482, A BILL TO AMEND THE FEDERAL INSECTICIDE, FUNGICIDE AND RODENTICIDE ACT AND AUTHORIZE FUNDING FOR FISCAL 1987.","TO PASS HR 2482, A BILL TO AMEND THE FEDERAL INSECTICIDE, FUNGICIDE AND RODENTICIDE ACT AND AUTHORIZE FUNDING FOR FISCAL 1987.",7,704,7,704
344,24137,99,1,807,RH0990807,"'RH0990807',","RH0990807,",9/23/86,1986,9,23,NA,NA,390,4,0,0,0,0,0,HR5369,NA,NA,NA,"TO SUSPEND THE RULES AND PASS HR 5369, A BILL TO REQUIRE ASBESTOS MANUFACTURERS TO SUBMIT INFORMATION ON THEIR ASBESTOS PRODUCTS TO THE ENVIRONMENTAL PROTECTION AGENCY AND TO REQUIRE OWNERS OF BUILDINGS CONTAINING ASBESTOS TO INSPECT THE BUILDINGS AND TAKE SAMPLES OF ASBESTOS BEFORE COMMENCING CIVIL ACTIONS RELATING TO ASBESTOS. (MOTION PASSED; TWO-THIRDS OF THOSE PRESENT VOTING IN FAVOR.)","TO SUSPEND THE RULES AND PASS HR 5369, A BILL TO REQUIRE ASBESTOS MANUFACTURERS TO SUBMIT INFORMATION ON THEIR ASBESTOS PRODUCTS TO THE ENVIRONMENTAL PROTECTION AGENCY AND TO REQUIRE OWNERS OF BUILDINGS CONTAINING ASBESTOS TO INSPECT THE BUILDINGS AND T",7,708,7,708
345,24160,99,1,847,RH0990847,"'RH0990847',","RH0990847,",10/8/86,1986,10,8,NA,NA,386,27,0.394,0.461,0.206,0.387,-67.441,HR2005,NA,NA,NA,"TO ACCEPT THE CONFERENCE REPORT ON HR 2005, THE SUPERFUND HAZARDOUS WASTE CLEANUP PROGRAM, CLEARING THE MEASURE FOR THE PRESIDENT.","TO ACCEPT THE CONFERENCE REPORT ON HR 2005, THE SUPERFUND HAZARDOUS WASTE CLEANUP PROGRAM, CLEARING THE MEASURE FOR THE PRESIDENT.",7,704,7,704
346,24179,99,1,873,RH0990873,"'RH0990873',","RH0990873,",10/15/86,1986,10,15,NA,NA,408,0,0,0,0,0,0,S1128,NA,NA,NA,"TO AGREE TO THE CONFERENCE REPORT ON S 1128, A BILL TO AMEND THE CLEAN WATER ACT, CLEARING THE MEASURE FOR SENATE ACTION.","TO AGREE TO THE CONFERENCE REPORT ON S 1128, A BILL TO AMEND THE CLEAN WATER ACT, CLEARING THE MEASURE FOR SENATE ACTION.",7,701,7,701
347,24282,99,1,796,RH0990796,"'RH0990796',","RH0990796,",9/17/86,1986,9,17,NA,NA,390,15,0.596,-0.139,0.324,-0.179,-34.038,HR2482,NA,NA,NA,"TO ADOPT H RES 536, THE RULE UNDER WHICH HR 2482, A BILL TO AMEND FIFRA (FEDERAL INSECTICIDE, FUNGICIDE AND RODENTICIDE ACT), WILL BE CONSIDERED.","TO ADOPT H RES 536, THE RULE UNDER WHICH HR 2482, A BILL TO AMEND FIFRA (FEDERAL INSECTICIDE, FUNGICIDE AND RODENTICIDE ACT), WILL BE CONSIDERED.",7,704,7,704
348,24299,99,1,844,RH0990844,"'RH0990844',","RH0990844,",10/8/86,1986,10,8,NA,NA,311,104,0.298,0.653,0.128,0.04,-172.244,HR2005,NA,NA,NA,"TO AGREE TO ORDER THE PREVIOUS QUESTION, THEREBY ENDING DEBATE AND FURTHER AMENDMENT TO H RES 577, THE RULE FOR HR 2005.","TO AGREE TO ORDER THE PREVIOUS QUESTION, THEREBY ENDING DEBATE AND FURTHER AMENDMENT TO H RES 577, THE RULE FOR HR 2005.",7,704,7,704
349,24300,99,1,845,RH0990845,"'RH0990845',","RH0990845,",10/8/86,1986,10,8,NA,NA,339,74,0.338,0.261,0.151,0.176,-134.758,HR2005,NA,NA,NA,"TO ADOPT H RES 577, THE RULE WAIVING CERTAIN POINTS OF ORDER AGAINST THE CONFERENCE REPORT TO HR 2005, A BILL TO REAUTHORIZE THE SUPERFUND HAZARDOUS WASTE CLEANUP PROGRAM.","TO ADOPT H RES 577, THE RULE WAIVING CERTAIN POINTS OF ORDER AGAINST THE CONFERENCE REPORT TO HR 2005, A BILL TO REAUTHORIZE THE SUPERFUND HAZARDOUS WASTE CLEANUP PROGRAM.",7,704,7,704
350,24486,100,1,13,RH1000013,"'RH1000013',","RH1000013,",2/3/87,1987,2,3,NA,NA,401,26,0.541,0.106,0.234,0.124,-66.285,HR1,NA,NA,NA,"TO PASS, OVER PRESIDENT REAGAN'S VETO, HR 1, THE CLEAN WATER ACT, A BILL TO AMEND AND REAUTHORIZE THE CLEAN WATER ACT OF 1972. VETO OVERRIDDEN; TWO-THIRDS OF THOSE PRESENT VOTING IN FAVOR.","TO PASS, OVER PRESIDENT REAGAN'S VETO, HR 1, THE CLEAN WATER ACT, A BILL TO AMEND AND REAUTHORIZE THE CLEAN WATER ACT OF 1972. VETO OVERRIDDEN; TWO-THIRDS OF THOSE PRESENT VOTING IN FAVOR.",7,701,7,701
351,24534,100,1,160,RH1000160,"'RH1000160',","RH1000160,",6/4/87,1987,6,4,NA,NA,124,278,-0.518,0.263,0.038,-0.189,-241.71,HR2355,NA,NA,NA,"TO AMEND HR 2355, EPA RESEARCH AND DEVELOPMENT, TO INCREASE THE APPROPRIATIONS AUTHORIZED FOR ACID DEPOSITION RESEARCH BY $3 MILLION ANNUALLY.","TO AMEND HR 2355, EPA RESEARCH AND DEVELOPMENT, TO INCREASE THE APPROPRIATIONS AUTHORIZED FOR ACID DEPOSITION RESEARCH BY $3 MILLION ANNUALLY.",7,798,7,798
352,24806,100,1,319,RH1000319,"'RH1000319',","RH1000319,",9/29/87,1987,9,29,NA,NA,311,93,0.293,0.085,0.187,0.06,-110.704,HR1171,NA,NA,NA,"TO SUSPEND THE RULES AND PASS HR 1171, NATIONAL OCEANS POLICY, A BILL TO CREATE A NATIONAL OCEANS POLICY COMMISSION. MOTION PASSED; TWO-THIRDS OF THOSE PRESENT VOTING IN FAVOR.","TO SUSPEND THE RULES AND PASS HR 1171, NATIONAL OCEANS POLICY, A BILL TO CREATE A NATIONAL OCEANS POLICY COMMISSION. MOTION PASSED; TWO-THIRDS OF THOSE PRESENT VOTING IN FAVOR.",7,710,7,701
353,24831,100,1,334,RH1000334,"'RH1000334',","RH1000334,",10/13/87,1987,10,13,NA,NA,386,14,0.579,0.243,0.35,0.166,-29.939,HR940,NA,NA,NA,"TO SUSPEND THE RULES AND PASS HR 940, PLASTIC POLLUTION CONTROL, A BILL TO PROVIDE FOR THE REGULATION OF THE DISPOSAL OF PLASTIC AND OTHER MATERIALS AT SEA. MOTION PASSED; TWO-THIRDS OF THOSE PRESENT VOTING IN FAVOR.","TO SUSPEND THE RULES AND PASS HR 940, PLASTIC POLLUTION CONTROL, A BILL TO PROVIDE FOR THE REGULATION OF THE DISPOSAL OF PLASTIC AND OTHER MATERIALS AT SEA. MOTION PASSED; TWO-THIRDS OF THOSE PRESENT VOTING IN FAVOR.",7,710,7,701
354,24909,100,1,398,RH1000398,"'RH1000398',","RH1000398,",11/9/87,1987,11,9,NA,NA,362,29,0.523,-0.038,0.292,-0.043,-56.57,HR2752,NA,NA,NA,"TO SUSPEND THE RULES AND PASS HR 2752, CROP ACREAGE HABITAT USE, A BILL TO ENCOURAGE THE USE OF PROGRAM CROP ACREAGE FOR THE PURPOSE OF CREATING GAME AND WILDLIFE HABITATS, FEEDING AREAS AND SANCTUARIES. MOTION PASSED; TWO-THIRDS OF THOSE PRESENT VOTING IN FAVOR.","TO SUSPEND THE RULES AND PASS HR 2752, CROP ACREAGE HABITAT USE, A BILL TO ENCOURAGE THE USE OF PROGRAM CROP ACREAGE FOR THE PURPOSE OF CREATING GAME AND WILDLIFE HABITATS, FEEDING AREAS AND SANCTUARIES. MOTION PASSED; TWO-THIRDS OF THOSE PRESENT VOTING",7,709,7,709
355,24948,100,1,428,RH1000428,"'RH1000428',","RH1000428,",12/2/87,1987,12,2,NA,NA,399,15,0.567,0.023,0.361,0.366,-30.89,HR791,NA,NA,NA,"TO PASS HR 791, GROUND WATER RESEARCH, A BILL TO AUTHORIZE THE WATER RESOURCES RESEARCH ACTIVITIES OF THE UNITED STATES GEOLOGICAL SURVEY.","TO PASS HR 791, GROUND WATER RESEARCH, A BILL TO AUTHORIZE THE WATER RESOURCES RESEARCH ACTIVITIES OF THE UNITED STATES GEOLOGICAL SURVEY.",7,701,7,701
356,24952,100,1,433,RH1000433,"'RH1000433',","RH1000433,",12/3/87,1987,12,3,NA,NA,162,257,0.272,-0.076,-0.065,-0.497,-219.688,HJRES395,NA,NA,NA,"TO AMEND H J RES 395, FISCAL 1988 CONTINUING APPROPRIATIONS, TO POSTPONE ECONOMIC SANCTIONS AGAINST AREAS THAT FAIL TO MEET CLEAN AIR ACT STANDARDS.","TO AMEND H J RES 395, FISCAL 1988 CONTINUING APPROPRIATIONS, TO POSTPONE ECONOMIC SANCTIONS AGAINST AREAS THAT FAIL TO MEET CLEAN AIR ACT STANDARDS.",7,705,7,705
357,24981,100,1,467,RH1000467,"'RH1000467',","RH1000467,",12/17/87,1987,12,17,NA,NA,136,273,0.473,-0.28,-0.122,-0.588,-189.843,HR1467,NA,NA,NA,"TO AMEND HR 1467, ENDANGERED SPECIES ACT, TO REMOVE THE LEOPARD DARTER MINNOW FROM THE ENDANGERED OR THREATENED SPECIES LIST.","TO AMEND HR 1467, ENDANGERED SPECIES ACT, TO REMOVE THE LEOPARD DARTER MINNOW FROM THE ENDANGERED OR THREATENED SPECIES LIST.",7,709,7,709
358,24982,100,1,468,RH1000468,"'RH1000468',","RH1000468,",12/17/87,1987,12,17,NA,NA,147,270,0.187,0.006,-0.089,-0.543,-192.858,HR1467,NA,NA,NA,"TO AMEND HR 1467, ENDANGERED SPECIES ACT, TO DELAY FOR TWO YEARS THE IMPLEMENTATION OF REGULATIONS REQUIRING THE USE OF TURTLE EXCLUDER DEVICES BY SHRIMPERS ON OFFSHORE WATERS OF THE GULF OF MEXICO.","TO AMEND HR 1467, ENDANGERED SPECIES ACT, TO DELAY FOR TWO YEARS THE IMPLEMENTATION OF REGULATIONS REQUIRING THE USE OF TURTLE EXCLUDER DEVICES BY SHRIMPERS ON OFFSHORE WATERS OF THE GULF OF MEXICO.",7,709,7,709
359,24983,100,1,469,RH1000469,"'RH1000469',","RH1000469,",12/17/87,1987,12,17,NA,NA,151,266,0.213,-0.314,-0.201,-0.333,-128.058,HR1467,NA,NA,NA,"TO AMEND HR 1467, ENDANGERED SPECIES ACT, TO GIVE THE SECRETARY OF THE INTERIOR DISCRETION TO CONSIDER THE IMPACT ON HUMAN LIFE AND SAFETY WHEN EVALUATING FEDERAL PROJECTS.","TO AMEND HR 1467, ENDANGERED SPECIES ACT, TO GIVE THE SECRETARY OF THE INTERIOR DISCRETION TO CONSIDER THE IMPACT ON HUMAN LIFE AND SAFETY WHEN EVALUATING FEDERAL PROJECTS.",7,709,7,709
360,24985,100,1,470,RH1000470,"'RH1000470',","RH1000470,",12/17/87,1987,12,17,NA,NA,399,16,0.44,0.515,0.243,0.444,-42.927,HR1467,NA,NA,NA,"TO PASS HR 1467, ENDANGERED SPECIES ACT, A BILL TO AUTHORIZE APPROPRIATIONS TO CARRY OUT THE ENDANGERED SPECIES ACT OF 1973 DURING FISCAL YEARS 1988-1992.","TO PASS HR 1467, ENDANGERED SPECIES ACT, A BILL TO AUTHORIZE APPROPRIATIONS TO CARRY OUT THE ENDANGERED SPECIES ACT OF 1973 DURING FISCAL YEARS 1988-1992.",7,709,7,709
361,25027,100,1,7,RH1000007,"'RH1000007',","RH1000007,",1/8/87,1987,1,8,NA,NA,406,8,0,0,0,0,0,HR1,NA,NA,NA,"TO PASS H.R. 1, THE CLEAN AIR ACT, A BILL TO AMEND AND REAUTHORIZE THE CLEAN WATER ACT OF 1972 TO PROVIDE FOR THE RENEWAL OF THE QUALITY OF THE NATION'S WATER.","TO PASS H.R. 1, THE CLEAN AIR ACT, A BILL TO AMEND AND REAUTHORIZE THE CLEAN WATER ACT OF 1972 TO PROVIDE FOR THE RENEWAL OF THE QUALITY OF THE NATION'S WATER.",7,701,7,701
362,25067,100,1,6,RH1000006,"'RH1000006',","RH1000006,",1/8/87,1987,1,8,NA,NA,286,124,0.23,-0.092,0.227,-0.189,-88.846,HR1,NA,NA,NA,"TO ORDER THE PREVIOUS QUESTION ON H RES 27, THE RULE TO PROVIDE FOR HOUSE FLOOR CONSIDERATION OF H.R. 1, THE CLEAN AIR ACT, A BILL TO AMEND AND REAUTHORIZE THE CLEAN WATER ACT OF 1972.","TO ORDER THE PREVIOUS QUESTION ON H RES 27, THE RULE TO PROVIDE FOR HOUSE FLOOR CONSIDERATION OF H.R. 1, THE CLEAN AIR ACT, A BILL TO AMEND AND REAUTHORIZE THE CLEAN WATER ACT OF 1972.",7,700,7,700
363,25189,100,1,455,RH1000455,"'RH1000455',","RH1000455,",12/11/87,1987,12,11,NA,NA,343,0,0,0,0,0,0,HR1467,NA,NA,NA,"TO ADOPT THE RULE H RES 328 TO PROVIDE FOR HOUSE FLOOR CONSIDERATION OF HR 1467, ENDANGERED SPECIES ACT, TO AUTHORIZE APPROPRIATIONS FOR THE ENDANGERED SPECIES ACT OF 1973 FOR FISCAL YEARS 1988-1992.","TO ADOPT THE RULE H RES 328 TO PROVIDE FOR HOUSE FLOOR CONSIDERATION OF HR 1467, ENDANGERED SPECIES ACT, TO AUTHORIZE APPROPRIATIONS FOR THE ENDANGERED SPECIES ACT OF 1973 FOR FISCAL YEARS 1988-1992.",7,709,7,709
364,25608,100,1,654,RH1000654,"'RH1000654',","RH1000654,",6/8/88,1988,6,8,NA,NA,407,0,0,0,0,0,0,HR4365,NA,NA,NA,"TO SUSPEND THE RULES AND PASS HR 4365, RICHARD CRONIN SALMON STATION, A BILL TO RENAME THE SUNDERLAND NATIONAL SALMON STATION IN SUNDERLAND, MASSACHUSETTS THE RICHARD CRONIN NATIONAL SALMON STATION AFTER THE DIRECTOR OF THE MASSACHUSETTS DIVISION OF FISH AND WILDLIFE. MOTION PASSED; TWO-THIRDS OF THOSE PRESENT VOTING IN FAVOR.","TO SUSPEND THE RULES AND PASS HR 4365, RICHARD CRONIN SALMON STATION, A BILL TO RENAME THE SUNDERLAND NATIONAL SALMON STATION IN SUNDERLAND, MASSACHUSETTS THE RICHARD CRONIN NATIONAL SALMON STATION AFTER THE DIRECTOR OF THE MASSACHUSETTS DIVISION OF FIS",7,709,7,709
365,25647,100,1,677,RH1000677,"'RH1000677',","RH1000677,",6/22/88,1988,6,22,NA,NA,166,256,0.07,-0.43,0.095,0.39,-206.089,HR4800,NA,NA,NA,"TO AMEND HR 4800, FISCAL 1989 HOUSING AND URBAN DEVELOPMENT APPROPRIATIONS, TO TRANSFER $400 MILLION IN NASA RESEARCH AND DEVELOPMENT FUNDS TO FEDERAL HOUSING PROGRAMS AND THE ENVIRONMENTAL PROTECTION AGENCY.","TO AMEND HR 4800, FISCAL 1989 HOUSING AND URBAN DEVELOPMENT APPROPRIATIONS, TO TRANSFER $400 MILLION IN NASA RESEARCH AND DEVELOPMENT FUNDS TO FEDERAL HOUSING PROGRAMS AND THE ENVIRONMENTAL PROTECTION AGENCY.",7,709,7,709
366,25918,100,1,876,RH1000876,"'RH1000876',","RH1000876,",10/4/88,1988,10,4,NA,NA,417,0,0,0,0,0,0,HR5430,NA,NA,NA,"TO SUSPEND THE RULES AND PASS HR 5430, OCEAN DUMPING FEES, TO AMEND THE MARINE PROTECTION, RESEARCH AND SANCTUARIES ACT OF 1972 TO CREATE SPECIAL ASSESSMENTS TO DISCOURAGE OCEAN DUMPING OF SEWAGE SLUDGE AND INDUSTRIAL WASTE. MOTION PASSED; TWO-THIRDS OF THOSE PRESENT VOTING IN FAVOR.","TO SUSPEND THE RULES AND PASS HR 5430, OCEAN DUMPING FEES, TO AMEND THE MARINE PROTECTION, RESEARCH AND SANCTUARIES ACT OF 1972 TO CREATE SPECIAL ASSESSMENTS TO DISCOURAGE OCEAN DUMPING OF SEWAGE SLUDGE AND INDUSTRIAL WASTE. MOTION PASSED; TWO-THIRDS O",7,710,7,701
367,25919,100,1,877,RH1000877,"'RH1000877',","RH1000877,",10/4/88,1988,10,4,NA,NA,415,2,0,0,0,0,0,HR4210,NA,NA,NA,"TO SUSPEND THE RULES AND PASS HR 4210, MARINE PROGRAMS REAUTHORIZATION, TO EXTEND TITLE II OF THE MARINE PROTECTION, RESEARCH AND SANCTUARIES ACT OF 1972 FOR THE 1989 AND 1990 FISCAL YEARS. MOTION PASSED; TWO-THIRDS OF THOSE PRESENT VOTING IN FAVOR.","TO SUSPEND THE RULES AND PASS HR 4210, MARINE PROGRAMS REAUTHORIZATION, TO EXTEND TITLE II OF THE MARINE PROTECTION, RESEARCH AND SANCTUARIES ACT OF 1972 FOR THE 1989 AND 1990 FISCAL YEARS. MOTION PASSED; TWO-THIRDS OF THOSE PRESENT VOTING IN FAVOR.",7,710,7,701
368,25920,100,1,878,RH1000878,"'RH1000878',","RH1000878,",10/4/88,1988,10,4,NA,NA,398,21,0.466,0.571,0.245,0.257,-52.441,HR4211,NA,NA,NA,"TO SUSPEND THE RULES AND PASS HR 4211, OCEAN POLLUTION PLANNING REAUTHORIZATION, TO EXTEND THE NATIONAL OCEAN POLLUTION PLANNING ACT OF 1978 FOR THE 1989 AND 1990 FISCAL YEARS. MOTION PASSED; TWO-THIRDS OF THOSE PRESENT VOTING IN FAVOR.","TO SUSPEND THE RULES AND PASS HR 4211, OCEAN POLLUTION PLANNING REAUTHORIZATION, TO EXTEND THE NATIONAL OCEAN POLLUTION PLANNING ACT OF 1978 FOR THE 1989 AND 1990 FISCAL YEARS. MOTION PASSED; TWO-THIRDS OF THOSE PRESENT VOTING IN FAVOR.",7,710,7,701
369,25926,100,1,886,RH1000886,"'RH1000886',","RH1000886,",10/4/88,1988,10,4,NA,NA,419,0,0,0,0,0,0,S2800,NA,NA,NA,"TO SUSPEND THE RULES AND PASS S 2800, NUCLEAR WASTE POLICY, TO AMEND THE NUCLEAR WASTE POLICY ACT OF 1982 WITH RESPECT TO THE OFFICE OF NUCLEAR WASTE NEGOTIATOR AND THE MONITORED RETRIEVABLE STORAGE COMMISSION. MOTION PASSED; TWO-THIRDS OF THOSE PRESENT VOTING IN FAVOR.","TO SUSPEND THE RULES AND PASS S 2800, NUCLEAR WASTE POLICY, TO AMEND THE NUCLEAR WASTE POLICY ACT OF 1982 WITH RESPECT TO THE OFFICE OF NUCLEAR WASTE NEGOTIATOR AND THE MONITORED RETRIEVABLE STORAGE COMMISSION. MOTION PASSED; TWO-THIRDS OF THOSE PRESEN",7,704,7,704
370,25945,100,1,912,RH1000912,"'RH1000912',","RH1000912,",10/6/88,1988,10,6,NA,NA,390,28,-0.091,0.945,0.06,0.549,-79.186,HR3515,NA,NA,NA,"TO SUSPEND THE RULES AND PASS HR 3515, MEDICAL WASTE TRACKING, TO AMEND THE SOLID WASTE DISPOSAL ACT TO DIRECT THE ENVIRONMENTAL PROTECTION AGENCY TO OFFICIALLY ANNOUNCE REGULATIONS ON INFECTIOUS WASTE MANAGEMENT. MOTION PASSED; TWO-THIRDS OF THOSE PRESENT VOTING IN FAVOR.","TO SUSPEND THE RULES AND PASS HR 3515, MEDICAL WASTE TRACKING, TO AMEND THE SOLID WASTE DISPOSAL ACT TO DIRECT THE ENVIRONMENTAL PROTECTION AGENCY TO OFFICIALLY ANNOUNCE REGULATIONS ON INFECTIOUS WASTE MANAGEMENT. MOTION PASSED; TWO-THIRDS OF THOSE PRE",7,703,7,703
371,26316,101,1,174,RH1010174,"'RH1010174',","RH1010174,",7/27/89,1989,7,27,NA,NA,70,348,-0.019,0.689,-0.085,-0.411,-149.191,HR2461,NA,NA,NA,"TO AMEND HR 2461, FISCAL 1990-91 DEFENSE DEPARTMENT AUTHORIZATION, TO EXEMPT THE EFFLUENTS FROM THE K-REACTOR AT THE SAVANNAH RIVER SITE IN SOUTH CAROLINA FROM THE THERMAL REQUIREMENTS OF THE CLEAN WATER ACT.","TO AMEND HR 2461, FISCAL 1990-91 DEFENSE DEPARTMENT AUTHORIZATION, TO EXEMPT THE EFFLUENTS FROM THE K-REACTOR AT THE SAVANNAH RIVER SITE IN SOUTH CAROLINA FROM THE THERMAL REQUIREMENTS OF THE CLEAN WATER ACT.",7,701,7,701
372,26544,101,1,327,RH1010327,"'RH1010327',","RH1010327,",11/8/89,1989,11,8,NA,NA,151,270,-0.185,0.53,-0.123,-0.388,-186.205,HR1465,NA,NA,NA,"TO AMEND THE MILLER (D, CA) AMENDMENT TO HR 1465, OIL POLLUTION LIMITS, TO REMOVE PROVISIONS THAT DEALT WITH STATE AUTHORITY AS IT RELATED TO CLEANUPS.","TO AMEND THE MILLER (D, CA) AMENDMENT TO HR 1465, OIL POLLUTION LIMITS, TO REMOVE PROVISIONS THAT DEALT WITH STATE AUTHORITY AS IT RELATED TO CLEANUPS.",7,710,7,701
373,26545,101,1,328,RH1010328,"'RH1010328',","RH1010328,",11/8/89,1989,11,8,NA,NA,279,143,-0.122,0.542,0.123,0.343,-184.105,HR1465,NA,NA,NA,"TO AMEND HR 1465, OIL POLLUTION LIMITS, TO PREVENT FEDERAL LAW FROM PREEMPTING STATE LAWS THAT DEAL WITH OIL SPILL LIABILITY AND RELATED ISSUES.","TO AMEND HR 1465, OIL POLLUTION LIMITS, TO PREVENT FEDERAL LAW FROM PREEMPTING STATE LAWS THAT DEAL WITH OIL SPILL LIABILITY AND RELATED ISSUES.",7,710,7,701
374,26546,101,1,329,RH1010329,"'RH1010329',","RH1010329,",11/8/89,1989,11,8,NA,NA,169,251,0.206,-0.362,-0.183,-0.377,-144.471,HR1465,NA,NA,NA,"TO AMEND HR 1465, OIL POLLUTION LIMITS, TO ALLOW A PARTY TO BE ABLE TO SEEK REDRESS UNDER EITHER FEDERAL OR STATE LAW, BUT NOT BOTH.","TO AMEND HR 1465, OIL POLLUTION LIMITS, TO ALLOW A PARTY TO BE ABLE TO SEEK REDRESS UNDER EITHER FEDERAL OR STATE LAW, BUT NOT BOTH.",7,710,7,701
375,26549,101,1,330,RH1010330,"'RH1010330',","RH1010330,",11/8/89,1989,11,8,NA,NA,171,252,-0.032,0.192,-0.099,-0.279,-207.618,HR1465,NA,NA,NA,"TO AMEND HR 1465, OIL POLLUTION LIMITS, TO PROHIBIT STATE OR LOCAL LIABILITY LIMITS HIGHER THAN THOSE SET IN THIS LEGISLATION.","TO AMEND HR 1465, OIL POLLUTION LIMITS, TO PROHIBIT STATE OR LOCAL LIABILITY LIMITS HIGHER THAN THOSE SET IN THIS LEGISLATION.",7,710,7,701
376,26550,101,1,331,RH1010331,"'RH1010331',","RH1010331,",11/8/89,1989,11,8,NA,NA,213,206,-0.056,-0.008,0.13,0.314,-181.638,HR1465,NA,NA,NA,"TO AMEND HR 1465, OIL POLLUTION LIMITS, TO CHANGE THE LIABILITY STANDARDS SO THAT LIABILITY LIMITS WOULD NOT APPLY TO SPILLS DUE TO NEGLIGENCE AS OPPOSED TO GROSS NEGLIGENCE.","TO AMEND HR 1465, OIL POLLUTION LIMITS, TO CHANGE THE LIABILITY STANDARDS SO THAT LIABILITY LIMITS WOULD NOT APPLY TO SPILLS DUE TO NEGLIGENCE AS OPPOSED TO GROSS NEGLIGENCE.",7,710,7,701
377,26552,101,1,334,RH1010334,"'RH1010334',","RH1010334,",11/9/89,1989,11,9,NA,NA,185,197,-0.121,0.068,0.131,0.334,-170.143,HR1465,NA,NA,NA,"TO AMEND HR 1465, OIL POLLUTION LIMIT, TO CHANGE THE LIABILITY STANDARDS SO THAT LIABILITY LIMITS WOULD NOT APPLY TO SPILLS DUE TO NEGLIGENCE AS OPPOSED TO GROSS NEGLIGENCE OR WILLFUL MISCONDUCT.","TO AMEND HR 1465, OIL POLLUTION LIMIT, TO CHANGE THE LIABILITY STANDARDS SO THAT LIABILITY LIMITS WOULD NOT APPLY TO SPILLS DUE TO NEGLIGENCE AS OPPOSED TO GROSS NEGLIGENCE OR WILLFUL MISCONDUCT.",7,710,7,701
378,26553,101,1,335,RH1010335,"'RH1010335',","RH1010335,",11/9/89,1989,11,9,NA,NA,375,5,0,0,0,0,0,HR1465,NA,NA,NA,"TO PASS HR 1465, OIL POLLUTION LIMITATIONS, TO SET LIMITS ON LIABILITY AND DAMAGES CAUSED BY OIL SPILLS AND TO ESTABLISH A FUND TO HELP PAY FOR THOSE DAMAGES.","TO PASS HR 1465, OIL POLLUTION LIMITATIONS, TO SET LIMITS ON LIABILITY AND DAMAGES CAUSED BY OIL SPILLS AND TO ESTABLISH A FUND TO HELP PAY FOR THOSE DAMAGES.",7,710,7,701
379,26773,101,1,319,RH1010319,"'RH1010319',","RH1010319,",11/1/89,1989,11,1,NA,NA,238,154,0.1,-0.206,0.243,0.109,-81.893,HR1465,NA,NA,NA,"TO APPROVE H RES 277, TO ALLOW FOR THE CONSIDERATION OF HR 1465, OIL SPILL DAMAGE.","TO APPROVE H RES 277, TO ALLOW FOR THE CONSIDERATION OF HR 1465, OIL SPILL DAMAGE.",7,710,7,701
380,26911,101,1,374,RH1010374,"'RH1010374',","RH1010374,",2/6/90,1990,2,6,2,7,396,21,0.682,0.032,0.227,-0.231,-58.771,HR2061,Passed,MAGNUSON FISHERIES CONSERVATION AND MANAGEMENT ACT,On Motion to Suspend the Rules and Pass,"TO SUSPEND THE RULES AND PASS HR 2061, MAGNUSON FISHERY CONSERVATION AND MANAGEMENT ACT, TO AUTHORIZE APPROPRIATIONS TO CARRY OUT THE MAGNUSON FISHERY CONSERVATION AND MANAGEMENT ACT THROUGH FISCAL YEAR 1992. (MOTION PASSED; TWO THIRDS OF THOSE PRESENT VOTING IN FAVOR.)","TO SUSPEND THE RULES AND PASS HR 2061, MAGNUSON FISHERY CONSERVATION AND MANAGEMENT ACT, TO AUTHORIZE APPROPRIATIONS TO CARRY OUT THE MAGNUSON FISHERY CONSERVATION AND MANAGEMENT ACT THROUGH FISCAL YEAR 1992. (MOTION PASSED; TWO THIRDS OF THOSE PRESENT",7,709,7,709
381,26925,101,1,381,RH1010381,"'RH1010381',","RH1010381,",2/7/90,1990,2,7,2,14,376,37,0.392,0.301,0.149,0.65,-84.344,HR1465,Passed,"OIL POLLUTION PREVENTION, RESPONSE, LIABILITY, AND COMPENSATION ACT",MOTION TO INSTRUCT CONFEREES,"TO INSTRUCT HOUSE CONFEREES ON HR 1465, OIL-SPILL LIABILITY, TO INSIST UPON INCLUSION IN THE CONFERENCE REPORT OF A REQUIREMENT FOR EQUIPPING NEW AND EXISTING TANK VESSELS WITH DOUBLE BOTTOMS OR DOUBLE HULLS.","TO INSTRUCT HOUSE CONFEREES ON HR 1465, OIL-SPILL LIABILITY, TO INSIST UPON INCLUSION IN THE CONFERENCE REPORT OF A REQUIREMENT FOR EQUIPPING NEW AND EXISTING TANK VESSELS WITH DOUBLE BOTTOMS OR DOUBLE HULLS.",7,710,7,701
382,26979,101,1,412,RH1010412,"'RH1010412',","RH1010412,",3/28/90,1990,3,28,2,49,161,266,-0.045,0.477,-0.242,-0.346,-112.711,HR3847,Failed,NA,On Agreeing to the Amendment,"TO AMEND IN THE NATURE OF A SUBSTITUTE, HR 3847, DEPARTMENT OF ENVIRONMENTAL PROTECTION, TO ELEVATE THE EPA TO CABINET LEVEL.","TO AMEND IN THE NATURE OF A SUBSTITUTE, HR 3847, DEPARTMENT OF ENVIRONMENTAL PROTECTION, TO ELEVATE THE EPA TO CABINET LEVEL.",7,700,7,700
383,26981,101,1,413,RH1010413,"'RH1010413',","RH1010413,",3/28/90,1990,3,28,2,50,371,55,0.242,0.617,0.14,0.303,-115.054,HR3847,Passed,DEPARTMENT OF ENVIRONMENTAL PROTECTION ACT,On Passage,"TO PASS HR 3847, DEPARTMENT OF ENVIRONMENTAL PROTECTION, TO ESTABLISH A DEPARTMENT OF ENVIRONMENTAL PROTECTION.","TO PASS HR 3847, DEPARTMENT OF ENVIRONMENTAL PROTECTION, TO ESTABLISH A DEPARTMENT OF ENVIRONMENTAL PROTECTION.",7,700,7,700
384,27111,101,1,487,RH1010487,"'RH1010487',","RH1010487,",5/23/90,1990,5,23,2,129,312,106,0.373,-0.146,0.106,0.066,-190.437,HRES399,Passed,"PROVIDING FOR THE FURTHER CONSIDERATION OF H.R. 3030, CLEAN AIR ACT AMENDMENTS OF 1990",On Ordering the Previous Question,"TO ORDER THE PREVIOUS QUESTION ON H RES 399, TO PROVIDE FOR CONSIDERATION OF HR 3030, CLEAN AIR ACT AMENDMENTS OF 1990, TO AMEND THE CLEAN AIR ACT TO PROVIDE FOR THE ATTAINMENT AND MAINTENANCE OF NATURAL AMBIENT AIR QUALITY STANDARDS.","TO ORDER THE PREVIOUS QUESTION ON H RES 399, TO PROVIDE FOR CONSIDERATION OF HR 3030, CLEAN AIR ACT AMENDMENTS OF 1990, TO AMEND THE CLEAN AIR ACT TO PROVIDE FOR THE ATTAINMENT AND MAINTENANCE OF NATURAL AMBIENT AIR QUALITY STANDARDS.",7,705,7,705
385,27114,101,1,489,RH1010489,"'RH1010489',","RH1010489,",5/23/90,1990,5,23,2,131,170,253,0.667,-0.745,-0.07,-0.214,-269.096,HR3030,Failed,NA,ON AGREEING TO THE AMENDMENTS,"TO AMEND HR 3030, CLEAN AIR ACT AMENDMENTS OF 1990, TO ELIMINATE PROVISIONS REQUIRING CERTAIN FEES AND CHARGES.","TO AMEND HR 3030, CLEAN AIR ACT AMENDMENTS OF 1990, TO ELIMINATE PROVISIONS REQUIRING CERTAIN FEES AND CHARGES.",7,705,7,705
386,27116,101,1,490,RH1010490,"'RH1010490',","RH1010490,",5/23/90,1990,5,23,2,132,274,146,0.142,0.032,0.153,0.005,-148.47,HR3030,Agreed to,NA,On Agreeing to the Amendment,"TO AMEND HR 3030, CLEAN AIR ACT AMENDMENTS OF 1990, TO AUTHORIZE $250 MILLION FOR A """"""""""""""""CLEAN AIR EMPLOYMENT TRANSITION ASSISTANCE"""""""""""""""" PROGRAM TO BE DISBURSED OVER A 5-YEAR PERIOD.",PROGRAM TO BE DISBURSED OVER A 5-YEAR PERIOD.,7,705,7,705
387,27118,101,1,491,RH1010491,"'RH1010491',","RH1010491,",5/23/90,1990,5,23,2,133,239,180,0.104,-0.123,0.107,0.343,-203.249,HR3030,Agreed to,NA,On Agreeing to the Amendment,"TO AMEND HR 3030, CLEAN AIR ACT AMENDMENTS OF 1990, TO EXTEND THE 5 YEAR/50,000 MILE WARRANTIES ON """"""""""""""""MAJOR"""""""""""""""" AUTO EMISSION CONTROL DEVICES TO 8 YEAR/80,000 MILE WARRANTIES.","AUTO EMISSION CONTROL DEVICES TO 8 YEAR/80,000 MILE WARRANTIES.",7,705,7,705
388,27120,101,1,492,RH1010492,"'RH1010492',","RH1010492,",5/23/90,1990,5,23,2,134,416,0,0,0,0,0,0,HR3030,Agreed to,NA,On Agreeing to the Amendment,"TO AMEND HR 3030, CLEAN AIR ACT AMENDMENTS OF 1990, TO REQUIRE COMPLETE ELIMINATION OF THE MOST DESTRUCTIVE CHEMICALS THAT DESTROY THE OZONE LAYER BY MID-2000 AND LESS DESTRUCTIVE TYPES OF CHEMICALS BY THE BEGINNING OF 2020.","TO AMEND HR 3030, CLEAN AIR ACT AMENDMENTS OF 1990, TO REQUIRE COMPLETE ELIMINATION OF THE MOST DESTRUCTIVE CHEMICALS THAT DESTROY THE OZONE LAYER BY MID-2000 AND LESS DESTRUCTIVE TYPES OF CHEMICALS BY THE BEGINNING OF 2020.",7,705,7,705
389,27122,101,1,493,RH1010493,"'RH1010493',","RH1010493,",5/23/90,1990,5,23,2,135,411,5,0,0,0,0,0,HR3030,Agreed to,NA,On Agreeing to the Amendment,"TO AMEND HR 3030, CLEAN AIR ACT AMENDMENTS OF 1990, TO REQUIRE THE EPA TO ESTABLISH REGULATIONS TO CONTROL POLLUTION FROM OFFSHORE OIL AND GAS PLATFORMS.","TO AMEND HR 3030, CLEAN AIR ACT AMENDMENTS OF 1990, TO REQUIRE THE EPA TO ESTABLISH REGULATIONS TO CONTROL POLLUTION FROM OFFSHORE OIL AND GAS PLATFORMS.",7,705,7,705
390,27124,101,1,494,RH1010494,"'RH1010494',","RH1010494,",5/23/90,1990,5,23,2,136,405,15,0.522,0.341,0.246,0.345,-41.144,HR3030,Agreed to,NA,On Agreeing to the Amendment,"TO AMEND HR 3030, CLEAN AIR ACT AMENDMENTS OF 1990, TO MODIFY THE CLEAN FUEL PROVISIONS IN THE BILL.","TO AMEND HR 3030, CLEAN AIR ACT AMENDMENTS OF 1990, TO MODIFY THE CLEAN FUEL PROVISIONS IN THE BILL.",7,705,7,705
391,27126,101,1,495,RH1010495,"'RH1010495',","RH1010495,",5/23/90,1990,5,23,2,137,401,21,0.487,0.364,0.171,0.434,-65.533,HR3030,Passed,CLEAN AIR ACT AMENDMENTS OF 1990,On Passage,"TO PASS HR 3030, CLEAN AIR AMENDMENTS OF 1990, TO AMEND THE CLEAN AIR ACT TO PROVIDE FOR THE ATTAINMENT AND MAINTENANCE OF NATURAL AMBIENT AIR QUALITY STANDARDS.","TO PASS HR 3030, CLEAN AIR AMENDMENTS OF 1990, TO AMEND THE CLEAN AIR ACT TO PROVIDE FOR THE ATTAINMENT AND MAINTENANCE OF NATURAL AMBIENT AIR QUALITY STANDARDS.",7,705,7,705
392,27396,101,1,670,RH1010670,"'RH1010670',","RH1010670,",8/3/90,1990,8,3,2,319,281,82,0.103,0.995,0.202,0.229,-104.721,HRES452,Passed,"WAIVING CERTAIN POINTS OF ORDER AGAINST CONFERENCE REPORT ON H.R. 1465, OIL POLLUTION PREVENTION, RESPONSE, LIABILITY, AND COMPENSATION ACT OF 1989",On Ordering the Previous Question,"TO ORDER THE PREVIOUS QUESTION ON H RES 452, TO PROVIDE FOR CONSIDERATION OF HR 1465, OIL POLLUTION ACT OF 1990.","TO ORDER THE PREVIOUS QUESTION ON H RES 452, TO PROVIDE FOR CONSIDERATION OF HR 1465, OIL POLLUTION ACT OF 1990.",7,710,7,701
393,27397,101,1,671,RH1010671,"'RH1010671',","RH1010671,",8/3/90,1990,8,3,2,320,360,0,0,0,0,0,0,HR1465,Passed,"OIL POLLUTION PREVENTION, RESPONSE, LIABILITY, AND COMPENSATION ACT",On Agreeing to the Conference Report,"TO ADOPT THE CONFERENCE REPORT ON HR 1465, OIL POLLUTION ACT OF 1990, TO ESTABLISH LIMITATIONS ON LIABILITY AND DAMAGES RESULTING FROM OIL POLLUTION.","TO ADOPT THE CONFERENCE REPORT ON HR 1465, OIL POLLUTION ACT OF 1990, TO ESTABLISH LIMITATIONS ON LIABILITY AND DAMAGES RESULTING FROM OIL POLLUTION.",7,710,7,701
394,27427,101,1,710,RH1010710,"'RH1010710',","RH1010710,",9/24/90,1990,9,24,2,360,371,42,0.475,0.386,0.212,0.061,-87.94,HRES468,Passed,PROVIDING FOR THE CONSIDERATION OF H.R. 4450; COASTAL ZONE ACT REAUTHORIZATION AMENDMENTS OF 1990,On Ordering the Previous Question,"TO ORDER THE PREVIOUS QUESTION ON H RES 468, TO PROVIDE FOR CONSIDERATION OF HR 4450, COASTAL ZONE ACT REAUTHORIZATION AMENDMENTS OF 1990.","TO ORDER THE PREVIOUS QUESTION ON H RES 468, TO PROVIDE FOR CONSIDERATION OF HR 4450, COASTAL ZONE ACT REAUTHORIZATION AMENDMENTS OF 1990.",7,710,7,701
395,27431,101,1,715,RH1010715,"'RH1010715',","RH1010715,",9/24/90,1990,9,24,2,365,376,37,0.488,0.094,0.246,0.113,-69.365,HR4323,Passed,GREAT LAKES WATER QUALITY IMPROVEMENT ACT OF 1990,On Motion to Suspend the Rules and Pass,"TO SUSPEND THE RULES AND PASS HR 4323, GREAT LAKES WATER QUALITY IMPROVEMENT ACT OF 1990, TO AMEND THE FEDERAL WATER POLLUTION CONTROL ACT RELATING TO WATER QUALITY IN THE GREAT LAKES. (MOTION PASSED; TWO-THIRDS OF THOSE PRESENT VOTING IN FAVOR.)","TO SUSPEND THE RULES AND PASS HR 4323, GREAT LAKES WATER QUALITY IMPROVEMENT ACT OF 1990, TO AMEND THE FEDERAL WATER POLLUTION CONTROL ACT RELATING TO WATER QUALITY IN THE GREAT LAKES. (MOTION PASSED; TWO-THIRDS OF THOSE PRESENT VOTING IN FAVOR",7,701,7,701
396,27433,101,1,717,RH1010717,"'RH1010717',","RH1010717,",9/24/90,1990,9,24,2,367,407,7,0,0,0,0,0,HR5254,Passed,FISH AND WILDLIFE CONSERVATION ACT AUTHORIZATION,On Motion to Suspend the Rules and Pass,"TO SUSPEND THE RULES AND PASS HR 5254, FISH AND WILDLIFE CONSERVATION ACT OF 1990, TO AUTHORIZE APPROPRIATIONS TO CARRY OUT THE FISH AND WILDLIFE CONSERVATION ACT OF 1980 FOR FISCAL YEARS 1991 AND 1992. (MOTION PASSED; TWO-THIRDS OF THOSE PRESENT VOTING IN FAVOR.)","TO SUSPEND THE RULES AND PASS HR 5254, FISH AND WILDLIFE CONSERVATION ACT OF 1990, TO AUTHORIZE APPROPRIATIONS TO CARRY OUT THE FISH AND WILDLIFE CONSERVATION ACT OF 1980 FOR FISCAL YEARS 1991 AND 1992. (MOTION PASSED; TWO-THIRDS OF THOSE PRESENT VOTING",7,709,7,709
397,27434,101,1,718,RH1010718,"'RH1010718',","RH1010718,",9/24/90,1990,9,24,2,368,369,46,0.434,0.181,0.192,0.23,-90.301,HR5255,Passed,FISH AND WILDLIFE FOUNDATION ESTABLISHMENT ACT AMENDMENTS OF 1990,On Motion to Suspend the Rules and Pass,"TO SUSPEND THE RULES AND PASS HR 5255, NATIONAL FISH AND WILDLIFE FOUNDATION ESTABLISHMENT ACT AMENDMENTS OF 1990, TO AUTHORIZE APPROPRIATIONS FOR THE NATIONAL FISH AND WILDLIFE FOUNDATION FOR FISCAL YEARS 1991-1993. (MOTION PASSED; TWO-THIRDS OF THOSE PRESENT VOTING IN FAVOR.)","TO SUSPEND THE RULES AND PASS HR 5255, NATIONAL FISH AND WILDLIFE FOUNDATION ESTABLISHMENT ACT AMENDMENTS OF 1990, TO AUTHORIZE APPROPRIATIONS FOR THE NATIONAL FISH AND WILDLIFE FOUNDATION FOR FISCAL YEARS 1991-1993. (MOTION PASSED; TWO-THIRDS OF THOSE",7,709,7,709
398,27446,101,1,735,RH1010735,"'RH1010735',","RH1010735,",9/26/90,1990,9,26,2,386,391,32,0.518,0.06,0.239,0.121,-66.712,HR4450,Passed,COASTAL ZONE ACT REAUTHORIZATION AMENDMENTS OF 1990,On Passage,"TO PASS HR 4450, COASTAL ZONE ACT REAUTHORIZATION AMENDMENTS OF 1990, TO IMPROVE MANAGEMENT OF THE COASTAL ZONE AND ENHANCE ENVIRONMENTAL PROTECTION OF COASTAL ZONE RESOURCES.","TO PASS HR 4450, COASTAL ZONE ACT REAUTHORIZATION AMENDMENTS OF 1990, TO IMPROVE MANAGEMENT OF THE COASTAL ZONE AND ENHANCE ENVIRONMENTAL PROTECTION OF COASTAL ZONE RESOURCES.",7,710,7,701
399,27545,101,1,853,RH1010853,"'RH1010853',","RH1010853,",10/23/90,1990,10,23,2,510,325,89,0.19,0.582,0.134,0.197,-149.585,HR4333,Passed,"BEACHES ENVIRONMENTAL ASSESSMENT, CLOSURE, AND HEALTH ACT OF 1990",On Motion to Suspend the Rules and Pass,"TO SUSPEND THE RULES AND PASS HR 4333, BEACHES ENVIRONMENTAL ASSESSMENT, CLOSURE, AND HEALTH ACT OF 1990, TO ESTABLISH THE CLEAN COASTAL BEACHES COUNCIL TO DEVELOP A PROGRAM OF MONITORING COASTAL ZONE RECREATIONAL WATERS. (MOTION PASSED; TWO-THIRDS OF THOSE PRESENT VOTING IN FAVOR.)","TO SUSPEND THE RULES AND PASS HR 4333, BEACHES ENVIRONMENTAL ASSESSMENT, CLOSURE, AND HEALTH ACT OF 1990, TO ESTABLISH THE CLEAN COASTAL BEACHES COUNCIL TO DEVELOP A PROGRAM OF MONITORING COASTAL ZONE RECREATIONAL WATERS. (MOTION PASSED; TWO-THIRDS OF T",7,710,7,701
400,27556,101,1,868,RH1010868,"'RH1010868',","RH1010868,",10/26/90,1990,10,26,2,525,400,25,0.327,0.629,0.145,0.445,-72.546,S1630,Passed,CLEAN AIR ACT AMENDMENTS OF 1990,On Agreeing to the Conference Report,"TO ADOPT THE CONFERENCE REPORT ON S 1630, CLEAN AIR ACT AMENDMENTS OF 1990.","TO ADOPT THE CONFERENCE REPORT ON S 1630, CLEAN AIR ACT AMENDMENTS OF 1990.",7,705,7,705
401,27591,101,1,488,RH1010488,"'RH1010488',","RH1010488,",5/23/90,1990,5,23,2,130,317,105,0.427,-0.39,0.106,0.058,-199.482,HRES399,Passed,"PROVIDING FOR THE FURTHER CONSIDERATION OF H.R. 3030, CLEAN AIR ACT AMENDMENTS OF 1990",On Agreeing to the Resolution,"TO ADOPT THE RULE TO PROVIDE FOR CONSIDERATION OF HR 3030, CLEAN AIR ACT AMENDMENTS OF 1990, TO AMEND THE CLEAN AIR ACT TO PROVIDE FOR THE ATTAINMENT AND MAINTENANCE OF NATURAL AMBIENT AIR QUALITY STANDARDS.","TO ADOPT THE RULE TO PROVIDE FOR CONSIDERATION OF HR 3030, CLEAN AIR ACT AMENDMENTS OF 1990, TO AMEND THE CLEAN AIR ACT TO PROVIDE FOR THE ATTAINMENT AND MAINTENANCE OF NATURAL AMBIENT AIR QUALITY STANDARDS.",7,705,7,705
402,27633,101,1,711,RH1010711,"'RH1010711',","RH1010711,",9/24/90,1990,9,24,2,361,370,44,0.461,0.132,0.242,0.111,-75.267,HRES468,Passed,PROVIDING FOR THE CONSIDERATION OF H.R. 4450; COASTAL ZONE ACT REAUTHORIZATION AMENDMENTS OF 1990,On Agreeing to the Resolution,"TO ADOPT THE RULE TO PROVIDE FOR CONSIDERATION OF HR 4450, COASTAL ZONE ACT REAUTHORIZATION AMENDMENTS OF 1990.","TO ADOPT THE RULE TO PROVIDE FOR CONSIDERATION OF HR 4450, COASTAL ZONE ACT REAUTHORIZATION AMENDMENTS OF 1990.",7,710,7,701
403,27661,101,1,867,RH1010867,"'RH1010867',","RH1010867,",10/26/90,1990,10,26,2,524,389,26,0.416,0.463,0.179,0.382,-68.906,HRES535,Passed,"WAIVING CERTAIN POINTS OF ORDER AGAINST CONSIDERATION OF THE CONFERENCE REPORT ON S. 1630, CLEAN AIR ACT AMENDMENTS OF 1990",On Agreeing to the Resolution,"TO ADOPT THE RULE TO PROVIDE FOR CONSIDERATION OF S 1630, CLEAN AIR ACT AMENDMENTS OF 1990.","TO ADOPT THE RULE TO PROVIDE FOR CONSIDERATION OF S 1630, CLEAN AIR ACT AMENDMENTS OF 1990.",7,705,7,705
404,28130,102,1,335,RH1020335,"'RH1020335',","RH1020335,",10/29/91,1991,10,29,1,348,181,241,-0.178,-0.009,0.128,0.417,-177.946,HR3543,Failed,NA,On Agreeing to the Amendment,"(HOUSE REJECTED THE GILCHREST AMENDMENT THAT SOUGHT TO PROVIDE $500,000 TO THE NATIONAL ACADEMY OF SCIENCES TO STUDY THE CONSERVATION OF FISH AND WILDLIFE.)","(HOUSE REJECTED THE GILCHREST AMENDMENT THAT SOUGHT TO PROVIDE $500,000 TO THE NATIONAL ACADEMY OF SCIENCES TO STUDY THE CONSERVATION OF FISH AND WILDLIFE",7,709,7,709
405,28294,102,1,72,RH1020072,"'RH1020072',","RH1020072,",5/1/91,1991,5,1,1,74,160,248,0.009,0.004,-0.589,0.41,-18.392,HR1236,Failed,NA,On Agreeing to the Amendment,"H.R.1236 BY ERDREICH (D-AL) -- NATIONAL FLOOD INSURANCE, MITIGATION, AND EROSION MANAGEMENT ACT OF 1991 (HOUSE REJECTED THE GRADISON AMENDMENT THAT SOUGHT TO DELETE LANGUAGE THAT INCORPORATES THE CONGRESSIONAL BUDGET OFFICE ESTIMATE REGARDING THE NET EFFECT OF THE BILL ON FEDERAL OUTLAYS THROUGH FISCAL YEAR 1995.)","NATIONAL FLOOD INSURANCE, MITIGATION, AND EROSION MANAGEMENT ACT OF 1991 (HOUSE REJECTED THE GRADISON AMENDMENT THAT SOUGHT TO DELETE LANGUAGE THAT INCORPORATES THE CONGRESSIONAL BUDGET OFFICE ESTIMATE REGARDING THE NET EFFECT OF THE BILL ON FEDERAL OUTL",7,710,7,701
406,28769,102,1,556,RH1020556,"'RH1020556',","RH1020556,",5/20/92,1992,5,20,2,132,328,79,0.312,0.103,0.196,0.236,-102.896,HR776,Agreed to,NA,On Agreeing to the Amendment,"H.R.776 BY SHARP (D-IN) -- ENERGY POLICY ACT OF 1992 COAL INDUSTRY RETIREE HEALTH BENEFIT ACT OF 1992 (PUB. L. 102-486, APPROVED 10/24/92) (HOUSE AGREED TO THE ATKINS AMENDMENT, AS MODIFIED, THAT SETS MAXIMUM WATER USE STANDARDS FOR SHOWERHEADS, FAUCETS, AND TOILETS.)","ENERGY POLICY ACT OF 1992 COAL INDUSTRY RETIREE HEALTH BENEFIT ACT OF 1992 (PUB. L. 102-486, APPROVED 10/24/92) (HOUSE AGREED TO THE ATKINS AMENDMENT, AS MODIFIED, THAT SETS MAXIMUM WATER USE STANDARDS FOR SHOWERHEADS, FAUCETS, AND TOILETS",7,799,7,799
407,28778,102,1,565,RH1020565,"'RH1020565',","RH1020565,",5/27/92,1992,5,27,2,141,117,293,0.042,-0.648,0.112,0.443,-162.791,HR776,Failed,NA,On Agreeing to the Amendment,"(HOUSE REJECTED THE GEJDENSON AMENDMENT THAT SOUGHT TO CREATE NEW REQUIREMENTS GOVERNING DISPOSAL OF LOW-LEVEL RADIOACTIVE WASTE BY PROVIDING THAT SITES BEING CONSIDERED AS DISPOSAL FACILITIES MUST BE LOCATED IN AREAS OF LOW POPULATION DENSITY, WHICH HAVE LIMITED POTENTIAL FOR FUTURE POPULATION GROWTH, AND WHICH ARE AT LEAST FIVE KILOMETERS AWAY FROM URBAN RESIDENTIAL PROPERTY LIMITS AND FROM SCHOOLS AND OTHER FACILITIES THAT PRIMARILY SERVE CHILDREN.)","(HOUSE REJECTED THE GEJDENSON AMENDMENT THAT SOUGHT TO CREATE NEW REQUIREMENTS GOVERNING DISPOSAL OF LOW-LEVEL RADIOACTIVE WASTE BY PROVIDING THAT SITES BEING CONSIDERED AS DISPOSAL FACILITIES MUST BE LOCATED IN AREAS OF LOW POPULATION DENSITY, WHICH HA",7,704,7,704
408,28904,102,1,704,RH1020704,"'RH1020704',","RH1020704,",7/21/92,1992,7,21,2,287,148,253,0.182,-0.798,0.107,0.329,-189.153,HR2637,Failed,NA,On Agreeing to the Amendment,H.R.2637 BY KOSTMAYER (D-PA) -- WASTE ISOLATION PILOT PLANT LAND WITHDRAWAL ACT (HOUSE REJECTED THE RICHARDSON AMENDMENT THAT SOUGHT TO PROHIBIT THE PLACEMENT OF ANY TRANSURANIC WASTE TO CONDUCT TEST PHASE ACTIVITIES IN THE WIPP FACILITY UNTIL SUCH TIME AS THE SECRETARY OF ENERGY AND THE EPA ADMINISTRATOR CERTIFY THAT THE FACILITY IS IN COMPLIANCE WITH THE FINAL DISPOSAL STANDARDS.),WASTE ISOLATION PILOT PLANT LAND WITHDRAWAL ACT (HOUSE REJECTED THE RICHARDSON AMENDMENT THAT SOUGHT TO PROHIBIT THE PLACEMENT OF ANY TRANSURANIC WASTE TO CONDUCT TEST PHASE ACTIVITIES IN THE WIPP FACILITY UNTIL SUCH TIME AS THE SECRETARY OF ENERGY AND T,7,704,7,704
409,28905,102,1,705,RH1020705,"'RH1020705',","RH1020705,",7/21/92,1992,7,21,2,288,144,248,0.108,-0.011,-0.222,0.067,-75.977,HR2637,Failed,NA,On Agreeing to the Amendment,(HOUSE REJECTED THE WALKER AMENDMENT THAT SOUGHT TO PROVIDE THAT NO FUNDS WOULD BE AUTHORIZED TO BE APPROPRIATED BY THIS BILL UNLESS SUCH FUNDS WERE APPROPRIATED IN AN ACT OR JOINT RESOLUTION CONTAINING NO OTHER APPROPRIATION TO CARRY OUT ANY OTHER LAW .),(HOUSE REJECTED THE WALKER AMENDMENT THAT SOUGHT TO PROVIDE THAT NO FUNDS WOULD BE AUTHORIZED TO BE APPROPRIATED BY THIS BILL UNLESS SUCH FUNDS WERE APPROPRIATED IN AN ACT OR JOINT RESOLUTION CONTAINING NO OTHER APPROPRIATION TO CARRY OUT ANY OTHER LAW,7,703,7,703
410,28906,102,1,706,RH1020706,"'RH1020706',","RH1020706,",7/21/92,1992,7,21,2,289,382,10,0.752,-0.124,0.228,-0.032,-40.797,HR2637,Passed,WASTE ISOLATION PILOT PLANT LAND WITHDRAWAL ACT OF 1992,On Passage,"(HOUSE PASSED H.R. 2637, TO WITHDRAW LANDS FOR THE WASTE ISOLATION PILOT PLANT.)","(HOUSE PASSED H.R. 2637, TO WITHDRAW LANDS FOR THE WASTE ISOLATION PILOT PLANT",7,703,7,703
411,28907,102,1,707,RH1020707,"'RH1020707',","RH1020707,",7/22/92,1992,7,22,2,290,236,171,-0.061,-0.219,0.339,-0.235,-42.928,HRES517,Passed,WAIVING CERTAIN POINTS OF ORDER AGAINST AND DURING CONSIDERATION OF H.R. 5503; INTERIOR APPROPRIATIONS FOR FY 1993,On Ordering the Previous Question,H.RES.517 BY GORDON (D-TN) -- PROCEDURAL RESOLUTION - H.R. 5503 (HOUSE AGREED TO ORDER THE PREVIOUS QUESTION .),(HOUSE AGREED TO ORDER THE PREVIOUS QUESTION,7,703,7,703
412,28957,102,1,757,RH1020757,"'RH1020757',","RH1020757,",7/29/92,1992,7,29,2,341,238,166,0.038,-0.035,0.193,-0.018,-99.888,HR5679,Agreed to,NA,On Agreeing to the Amendment,"(HOUSE AGREED TO THE MORAN AMENDMENT THAT PROHIBITS ANY FEDERAL AGENCIES FROM PLANNING, FINANCING, BUILDING, OR PERMITTING A STADIUM COMPLEX, OR ANY PUBLIC IMPROVEMENTS TO SUCH A COMPLEX, TO BE BUILT AT THE POTOMAC YARD IN ALEXANDRIA, VIRGINIA, UNTIL THE EPA HAS PREPARED AN ENVIRONMENTAL IMPACT STATEMENT WITH RESPECT TO CONSTRUCTION OF SUCH A COMPLEX.)","(HOUSE AGREED TO THE MORAN AMENDMENT THAT PROHIBITS ANY FEDERAL AGENCIES FROM PLANNING, FINANCING, BUILDING, OR PERMITTING A STADIUM COMPLEX, OR ANY PUBLIC IMPROVEMENTS TO SUCH A COMPLEX, TO BE BUILT AT THE POTOMAC YARD IN ALEXANDRIA, VIRGINIA, UNTIL TH",7,700,7,700
413,29018,102,1,823,RH1020823,"'RH1020823',","RH1020823,",9/23/92,1992,9,23,2,409,403,3,0,0,0,0,0,HR2194,Passed,FEDERAL FACILITIES COMPLIANCE ACT,On Agreeing to the Conference Report,"H.R.2194 BY ECKART (D-OH) -- FEDERAL FACILITY COMPLIANCE ACT OF 1992 METROPOLITAN WASHINGTON WASTE MANAGEMENT STUDY ACT (PUB. L. 102-386, APPROVED 10/06/92) (HOUSE AGREED TO THE CONFERENCE REPORT ON H.R. 2194, TO AMEND THE SOLID WASTE DISPOSAL ACT TO CLARIFY PROVISIONS CONCERNING THE APPLICATION OF CERTAIN REQUIREMENTS AND SANCTIONS TO FEDERAL FACILITIES.)","FEDERAL FACILITY COMPLIANCE ACT OF 1992 METROPOLITAN WASHINGTON WASTE MANAGEMENT STUDY ACT (PUB. L. 102-386, APPROVED 10/06/92) (HOUSE AGREED TO THE CONFERENCE REPORT ON H.R. 2194, TO AMEND THE SOLID WASTE DISPOSAL ACT TO CLARIFY PROVISIONS CONCERNING TH",7,704,7,704
414,29030,102,1,835,RH1020835,"'RH1020835',","RH1020835,",9/24/92,1992,9,24,2,421,389,15,0.544,0.363,0.215,0.345,-44.078,HR5419,Passed,INTERNATIONAL DOLPHIN CONSERVATION ACT,"SUSPEND THE RULES AND PASS, AS AMENDED","H.R.5419 BY STUDDS (D-MA) -- INTERNATIONAL DOLPHIN CONSERVATION ACT OF 1992 (PUB. L. 102-523, APPROVED 10/26/92) (HOUSE PASSED H.R. 5419, AMENDED, TO AMEND THE MARINE MAMMAL PROTECTION ACT OF 1972 TO AUTHORIZE THE SECRETARY OF STATE TO ENTER INTO INTERNATIONAL AGREEMENTS TO ESTABLISH A GLOBAL MORATORIUM TO PROHIBIT HARVESTING OF TUNA THROUGH THE USE OF PURSE SEINE NETS DEPLOYED ON OR TO ENCIRCLE DOLPHINS OR OTHER MARINE MAMMALS.)","INTERNATIONAL DOLPHIN CONSERVATION ACT OF 1992 (PUB. L. 102-523, APPROVED 10/26/92) (HOUSE PASSED H.R. 5419, AMENDED, TO AMEND THE MARINE MAMMAL PROTECTION ACT OF 1972 TO AUTHORIZE THE SECRETARY OF STATE TO ENTER INTO INTERNATIONAL AGREEMENTS TO ESTABLISH",7,709,7,709
415,29311,103,1,183,RH1030183,"'RH1030183',","RH1030183,",5/26/93,1993,5,26,1,190,175,242,0.044,0.077,-0.189,0.04,-97.517,HR2244,Failed,NA,ON AGREEING TO THE AMENDMENTS,(HOUSE REJECTED THE BURTON OF INDIANA AMENDMENT EN BLOC THAT SOUGHT TO STRIKE LANGUAGE THAT ALLOWS STATES TO USE FUNDS APPROPRIATED FOR GRANTS UNDER THE FEDERAL WATER POLLUTION CONTROL ACT WITHOUT REQUIRING STATE MATCHING FUNDS; AND TO REDUCE BY $90 MILLION THE AMOUNT FOR GRANTS UNDER THE FEDERAL WATER POLLUTION CONTROL ACT.),(HOUSE REJECTED THE BURTON OF INDIANA AMENDMENT EN BLOC THAT SOUGHT TO STRIKE LANGUAGE THAT ALLOWS STATES TO USE FUNDS APPROPRIATED FOR GRANTS UNDER THE FEDERAL WATER POLLUTION CONTROL ACT WITHOUT REQUIRING STATE MATCHING FUNDS; AND TO REDUCE BY $90 MIL,7,701,7,701
416,29589,103,1,322,RH1030322,"'RH1030322',","RH1030322,",7/15/93,1993,7,15,1,334,174,242,0.01,0.569,-0.243,-0.059,-77.441,HR2520,Failed,NA,On Agreeing to the Amendment,"(HOUSE REJECTED THE POMBO AMENDMENT THAT SOUGHT TO REDUCE FUNDING FOR THE FISH AND WILDLIFE SERVICE'S LAND ACQUISITION ACCOUNT BY $1 MILLION, THUS ELIMINATING FUNDING FOR THE CREATION OF THE STONE LAKES WILDLIFE REFUGE WETLANDS PROJECT.)","(HOUSE REJECTED THE POMBO AMENDMENT THAT SOUGHT TO REDUCE FUNDING FOR THE FISH AND WILDLIFE SERVICE'S LAND ACQUISITION ACCOUNT BY $1 MILLION, THUS ELIMINATING FUNDING FOR THE CREATION OF THE STONE LAKES WILDLIFE REFUGE WETLANDS PROJECT",7,709,7,709
417,29777,103,1,430,RH1030430,"'RH1030430',","RH1030430,",9/21/93,1993,9,21,1,445,425,0,0,0,0,0,0,HR2961,Passed,WALTER B. JONES CENTER FOR THE SOUNDS,On Motion to Suspend the Rules and Pass,"H.R.2961 BY LANCASTER (D-NC) -- WALTER B. JONES CENTER FOR THE SOUNDS, POCOSIN LAKES NATIONAL WILDLIFE REFUGE, NORTH CAROLINA, ESTABLISHMENT (HOUSE PASSED H.R. 2961, TO AUTHORIZE THE SECRETARY OF THE INTERIOR TO CONSTRUCT AND OPERATE THE WALTER B. JONES CENTER FOR THE SOUNDS AT THE POCOSIN LAKES NATIONAL WILDLIFE REFUGE.)","WALTER B. JONES CENTER FOR THE SOUNDS, POCOSIN LAKES NATIONAL WILDLIFE REFUGE, NORTH CAROLINA, ESTABLISHMENT (HOUSE PASSED H.R. 2961, TO AUTHORIZE THE SECRETARY OF THE INTERIOR TO CONSTRUCT AND OPERATE THE WALTER B. JONES CENTER FOR THE SOUNDS AT THE POC",7,709,7,709
418,29778,103,1,431,RH1030431,"'RH1030431',","RH1030431,",9/21/93,1993,9,21,1,446,360,64,0.487,-0.361,0.161,-0.016,-132.107,HR2604,Passed,"WETLANDS CENTER AT BROWNSVILLE, TEXAS",On Motion to Suspend the Rules and Pass,"H.R.2604 BY ORTIZ (D-TX) -- BROWNSVILLE WETLANDS POLICY ACT OF 1993 (HOUSE PASSED H.R. 2604, TO ESTABLISH A WETLANDS CENTER AT THE PORT OF BROWNSVILLE, TEXAS.)","BROWNSVILLE WETLANDS POLICY ACT OF 1993 (HOUSE PASSED H.R. 2604, TO ESTABLISH A WETLANDS CENTER AT THE PORT OF BROWNSVILLE, TEXAS",7,710,7,701
419,29819,103,1,468,RH1030468,"'RH1030468',","RH1030468,",10/6/93,1993,10,6,1,483,238,188,-0.033,0.238,0.269,0.168,-73.151,HRES262,Passed,PROVIDING FOR THE CONSIDERATION OF H.R. 1845; ESTABLISH THE BIOLOGICAL SURVEY,On Agreeing to the Resolution,"H.RES.262 BY HALL, TONY (D-OH) -- PROCEDURAL RESOLUTION - H.R. 1845 (HOUSE PASSED H.RES. 262, THE RULE UNDER WHICH H.R. 1845 WAS CONSIDERED.)","PROCEDURAL RESOLUTION - H.R. 1845 (HOUSE PASSED H.RES. 262, THE RULE UNDER WHICH H.R. 1845 WAS CONSIDERED",7,709,7,709
420,29820,103,1,469,RH1030469,"'RH1030469',","RH1030469,",10/6/93,1993,10,6,1,484,217,209,-0.043,-0.081,-0.211,-0.543,-114.353,HR1845,Agreed to,NA,On Agreeing to the Amendment,"H.R.1845 BY STUDDS (D-MA) -- NATIONAL BIOLOGICAL SURVEY ACT OF 1993 (HOUSE AGREED TO THE TAUZIN AMENDMENT THAT STRIKES LANGUAGE AUTHORIZING THE SECRETARY OF THE INTERIOR TO ACCEPT THE SERVICES OF VOLUNTEERS FROM THE PRIVATE SECTOR TO ASSIST IN THE COLLECTION OF DATA OF NON-FEDERAL LANDS FOR RESEARCH, INFORMATION, AND ANALYSIS CRITICAL TO THE MANAGEMENT OF BIOLOGICAL AND NATURAL RESOURCES.)",NATIONAL BIOLOGICAL SURVEY ACT OF 1993 (HOUSE AGREED TO THE TAUZIN AMENDMENT THAT STRIKES LANGUAGE AUTHORIZING THE SECRETARY OF THE INTERIOR TO ACCEPT THE SERVICES OF VOLUNTEERS FROM THE PRIVATE SECTOR TO ASSIST IN THE COLLECTION OF DATA OF NON-FEDERAL L,7,709,7,709
421,29873,103,1,512,RH1030512,"'RH1030512',","RH1030512,",10/26/93,1993,10,26,1,528,227,194,0.095,-0.458,-0.178,-0.447,-135.772,HR1845,Agreed to,NA,On Agreeing to the Amendment,"H.R.1845 BY STUDDS (D-MA) -- NATIONAL BIOLOGICAL SURVEY ACT OF 1993 (ON A SEPARATE VOTE, HOUSE AGREED TO THE TAUZIN AMENDMENT THAT STRIKES LANGUAGE AUTHORIZING THE SECRETARY OF THE INTERIOR TO ACCEPT THE SERVICES OF VOLUNTEERS FROM THE PRIVATE SECTOR TO ASSIST IN THE COLLECTION OF DATA OF NON-FEDERAL LANDS FOR RESEARCH, INFORMATION, AND ANALYSIS CRITICAL TO THE MANAGEMENT OF BIOLOGICAL AND NATURAL RESOURCES.)","NATIONAL BIOLOGICAL SURVEY ACT OF 1993 (ON A SEPARATE VOTE, HOUSE AGREED TO THE TAUZIN AMENDMENT THAT STRIKES LANGUAGE AUTHORIZING THE SECRETARY OF THE INTERIOR TO ACCEPT THE SERVICES OF VOLUNTEERS FROM THE PRIVATE SECTOR TO ASSIST IN THE COLLECTION OF D",7,709,7,709
422,29875,103,1,514,RH1030514,"'RH1030514',","RH1030514,",10/26/93,1993,10,26,1,530,255,165,0.271,-0.465,0.236,0.487,-108.162,HR1845,Passed,ESTABLISHING THE BIOLOGIAL SURVEY IN THE DEPARTMENT OF THE INTERIOR,On Passage,"(HOUSE PASSED H.R. 1845, TO ESTABLISH THE BIOLOGICAL SURVEY IN THE DEPARTMENT OF THE INTERIOR.)","(HOUSE PASSED H.R. 1845, TO ESTABLISH THE BIOLOGICAL SURVEY IN THE DEPARTMENT OF THE INTERIOR",7,709,7,709
423,29885,103,1,523,RH1030523,"'RH1030523',","RH1030523,",11/3/93,1993,11,3,1,539,368,59,0.274,0.665,0.2,0.323,-94.101,HR2684,Passed,FISH AND WILDLIFE FOUNDATION AUTHORIZATION,"SUSPEND THE RULES AND PASS, AS AMENDED","H.R.2684 BY STUDDS (D-MA) -- NATIONAL FISH AND WILDLIFE FOUNDATION IMPROVEMENT ACT OF 1993 BROWNSVILLE WETLANDS POLICY ACT OF 1993 (HOUSE PASSED H.R. 2684, AMENDED, TO REAUTHORIZE AND AMEND THE NATIONAL FISH AND WILDLIFE FOUNDATION ESTABLISHMENT ACT.)","NATIONAL FISH AND WILDLIFE FOUNDATION IMPROVEMENT ACT OF 1993 BROWNSVILLE WETLANDS POLICY ACT OF 1993 (HOUSE PASSED H.R. 2684, AMENDED, TO REAUTHORIZE AND AMEND THE NATIONAL FISH AND WILDLIFE FOUNDATION ESTABLISHMENT ACT",7,709,7,709
424,29943,103,1,577,RH1030577,"'RH1030577',","RH1030577,",11/20/93,1993,11,20,1,594,335,85,0.386,0.198,0.152,0.071,-139.658,HR2457,Passed,WINTER RUN CHINOOK SALMON CAPTIVE BROODSTOCK ACT OF 1993,"SUSPEND THE RULES AND PASS, AS AMENDED","H.R.2457 BY PELOSI(D-CA) -- WINTER RUN CHINOOK SALMON CAPTIVE BROODSTOCK ACT OF 1993 (PUB. L. 103-292, APPROVED 8/11/94) (HOUSE PASSED H.R. 2457, AMENDED, TO DIRECT THE SECRETARY OF THE INTERIOR TO CONDUCT A SALMON CAPTIVE BROODSTOCK PROGRAM.)","H.R.2457 BY PELOSI(D-CA) -- WINTER RUN CHINOOK SALMON CAPTIVE BROODSTOCK ACT OF 1993 (PUB. L. 103-292, APPROVED 8/11/94) (HOUSE PASSED H.R. 2457, AMENDED, TO DIRECT THE SECRETARY OF THE INTERIOR TO CONDUCT A SALMON CAPTIVE BROODSTOCK PROGRAM",7,709,7,709
425,30141,103,1,1012,RH1031012,"'RH1031012',","RH1031012,",9/13/94,1994,9,13,2,423,368,5,0,0,0,0,0,HR4308,Passed,WETLANDS CONSERVATION ACT AMENDMENTS,"SUSPEND THE RULES AND PASS, AS AMENDED","H.R.4308 BY DINGELL (D-MI) -- NORTH AMERICAN WETLANDS CONSERVATION ACT AMENDMENTS OF 1994 (PUB. L. 103-375, APPROVED 10/19/94) (HOUSE PASSED H.R.4308, TO AMEND THE NORTH AMERICAN WETLANDS CONSERVATION ACT TO AUTHORIZE APPROPRIATIONS FOR ALLOCATIONS UNDER THAT ACT FOR WETLANDS CONSERVATION.)","NORTH AMERICAN WETLANDS CONSERVATION ACT AMENDMENTS OF 1994 (PUB. L. 103-375, APPROVED 10/19/94) (HOUSE PASSED H.R.4308, TO AMEND THE NORTH AMERICAN WETLANDS CONSERVATION ACT TO AUTHORIZE APPROPRIATIONS FOR ALLOCATIONS UNDER THAT ACT FOR WETLANDS CONSERVA",7,710,7,701
426,30161,103,1,1032,RH1031032,"'RH1031032',","RH1031032,",9/28/94,1994,9,28,2,443,368,55,0.494,-0.698,0.052,-0.413,-153.838,HR4779,Passed,STATE & LOCAL GOVERNMENT INTERSTATE SOLID WASTE CONTROL ACT,On Passage,"H.R.4779 BY BOUCHER (D-VA) -- STATE AND LOCAL GOVERNMENT INTERSTATE WASTE CONTROL ACT OF 1994 (HOUSE PASSED H.R. 4779, TO AMEND THE SOLID WASTE DISPOSAL ACT TO AUTHORIZE LOCAL GOVERNMENTS AND GOVERNORS TO RESTRICT RECEIPT OF OUT-OF-STATE MUNICIPAL SOLID WASTE.)","STATE AND LOCAL GOVERNMENT INTERSTATE WASTE CONTROL ACT OF 1994 (HOUSE PASSED H.R. 4779, TO AMEND THE SOLID WASTE DISPOSAL ACT TO AUTHORIZE LOCAL GOVERNMENTS AND GOVERNORS TO RESTRICT RECEIPT OF OUT-OF-STATE MUNICIPAL SOLID WASTE",7,703,7,703
427,30400,103,1,600,RH1030600,"'RH1030600',","RH1030600,",2/2/94,1994,2,2,2,4,191,227,-0.148,-0.002,0.275,0.253,-85.806,HRES312,Failed,PROVIDING FOR CONSIDERATION OF H.R. 3425; DEPARTMENT OF ENVIRONMENTAL PROTECTION ACT,On Agreeing to the Resolution,"H.RES.312 BY MOAKLEY (D-MA) -- PROCEDURAL RESOLUTION - H.R. 3425 (HOUSE FAILED TO AGREE TO H.RES. 312, PROVIDING FOR THE CONSIDERATION OF H.R. 3425, TO REDESIGNATE THE ENVIRONMENTAL PROTECTION AGENCY AS THE DEPARTMENT OF ENVIRONMENTAL PROTECTION.)","PROCEDURAL RESOLUTION - H.R. 3425 (HOUSE FAILED TO AGREE TO H.RES. 312, PROVIDING FOR THE CONSIDERATION OF H.R. 3425, TO REDESIGNATE THE ENVIRONMENTAL PROTECTION AGENCY AS THE DEPARTMENT OF ENVIRONMENTAL PROTECTION",7,700,7,700
428,30720,103,1,826,RH1030826,"'RH1030826',","RH1030826,",6/13/94,1994,6,13,2,232,355,0,0,0,0,0,0,HR518,Agreed to,NA,On Agreeing to the Amendment,"(HOUSE AGREED TO THE MCCANDLESS PERFECTING AMENDMENT TO THE HUNTER AMENDMENT, OF A PERFECTING NATURE THAT PROVIDES THAT NOTHING IN THIS BILL SHALL BE CONSTRUED AS AFFECTING THE JURISDICTION OF THE STATE OF CALIFORNIA WITH RESPECT TO FISH AND WILDLIFE ON THE PUBLIC LANDS LOCATED IN THAT STATE; AND THAT MANAGEMENT ACTIVITIES TO MAINTAIN OR RESTORE FISH AND WILDLIFE POPULATIONS AND THE HABITATS TO SUPPORT SUCH POPULATIONS MAY BE CARRIED OUT WITHIN WILDERNESS AREAS SO DESIGNATED AND SHALL INCLUDE THE USE OF MOTORIZED VEHICLES BY THE APPROPRIATE STATE AGENCIES.)","(HOUSE AGREED TO THE MCCANDLESS PERFECTING AMENDMENT TO THE HUNTER AMENDMENT, OF A PERFECTING NATURE THAT PROVIDES THAT NOTHING IN THIS BILL SHALL BE CONSTRUED AS AFFECTING THE JURISDICTION OF THE STATE OF CALIFORNIA WITH RESPECT TO FISH AND WILDLIFE ON",7,709,7,709
429,30721,103,1,827,RH1030827,"'RH1030827',","RH1030827,",6/13/94,1994,6,13,2,233,178,189,-0.035,-0.092,0.202,0.408,-99.913,HR518,Failed,NA,ON AGREEING TO THE AMENDMENT,"(HOUSE REJECTED THE VENTO SUBSTITUTE AMENDMENT TO THE HUNTER AMENDMENT THAT SOUGHT TO PERMIT MANAGEMENT ACTIVITIES TO MAINTAIN OR RESTORE FISH AND WILDLIFE POPULATIONS TO BE CARRIED OUT WITHIN FEDERALLY-DESIGNATED WILDERNESS AREAS WHERE CONSISTENT WITH RELEVANT WILDERNESS MANAGEMENT PLANS AND IN ACCORDANCE WITH FEDERAL POLICIES AND GUIDELINES, INCLUDING THOSE RELATED TO THE USE OF MOTORIZED EQUIPMENT.)",(HOUSE REJECTED THE VENTO SUBSTITUTE AMENDMENT TO THE HUNTER AMENDMENT THAT SOUGHT TO PERMIT MANAGEMENT ACTIVITIES TO MAINTAIN OR RESTORE FISH AND WILDLIFE POPULATIONS TO BE CARRIED OUT WITHIN FEDERALLY-DESIGNATED WILDERNESS AREAS WHERE CONSISTENT WITH,7,709,7,709
430,30748,103,1,854,RH1030854,"'RH1030854',","RH1030854,",6/22/94,1994,6,22,2,260,169,255,0.198,-0.226,-0.23,-0.636,-107.797,HR4602,Failed,NA,On Agreeing to the Amendment,"H.R.4602 BY YATES (D-IL) -- DEPARTMENT OF THE INTERIOR AND RELATED AGENCIES APPROPRIATIONS ACT, 1995 (PUB. L. 103-332, APPROVED 9/30/94) (HOUSE REJECTED THE ALLARD AMENDMENT THAT SOUGHT TO STRIKE $167 MILLION IN FUNDING FOR THE NATIONAL BIOLOGICAL SURVEY.)","DEPARTMENT OF THE INTERIOR AND RELATED AGENCIES APPROPRIATIONS ACT, 1995 (PUB. L. 103-332, APPROVED 9/30/94) (HOUSE REJECTED THE ALLARD AMENDMENT THAT SOUGHT TO STRIKE $167 MILLION IN FUNDING FOR THE NATIONAL BIOLOGICAL SURVEY",7,709,7,709
431,30835,103,1,943,RH1030943,"'RH1030943',","RH1030943,",7/26/94,1994,7,26,2,352,199,225,-0.105,-0.229,0.235,0.149,-99.106,HR3870,Failed,NA,On Agreeing to the Amendment,"H.R.3870 BY BROWN, GEORGE (D-CA) -- ENVIRONMENTAL TECHNOLOGIES ACT OF 1994 (HOUSE REJECTED THE BROWN OF CALIFORNIA SUBSTITUTE TO THE WALKER AMENDMENT THAT SOUGHT TO DIRECT THE OFFICE OF SCIENCE AND TECHNOLOGY TO IDENTIFY AND DEFINE A SET OF ENVIRONMENTAL PROBLEMS FOR WHICH RISKS WILL BE CONSIDERED; TO USE BOTH AVAILABLE QUANTITATIVE DATA AND INDEPENDENT AND WELL-QUALIFIED EXPERT ADVICE; AND TO DEVELOP AND USE A COMMON SET OF ANALYTICAL METHODS FOR RANKING ENVIRONMENTAL PROBLEMS BASED ON THE RELATIVE RISKS THEY POSE AND THE POTENTIAL FOR ADDRESSING THESE ENVIRONMENTAL PROBLEMS THROUGH THE DEVELOPMENT OF ENVIRONMENTAL TECHNOLOGIES .)",ENVIRONMENTAL TECHNOLOGIES ACT OF 1994 (HOUSE REJECTED THE BROWN OF CALIFORNIA SUBSTITUTE TO THE WALKER AMENDMENT THAT SOUGHT TO DIRECT THE OFFICE OF SCIENCE AND TECHNOLOGY TO IDENTIFY AND DEFINE A SET OF ENVIRONMENTAL PROBLEMS FOR WHICH RISKS WILL BE CON,7,798,7,798
432,30836,103,1,944,RH1030944,"'RH1030944',","RH1030944,",7/26/94,1994,7,26,2,353,286,136,-0.26,-0.302,-0.346,-0.27,-81.379,HR3870,Agreed to,NA,On Agreeing to the Amendment,(HOUSE AGREED TO THE WALKER AMENDMENT THAT DIRECTS THE OFFICE OF SCIENCE AND TECHNOLOGY TO DEVELOP SPECIFIC CRITERIA AND PROCEDURES FOR THE EVALUATION OF ENVIRONMENTAL RISK ASSESSMENT.),(HOUSE AGREED TO THE WALKER AMENDMENT THAT DIRECTS THE OFFICE OF SCIENCE AND TECHNOLOGY TO DEVELOP SPECIFIC CRITERIA AND PROCEDURES FOR THE EVALUATION OF ENVIRONMENTAL RISK ASSESSMENT,7,798,7,798
433,30841,103,1,950,RH1030950,"'RH1030950',","RH1030950,",7/28/94,1994,7,28,2,360,192,223,-0.042,0.023,-0.191,-0.109,-110.904,HR2448,Failed,NA,On Agreeing to the Amendment,"H.R.2448 BY MARKEY (D-MA) -- RADON AWARENESS AND DISCLOSURE ACT OF 1994 (HOUSE REJECTED THE OXLEY EN BLOC AMENDMENTS THAT SOUGHT TO ELIMINATE LANGUAGE REQUIRING THAT PROPERTY OWNERS, WHEN SELLING OR RENTING THEIR PROPERTIES, PROVIDE POTENTIAL BUYERS OR LESSEES WITH PAMPHLETS ON RADON HAZARDS; DISCLOSE THE RESULTS OF ANY KNOWN RADON TESTS PERFORMED ON THEIR PROPERTIES; AND INCLUDE IN ANY SALES CONTRACT A RADON WARNING STATEMENT AND BUYER ACKNOWLEDGEMENT STATEMENT THAT RADON INFORMATION WAS PROVIDED AND THAT THE BUYER WAS GIVEN AN OPPORTUNITY TO TEST THE PROPERTY FOR RADON; AND SEEKING TO REPLACE SUCH LANGUAGE WITH PROVISIONS REQUIRING THE ENVIRONMENTAL PROTECTION AGENCY TO DEVELOP A PROGRAM TO DISTRIBUTE PAMPHLETS TO HIGH RADON AREAS, AND COORDINATE WITH THE PRESIDENTIAL COMMISSION BEING CREATED TO ASSURE THE BROAD DISTRIBUTION OF RADON INFORMATION .)","RADON AWARENESS AND DISCLOSURE ACT OF 1994 (HOUSE REJECTED THE OXLEY EN BLOC AMENDMENTS THAT SOUGHT TO ELIMINATE LANGUAGE REQUIRING THAT PROPERTY OWNERS, WHEN SELLING OR RENTING THEIR PROPERTIES, PROVIDE POTENTIAL BUYERS OR LESSEES WITH PAMPHLETS ON RADON",7,708,7,708
434,30842,103,1,951,RH1030951,"'RH1030951',","RH1030951,",7/28/94,1994,7,28,2,361,255,164,0.113,-0.145,0.197,0.214,-105.736,HR2448,Passed,RADON AWARENESS AND DISCLOSURE,On Passage,"(HOUSE PASSED H.R. 2448, IMPROVING THE ACCURACY OF RADON TESTING PRODUCTS AND SERVICES, AND INCREASING TESTING FOR RADON. .)","(HOUSE PASSED H.R. 2448, IMPROVING THE ACCURACY OF RADON TESTING PRODUCTS AND SERVICES, AND INCREASING TESTING FOR RADON.",7,708,7,708
435,30918,103,1,1034,RH1031034,"'RH1031034',","RH1031034,",9/28/94,1994,9,28,2,445,177,243,0.026,0.046,-0.288,0.186,-38.412,HR3171,Failed,NA,On Agreeing to the Amendment,"H.R.3171 BY DE LA GARZA (D-TX) -- DEPARTMENT OF AGRICULTURE REORGANIZATION ACT OF 1994 (HOUSE REJECTED THE ALLARD AMENDMENT THAT SOUGHT TO ELIMINATE THE NEW AGRICULTURAL SERVICE AGENCY, BY LEAVING THE AGRICULTURAL STABILIZATION AND CONSERVATION SERVICE PROGRAMS, FMHA AGRICULTURAL LENDING PROGRAMS, AND FEDERAL CROP INSURANCE PROGRAMS WITHIN THE SEPARATE AGENCIES THAT NOW ADMINISTER THEM; BUT WOULD REQUIRE THAT THESE AGENCIES' FIELD OFFICES, ALONG WITH THE SOIL CONSERVATION SERVICE FIELD OFFICES BE """"""""""""""""CO-LOCATED"""""""""""""""" INTO A SINGLE POINT OF CONTACT FOR FARMERS.)","H.R.3171 BY DE LA GARZA (D-TX) -- DEPARTMENT OF AGRICULTURE REORGANIZATION ACT OF 1994 (HOUSE REJECTED THE ALLARD AMENDMENT THAT SOUGHT TO ELIMINATE THE NEW AGRICULTURAL SERVICE AGENCY, BY LEAVING THE AGRICULTURAL STABILIZATION AND CONSERVATION SERVICE",7,711,7,711
436,31082,104,1,161,RH1040161,"'RH1040161',","RH1040161,",2/24/95,1995,2,24,1,168,194,228,-0.194,-0.79,0.291,-0.357,-43.601,HR450,Failed,NA,On Agreeing to the Amendment,"(HOUSE REJECTED THE WISE AMENDMENT THAT SOUGHT TO EXEMPT RULEMAKING ACTIONS RELATING TO AIRCRAFT SAFETY, NUCLEAR WASTE DISPOSAL, AND MINE SAFETY FROM THE MORATORIUM.)","(HOUSE REJECTED THE WISE AMENDMENT THAT SOUGHT TO EXEMPT RULEMAKING ACTIONS RELATING TO AIRCRAFT SAFETY, NUCLEAR WASTE DISPOSAL, AND MINE SAFETY FROM THE MORATORIUM",7,704,7,704
437,31092,104,1,166,RH1040166,"'RH1040166',","RH1040166,",2/24/95,1995,2,24,1,173,172,250,-0.118,0.181,0.73,0.627,-27.735,HR450,Failed,Regulatory Transition Act of 1995,On Motion to Recommit with Instructions,(HOUSE REJECTED THE COLLINS OF ILLINOIS MOTION TO RECOMMIT THE BILL TO THE COMMITTEE ON GOVERNMENT REFORM AND OVERSIGHT WITH INSTRUCTIONS TO REPORT IT BACK FORTHWITH CONTAINING AN AMENDMENT TO EXEMPT FROM THE MORATORIUM ANY REGULATORY RULEMAKING BEGUN BY EPA BEFORE THE DATE OF ENACTMENT THAT RELATED TO CONTROL OF MICROBIAL AND DISINFECTION BY-PRODUCT RISKS IN DRINKING WATER SUPPLIES.),(HOUSE REJECTED THE COLLINS OF ILLINOIS MOTION TO RECOMMIT THE BILL TO THE COMMITTEE ON GOVERNMENT REFORM AND OVERSIGHT WITH INSTRUCTIONS TO REPORT IT BACK FORTHWITH CONTAINING AN AMENDMENT TO EXEMPT FROM THE MORATORIUM ANY REGULATORY RULEMAKING BEGUN B,7,701,7,701
438,31145,104,1,191,RH1040191,"'RH1040191',","RH1040191,",3/3/95,1995,3,3,1,198,180,239,-0.057,-0.098,0.314,0.065,-37.017,HR9,Failed,Job Creation and Wage Enhancement Act of 1995,On Motion to Recommit with Instructions,"H.R.9 BY ARCHER (R-TX) -- JOB CREATION AND WAGE ENHANCEMENT ACT OF 1995 PAPERWORK REDUCTION ACT OF 1995 PRIVATE PROPERTY PROTECTION ACT OF 1995 REGULATORY REFORM AND RELIEF ACT RISK ASSESSMENT AND COST-BENEFIT ACT OF 1995 RISK ASSESSMENT AND COMMUNICATION ACT OF 1995 (HOUSE REJECTED THE SPRATT MOTION TO RECOMMIT THE BILL TO THE COMMITTEE ON SCIENCE WITH INSTRUCTIONS TO REPORT IT BACK FORTHWITH CONTAINING AN AMENDMENT STRIKING LANGUAGE PROVIDING THAT ANY DETERMINATION BY A FEDERAL AGENCY TO APPROVE OR REJECT ANY PROPOSED OR FINAL ENVIRONMENTAL CLEAN-UP PLAN FOR A FACILITY THE COSTS OF WHICH ARE LIKELY TO EXCEED $5,000,000 BE TREATED AS A MAJOR RULE.)",JOB CREATION AND WAGE ENHANCEMENT ACT OF 1995 PAPERWORK REDUCTION ACT OF 1995 PRIVATE PROPERTY PROTECTION ACT OF 1995 REGULATORY REFORM AND RELIEF ACT RISK ASSESSMENT AND COST-BENEFIT ACT OF 1995 RISK ASSESSMENT AND COMMUNICATION ACT OF 1995 (HOUSE REJECT,7,704,7,704
439,31195,104,1,22,RH1040022,"'RH1040022',","RH1040022,",1/20/95,1995,1,20,1,23,173,249,-0.136,0.001,0.237,-0.148,-66.048,HR5,Failed,NA,On agreeing to the amendments en bloc,"(HOUSE REJECTED THE TAYLOR OF MISSISSIPPI EN BLOC AMENDMENT THAT SOUGHT TO PROVIDE THAT PROVISIONS WOULD NOT APPLY TO EXISTING LAWS AND REGULATIONS ESTABLISHING EFFLUENT LIMITATIONS RESTRICTING TYPES AND QUANTITIES OF POLLUTANTS THAT MAY BE DISCHARGED INTO U.S. WATERS BY SEWAGE TREATMENT PLANTS, FACTORIES, AND OTHER FACILITIES.)",(HOUSE REJECTED THE TAYLOR OF MISSISSIPPI EN BLOC AMENDMENT THAT SOUGHT TO PROVIDE THAT PROVISIONS WOULD NOT APPLY TO EXISTING LAWS AND REGULATIONS ESTABLISHING EFFLUENT LIMITATIONS RESTRICTING TYPES AND QUANTITIES OF POLLUTANTS THAT MAY BE DISCHARGED I,7,703,7,703
440,31246,104,1,25,RH1040025,"'RH1040025',","RH1040025,",1/23/95,1995,1,23,1,26,162,259,-0.157,0.059,0.328,0.198,-48.461,HR5,Failed,NA,On agreeing to the amendments en bloc,"(HOUSE REJECTED THE GENE GREEN OF TEXAS EN BLOC AMENDMENT THAT SOUGHT TO EXCLUDE FROM PROVISIONS ANY FEDERAL LAWS THAT REGULATE THE LICENSING, CONSTRUCTION, OR OPERATION OF NUCLEAR REACTORS, OR THE DISPOSAL OF NUCLEAR WASTE.)","(HOUSE REJECTED THE GENE GREEN OF TEXAS EN BLOC AMENDMENT THAT SOUGHT TO EXCLUDE FROM PROVISIONS ANY FEDERAL LAWS THAT REGULATE THE LICENSING, CONSTRUCTION, OR OPERATION OF NUCLEAR REACTORS, OR THE DISPOSAL OF NUCLEAR WASTE",7,704,7,704
441,31289,104,1,27,RH1040027,"'RH1040027',","RH1040027,",1/23/95,1995,1,23,1,28,161,263,-0.191,0.03,0.335,-0.085,-53.759,HR5,Failed,NA,On Agreeing to the Amendment,"(HOUSE REJECTED THE SPRATT AMENDMENT THAT SOUGHT TO EXEMPT FROM PROVISIONS ANY FEDERAL LAW THAT REGULATES THE GENERATION, TRANSPORTATION, STORAGE, OR DISPOSAL OF TOXIC, HAZARDOUS, OR RADIOACTIVE SUBSTANCES.)","(HOUSE REJECTED THE SPRATT AMENDMENT THAT SOUGHT TO EXEMPT FROM PROVISIONS ANY FEDERAL LAW THAT REGULATES THE GENERATION, TRANSPORTATION, STORAGE, OR DISPOSAL OF TOXIC, HAZARDOUS, OR RADIOACTIVE SUBSTANCES",7,704,7,704
442,31353,104,1,302,RH1040302,"'RH1040302',","RH1040302,",5/10/95,1995,5,10,1,311,414,4,0,0,0,0,0,HRES140,Passed,Providing for consideration of H.R. 961; Clean Water Amendments of 1995,On Agreeing to the Resolution,"H.RES.140 BY QUILLEN (R-TN) -- PROCEDURAL RESOLUTION - H.R. 961 (HOUSE PASSED H.RES. 140, THE RULE UNDER WHICH H.R. 961 WAS CONSIDERED.)","(HOUSE PASSED H.RES. 140, THE RULE UNDER WHICH H.R. 961 WAS CONSIDERED",7,710,7,701
443,31355,104,1,303,RH1040303,"'RH1040303',","RH1040303,",5/10/95,1995,5,10,1,312,184,242,0.092,-0.207,0.216,0.831,-104.226,HR961,Failed,NA,"On agreeing to the Substitute Amendment, as amended","H.R.961 BY SHUSTER (R-PA) -- CLEAN WATER AMENDMENTS OF 1995 COMPREHENSIVE WETLANDS CONSERVATION AND MANAGEMENT ACT OF 1995 (HOUSE REJECTED THE SAXTON AMENDMENT IN THE NATURE OF A SUBSTITUTE THAT SOUGHT TO RETAIN PROVISIONS REGARDING CLEAN WATER ACT FUNDING AUTHORIZATIONS, ASSISTANCE TO SMALL AND RURAL COMMUNITIES, CONTROL OF WATER POLLUTION FROM COMBINED SEWER OVERFLOWS (CSOS) AND CONSISTENCY OF STATE PROGRAMS WITH THE ENVIRONMENTAL PROTECTION AGENCY'S GREAT LAKES WATER QUALITY GUIDANCE; REPLACE WETLANDS LANGUAGE WITH PROVISIONS PROVIDING INCENTIVES FOR STATES TO ASSUME AUTHORITY OVER WETLANDS REGULATION THROUGH DELEGATION FROM EPA; EXPEDITE THE FEDERAL WETLANDS PERMITTING PROCESS; MAKE THE AGRICULTURE DEPARTMENT RESPONSIBLE FOR DETERMINING WHICH AREAS TO BE DESIGNATED WETLANDS ON ALL AGRICULTURE LANDS; REQUIRE THE ESTABLISHMENT OF A COORDINATING COMMITTEE OF FEDERAL, STATE AND LOCAL OFFICIALS TO HELP DEVELOP AND FIELDTEST NATIONAL WETLANDS POLICIES AND A STRATEGY FOR RESTORATION OF WETLANDS ECOSYSTEMS; STRIKE PROVISIONS ESTABLISHING NEW REQUIREMENTS TO COMPENSATE LANDOWNERS FOR LOSSES IN PROPERTY VALUE RESULTING FROM FEDERAL REGULATION; RETAIN THE SPECIAL RUNOFF CONTROL PROVISIONS CURRENTLY APPLICABLE TO COASTAL AREAS, BUT MODIFY THE CURRENT PROGRAM IN ACCORDANCE WITH RECOMMENDATIONS OF THE COASTAL STATES ORGANIZATION, ALLOW AFFECTED STATES TO TARGET RUNOFF CONTROL PROGRAMS TO THE AREAS MOST THREATENED BY POLLUTION AND GIVE GREATER AUTHORITY TO USE INCENTIVE-BASED PROGRAMS AND PLANNING AND MANAGEMENT MEASURES IN LIEU OF ENFORCEABLE REQUIREMENTS; RETAIN THE EXISTING STORM WATER MANAGEMENT PROGRAM, MAKING SEVERAL CHANGES IN THE PROGRAM, INCLUDING PLACING A TEN-YEAR MORATORIUM ON THE IMPLEMENTATION OF ANY NEW STORM WATER REQUIREMENTS FOR LIGHT INDUSTRIES OR COMMUNITIES WITH A POPULATION OF LESS THAN 100,000; AND PROHIBIT THE APPLICATION OF NUMERIC EFFLUENT LIMITS TO MUNICIPAL STORM WATER PERMITS.)","CLEAN WATER AMENDMENTS OF 1995 COMPREHENSIVE WETLANDS CONSERVATION AND MANAGEMENT ACT OF 1995 (HOUSE REJECTED THE SAXTON AMENDMENT IN THE NATURE OF A SUBSTITUTE THAT SOUGHT TO RETAIN PROVISIONS REGARDING CLEAN WATER ACT FUNDING AUTHORIZATIONS, ASSISTANCE",7,710,7,701
444,31357,104,1,304,RH1040304,"'RH1040304',","RH1040304,",5/10/95,1995,5,10,1,313,166,260,0.028,-0.434,0.229,0.399,-86.477,HR961,Failed,NA,On Agreeing to the Amendment,"(HOUSE REJECTED THE MINETA AMENDMENT THAT SOUGHT TO STRIKE LANGUAGE THAT WOULD REMOVE THE REQUIREMENT THAT EPA FIRST LIST A POLLUTANT BEFORE IT OR A STATE MAY ALLOW A PERMIT-HOLDER TO COMPLY WITH BEST PRACTICABLE CONTROL TECHNOLOGY OR WATER QUALITY STANDARDS IN LIEU OF BEST AVAILABLE TECHNOLOGY; STRIKE LANGUAGE THAT WOULD AUTHORIZE EPA OR STATES TO MODIFY EFFLUENT LIMITATIONS IN PERMITS FOR COAL REMINING, EVEN IF THE OPERATIONS EXCEED STATE WATER QUALITY STANDARDS IF THE RECEIVING WATERS DID NOT MEET WATER QUALITY STANDARDS PRIOR TO REMINING AND THE APPLICANT SUBMITS A PLAN CITING SPECIFIC MEASURES THAT WILL BE USED TO IMPROVE EXISTING WATER QUALITY; STRIKE LANGUAGE THAT WOULD STIPULATE THAT A COAL REMINING OPERATION THAT STARTED PRIOR TO THE ADOPTION OF NEW REGULATORY STANDARDS IS DEEMED TO BE IN COMPLIANCE AS LONG AS POST-MINING DISCHARGES ARE THE SAME OR BETTER THAN BEFORE MINING COMMENCED, AND REMINING WAS CONDUCTED UNDER A SURFACE MINING CONTROL AND RECLAMATION PERMIT; STRIKE LANGUAGE THAT WOULD PROVIDE FLEXIBILITY FOR PERMIT HOLDERS TO UNDERTAKE INNOVATIVE POLLUTION PREVENTION MEASURES; AND STRIKE LANGUAGE THAT WOULD REVISE THE STANDARDS AND PROCEDURES FOR DETERMINING WATER QUALITY STANDARDS ON A STATE AND FEDERAL LEVEL, BUT RETAIN LANGUAGE PROVIDING FOR A REVIEW OF SUCH PROPOSED REVISIONS BY THE ADMINISTRATION.)",(HOUSE REJECTED THE MINETA AMENDMENT THAT SOUGHT TO STRIKE LANGUAGE THAT WOULD REMOVE THE REQUIREMENT THAT EPA FIRST LIST A POLLUTANT BEFORE IT OR A STATE MAY ALLOW A PERMIT-HOLDER TO COMPLY WITH BEST PRACTICABLE CONTROL TECHNOLOGY OR WATER QUALITY STAN,7,700,7,700
445,31359,104,1,305,RH1040305,"'RH1040305',","RH1040305,",5/10/95,1995,5,10,1,314,224,199,0.137,-0.049,0.181,0.601,-126.655,HR961,Agreed to,NA,On Agreeing to the Amendment,"(HOUSE AGREED TO THE BOEHLERT AMENDMENT THAT STRIKES PROVISIONS FOLDING THE COASTAL ZONE MANAGEMENT PROGRAM INTO STATE NONPOINT SOURCE MANAGEMENT PROGRAMS AND, INSTEAD, REAUTHORIZES THE COASTAL ZONE ACT THROUGH FISCAL YEAR 2000, AMENDING IT TO REQUIRE THAT ANY STATE THAT HAS NOT RECEIVED FEDERAL APPROVAL FOR ITS CORE COASTAL MANAGEMENT PROGRAM SUBMIT A COASTAL NONPOINT PROGRAM WITHIN 30 MONTHS OF SUCH APPROVAL.)","(HOUSE AGREED TO THE BOEHLERT AMENDMENT THAT STRIKES PROVISIONS FOLDING THE COASTAL ZONE MANAGEMENT PROGRAM INTO STATE NONPOINT SOURCE MANAGEMENT PROGRAMS AND, INSTEAD, REAUTHORIZES THE COASTAL ZONE ACT THROUGH FISCAL YEAR 2000, AMENDING IT TO REQUIRE T",7,710,7,701
446,31361,104,1,306,RH1040306,"'RH1040306',","RH1040306,",5/11/95,1995,5,11,1,315,154,267,0.166,-0.986,0.231,0.406,-101.562,HR961,Failed,NA,On Agreeing to the Amendment,(HOUSE REJECTED THE PALLONE AMENDMENT THAT SOUGHT TO STRIKE LANGUAGE ADDRESSING SECONDARY TREATMENT REQUIREMENTS FOR SEWAGE TREATMENT PLANTS.),(HOUSE REJECTED THE PALLONE AMENDMENT THAT SOUGHT TO STRIKE LANGUAGE ADDRESSING SECONDARY TREATMENT REQUIREMENTS FOR SEWAGE TREATMENT PLANTS,7,703,7,703
447,31363,104,1,307,RH1040307,"'RH1040307',","RH1040307,",5/11/95,1995,5,11,1,316,159,258,-0.099,-0.09,0.215,0.378,-82.283,HR961,Failed,NA,On Agreeing to the Amendment,(HOUSE REJECTED THE MINETA AMENDMENT THAT SOUGHT TO REVISE LANGUAGE ADDRESSING STORMWATER MANAGEMENT PROVISIONS; LEAVE THE INDUSTRY UNDER THE STORMWATER DISCHARGE PERMIT SYSTEM; AND INCLUDE A MORATORIUM EXTENDING EPA'S DEADLINE FOR COMPLIANCE BY COMMERCIAL OPERATIONS.),(HOUSE REJECTED THE MINETA AMENDMENT THAT SOUGHT TO REVISE LANGUAGE ADDRESSING STORMWATER MANAGEMENT PROVISIONS; LEAVE THE INDUSTRY UNDER THE STORMWATER DISCHARGE PERMIT SYSTEM; AND INCLUDE A MORATORIUM EXTENDING EPA'S DEADLINE FOR COMPLIANCE BY COMMERC,7,701,7,701
448,31365,104,1,308,RH1040308,"'RH1040308',","RH1040308,",5/11/95,1995,5,11,1,317,175,251,0.002,-0.234,0.199,0.393,-101.289,HR961,Failed,NA,On Agreeing to the Amendment,"(HOUSE REJECTED THE PALLONE AMENDMENT THAT SOUGHT TO CHANGE THE BEACH WATER QUALITY MONITORING PROVISIONS AND PLACE NEW STANDARDS FOR ENVIRONMENTAL ASSESSMENT, CLOSURE PROCEDURES AND HEALTH STANDARDS FOR BEACHES.)","(HOUSE REJECTED THE PALLONE AMENDMENT THAT SOUGHT TO CHANGE THE BEACH WATER QUALITY MONITORING PROVISIONS AND PLACE NEW STANDARDS FOR ENVIRONMENTAL ASSESSMENT, CLOSURE PROCEDURES AND HEALTH STANDARDS FOR BEACHES",7,701,7,701
449,31367,104,1,309,RH1040309,"'RH1040309',","RH1040309,",5/11/95,1995,5,11,1,318,152,271,-0.196,0.093,0.24,0.19,-72.65,HR961,Failed,NA,On Agreeing to the Amendment,(HOUSE REJECTED THE MINETA AMENDMENT THAT SOUGHT TO REQUIRE THE EPA TO CONDUCT RISK ASSESSMENTS FOR THE PROPOSED REGULATORY REFORMS.),(HOUSE REJECTED THE MINETA AMENDMENT THAT SOUGHT TO REQUIRE THE EPA TO CONDUCT RISK ASSESSMENTS FOR THE PROPOSED REGULATORY REFORMS,7,701,7,701
450,31371,104,1,310,RH1040310,"'RH1040310',","RH1040310,",5/11/95,1995,5,11,1,319,153,271,-0.197,0.01,0.273,0.172,-66.831,HR961,Failed,NA,On agreeing to the amendments en bloc,"(HOUSE REJECTED THE COLLINS OF MICHIGAN EN BLOC AMENDMENT THAT SOUGHT TO REQUIRE THE EPA TO CONSIDER THE CONSUMPTION PATTERNS OF DIVERSE SEGMENTS OF THE POPULATION WHEN SETTING WATER QUALITY CRITERIA; TO POST WARNING SIGNS, PROPOSE AND ISSUE REGULATIONS ESTABLISHING MINIMUM UNIFORM REQUIREMENTS FOR WATERS THAT SIGNIFICANTLY VIOLATE WATER QUALITY STANDARDS OR ARE SUBJECT TO A FISHING OR SHELLFISH BAN, ADVISORY, OR CONSUMPTION RESTRICTION DUE TO CONTAMINATION; ESTABLISH WITHIN 18 MONTHS OF ENACTMENT, UNIFORM AND SCIENTIFICALLY SOUND REQUIREMENTS AND PROCEDURES FOR FISH AND SHELLFISH SAMPLING, MONITORING OF NAVIGABLE WATERS THAT DO NOT MEET APPLICABLE WATER QUALITY STANDARDS OR ARE SUBJECT TO FISHING BANS ADVISORIES, OR CONSUMPTION RESTRICTIONS; REVIEW FACILITY DISCHARGE PERMIT APPLICATIONS SO AS TO IDENTIFY AND REDUCE POLLUTION HAVING A DISPROPORTIONATELY HIGH AND ADVERSE IMPACT ON MINORITY AND LOW-INCOME POPULATIONS; AND COLLECT AND ANALYZE DATA ON SOURCES OF POLLUTION TO WHICH MINORITY AND LOW-INCOME POPULATIONS ARE EXPOSED, AND ON POLLUTANT DISCHARGES IN WATERS WHICH ARE ADJACENT TO AND OR USED BY MINORITY AND LOW-INCOME POPULATIONS.)","(HOUSE REJECTED THE COLLINS OF MICHIGAN EN BLOC AMENDMENT THAT SOUGHT TO REQUIRE THE EPA TO CONSIDER THE CONSUMPTION PATTERNS OF DIVERSE SEGMENTS OF THE POPULATION WHEN SETTING WATER QUALITY CRITERIA; TO POST WARNING SIGNS, PROPOSE AND ISSUE REGULATIONS",7,701,7,701
451,31373,104,1,311,RH1040311,"'RH1040311',","RH1040311,",5/11/95,1995,5,11,1,320,157,262,-0.195,0.182,0.336,0.525,-54.152,HR961,Failed,NA,On Agreeing to the Amendment,(HOUSE REJECTED THE MINETA AMENDMENT THAT SOUGHT TO MODIFY PROVISIONS RELATING TO RISK ASSESSMENT AND COST BENEFIT ANALYSIS REQUIREMENTS BY ESTABLISHING AN EFFECTIVE DATE OF ONE YEAR AFTER THE DATE OF ENACTMENT FOR ALL RISK ASSESSMENT COST-BENEFIT ANALYSIS.),(HOUSE REJECTED THE MINETA AMENDMENT THAT SOUGHT TO MODIFY PROVISIONS RELATING TO RISK ASSESSMENT AND COST BENEFIT ANALYSIS REQUIREMENTS BY ESTABLISHING AN EFFECTIVE DATE OF ONE YEAR AFTER THE DATE OF ENACTMENT FOR ALL RISK ASSESSMENT COST-BENEFIT ANALY,7,701,7,701
452,31375,104,1,312,RH1040312,"'RH1040312',","RH1040312,",5/11/95,1995,5,11,1,321,126,294,-0.208,-0.287,0.254,0.334,-78.252,HR961,Failed,NA,On Agreeing to the Amendment,(HOUSE REJECTED THE DEFAZIO AMENDMENT THAT SOUGHT TO EXEMPT CERTAIN NAVAL FACILITIES FROM ADHERING TO THE WATER QUALITY STANDARDS LANGUAGE.),(HOUSE REJECTED THE DEFAZIO AMENDMENT THAT SOUGHT TO EXEMPT CERTAIN NAVAL FACILITIES FROM ADHERING TO THE WATER QUALITY STANDARDS LANGUAGE,7,701,7,701
453,31377,104,1,313,RH1040313,"'RH1040313',","RH1040313,",5/11/95,1995,5,11,1,322,121,294,-0.319,0.139,0.275,0.314,-73.114,HR961,Failed,NA,On Agreeing to the Amendment,(HOUSE REJECTED THE NADLER AMENDMENT THAT SOUGHT TO STRIKE PROVISIONS WHICH ALLOW STATES TO DOWNGRADE DESIGNATED USES OF BODIES OF WATER IF THE COST OF ACHIEVING THE DESIGNATED USE STATUS EXCEEDS THE BENEFITS.),(HOUSE REJECTED THE NADLER AMENDMENT THAT SOUGHT TO STRIKE PROVISIONS WHICH ALLOW STATES TO DOWNGRADE DESIGNATED USES OF BODIES OF WATER IF THE COST OF ACHIEVING THE DESIGNATED USE STATUS EXCEEDS THE BENEFITS,7,710,7,701
454,31379,104,1,314,RH1040314,"'RH1040314',","RH1040314,",5/11/95,1995,5,11,1,323,122,290,-0.24,-0.146,0.237,0.335,-81.045,HR961,Failed,NA,On Agreeing to the Amendment,(HOUSE REJECTED THE OBERSTAR AMENDMENT THAT SOUGHT TO STRIKE PROVISIONS WHICH DELAY COMPLIANCE DEADLINES FOR STATE NON-POINT SOURCE POLLUTION CONTROL PROGRAMS BY ONE YEAR FOR EVERY YEAR IN WHICH THE BILL IS LESS THAN FULLY FUNDED.),(HOUSE REJECTED THE OBERSTAR AMENDMENT THAT SOUGHT TO STRIKE PROVISIONS WHICH DELAY COMPLIANCE DEADLINES FOR STATE NON-POINT SOURCE POLLUTION CONTROL PROGRAMS BY ONE YEAR FOR EVERY YEAR IN WHICH THE BILL IS LESS THAN FULLY FUNDED,7,701,7,701
455,31381,104,1,315,RH1040315,"'RH1040315',","RH1040315,",5/11/95,1995,5,11,1,324,106,299,-0.324,0.013,0.214,0.338,-92.194,HR961,Failed,NA,On Agreeing to the Amendment,(HOUSE REJECTED THE PALLONE AMENDMENT THAT SOUGHT TO ESTABLISH MANDATORY MINIMUM PENALTIES FOR VIOLATIONS TO THE CLEAN WATER ACT; TARGET REPEAT OFFENDERS BY INCREASING PENALTIES AND INSPECTION REQUIREMENTS FOR FACILITIES THAT REPEATEDLY VIOLATE THEIR PERMITS; TO AUTHORIZE CITIZENS TO SUE FOR VIOLATIONS AND PROHIBIT THE USE OF STATE ADMINISTRATIVE SETTLEMENTS AS A MEANS OF PRECLUDING CITIZEN SUITS AND ALLOW COURTS TO USE THE PROCEEDS OF SETTLEMENTS AND PENALTIES AGAINST POLLUTERS TO BE TARGETED FOR USE IN MITIGATION PROJECTS.),(HOUSE REJECTED THE PALLONE AMENDMENT THAT SOUGHT TO ESTABLISH MANDATORY MINIMUM PENALTIES FOR VIOLATIONS TO THE CLEAN WATER ACT; TARGET REPEAT OFFENDERS BY INCREASING PENALTIES AND INSPECTION REQUIREMENTS FOR FACILITIES THAT REPEATEDLY VIOLATE THEIR PE,7,700,7,700
456,31383,104,1,316,RH1040316,"'RH1040316',","RH1040316,",5/11/95,1995,5,11,1,325,156,247,0.031,-0.322,0.138,0.334,-141.551,HR961,Failed,NA,On Agreeing to the Amendment,(HOUSE REJECTED THE VISCLOSKY AMENDMENT THAT SOUGHT TO ESTABLISH A NATIONAL CLEAN WATER TRUST FUND.),(HOUSE REJECTED THE VISCLOSKY AMENDMENT THAT SOUGHT TO ESTABLISH A NATIONAL CLEAN WATER TRUST FUND,7,701,7,701
457,31385,104,1,317,RH1040317,"'RH1040317',","RH1040317,",5/11/95,1995,5,11,1,326,309,100,-0.345,-0.026,-0.213,-0.486,-90.307,HR961,Agreed to,NA,On Agreeing to the Amendment,(HOUSE AGREED TO THE LAUGHLIN SUBSTITUTE TO THE EMERSON AMENDMENT THAT PROVIDES THAT THE FEDERAL WATER POLLUTION CONTROL ACT DOES NOT APPLY WITH RESPECT TO THE LICENSING OF A HYDROELECTRIC PROJECT AND PROVIDES A DISPUTE RESOLUTION MECHANISM FOR THE PURPOSES OF RESOLVING CONFLICTS OR UNREASONABLE CONSEQUENCES RESULTING FROM ACTION TAKEN RELATING TO THE ISSUANCE OF A LICENSE FOR A HYDROELECTRIC PROJECT.),(HOUSE AGREED TO THE LAUGHLIN SUBSTITUTE TO THE EMERSON AMENDMENT THAT PROVIDES THAT THE FEDERAL WATER POLLUTION CONTROL ACT DOES NOT APPLY WITH RESPECT TO THE LICENSING OF A HYDROELECTRIC PROJECT AND PROVIDES A DISPUTE RESOLUTION MECHANISM FOR THE PURP,7,701,7,701
458,31387,104,1,318,RH1040318,"'RH1040318',","RH1040318,",5/12/95,1995,5,12,1,327,160,246,-0.433,0.901,-0.02,-0.134,-263.419,HR961,Failed,NA,On Agreeing to the Amendment,(HOUSE REJECTED THE BATEMAN SUBSTITUTE TO THE LIPINSKI AMENDMENT THAT SOUGHT TO CHANGE THE FORMULA FOR ALLOCATING SEWAGE TREATMENT PLANT CONSTRUCTION FUNDS.),(HOUSE REJECTED THE BATEMAN SUBSTITUTE TO THE LIPINSKI AMENDMENT THAT SOUGHT TO CHANGE THE FORMULA FOR ALLOCATING SEWAGE TREATMENT PLANT CONSTRUCTION FUNDS,7,703,7,703
459,31389,104,1,319,RH1040319,"'RH1040319',","RH1040319,",5/12/95,1995,5,12,1,328,247,154,-0.307,0.952,0.021,0.126,-258.132,HR961,Agreed to,NA,On Agreeing to the Amendment,(HOUSE AGREED TO THE LIPINSKI AMENDMENT THAT CHANGES THE FORMULA FOR ALLOCATING FEDERAL FUNDS FOR SEWAGE TREATMENT PLANT CONSTRUCTION AMONG STATES.),(HOUSE AGREED TO THE LIPINSKI AMENDMENT THAT CHANGES THE FORMULA FOR ALLOCATING FEDERAL FUNDS FOR SEWAGE TREATMENT PLANT CONSTRUCTION AMONG STATES,7,703,7,703
460,31393,104,1,320,RH1040320,"'RH1040320',","RH1040320,",5/12/95,1995,5,12,1,329,209,192,-0.187,0.823,-0.199,-0.274,-119.872,HR961,Agreed to,NA,On Agreeing to the Amendment,(HOUSE AGREED TO THE LARGENT AMENDMENT THAT REDUCES BY $1 BILLION THE AMOUNT APPROPRIATED FOR STATE WATER POLLUTION CONTROL REVOLVING FUNDS OVER THE NEXT FIVE YEARS; AND ELIMINATES THE STATE NONPOINT SOURCE WATER POLLUTION CONTROL REVOLVING FUNDS.),(HOUSE AGREED TO THE LARGENT AMENDMENT THAT REDUCES BY $1 BILLION THE AMOUNT APPROPRIATED FOR STATE WATER POLLUTION CONTROL REVOLVING FUNDS OVER THE NEXT FIVE YEARS; AND ELIMINATES THE STATE NONPOINT SOURCE WATER POLLUTION CONTROL REVOLVING FUNDS,7,701,7,701
461,31398,104,1,323,RH1040323,"'RH1040323',","RH1040323,",5/16/95,1995,5,16,1,332,185,242,-0.054,0.026,0.234,0.843,-99.036,HR961,Failed,NA,On Agreeing to the Amendment,"H.R.961 BY SHUSTER (R-PA) -- CLEAN WATER AMENDMENTS OF 1995 COMPREHENSIVE WETLANDS CONSERVATION AND MANAGEMENT ACT OF 1995 (HOUSE REJECTED THE BOEHLERT AMENDMENT THAT SOUGHT TO DEFINE """"""""""""""""WETLAND"""""""""""""""" MORE BROADLY AS ANY AREA THAT IS INUNDATED OR SATURATED BY SURFACE WATER OR GROUND WATER AT A FREQUENCY AND DURATION SUFFICIENT TO A PREVALENCE OF VEGETATION ADAPTED TO SUCH CONDITIONS; REQUIRE EPA TO INITIATE A NATIONAL WETLAND RESTORATION STRATEGY IN COOPERATION WITH OTHER FEDERAL AGENCIES, STATE, AND LOCAL GOVERNMENTS, AND THE PRIVATE SECTOR; DIRECT EPA TO ESTABLISH A WETLANDS COORDINATING COMMITTEE MADE UP OF FEDERAL, STATE, AND LOCAL GOVERNMENT OFFICIALS AND ASSOCIATIONS TO INTEGRATE CONSERVATION EFFORTS AMONG DIFFERENT LEVELS OF GOVERNMENT AND HELP DEVELOP NATIONAL WETLAND STRATEGY AND POLICY IMPLEMENTATION AND ADVISE EPA AND THE ARMY SECRETARY IN ADOPTING A REGULATORY PROGRAM; DIRECT EPA OR THE CORPS OF ENGINEERS, AS APPROPRIATE, TO PROVIDE TECHNICAL ASSISTANCE AND TRAINING TO STATE AND LOCAL GOVERNMENTS IN THE DEVELOPMENT AND IMPLEMENTATION OF WETLANDS PROTECTION; AUTHORIZE $15 MILLION ANNUALLY FOR FISCAL YEAR 1996 TO 2000 FOR EPA TO ESTABLISH DIRECT GRANTS TO STATES AND TRIBES FOR IMPLEMENTATION AND DEVELOPMENT OF WETLANDS STRATEGIES, ASSISTANCE TO REGIONAL AND LOCAL GOVERNMENTS TO PURSUE THE SAME OBJECTIVES, PROVIDE FINANCING OF STATE PERMITS IN SUPPORT OF FEDERAL WETLANDS PROJECTS WITH NO STATE RECEIVING MORE THAN $300,OOO OF EACH TYPE OF GRANT NOR MORE THAN $500,000 OVERALL AND WITH RECIPIENTS SHARING AT LEAST 25 PERCENT OF THE COSTS OF PROJECTS UNDERTAKEN.)",MORE BROADLY AS ANY AREA THAT IS INUNDATED OR SATURATED BY SURFACE WATER OR GROUND WATER A,7,710,7,701
462,31400,104,1,324,RH1040324,"'RH1040324',","RH1040324,",5/16/95,1995,5,16,1,333,180,247,-0.028,-0.068,0.175,0.722,-118.862,HR961,Failed,NA,On Agreeing to the Amendment,(HOUSE REJECTED THE GILCHREST AMENDMENT THAT SOUGHT TO STRIKE LANGUAGE THAT ESTABLISHES A NEW DEFINITION OF WHAT CONSTITUTES A WETLAND AS WELL AS ITS DETAILED WETLANDS CLASSIFICATION SYSTEM.),(HOUSE REJECTED THE GILCHREST AMENDMENT THAT SOUGHT TO STRIKE LANGUAGE THAT ESTABLISHES A NEW DEFINITION OF WHAT CONSTITUTES A WETLAND AS WELL AS ITS DETAILED WETLANDS CLASSIFICATION SYSTEM,7,710,7,701
463,31402,104,1,325,RH1040325,"'RH1040325',","RH1040325,",5/16/95,1995,5,16,1,334,181,243,0.063,-0.173,0.133,0.505,-150.02,HR961,Failed,NA,On Agreeing to the Amendment,(HOUSE REJECTED THE FRELINGHUYSEN AMENDMENT THAT SOUGHT TO ALLOW STATES THAT ARE ADMINISTERING THEIR OWN FEDERALLY APPROVED WETLANDS PERMIT PROGRAMS AS OF THE DATE OF ENACTMENT TO CONTINUE ADMINISTERING THEIR OWN PROGRAMS RATHER THAN THE NEW PROGRAM ESTABLISHED IN THE BILL.),(HOUSE REJECTED THE FRELINGHUYSEN AMENDMENT THAT SOUGHT TO ALLOW STATES THAT ARE ADMINISTERING THEIR OWN FEDERALLY APPROVED WETLANDS PERMIT PROGRAMS AS OF THE DATE OF ENACTMENT TO CONTINUE ADMINISTERING THEIR OWN PROGRAMS RATHER THAN THE NEW PROGRAM EST,7,710,7,701
464,31404,104,1,326,RH1040326,"'RH1040326',","RH1040326,",5/16/95,1995,5,16,1,335,158,270,-0.211,0.176,0.289,0.611,-72.033,HR961,Failed,NA,On Agreeing to the Amendment,"(HOUSE REJECTED THE WYDEN AMENDMENT THAT SOUGHT TO PROVIDE THAT THE FEDERAL GOVERNMENT WOULD NOT HAVE TO PAY COMPENSATION FOR LOSSES IN PROPERTY VALUE CAUSED BY WETLANDS REGULATION IN CASES WHERE FAILURE TO ENFORCE SUCH REGULATIONS IS LIKELY TO REDUCE THE FAIR MARKET VALUE OF ONE OR MORE PRIVATE HOMES BY $10,000 MORE.)",(HOUSE REJECTED THE WYDEN AMENDMENT THAT SOUGHT TO PROVIDE THAT THE FEDERAL GOVERNMENT WOULD NOT HAVE TO PAY COMPENSATION FOR LOSSES IN PROPERTY VALUE CAUSED BY WETLANDS REGULATION IN CASES WHERE FAILURE TO ENFORCE SUCH REGULATIONS IS LIKELY TO REDUCE T,7,710,7,701
465,31406,104,1,327,RH1040327,"'RH1040327',","RH1040327,",5/16/95,1995,5,16,1,336,169,256,-0.218,0.464,0.321,0.452,-60.298,HR961,Failed,Clean Water Amendments of 1995,On Motion to Recommit with Instructions,(HOUSE REJECTED THE BONIOR MOTION TO RECOMMIT THE BILL TO THE COMMITTEE ON TRANSPORTATION AND INFRASTRUCTURE WITH INSTRUCTIONS TO REPORT THE BILL BACK TO THE HOUSE ADDING PROVISIONS INCLUDING STANDARDS FOR THE DISCHARGE OF INDUSTRIAL POLLUTION INTO WATER; ADDITIONAL WATER POLLUTION AND CONTROL PROTECTIONS FOR PUBLIC WATER SUPPLIES WHICH ARE USED FOR DRINKING; AND A REPORT BY THE CONGRESSIONAL BUDGET OFFICE ON THE IMPLICATIONS OF THIS BILL WITH REGARDS TO THE UNFUNDED MANDATES REFORM ACT.),(HOUSE REJECTED THE BONIOR MOTION TO RECOMMIT THE BILL TO THE COMMITTEE ON TRANSPORTATION AND INFRASTRUCTURE WITH INSTRUCTIONS TO REPORT THE BILL BACK TO THE HOUSE ADDING PROVISIONS INCLUDING STANDARDS FOR THE DISCHARGE OF INDUSTRIAL POLLUTION INTO WATE,7,701,7,701
466,31408,104,1,328,RH1040328,"'RH1040328',","RH1040328,",5/16/95,1995,5,16,1,337,240,185,-0.049,0.025,-0.21,-0.639,-102.804,HR961,Passed,Clean Water Amendments of 1995,On Passage,"(HOUSE PASSED H.R. 961, TO AMEND THE FEDERAL WATER POLLUTION CONTROL ACT.)","(HOUSE PASSED H.R. 961, TO AMEND THE FEDERAL WATER POLLUTION CONTROL ACT",7,701,7,701
467,31735,104,1,490,RH1040490,"'RH1040490',","RH1040490,",7/13/95,1995,7,13,1,503,132,289,0.587,-0.575,-0.114,-0.181,-231.647,HR1977,Failed,NA,On Agreeing to the Amendment,"(HOUSE REJECTED THE NEUMANN AMENDMENT THAT SOUGHT TO STRIKE THE $600,000 APPROPRIATION TO CARRY OUT THE AFRICAN ELEPHANT CONSERVATION ACT AND THE $200,000 APPROPRIATION FOR THE RHINOCEROS AND TIGER CONSERVATION FUND.)","(HOUSE REJECTED THE NEUMANN AMENDMENT THAT SOUGHT TO STRIKE THE $600,000 APPROPRIATION TO CARRY OUT THE AFRICAN ELEPHANT CONSERVATION ACT AND THE $200,000 APPROPRIATION FOR THE RHINOCEROS AND TIGER CONSERVATION FUND",7,709,7,709
468,31746,104,1,497,RH1040497,"'RH1040497',","RH1040497,",7/13/95,1995,7,13,1,510,281,117,-0.272,-0.077,-0.247,-0.222,-74.496,HR1977,Agreed to,NA,On Agreeing to the Amendment,"(HOUSE AGREED TO THE YOUNG OF ALASKA AMENDMENT THAT LIMITS THE FISH AND WILDLIFE SERVICE TO THE PURCHASE OF 54 PASSENGER VEHICLES RATHER THAN 59 POLICE-TYPE AND 88 REPLACEMENT VEHICLES, STRIKES LANGUAGE PERMITTING FWS TO ACCEPT DONATED AIRCRAFT AS REPLACEMENTS, REDUCES THE FWS RESOURCE MANAGEMENT ACCOUNT BY $885,000, AND INCREASES THE APPROPRIATION FOR OPERATION OF INDIAN PROGRAMS BY $851,000.)","(HOUSE AGREED TO THE YOUNG OF ALASKA AMENDMENT THAT LIMITS THE FISH AND WILDLIFE SERVICE TO THE PURCHASE OF 54 PASSENGER VEHICLES RATHER THAN 59 POLICE-TYPE AND 88 REPLACEMENT VEHICLES, STRIKES LANGUAGE PERMITTING FWS TO ACCEPT DONATED AIRCRAFT AS REPLA",7,709,7,709
469,31863,104,1,55,RH1040055,"'RH1040055',","RH1040055,",1/30/95,1995,1,30,1,60,114,312,-0.335,0.014,0.253,-0.026,-102.534,HR5,Failed,NA,on agreeing to the amendment,(HOUSE REJECTED THE VOLKMER AMENDMENT TO THE BORSKI AMENDMENT THAT SOUGHT TO ADD 5 REPRODUCTIVE DISORDERS TO THE LIST OF HEALTH ILLNESSES AFFECTED BY WATER POLLUTION.),(HOUSE REJECTED THE VOLKMER AMENDMENT TO THE BORSKI AMENDMENT THAT SOUGHT TO ADD 5 REPRODUCTIVE DISORDERS TO THE LIST OF HEALTH ILLNESSES AFFECTED BY WATER POLLUTION,7,701,7,701
470,31865,104,1,550,RH1040550,"'RH1040550',","RH1040550,",7/25/95,1995,7,25,1,563,179,245,-0.088,-0.018,0.294,0.024,-41.88,HR1943,Failed,To amend the Federal Water Pollution Control Act,On Motion to Recommit with Instructions,H.R.1943 BY BILBRAY (R-CA) -- SAN DIEGO COASTAL CORRECTIONS ACT OF 1995 (HOUSE REJECTED THE MINETA MOTION TO RECOMMIT THE BILL TO THE COMMITTEE ON TRANSPORTATION WITH INSTRUCTIONS TO REPORT THE BILL BACK FORTHWITH CONTAINING AN AMENDMENT THAT PROVIDES THAT CHEMICALLY ENHANCED PRIMARY TREATMENT RESULT IN THE REMOVAL OF NOT LESS THAN 58 PERCENT OF THE BIOLOGICAL OXYGEN DEMAND ON AN ANNUAL AVERAGE AND NOT LESS THAN 80 PERCENT OF THE TOTAL SUSPENDED SOLIDS ON A MONTHLY AVERAGE.),SAN DIEGO COASTAL CORRECTIONS ACT OF 1995 (HOUSE REJECTED THE MINETA MOTION TO RECOMMIT THE BILL TO THE COMMITTEE ON TRANSPORTATION WITH INSTRUCTIONS TO REPORT THE BILL BACK FORTHWITH CONTAINING AN AMENDMENT THAT PROVIDES THAT CHEMICALLY ENHANCED PRIMARY,7,710,7,701
471,31867,104,1,551,RH1040551,"'RH1040551',","RH1040551,",7/25/95,1995,7,25,1,564,269,156,-0.165,-0.076,-0.184,-0.117,-100.131,HR1943,Passed,To amend the Federal Water Pollution Control Act,On Passage,"(HOUSE PASSED H.R. 1943, TO AMEND THE FEDERAL WATER POLLUTION CONTROL ACT TO DEEM CERTAIN MUNICIPAL WASTEWATER TREATMENT FACILITIES DISCHARGING INTO OCEAN WATERS AS THE EQUIVALENT OF SECONDARY TREATMENT FACILITIES.)","(HOUSE PASSED H.R. 1943, TO AMEND THE FEDERAL WATER POLLUTION CONTROL ACT TO DEEM CERTAIN MUNICIPAL WASTEWATER TREATMENT FACILITIES DISCHARGING INTO OCEAN WATERS AS THE EQUIVALENT OF SECONDARY TREATMENT FACILITIES",7,701,7,701
472,31884,104,1,56,RH1040056,"'RH1040056',","RH1040056,",1/30/95,1995,1,30,1,61,162,263,-0.183,0.021,0.279,-0.003,-63.493,HR5,Failed,NA,On agreeing to the amendments en bloc,"(HOUSE REJECTED THE BORSKI AMENDMENT EN BLOC THAT SOUGHT TO PROVIDE THAT PROVISIONS NOT APPLY TO LAWS OR REGULATIONS THAT ENFORCE OR ESTABLISH LIMITS ON THE INTRODUCTION INTO UNITED STATES WATER OF POLLUTANTS THAT CAUSE SIGNIFICANT ADVERSE ACUTE EFFECTS ON HUMAN HEALTH, CANCER, DEVELOPMENTAL MALFORMATION, REPRODUCTIVE DYSFUNCTIONS, NEUROLOGICAL DISORDERS, GENETIC MUTATIONS OR OTHER CHRONIC EFFECTS ON HUMAN HEALTH WHICH ARE SERIOUS OR IRREVERSIBLE.)",(HOUSE REJECTED THE BORSKI AMENDMENT EN BLOC THAT SOUGHT TO PROVIDE THAT PROVISIONS NOT APPLY TO LAWS OR REGULATIONS THAT ENFORCE OR ESTABLISH LIMITS ON THE INTRODUCTION INTO UNITED STATES WATER OF POLLUTANTS THAT CAUSE SIGNIFICANT ADVERSE ACUTE EFFECTS,7,701,7,701
473,31940,104,1,585,RH1040585,"'RH1040585',","RH1040585,",7/28/95,1995,7,28,1,599,212,206,0.063,0.035,0.259,0.825,-96.368,HR2099,Agreed to,NA,On Agreeing to the Amendment,"(HOUSE AGREED TO THE STOKES AMENDMENT THAT STRIKES LANGUAGE THAT PROHIBITS OR LIMITS THE ENVIRONMENTAL PROTECTION AGENCY'S ABILITY TO PROMULGATE, ENFORCE, IMPLEMENT, OR TAKE CERTAIN ACTIONS AUTHORIZED UNDER ENVIRONMENTAL LAWS, INCLUDING THE CLEAN AIR ACT, CLEAN WATER ACT, AND FOOD SAFETY LAWS.)","(HOUSE AGREED TO THE STOKES AMENDMENT THAT STRIKES LANGUAGE THAT PROHIBITS OR LIMITS THE ENVIRONMENTAL PROTECTION AGENCY'S ABILITY TO PROMULGATE, ENFORCE, IMPLEMENT, OR TAKE CERTAIN ACTIONS AUTHORIZED UNDER ENVIRONMENTAL LAWS, INCLUDING THE CLEAN AIR AC",7,700,7,700
474,31945,104,1,588,RH1040588,"'RH1040588',","RH1040588,",7/31/95,1995,7,31,1,602,188,228,0.103,-0.182,0.243,0.631,-90.166,HR2099,Failed,NA,On Agreeing to the Amendment,"H.R.2099 BY LEWIS, JERRY (R-CA) -- DEPARTMENTS OF VETERANS AFFAIRS AND HOUSING AND URBAN DEVELOPMENT, AND INDEPENDENT AGENCIES APPROPRIATIONS ACT, 1996 (HOUSE REJECTED THE DURBIN AMENDMENT THAT SOUGHT TO PROVIDE THAT ANY LIMITATION ON USE OF EPA FUNDS WOULD NOT APPLY TO THE AGENCY'S ENVIRONMENTAL PROGRAMS AND COMPLIANCE PROVISIONS WHEN IT IS MADE KNOWN THAT THE LIMITATION WOULD RESTRICT THE AGENCY'S ABILITY TO PROTECT HUMANS AGAINST EXPOSURE TO ARSENIC, BENZENE, DIOXIN, LEAD, OR ANY KNOWN CARCINOGEN.)","DEPARTMENTS OF VETERANS AFFAIRS AND HOUSING AND URBAN DEVELOPMENT, AND INDEPENDENT AGENCIES APPROPRIATIONS ACT, 1996 (HOUSE REJECTED THE DURBIN AMENDMENT THAT SOUGHT TO PROVIDE THAT ANY LIMITATION ON USE OF EPA FUNDS WOULD NOT APPLY TO THE AGENCY'S ENVIRO",7,700,7,700
475,31947,104,1,589,RH1040589,"'RH1040589',","RH1040589,",7/31/95,1995,7,31,1,603,155,261,0.181,-0.983,0.247,0.409,-92.002,HR2099,Failed,NA,On Agreeing to the Amendment,(HOUSE REJECTED THE DINGELL AMENDMENT THAT SOUGHT TO INCREASE FUNDING FOR THE SUPERFUND PROGRAM BY $440 MILLION AND REDUCE FUNDING FOR FEMA DISASTER RELIEF BY $186 MILLION.),(HOUSE REJECTED THE DINGELL AMENDMENT THAT SOUGHT TO INCREASE FUNDING FOR THE SUPERFUND PROGRAM BY $440 MILLION AND REDUCE FUNDING FOR FEMA DISASTER RELIEF BY $186 MILLION,7,704,7,704
476,31953,104,1,591,RH1040591,"'RH1040591',","RH1040591,",7/31/95,1995,7,31,1,605,210,210,0.046,0.064,0.255,0.781,-97.395,HR2099,Failed,NA,On Agreeing to the Amendment,"(ON A DEMAND FOR A SEPARATE VOTE, HOUSE REJECTED THE STOKES AMENDMENT THAT SOUGHT TO STRIKE LANGUAGE THAT PROHIBITS OR LIMITS EPA'S ABILITY TO PROMULGATE, ENFORCE, IMPLEMENT, OR TAKE CERTAIN ACTIONS AUTHORIZED UNDER ENVIRONMENTAL LAWS AND FOOD SAFETY LAWS.)","(ON A DEMAND FOR A SEPARATE VOTE, HOUSE REJECTED THE STOKES AMENDMENT THAT SOUGHT TO STRIKE LANGUAGE THAT PROHIBITS OR LIMITS EPA'S ABILITY TO PROMULGATE, ENFORCE, IMPLEMENT, OR TAKE CERTAIN ACTIONS AUTHORIZED UNDER ENVIRONMENTAL LAWS AND FOOD SAFETY LA",7,700,7,700
477,31955,104,1,592,RH1040592,"'RH1040592',","RH1040592,",7/31/95,1995,7,31,1,606,198,222,0.129,-0.213,0.246,0.55,-88.366,HR2099,Failed,"VA, HUD, Appropriations for Fiscal Year 1996",On Motion to Recommit with Instructions,"(HOUSE REJECTED THE STOKES MOTION TO RECOMMIT THE BILL TO THE COMMITTEE ON APPROPRIATIONS WITH INSTRUCTIONS TO REPORT IT BACK FORTHWITH CONTAINING AN AMENDMENT THAT PROVIDES LIMITATIONS PLACED ON EPA ACTIVITIES WOULD NOT APPLY WHEN IT IS MADE KNOWN THAT THE LIMITATION WOULD RESTRICT THE ABILITY OF EPA TO PROTECT HUMANS AGAINST EXPOSURE TO ARSENIC, BENZENE, DIOXIN, LEAD, OR ANY KNOWN CARCINOGEN.)",(HOUSE REJECTED THE STOKES MOTION TO RECOMMIT THE BILL TO THE COMMITTEE ON APPROPRIATIONS WITH INSTRUCTIONS TO REPORT IT BACK FORTHWITH CONTAINING AN AMENDMENT THAT PROVIDES LIMITATIONS PLACED ON EPA ACTIVITIES WOULD NOT APPLY WHEN IT IS MADE KNOWN THAT,7,700,7,700
478,31972,104,1,60,RH1040060,"'RH1040060',","RH1040060,",1/30/95,1995,1,30,1,65,127,297,-0.302,0.004,0.314,0.016,-79.066,HR5,Failed,NA,On agreeing to the amendments en bloc,"(HOUSE REJECTED THE CLAY EN BLOC AMENDMENT THAT SOUGHT TO PROVIDE THAT PROVISIONS NOT APPLY TO LAWS OR REGULATIONS THAT PROTECT SCHOOL CHILDREN FROM EXPOSURE TO DANGEROUS CONDITIONS IN SCHOOLS, INCLUDING EXPOSURE TO ASBESTOS AND LEAD PAINT.)","(HOUSE REJECTED THE CLAY EN BLOC AMENDMENT THAT SOUGHT TO PROVIDE THAT PROVISIONS NOT APPLY TO LAWS OR REGULATIONS THAT PROTECT SCHOOL CHILDREN FROM EXPOSURE TO DANGEROUS CONDITIONS IN SCHOOLS, INCLUDING EXPOSURE TO ASBESTOS AND LEAD PAINT",7,708,7,708
479,32048,104,1,655,RH1040655,"'RH1040655',","RH1040655,",9/19/95,1995,9,19,1,669,176,243,-0.12,0.993,-0.091,-0.139,-228.173,HR558,Failed,Texas Low-Level radioactive Waste Compact Consent Act,On Motion to Suspend the Rules and Pass,"H.R.558 BY FIELDS, JACK (R-TX) -- TEXAS LOW-LEVEL RADIOACTIVE WASTE DISPOSAL COMPACT CONSENT ACT (HOUSE FAILED TO SUSPEND THE RULES AND PASS H.R. 558, TO GRANT THE CONSENT OF THE CONGRESS TO THE TEXAS LOW-LEVEL RADIOACTIVE WASTE DISPOSAL COMPACT.)","TEXAS LOW-LEVEL RADIOACTIVE WASTE DISPOSAL COMPACT CONSENT ACT (HOUSE FAILED TO SUSPEND THE RULES AND PASS H.R. 558, TO GRANT THE CONSENT OF THE CONGRESS TO THE TEXAS LOW-LEVEL RADIOACTIVE WASTE DISPOSAL COMPACT",7,704,7,704
480,32088,104,1,693,RH1040693,"'RH1040693',","RH1040693,",10/12/95,1995,10,12,1,709,199,215,0.058,0.03,0.268,0.364,-69.96,HR2405,Failed,NA,On Agreeing to the Amendment,"H.R.2405 BY WALKER (R-PA) -- OMNIBUS CIVILIAN SCIENCE AUTHORIZATION ACT OF 1995 NATIONAL SCIENCE FOUNDATION AUTHORIZATION ACT OF 1995 NATIONAL AERONAUTICS AND SPACE ADMINISTRATION AUTHORIZATION ACT, FISCAL YEAR 1996 DEPARMTMENT OF ENERGY CIVILIAN RESEARCH AND DEVELOPMENT ACT OF 1995 NATIONAL OCEANIC AND ATMOSPHERIC ADMINISTRATION AUTHORIZATION ACT OF 1995 ENVIRONMENTAL RESEARCH, DEVELOPMENT, AND DEMONSTRATION AUTHORIZATION ACT OF 1995 AMERICAN TECHNOLOGY ADVANCEMENT ACT OF 1995 FIRE ADMINISTRATION AUTHORIZATION ACT OF 1995 (HOUSE REJECTED THE LOFGREN AMENDMENT THAT SOUGHT TO STRIKE LANGUAGE PROHIBITING USE OF FUNDS FOR EPA'S CLIMATE CHANGE ACTION PLAN.)","OMNIBUS CIVILIAN SCIENCE AUTHORIZATION ACT OF 1995 NATIONAL SCIENCE FOUNDATION AUTHORIZATION ACT OF 1995 NATIONAL AERONAUTICS AND SPACE ADMINISTRATION AUTHORIZATION ACT, FISCAL YEAR 1996 DEPARMTMENT OF ENERGY CIVILIAN RESEARCH AND DEVELOPMENT ACT OF 1995",7,700,7,700
481,32089,104,1,694,RH1040694,"'RH1040694',","RH1040694,",10/12/95,1995,10,12,1,710,195,218,-0.133,0.611,0.222,0.315,-99.443,HR2405,Failed,NA,On Agreeing to the Amendment,(HOUSE REJECTED THE KENNEDY OF MASSACHUSETTS AMENDMENT THAT SOUGHT TO STRIKE LANGUAGE PROHIBITING USE OF FUNDS TO CONDUCT INDOOR AIR POLLUTION RESEARCH.),(HOUSE REJECTED THE KENNEDY OF MASSACHUSETTS AMENDMENT THAT SOUGHT TO STRIKE LANGUAGE PROHIBITING USE OF FUNDS TO CONDUCT INDOOR AIR POLLUTION RESEARCH,7,708,7,708
482,32090,104,1,695,RH1040695,"'RH1040695',","RH1040695,",10/12/95,1995,10,12,1,711,189,219,0.068,-0.111,0.26,0.125,-58.129,HR2405,Failed,NA,On Agreeing to the Amendment,(HOUSE REJECTED THE BROWN OF CALIFORNIA AMENDMENT THAT SOUGHT TO STRIKE LANGUAGE PROHIBITING USE OF FUNDS FOR EPA'S ENVIRONMENTAL TECHNOLOGY INITIATIVE PROGRAM.),(HOUSE REJECTED THE BROWN OF CALIFORNIA AMENDMENT THAT SOUGHT TO STRIKE LANGUAGE PROHIBITING USE OF FUNDS FOR EPA'S ENVIRONMENTAL TECHNOLOGY INITIATIVE PROGRAM,7,700,7,700
483,32101,104,1,703,RH1040703,"'RH1040703',","RH1040703,",10/18/95,1995,10,18,1,719,294,129,0.152,0.302,0.132,0.509,-158.288,HR39,Agreed to,NA,On Agreeing to the Amendment,(HOUSE AGREED TO THE GOSS AMENDMENT THAT STRIKES PROVISIONS THAT WOULD PREVENT THE COMMERCE DEPARTMENT FROM REQUIRING SHRIMP FISHERMEN TO USE DEVICES WHICH WOULD REDUCE INCIDENTAL KILLING OF NON-TARGET SPECIES.),(HOUSE AGREED TO THE GOSS AMENDMENT THAT STRIKES PROVISIONS THAT WOULD PREVENT THE COMMERCE DEPARTMENT FROM REQUIRING SHRIMP FISHERMEN TO USE DEVICES WHICH WOULD REDUCE INCIDENTAL KILLING OF NON-TARGET SPECIES,7,709,7,709
484,32102,104,1,704,RH1040704,"'RH1040704',","RH1040704,",10/18/95,1995,10,18,1,720,388,37,0.012,0.975,0.047,0.462,-105.332,HR39,Passed,Fisheries Conservation and Management Amendments,On Passage,"(HOUSE PASSED H.R. 39, TO AMEND THE MAGNUSON FISHERY CONSERVATION AND MANAGEMENT ACT TO IMPROVE FISHERIES MANAGEMENT.)","(HOUSE PASSED H.R. 39, TO AMEND THE MAGNUSON FISHERY CONSERVATION AND MANAGEMENT ACT TO IMPROVE FISHERIES MANAGEMENT",7,709,7,709
485,32147,104,1,745,RH1040745,"'RH1040745',","RH1040745,",11/2/95,1995,11,2,1,762,227,194,0.033,0.157,0.216,0.697,-112.258,HR2099,Passed,"VA, HUD, Appropriations for Fiscal Year 1996",motion to instruct conferees,"(HOUSE AGREED TO THE STOKES MOTION TO INSTRUCT HOUSE CONFEREES TO AGREE TO THE SENATE AMENDMENT NUMBERED 66, STRIKING CERTAIN PROVISIONS LIMITING USE OF FUNDS APPROPRIATED TO THE ENVIRONMENTAL PROTECTION AGENCY.)","(HOUSE AGREED TO THE STOKES MOTION TO INSTRUCT HOUSE CONFEREES TO AGREE TO THE SENATE AMENDMENT NUMBERED 66, STRIKING CERTAIN PROVISIONS LIMITING USE OF FUNDS APPROPRIATED TO THE ENVIRONMENTAL PROTECTION AGENCY",7,700,7,700
486,32240,104,1,827,RH1040827,"'RH1040827',","RH1040827,",12/12/95,1995,12,12,1,845,412,0,0,0,0,0,0,HR2243,Passed,Trinity River Basin Fish and Wildlife Management Reauthorization,"Suspend the rules and pass, as amended","H.R.2243 BY RIGGS (R-CA) -- TRINITY RIVER BASIN FISH AND WILDLIFE MANAGEMENT REAUTHORIZATION ACT OF 1995 (HOUSE VOTED TO SUSPEND THE RULES AND PASS H.R. 2243, AMENDED, TO AMEND THE TRINITY RIVER BASIN FISH AND WILDLIFE MANAGEMENT ACT OF 1984, TO EXTEND FOR THREE YEARS THE AVAILABILITY OF MONEYS FOR THE RESTORATION OF FISH AND WILDLIFE IN THE TRINITY RIVER.)","TRINITY RIVER BASIN FISH AND WILDLIFE MANAGEMENT REAUTHORIZATION ACT OF 1995 (HOUSE VOTED TO SUSPEND THE RULES AND PASS H.R. 2243, AMENDED, TO AMEND THE TRINITY RIVER BASIN FISH AND WILDLIFE MANAGEMENT ACT OF 1984, TO EXTEND FOR THREE YEARS THE AVAILABIL",7,709,7,709
487,32506,104,1,1073,RH1041073,"'RH1041073',","RH1041073,",5/30/96,1996,5,30,2,207,197,211,-0.079,0.928,0.246,0.185,-87.361,HR3322,Failed,NA,On Agreeing to the Amendment,(HOUSE REJECTED THE LOFGREN AMENDMENT THAT SOUGHT TO REMOVE THE PROHIBITION ON FUNDING AUTHORIZED FOR THE CLIMATE CHANGE ACTION PLAN.),(HOUSE REJECTED THE LOFGREN AMENDMENT THAT SOUGHT TO REMOVE THE PROHIBITION ON FUNDING AUTHORIZED FOR THE CLIMATE CHANGE ACTION PLAN,7,700,7,700
488,32507,104,1,1074,RH1041074,"'RH1041074',","RH1041074,",5/30/96,1996,5,30,2,208,192,209,0.075,-0.024,0.226,0.146,-73.231,HR3322,Failed,NA,On Agreeing to the Amendment,(HOUSE REJECTED THE JACKSON-LEE AMENDMENT THAT SOUGHT TO REMOVE THE PROHIBITION ON FUNDING AUTHORIZED FOR THE ENVIRONMENTAL TECHNOLOGY INITIATIVE.),(HOUSE REJECTED THE JACKSON-LEE AMENDMENT THAT SOUGHT TO REMOVE THE PROHIBITION ON FUNDING AUTHORIZED FOR THE ENVIRONMENTAL TECHNOLOGY INITIATIVE,7,798,7,798
489,32550,104,1,1119,RH1041119,"'RH1041119',","RH1041119,",6/19/96,1996,6,19,2,253,257,164,0.013,0.334,0.198,0.666,-122.879,HR3662,Agreed to,NA,On Agreeing to the Amendment,(HOUSE AGREED TO THE DICKS AMENDMENT THAT STRIKES LANGUAGE DEALING WITH LIMITATIONS ON THE DESIGNATION OF A CRITICAL HABITAT FOR THE MARBLED MURRELET.),(HOUSE AGREED TO THE DICKS AMENDMENT THAT STRIKES LANGUAGE DEALING WITH LIMITATIONS ON THE DESIGNATION OF A CRITICAL HABITAT FOR THE MARBLED MURRELET,7,709,7,709
490,32551,104,1,1120,RH1041120,"'RH1041120',","RH1041120,",6/19/96,1996,6,19,2,254,200,220,0.049,-0.066,0.128,0.411,-159.105,HR3662,Failed,NA,On Agreeing to the Amendment,(HOUSE REJECTED THE RICHARDSON AMENDMENT THAT SOUGHT TO INCREASE FUNDING FOR THE FISH AND WILDLIFE SERVICE BY $5 MILLION AND REDUCE FOSSIL ENERGY RESEARCH AND DEVELOPMENT FUNDING ACCORDINGLY.),(HOUSE REJECTED THE RICHARDSON AMENDMENT THAT SOUGHT TO INCREASE FUNDING FOR THE FISH AND WILDLIFE SERVICE BY $5 MILLION AND REDUCE FOSSIL ENERGY RESEARCH AND DEVELOPMENT FUNDING ACCORDINGLY,7,709,7,709
491,32571,104,1,1141,RH1041141,"'RH1041141',","RH1041141,",6/26/96,1996,6,26,2,275,260,157,-0.245,0.761,-0.11,-0.04,-205.302,HR3666,Agreed to,NA,On Agreeing to the Amendment,(HOUSE AGREED TO THE HEFLEY AMENDMENT THAT INCREASES EPA LEAKING UNDERGROUND STORAGE TANK TRUST FUND BY $20 MILLION AND REDUCES HUD SALARIES AND EXPENSE FUNDING BY $42 MILLION.),(HOUSE AGREED TO THE HEFLEY AMENDMENT THAT INCREASES EPA LEAKING UNDERGROUND STORAGE TANK TRUST FUND BY $20 MILLION AND REDUCES HUD SALARIES AND EXPENSE FUNDING BY $42 MILLION,7,704,7,704
492,32575,104,1,1145,RH1041145,"'RH1041145',","RH1041145,",6/26/96,1996,6,26,2,279,142,274,-0.239,0.136,0.256,0.37,-73.114,HR3666,Failed,NA,On Agreeing to the Amendment,"(HOUSE REJECTED THE MARKEY AMENDMENT THAT SOUGHT TO PROHIBIT THE USE OF HAZARDOUS SUBSTANCE SUPERFUND FUNDING TO PROVIDE ANY REIMBURSEMENT OF RESPONSE COSTS, EXCEPT PURSUANT TO SECTION 122(B) OF THE COMPREHENSIVE ENVIRONMENTAL RESPONSE, COMPENSATION, AND LIABILITY ACT OF 1980, IF SUCH COSTS WERE REQUIRED UNDER A JUDICIALLY APPROVED CONSENT DECREE ENTERED BEFORE ENACTMENT.)","(HOUSE REJECTED THE MARKEY AMENDMENT THAT SOUGHT TO PROHIBIT THE USE OF HAZARDOUS SUBSTANCE SUPERFUND FUNDING TO PROVIDE ANY REIMBURSEMENT OF RESPONSE COSTS, EXCEPT PURSUANT TO SECTION 122(B) OF THE COMPREHENSIVE ENVIRONMENTAL RESPONSE, COMPENSATION, AN",7,704,7,704
493,32673,104,1,1265,RH1041265,"'RH1041265',","RH1041265,",8/2/96,1996,8,2,2,399,392,30,-0.538,0.165,-0.299,0.161,-68.027,S1316,Passed,Safe Drinking Water Act amendments of 1995,On Agreeing to the Conference Report,"S.1316 BY KEMPTHORNE (R-ID) -- SAFE DRINKING WATER ACT AMENDMENTS OF 1996 (PUB. L. 104-182, APPROVED 8/06/96) (HOUSE AGREED TO THE CONFERENCE REPORT ON S. 1316, TO AMEND TITLE XIV OF THE PUBLIC HEALTH SERVICE ACT (COMMONLY KNOWN AS THE """"""""""""""""SAFE DRINKING ACT"""""""""""""""").)",),7,701,7,701
494,33007,104,1,886,RH1040886,"'RH1040886',","RH1040886,",1/31/96,1996,1,31,2,20,150,271,0.534,-0.181,-0.035,0.189,-272.146,HRES349,Failed,Providing for the consideration of S. 534,On Motion to Suspend the Rules and Agree,"H.RES.349 BY BLILEY (R-VA) -- PROCEDURAL RESOLUTION - S.534 (HOUSE FAILED TO SUSPEND THE RULES AND AGREE TO H.RES. 349, PROVIDING FOR THE CONSIDERATION OF S. 534, MUNICIPAL SOLID WASTE FLOW CONTROL ACT OF 1995.)","(HOUSE FAILED TO SUSPEND THE RULES AND AGREE TO H.RES. 349, PROVIDING FOR THE CONSIDERATION OF S. 534, MUNICIPAL SOLID WASTE FLOW CONTROL ACT OF 1995",7,703,7,703
495,33009,104,1,887,RH1040887,"'RH1040887',","RH1040887,",1/31/96,1996,1,31,2,21,402,19,-0.705,0.639,-0.33,-0.197,-56.311,HR2036,Passed,Land Disposal Program Flexibility Act of 1995,"Suspend the rules and pass, as amended","H.R.2036 BY OXLEY (R-OH) -- LAND DISPOSAL PROGRAM FLEXIBILITY ACT OF 1996 (PUB. L. 104-119, APPROVED 3/26/96) (HOUSE VOTED TO SUSPEND THE RULES AND PASS H.R. 2036, AMENDED, TO AMEND THE SOLID WASTE DISPOSAL ACT TO MAKE CERTAIN ADJUSTMENTS IN THE LAND DISPOSAL PROGRAM TO PROVIDE NEEDED FLEXIBILITY.)","LAND DISPOSAL PROGRAM FLEXIBILITY ACT OF 1996 (PUB. L. 104-119, APPROVED 3/26/96) (HOUSE VOTED TO SUSPEND THE RULES AND PASS H.R. 2036, AMENDED, TO AMEND THE SOLID WASTE DISPOSAL ACT TO MAKE CERTAIN ADJUSTMENTS IN THE LAND DISPOSAL PROGRAM TO PROVIDE NEED",7,703,7,703
496,33043,104,1,905,RH1040905,"'RH1040905',","RH1040905,",2/29/96,1996,2,29,2,39,298,124,0.462,0.174,0.063,0.22,-234.624,HR2854,Agreed to,NA,On Agreeing to the Amendment,(HOUSE AGREED TO THE FOLEY AMENDMENT THAT AUTHORIZES $200 MILLION FOR LAND ACQUISITION IN THE EVERGLADES FOR THE PURPOSE OF ENVIRONMENTAL RESTORATION.),(HOUSE AGREED TO THE FOLEY AMENDMENT THAT AUTHORIZES $200 MILLION FOR LAND ACQUISITION IN THE EVERGLADES FOR THE PURPOSE OF ENVIRONMENTAL RESTORATION,7,709,7,709
497,33136,104,1,993,RH1040993,"'RH1040993',","RH1040993,",4/23/96,1996,4,23,2,127,407,0,0,0,0,0,0,HR1965,Passed,Coastal Zone Management Act of 1972 Reauthorization,"Suspend Rules and Pass, As Amended","H.R.1965 BY SAXTON (R-NJ) -- COASTAL ZONE PROTECTION ACT OF 1996 (HOUSE VOTED TO SUSPEND THE RULES AND PASS H.R. 1965, AMENDED, TO REAUTHORIZE THE COASTAL ZONE MANAGEMENT REAUTHORIZATION ACT OF 1996.)","COASTAL ZONE PROTECTION ACT OF 1996 (HOUSE VOTED TO SUSPEND THE RULES AND PASS H.R. 1965, AMENDED, TO REAUTHORIZE THE COASTAL ZONE MANAGEMENT REAUTHORIZATION ACT OF 1996",7,710,7,701
498,33140,104,1,997,RH1040997,"'RH1040997',","RH1040997,",4/24/96,1996,4,24,2,131,287,138,-0.146,-0.132,-0.219,-0.767,-94.465,HR1675,Passed,National Wildlife Refuge Act,On Passage,"(HOUSE PASSED H.R. 1675, TO AMEND THE NATIONAL WILDLIFE REFUGE SYSTEM ADMINISTRATION ACT OF 1966 TO IMPROVE THE MANAGEMENT OF THE NATIONAL WILDLIFE REFUGE SYSTEM.)","(HOUSE PASSED H.R. 1675, TO AMEND THE NATIONAL WILDLIFE REFUGE SYSTEM ADMINISTRATION ACT OF 1966 TO IMPROVE THE MANAGEMENT OF THE NATIONAL WILDLIFE REFUGE SYSTEM",7,709,7,709
499,33212,105,1,106,RH1050106,"'RH1050106',","RH1050106,",5/7/97,1997,5,7,1,108,227,196,-0.039,0.22,0.23,0.848,-102.654,HR478,Agreed to,NA,On Agreeing to the Amendment,"H.R.478 BY HERGER (R-CA) -- FLOOD PREVENTION AND FAMILY PROTECTION ACT OF 1997 (HOUSE AGREED TO THE BOEHLERT AMENDMENT IN THE NATURE OF A SUBSTITUTE, AS AMENDED, THAT EXEMPTS FROM THE ENDANGERED SPECIES ACT CONSULTATION AND CONFERENCING PROVISIONS, A PROJECT TO REPLACE A FLOOD CONTROL FACILITY THAT IS DECLARED A FEDERAL DISASTER AREA IN 1997 TO THE EXTENT AS WOULD BE REQUIRED BY CALIFORNIA PROJECTS SUBJECT TO THE U.S. FISH AND WILDLIFE SERVICE POLICY ON EMERGENCY FLOOD RESPONSE AND SHORT TERM REPAIR OF FLOOD CONTROL FACILITIES ISSUED ON FEBRUARY 19, 1997; PROVIDES THAT EXEMPTIONS SHALL NOT APPLY AFTER THE DATE THAT THE ASSISTANT SECRETARY OF THE ARMY FOR CIVIL WORKS DETERMINES THAT REPAIRS HAVE BEEN COMPLETED ON DECEMBER 31, 1998, WHICHEVER IS EARLIER; AND CLARIFIES THAT THE EXEMPTIONS APPLY TO ANY PROJECT TO REPAIR A FLOOD CONTROL FACILITY IN RESPONSE TO AN IMMINENT THREAT TO HUMAN LIVES AND PROPERTY.)","R (HOUSE AGREED TO THE BOEHLERT AMENDMENT IN THE NATURE OF A SUBSTITUTE, AS AMENDED, THAT EXEMPTS FROM THE ENDANGERED SPECIES ACT CONSULTATION AND CONFERENCING PROVISIONS, A PROJECT TO REPLACE A FLOOD CONTROL FACILITY THAT IS DECLARED A FEDERAL DISASTER",7,709,7,709
500,33293,105,1,147,RH1050147,"'RH1050147',","RH1050147,",5/21/97,1997,5,21,1,149,226,203,-0.028,-0.09,-0.404,0.267,-11.383,HRES153,Passed,Providing for consideration of H.R. 408; International Dolphin Conservation Program Act,On Ordering the Previous Question,"H.RES.153 BY HASTINGS, RICHARD (R-WA) -- PROCEDURAL RESOLUTION - H.R. 408 (HOUSE AGREED TO ORDER THE PREVIOUS QUESTION ON THE RULE.)",R (HOUSE AGREED TO ORDER THE PREVIOUS QUESTION ON THE RULE,7,709,7,709
501,33297,105,1,149,RH1050149,"'RH1050149',","RH1050149,",5/21/97,1997,5,21,1,151,262,166,-0.373,0.702,-0.173,-0.231,-154.616,HR408,Passed,International Dolphin Conservation Program Act,On Passage,"H.R.408 BY GILCHREST (R-MD) -- INTERNATIONAL DOLPHIN CONSERVATION PROGRAM ACT (HOUSE PASSED H.R. 408, TO AMEND THE MARINE MAMMAL PROTECTION ACT OF 1972 TO SUPPORT THE INTERNATIONAL DOLPHIN CONSERVATION PROGRAM IN THE EASTERN TROPICAL PACIFIC OCEAN.)","R (HOUSE PASSED H.R. 408, TO AMEND THE MARINE MAMMAL PROTECTION ACT OF 1972 TO SUPPORT THE INTERNATIONAL DOLPHIN CONSERVATION PROGRAM IN THE EASTERN TROPICAL PACIFIC OCEAN",7,709,7,709
502,33307,105,1,154,RH1050154,"'RH1050154',","RH1050154,",6/3/97,1997,6,3,1,156,407,1,0,0,0,0,0,HR1420,Passed,National Wildlife Refuge System Improvement Act,"Suspend the rules and pass, as amended","H.R.1420 BY YOUNG, DON (R-AK) -- NATIONAL WILDLIFE REFUGE SYSTEM IMPROVEMENT ACT OF 1997 (HOUSE PASSED H.R. 1420, AMENDED, TO AMEND THE NATIONAL WILDLIFE REFUGE SYSTEM ADMINISTRATION ACT OF 1966 TO IMPROVE THE MANAGEMENT OF THE NATIONAL WILDLIFE REFUGE SYSTEM. .)","R ACT OF 1997 (HOUSE PASSED H.R. 1420, AMENDED, TO AMEND THE NATIONAL WILDLIFE REFUGE SYSTEM ADMINISTRATION ACT OF 1966 TO IMPROVE THE MANAGEMENT OF THE NATIONAL WILDLIFE REFUGE SYSTEM.",7,709,7,709
503,33493,105,1,246,RH1050246,"'RH1050246',","RH1050246,",7/8/97,1997,7,8,1,248,399,8,0,0,0,0,0,HR1658,Passed,Atlantic Striped Bass Conservation Act,"Suspend the rules and pass, as amended","H.R.1658 BY SAXTON (R-NJ) -- ATLANTIC STRIPED BASS CONSERVATION ACT (HOUSE VOTED TO SUSPEND THE RULES AND PASS H.R. 1658, AMENDED, TO REAUTHORIZE AND AMEND THE ATLANTIC STRIPED BASS CONSERVATION ACT AND RELATED LAWS.)","R (HOUSE VOTED TO SUSPEND THE RULES AND PASS H.R. 1658, AMENDED, TO REAUTHORIZE AND AMEND THE ATLANTIC STRIPED BASS CONSERVATION ACT AND RELATED LAWS",7,709,7,709
504,33573,105,1,288,RH1050288,"'RH1050288',","RH1050288,",7/22/97,1997,7,22,1,290,416,6,0,0,0,0,0,HR765,Passed,Shackleford Banks Wild Horses Protection Act,On Motion to Suspend the Rules and Pass,"H.R.765 BY JONES (R-NC) -- SHACKLEFORD BANKS WILD HORSES PROTECTION ACT (HOUSE PASSED H.R. 765, TO ENSURE MAINTENANCE OF A HERD OF WILD HORSES IN CAPE LOOKOUT NATIONAL SEASHORE.)","R (HOUSE PASSED H.R. 765, TO ENSURE MAINTENANCE OF A HERD OF WILD HORSES IN CAPE LOOKOUT NATIONAL SEASHORE",7,709,7,709
505,33708,105,1,418,RH1050418,"'RH1050418',","RH1050418,",9/23/97,1997,9,23,1,424,419,1,0,0,0,0,0,HR1420,Passed,National Wildlife Refuge System Improvement Act,Suspend the Rules and Agree to Senate Amendments,"H.R.1420 BY YOUNG, DON (R-AK) -- NATIONAL WILDLIFE REFUGE SYSTEM IMPROVEMENT ACT OF 1997 (PUB.L. 105-57, APPROVED 10/9/97) (HOUSE VOTED TO SUSPEND THE RULES AND AGREE TO THE SENATE AMENDMENTS TO H.R. 1420, TO AMEND THE NATIONAL WILDLIFE REFUGE SYSTEM ADMINISTRATION ACT OF 1966 TO IMPROVE THE MANAGEMENT OF THE NATIONAL WILDLIFE REFUGE SYSTEM.)","R ACT OF 1997 (PUB.L. 105-57, APPROVED 10/9/97) (HOUSE VOTED TO SUSPEND THE RULES AND AGREE TO THE SENATE AMENDMENTS TO H.R. 1420, TO AMEND THE NATIONAL WILDLIFE REFUGE SYSTEM ADMINISTRATION ACT OF 1966 TO IMPROVE THE MANAGEMENT OF THE NATIONAL WILDLIFE",7,709,7,709
506,33778,105,1,491,RH1050491,"'RH1050491',","RH1050491,",10/7/97,1997,10,7,1,497,309,107,0.258,-0.965,-0.04,-0.256,-212.336,HR629,Passed,Texas Low-Level Radioactive Waste Disposal Compact,On Passage,"H.R.629 BY BARTON (R-TX) -- TEXAS LOW-LEVEL RADIOACTIVE WASTE DISPOSAL COMPACT CONSENT ACT (HOUSE PASSED H.R. 629, TO GRANT THE CONSENT OF THE CONGRESS TO THE TEXAS LOW-LEVEL RADIOACTIVE WASTE DISPOSAL COMPACT. .)","R CONSENT ACT (HOUSE PASSED H.R. 629, TO GRANT THE CONSENT OF THE CONGRESS TO THE TEXAS LOW-LEVEL RADIOACTIVE WASTE DISPOSAL COMPACT.",7,704,7,704
507,33782,105,1,495,RH1050495,"'RH1050495',","RH1050495,",10/8/97,1997,10,8,1,501,200,226,-0.072,0.247,0.241,0.325,-66.362,HR901,Failed,NA,On Agreeing to the Amendment,"H.R.901 BY YOUNG, DON (R-AK) -- AMERICAN LAND SOVEREIGNTY PROTECTION ACT (HOUSE REJECTED THE FARR AMENDMENT THAT SOUGHT TO EXEMPT THE CALIFORNIA COASTAL RANGES BIOSPHERE RESERVE. .)",R (HOUSE REJECTED THE FARR AMENDMENT THAT SOUGHT TO EXEMPT THE CALIFORNIA COASTAL RANGES BIOSPHERE RESERVE.,7,709,7,709
508,33820,105,1,530,RH1050530,"'RH1050530',","RH1050530,",10/29/97,1997,10,29,1,536,259,155,-0.345,0.593,-0.13,-0.141,-179.862,HRES283,Passed,"Providing for the consideration of H.R. 1270, Nuclear Waste Policy Act of 1997",On Agreeing to the Resolution,"H.RES.283 BY HASTINGS, RICHARD (R-WA) -- PROCEDURAL RESOLUTION - H.R. 1270 (HOUSE PASSED H. RES. 283, THE RULE THAT PROVIDED FOR CONSIDERATION OF H.R. 1270.)","R (HOUSE PASSED H. RES. 283, THE RULE THAT PROVIDED FOR CONSIDERATION OF H.R. 1270",7,704,7,704
509,33828,105,1,538,RH1050538,"'RH1050538',","RH1050538,",10/29/97,1997,10,29,1,544,407,11,-0.465,0.885,-0.206,0.36,-47.44,HR1270,Agreed to,NA,On Agreeing to the Amendment,(HOUSE AGREED TO THE TRAFICANT AMENDMENT THAT REQUIRES THAT ONLY NUCLEAR WASTE PRODUCED IN THE UNITED STATES CAN BE STORED IN ANY REPOSITORY ESTABLISHED IN THE BILL.),(HOUSE AGREED TO THE TRAFICANT AMENDMENT THAT REQUIRES THAT ONLY NUCLEAR WASTE PRODUCED IN THE UNITED STATES CAN BE STORED IN ANY REPOSITORY ESTABLISHED IN THE BILL,7,704,7,704
510,33835,105,1,544,RH1050544,"'RH1050544',","RH1050544,",10/30/97,1997,10,30,1,550,135,290,-0.407,0.039,0.087,0.127,-220.116,HR1270,Failed,NA,On Agreeing to the Amendment,"H.R.1270 BY UPTON (R-MI) -- NUCLEAR WASTE POLICY ACT OF 1997 (HOUSE REJECTED THE ENSIGN AMENDMENT, DEBATED ON OCTOBER 29, THAT SOUGHT TO ENSURE THAT A RISK ASSESSMENT STUDY AND COST BENEFIT ANALYSIS ARE CONDUCTED PRIOR TO ACTION BEING TAKEN UNDER THE ACT. .)","R (HOUSE REJECTED THE ENSIGN AMENDMENT, DEBATED ON OCTOBER 29, THAT SOUGHT TO ENSURE THAT A RISK ASSESSMENT STUDY AND COST BENEFIT ANALYSIS ARE CONDUCTED PRIOR TO ACTION BEING TAKEN UNDER THE ACT.",7,704,7,704
511,33836,105,1,545,RH1050545,"'RH1050545',","RH1050545,",10/30/97,1997,10,30,1,551,112,312,-0.597,0.004,0.083,0.2,-222.136,HR1270,Failed,NA,On Agreeing to the Amendment,"(HOUSE REJECTED THE GIBBONS AMENDMENT, DEBATED ON OCTOBER 29, THAT SOUGHT TO SPECIFY THAT THE GOVERNOR OF EACH STATE WITH NUCLEAR WASTE ROUTES SHALL CERTIFY THAT EMERGENCY RESPONSE TEAMS EXIST AND CAN MANAGE ANY NUCLEAR ACCIDENT BEFORE TRANSPORTATION CAN BE IMPLEMENTED. .)","(HOUSE REJECTED THE GIBBONS AMENDMENT, DEBATED ON OCTOBER 29, THAT SOUGHT TO SPECIFY THAT THE GOVERNOR OF EACH STATE WITH NUCLEAR WASTE ROUTES SHALL CERTIFY THAT EMERGENCY RESPONSE TEAMS EXIST AND CAN MANAGE ANY NUCLEAR ACCIDENT BEFORE TRANSPORTATION CA",7,704,7,704
512,33837,105,1,546,RH1050546,"'RH1050546',","RH1050546,",10/30/97,1997,10,30,1,552,118,305,-0.461,-0.131,0.081,0.185,-217.897,HR1270,Failed,NA,On Agreeing to the Amendment,"(HOUSE REJECTED THE ENSIGN AMENDMENT, DEBATED ON OCTOBER 29, THAT SOUGHT TO REQUIRE THAT BEFORE ANY SHIPMENTS OCCUR, CONGRESS MUST HAVE APPROPRIATED FUNDS TO ENSURE ADEQUATE EMERGENCY RESPONSE TEAMS ALONG THE TRANSPORTATION ROUTE. .)","(HOUSE REJECTED THE ENSIGN AMENDMENT, DEBATED ON OCTOBER 29, THAT SOUGHT TO REQUIRE THAT BEFORE ANY SHIPMENTS OCCUR, CONGRESS MUST HAVE APPROPRIATED FUNDS TO ENSURE ADEQUATE EMERGENCY RESPONSE TEAMS ALONG THE TRANSPORTATION ROUTE.",7,704,7,704
513,33838,105,1,547,RH1050547,"'RH1050547',","RH1050547,",10/30/97,1997,10,30,1,553,151,273,-0.132,-0.207,0.124,0.309,-156.22,HR1270,Failed,NA,On Agreeing to the Amendment,"(HOUSE REJECTED THE MARKEY AMENDMENT, DEBATED ON OCTOBER 29, THAT SOUGHT TO STRIKE PROVISIONS THAT PREVENT THE ENVIRONMENTAL PROTECTION AGENCY FROM SETTING RADIATION PROTECTION STANDARDS. .)","(HOUSE REJECTED THE MARKEY AMENDMENT, DEBATED ON OCTOBER 29, THAT SOUGHT TO STRIKE PROVISIONS THAT PREVENT THE ENVIRONMENTAL PROTECTION AGENCY FROM SETTING RADIATION PROTECTION STANDARDS.",7,704,7,704
514,33839,105,1,548,RH1050548,"'RH1050548',","RH1050548,",10/30/97,1997,10,30,1,554,67,357,-0.522,-0.103,0.161,0.259,-126.969,HR1270,Failed,NA,On Agreeing to the Amendment,"(HOUSE REJECTED THE GIBBONS AMENDMENT, DEBATED ON OCTOBER 29, THAT SOUGHT TO DELETE THE 1 MILL CAP AND GIVE THE SECRETARY OF ENERGY THE AUTHORITY TO ASSESS A FEE ON THE EXISTING REACTORS. .)","(HOUSE REJECTED THE GIBBONS AMENDMENT, DEBATED ON OCTOBER 29, THAT SOUGHT TO DELETE THE 1 MILL CAP AND GIVE THE SECRETARY OF ENERGY THE AUTHORITY TO ASSESS A FEE ON THE EXISTING REACTORS.",7,704,7,704
515,33843,105,1,550,RH1050550,"'RH1050550',","RH1050550,",10/30/97,1997,10,30,1,556,142,283,-0.255,-0.014,0.153,0.245,-136.161,HR1270,Failed,Nuclear Waste Policy Act,On Motion to Recommit with Instructions,"(HOUSE REJECTED THE MARKEY MOTION TO RECOMMIT THE BILL TO THE COMMITTEE ON COMMERCE WITH INSTRUCTIONS TO REPORT IT BACK TO THE HOUSE FORTHWITH WITH AN AMENDMENT THAT SPECIFIES THAT CONTRACTORS TRANSPORTING SPENT NUCLEAR FUEL OR HIGH-LEVEL RADIOACTIVE WASTE UNDER ANY SUCH CONTRACT SHALL NOT BE INDEMNIFIED UNDER SECTION 170D OF THE ATOMIC ENERGY ACT OF 1954 FOR ANY LIABILITY RESULTING FROM NEGLIGENCE, GROSS NEGLIGENCE, OR WILLFUL MISCONDUCT IN CONNECTION WITH SUCH TRANSPORTATION. .)",(HOUSE REJECTED THE MARKEY MOTION TO RECOMMIT THE BILL TO THE COMMITTEE ON COMMERCE WITH INSTRUCTIONS TO REPORT IT BACK TO THE HOUSE FORTHWITH WITH AN AMENDMENT THAT SPECIFIES THAT CONTRACTORS TRANSPORTING SPENT NUCLEAR FUEL OR HIGH-LEVEL RADIOACTIVE WA,7,704,7,704
516,33844,105,1,551,RH1050551,"'RH1050551',","RH1050551,",10/30/97,1997,10,30,1,557,307,120,-0.417,0.039,-0.113,-0.234,-186.276,HR1270,Passed,Nuclear Waste Policy Act,On Passage,"(HOUSE PASSED H.R. 1270, TO AMEND THE NUCLEAR WASTE POLICY ACT OF 1982. .)","(HOUSE PASSED H.R. 1270, TO AMEND THE NUCLEAR WASTE POLICY ACT OF 1982.",7,704,7,704
517,34006,105,1,90,RH1050090,"'RH1050090',","RH1050090,",4/29/97,1997,4,29,1,92,325,92,-0.194,-0.756,-0.12,-0.241,-145.851,HR1342,Passed,Conservation Reserve Program Enrollment,"Suspend the rules and pass, as amended","H.R.1342 BY SMITH, ROBERT F. (R-OR) -- ONE YEAR ENROLLMENT IN THE CONSERVATION RESERVE FOR LAND COVERED BY EXPIRING CONTRACTS, PROVISION (HOUSE VOTED TO SUSPEND THE RULES AND PASS H.R. 1342, AMENDED, TO PROVIDE FOR A ONE-YEAR ENROLLMENT IN THE CONSERVATION RESERVE OF LAND COVERED BY EXPIRING CONSERVATION RESERVE PROGRAM CONTRACTS.)","H.R.1342 BY SMITH, ROBERT F. (R-OR) -- ONE YEAR ENROLLMENT IN THE CONSERVATION RESERVE FOR LAND COVERED BY EXPIRING CONTRACTS, PROVISION (HOUSE VOTED TO SUSPEND THE RULES AND PASS H.R. 1342, AMENDED, TO PROVIDE FOR A ONE-YEAR ENROLLMENT IN THE CONSERVATION RESERVE OF LAND COVERED BY EXPIRING C",7,709,7,709
518,34138,105,1,1009,RH1051009,"'RH1051009',","RH1051009,",8/5/98,1998,8,5,2,389,158,267,0.519,-0.654,0.097,0.575,-197.523,HR4276,Failed,NA,On Agreeing to the Amendment,(HOUSE REJECTED THE PALLONE AMENDMENT NUMBERED 44 PRINTED IN THE CONGRESSIONAL RECORD THAT SOUGHT TO INCREASE FUNDING FOR NON-POINT SOURCE POLLUTION CONTROL BY $8 MILLION. .),(HOUSE REJECTED THE PALLONE AMENDMENT NUMBERED 44 PRINTED IN THE CONGRESSIONAL RECORD THAT SOUGHT TO INCREASE FUNDING FOR NON-POINT SOURCE POLLUTION CONTROL BY $8 MILLION.,7,700,7,700
519,34144,105,1,1015,RH1051015,"'RH1051015',","RH1051015,",8/5/98,1998,8,5,2,395,141,283,0.223,0.154,-0.123,-0.479,-161.999,HR4276,Failed,NA,On Agreeing to the Amendment,"(HOUSE REJECTED THE CALLAHAN AMENDMENT THAT SOUGHT TO CLARIFY THAT EACH OF THE STATES OF ALABAMA, LOUISIANA, AND MISSISSIPPI HAS EXCLUSIVE FISHERY MANAGEMENT AUTHORITY OVER ALL FISH IN THE GULF OF MEXICO WITHIN 3 LEAGUES OF THE COAST OF THAT STATE, EFFECTIVE JULY 1, 1999.)","(HOUSE REJECTED THE CALLAHAN AMENDMENT THAT SOUGHT TO CLARIFY THAT EACH OF THE STATES OF ALABAMA, LOUISIANA, AND MISSISSIPPI HAS EXCLUSIVE FISHERY MANAGEMENT AUTHORITY OVER ALL FISH IN THE GULF OF MEXICO WITHIN 3 LEAGUES OF THE COAST OF THAT STATE, EFFE",7,709,7,709
520,34260,105,1,1142,RH1051142,"'RH1051142',","RH1051142,",10/12/98,1998,10,12,2,523,153,248,-0.17,0.985,-0.234,-0.53,-119.005,S2095,Failed,National Fish and Wildlife Foundation Establishment Act,"On Motion to Suspend the Rules and Pass, as Amended","S.2095 BY CHAFEE (R-RI) -- NATIONAL FISH AND WILDLIFE FOUNDATION ESTABLISHMENT ACT, AMENDMENT (HOUSE FAILED TO SUSPEND THE RULES AND PASS S. 2095, TO REAUTHORIZE AND AMEND THE NATIONAL FISH AND WILDLIFE FOUNDATION ESTABLISHMENT ACT.)","R ACT, AMENDMENTHOUSE FAILED TO SUSPEND THE RULES AND PASS S. 2095, TO REAUTHORIZE AND AMEND THE NATIONAL FISH AND WILDLIFE FOUNDATION ESTABLISHMENT ACT",7,709,7,709
521,34820,105,1,907,RH1050907,"'RH1050907',","RH1050907,",7/15/98,1998,7,15,2,281,202,218,0.002,1,0.254,0.023,-61.129,HR3267,Failed,NA,On Agreeing to the Amendment,"H.R.3267 BY HUNTER (R-CA) -- SONNY BONO MEMORIAL SALTON SEA RECLAMATION ACT (HOUSE REJECTED THE MILLER OF CALIFORNIA AMENDMENT IN THE NATURE OF A SUBSTITUTE, THAT AUTHORIZES A STUDY OF ALTERNATIVES FOR RESTORING THE SALTON SEA.)","R (HOUSE REJECTED THE MILLER OF CALIFORNIA AMENDMENT IN THE NATURE OF A SUBSTITUTE, THAT AUTHORIZES A STUDY OF ALTERNATIVES FOR RESTORING THE SALTON SEA",7,710,7,701
522,34821,105,1,908,RH1050908,"'RH1050908',","RH1050908,",7/15/98,1998,7,15,2,282,221,200,-0.178,0.984,-0.155,-0.118,-155.363,HR3267,Passed,Sonny Bono Memorial Salton Sea Reclamation Act,On Passage,"(HOUSE PASSED H.R. 3267, TO DIRECT THE SECRETARY OF THE INTERIOR, ACTING THROUGH THE BUREAU OF RECLAMATION, TO CONDUCT A FEASIBILITY STUDY AND CONSTRUCT A PROJECT TO RECLAIM THE SALTON SEA.)","(HOUSE PASSED H.R. 3267, TO DIRECT THE SECRETARY OF THE INTERIOR, ACTING THROUGH THE BUREAU OF RECLAMATION, TO CONDUCT A FEASIBILITY STUDY AND CONSTRUCT A PROJECT TO RECLAIM THE SALTON SEA",7,710,7,701
523,34853,105,1,941,RH1050941,"'RH1050941',","RH1050941,",7/21/98,1998,7,21,2,315,203,221,0.126,-0.228,0.094,0.241,-199.136,HR4193,Failed,NA,On Agreeing to the Amendment,(HOUSE REJECTED THE MCGOVERN AMENDMENT THAT SOUGHT TO PROVIDE $30 MILLION FOR THE STATE SIDE PROGRAM OF THE LAND AND WATER CONSERVATION FUND.),(HOUSE REJECTED THE MCGOVERN AMENDMENT THAT SOUGHT TO PROVIDE $30 MILLION FOR THE STATE SIDE PROGRAM OF THE LAND AND WATER CONSERVATION FUND,7,711,7,711
524,34863,105,1,951,RH1050951,"'RH1050951',","RH1050951,",7/23/98,1998,7,23,2,327,202,221,0.022,-0.001,0.288,0.38,-53.812,HR4193,Failed,NA,On Agreeing to the Amendment,(HOUSE REJECTED THE MCDERMOTT AMENDMENT THAT SOUGHT TO STRIKE SECTION 333 DEALING WITH THE OPERATION OR IMPLEMENTATION OF THE INTERIOR COLUMBIA BASIN ECOSYSTEM MANAGEMENT PROJECT.),(HOUSE REJECTED THE MCDERMOTT AMENDMENT THAT SOUGHT TO STRIKE SECTION 333 DEALING WITH THE OPERATION OR IMPLEMENTATION OF THE INTERIOR COLUMBIA BASIN ECOSYSTEM MANAGEMENT PROJECT,7,709,7,709
525,34866,105,1,954,RH1050954,"'RH1050954',","RH1050954,",7/23/98,1998,7,23,2,330,139,285,0.234,0.403,-0.178,-0.228,-135.082,HR4193,Failed,NA,On Agreeing to the Amendment,(HOUSE REJECTED THE PAPPAS AMENDMENT THAT SOUGHT TO INCREASE THE STATE SIDE GRANT PROGRAM OF THE LAND AND WATER CONSERVATION FUND BY $50 MILLION.),(HOUSE REJECTED THE PAPPAS AMENDMENT THAT SOUGHT TO INCREASE THE STATE SIDE GRANT PROGRAM OF THE LAND AND WATER CONSERVATION FUND BY $50 MILLION,7,711,7,711
526,34868,105,1,956,RH1050956,"'RH1050956',","RH1050956,",7/23/98,1998,7,23,2,332,226,198,0.054,0.103,0.247,0.822,-95.839,HR4194,Agreed to,NA,On Agreeing to the Amendment,"H.R.4194 BY LEWIS, JERRY (R-CA) -- APPROPRIATIONS FOR THE DEPARTMENTS OF VETERANS AFFAIRS AND HOUSING AND URBAN DEVELOPMENT FOR FISCAL YEAR 1999, PROVISION HOUSING OPPORTUNITY AND RESPONSIBILITY ACT OF 1997 COMMUNITY PARTNERSHIPS AGAINST CRIME ACT OF 1997 (PUB. L. 105-276, APPROVED 10/21/98) (HOUSE AGREED TO THE OBEY AMENDMENT THAT SPECIFIES THAT ANY LIMITATION ON FUNDING TO EPA OR THE COUNCIL ON ENVIRONMENTAL QUALITY SHALL NOT APPLY TO EDUCATIONAL OUTREACH OR INFORMATIONAL SEMINARS.)","R VETERANS AFFAIRS AND HOUSING AND URBAN DEVELOPMENT FOR FISCAL YEAR 1999, PROVISION HOUSING OPPORTUNITY AND RESPONSIBILITY ACT OF 1997 COMMUNITY PARTNERSHIPS AGAINST CRIME ACT OF 1997 (PUB. L. 105-276, APPROVED 10/21/98) (HOUSE AGREED TO THE OBEY AMEN",7,799,7,799
527,34869,105,1,957,RH1050957,"'RH1050957',","RH1050957,",7/23/98,1998,7,23,2,334,176,243,0.108,-0.269,0.289,1.079,-78.019,HR4194,Failed,NA,On Agreeing to the Amendment,"(HOUSE REJECTED THE WAXMAN AMENDMENT THAT SOUGHT TO SPECIFY THAT ANY LIMITATION ON FUNDS TO THE EPA OR THE COUNCIL ON ENVIRONMENTAL QUALITY SHALL NOT APPLY TO REGULATORY DETERMINATIONS FOR MERCURY EMISSIONS, DREDGING AS A REMEDIATION TOOL, AND IMPLEMENTATION OF THE FOOD QUALITY PROTECTION ACT, REGIONAL HAZE PROGRAM, OR CLEANUP REQUIREMENTS FOR FACILITIES LICENSED BY THE NUCLEAR REGULATORY COMMISSION.)","(HOUSE REJECTED THE WAXMAN AMENDMENT THAT SOUGHT TO SPECIFY THAT ANY LIMITATION ON FUNDS TO THE EPA OR THE COUNCIL ON ENVIRONMENTAL QUALITY SHALL NOT APPLY TO REGULATORY DETERMINATIONS FOR MERCURY EMISSIONS, DREDGING AS A REMEDIATION TOOL, AND IMPLEMENT",7,700,7,700
528,34876,105,1,965,RH1050965,"'RH1050965',","RH1050965,",7/29/98,1998,7,29,2,343,313,108,-0.379,0.113,-0.195,-0.167,-115.464,HRES511,Passed,Waiving points of order against the conference report on H.R. 629,On Agreeing to the Resolution,"H.RES.511 BY PRYCE, DEBORAH (R-OH) -- PROCEDURAL RESOLUTION - H.R. 629 (HOUSE PASSED H. RES. 511, WAIVING POINTS OF ORDER AGAINST THE CONFERENCE REPORT TO ACCOMPANY H.R. 629, TO GRANT THE CONSENT OF THE CONGRESS TO THE TEXAS LOW-LEVEL RADIOACTIVE WASTE DISPOSAL COMPACT.)","R (HOUSE PASSED H. RES. 511, WAIVING POINTS OF ORDER AGAINST THE CONFERENCE REPORT TO ACCOMPANY H.R. 629, TO GRANT THE CONSENT OF THE CONGRESS TO THE TEXAS LOW-LEVEL RADIOACTIVE WASTE DISPOSAL COMPACT",7,704,7,704
529,34877,105,1,966,RH1050966,"'RH1050966',","RH1050966,",7/29/98,1998,7,29,2,344,305,117,-0.391,-0.044,-0.109,-0.208,-189.031,HR629,Passed,Texas Low-Level Radioactive Waste Disposal Compact,On Agreeing to the Conference Report,"H.R.629 BY BARTON (R-TX) -- TEXAS LOW-LEVEL RADIOACTIVE WASTE DISPOSAL COMPACT CONSENT ACT (PUB. L. 105-236, APPROVED 9/20/98) (HOUSE AGREED TO THE CONFERENCE REPORT ON H.R. 629, TO GRANT THE CONSENT OF THE CONGRESS TO THE TEXAS LOW;-LEVEL RADIOACTIVE WASTE DISPOSAL COMPACT. .)","R CONSENT ACT (PUB. L. 105-236, APPROVED 9/20/98) (HOUSE AGREED TO THE CONFERENCE REPORT ON H.R. 629, TO GRANT THE CONSENT OF THE CONGRESS TO THE TEXAS LOW;-LEVEL RADIOACTIVE WASTE DISPOSAL COMPACT.",7,704,7,704
530,35345,106,1,279,RH1060279,"'RH1060279',","RH1060279,",7/13/99,1999,7,13,1,281,213,202,0.076,-0.01,0.11,0.417,-170.123,HR2466,Agreed to,NA,On Agreeing to the Amendment,"H R 2466 AUTHOR(S): MCGOVERN OF MASSACHUSETTS AMENDMENT QUESTION: ON AGREEING TO THE AMENDMENT DEPARTMENT OF THE INTERIOR AND RELATED AGENCIES APPROPRIATIONS ACT, 2000","QUESTION: ON AGREEING TO THE AMENDMENT DEPARTMENT OF THE INTERIOR AND RELATED AGENCIES APPROPRIATIONS ACT, 2000",7,711,7,711
531,35351,106,1,281,RH1060281,"'RH1060281',","RH1060281,",7/13/99,1999,7,13,1,283,131,287,0.424,-0.432,-0.178,-0.171,-146.235,HR2466,Failed,NA,On Agreeing to the Amendment,"H R 2466 AUTHOR(S): COBURN OF OKLAHOMA AMENDMENT QUESTION: ON AGREEING TO THE AMENDMENT DEPARTMENT OF THE INTERIOR AND RELATED AGENCIES APPROPRIATIONS ACT, 2000","QUESTION: ON AGREEING TO THE AMENDMENT DEPARTMENT OF THE INTERIOR AND RELATED AGENCIES APPROPRIATIONS ACT, 2000",7,709,7,709
532,35364,106,1,289,RH1060289,"'RH1060289',","RH1060289,",7/14/99,1999,7,14,1,291,259,166,-0.047,0.272,0.119,0.688,-156.013,HR2466,Agreed to,NA,On Agreeing to the Amendment,"H R 2466 AUTHOR(S): FARR OF CALIFORNIA AMENDMENT QUESTION: ON AGREEING TO THE AMENDMENT DEPARTMENT OF THE INTERIOR AND RELATED AGENCIES APPROPRIATIONS ACT, 2000","QUESTION: ON AGREEING TO THE AMENDMENT DEPARTMENT OF THE INTERIOR AND RELATED AGENCIES APPROPRIATIONS ACT, 2000",7,709,7,709
533,35370,106,1,291,RH1060291,"'RH1060291',","RH1060291,",7/14/99,1999,7,14,1,293,174,250,-0.058,-0.085,0.161,0.589,-118.978,HR2466,Failed,NA,On Agreeing to the Amendment,"H R 2466 AUTHOR(S): WU OF OREGON AMENDMENT QUESTION: ON AGREEING TO THE AMENDMENT DEPARTMENT OF THE INTERIOR AND RELATED AGENCIES APPROPRIATIONS ACT, 2000","QUESTION: ON AGREEING TO THE AMENDMENT DEPARTMENT OF THE INTERIOR AND RELATED AGENCIES APPROPRIATIONS ACT, 2000",7,709,7,709
534,35467,106,1,339,RH1060339,"'RH1060339',","RH1060339,",7/27/99,1999,7,27,1,341,183,245,-0.05,-0.175,0.271,0.401,-60.817,HR2605,Failed,NA,On Agreeing to the Amendment,"H R 2605 AUTHOR(S): VISCLOSKY OF INDIANA AMENDMENT QUESTION: ON AGREEING TO THE AMENDMENT ENERGY AND WATER APPROPRIATIONS ACT, 2000","QUESTION: ON AGREEING TO THE AMENDMENT ENERGY AND WATER APPROPRIATIONS ACT, 2000",7,710,7,701
535,36074,106,1,1119,RH1061119,"'RH1061119',","RH1061119,",10/5/00,2000,10,5,2,513,411,0,0,0,0,0,0,HRES610,Passed,Providing for consideration of H.R. 2941 Las Cienegas National Conservation Area Establishment Act,On Agreeing to the Resolution,H RES 610 QUESTION: ON AGREEING TO THE RESOLUTION PROVIDING FOR CONSIDERATION OF H.R. 2941 LAS CIENEGAS NATIONAL CONSERVATION AREA ESTABLISHMENT ACT,QUESTION: ON AGREEING TO THE RESOLUTION PROVIDING FOR CONSIDERATION OF H.R. 2941 LAS CIENEGAS NATIONAL CONSERVATION AREA ESTABLISHMENT ACT,7,709,7,709
536,36090,106,1,1136,RH1061136,"'RH1061136',","RH1061136,",10/12/00,2000,10,12,2,530,407,1,0,0,0,0,0,HR34,Passed,Technical corrections to a map relating to the Coastal Barrier Resources System,Motion to Suspend the Rules and Agree to Senate Amendments,H R 34 QUESTION: MOTION TO SUSPEND THE RULES AND AGREE TO SENATE AMENDMENT TECHNICAL CORRECTIONS TO A MAP RELATING TO THE COASTAL BARRIER RESOURCES SYSTEM,QUESTION: MOTION TO SUSPEND THE RULES AND AGREE TO SENATE AMENDMENT TECHNICAL CORRECTIONS TO A MAP RELATING TO THE COASTAL BARRIER RESOURCES SYSTEM,7,710,7,701
537,36475,106,1,667,RH1060667,"'RH1060667',","RH1060667,",3/22/00,2000,3,22,2,59,219,195,-0.116,-0.442,-0.278,0.209,-32.515,HRES444,Passed,Providing for consideration of S. 1287; Nuclear Waste Policy Amendments Act,On Ordering the Previous Question,H RES 444 QUESTION: ON ORDERING THE PREVIOUS QUESTION PROVIDING FOR CONSIDERATION OF S. 1287; NUCLEAR WASTE POLICY AMENDMENTS ACT,QUESTION: ON ORDERING THE PREVIOUS QUESTION PROVIDING FOR CONSIDERATION OF S. 1287; NUCLEAR WASTE POLICY AMENDMENTS ACT,7,704,7,704
538,36477,106,1,668,RH1060668,"'RH1060668',","RH1060668,",3/22/00,2000,3,22,2,60,220,191,-0.032,0.124,-0.212,0.158,-53.986,HRES444,Passed,Providing for consideration of S. 1287; Nuclear Waste Policy Amendments Act,On Agreeing to the Resolution,H RES 444 QUESTION: ON AGREEING TO THE RESOLUTION PROVIDING FOR CONSIDERATION OF S. 1287; NUCLEAR WASTE POLICY AMENDMENTS ACT,QUESTION: ON AGREEING TO THE RESOLUTION PROVIDING FOR CONSIDERATION OF S. 1287; NUCLEAR WASTE POLICY AMENDMENTS ACT,7,704,7,704
539,36479,106,1,669,RH1060669,"'RH1060669',","RH1060669,",3/22/00,2000,3,22,2,61,206,205,-0.154,-0.988,-0.212,0.197,-86.435,S1287,Passed,Nuclear Waste Policy Amendments Act of 2000,Will the House Consider the Bill,S 1287 QUESTION: WILL THE HOUSE CONSIDER THE BILL NUCLEAR WASTE POLICY AMENDMENTS ACT OF 2000,QUESTION: WILL THE HOUSE CONSIDER THE BILL NUCLEAR WASTE POLICY AMENDMENTS ACT OF 2000,7,704,7,704
540,36481,106,1,670,RH1060670,"'RH1060670',","RH1060670,",3/22/00,2000,3,22,2,62,188,233,-0.052,-0.674,0.216,0.014,-71.032,S1287,Failed,Nuclear Waste Policy Amendments Act of 2000,Commit with Instructions,S 1287 QUESTION: COMMIT WITH INSTRUCTIONS NUCLEAR WASTE POLICY AMENDMENTS ACT OF 2000,QUESTION: COMMIT WITH INSTRUCTIONS NUCLEAR WASTE POLICY AMENDMENTS ACT OF 2000,7,704,7,704
541,36483,106,1,671,RH1060671,"'RH1060671',","RH1060671,",3/22/00,2000,3,22,2,63,253,167,-0.137,-0.091,-0.122,-0.146,-161.177,S1287,Passed,Nuclear Waste Policy Amendments Act of 2000,On Passage,S 1287 QUESTION: ON PASSAGE NUCLEAR WASTE POLICY AMENDMENTS ACT OF 2000,QUESTION: ON PASSAGE NUCLEAR WASTE POLICY AMENDMENTS ACT OF 2000,7,704,7,704
542,36525,106,1,713,RH1060713,"'RH1060713',","RH1060713,",4/5/00,2000,4,5,2,105,423,2,0,0,0,0,0,HR3671,Passed,Wildlife and Sport Fish Restoration Progrms Improvement Act,On Passage,H R 3671 QUESTION: ON PASSAGE WILDLIFE AND SPORT FISH RESTORATION PROGRMS IMPROVEMENT ACT,QUESTION: ON PASSAGE WILDLIFE AND SPORT FISH RESTORATION PROGRMS IMPROVEMENT ACT,7,709,7,709
543,36540,106,1,728,RH1060728,"'RH1060728',","RH1060728,",4/12/00,2000,4,12,2,120,420,5,0,0,0,0,0,HR2328,Passed,Clean Lakes Program Reauthorization,On Passage,H R 2328 QUESTION: ON PASSAGE CLEAN LAKES PROGRAM REAUTHORIZATION,QUESTION: ON PASSAGE CLEAN LAKES PROGRAM REAUTHORIZATION,7,701,7,701
544,36541,106,1,729,RH1060729,"'RH1060729',","RH1060729,",4/12/00,2000,4,12,2,121,418,7,0,0,0,0,0,HR3039,Passed,Chesapeake Bay Restoration Act,On Passage,H R 3039 QUESTION: ON PASSAGE CHESAPEAKE BAY RESTORATION ACT,QUESTION: ON PASSAGE CHESAPEAKE BAY RESTORATION ACT,7,710,7,701
545,36554,106,1,743,RH1060743,"'RH1060743',","RH1060743,",5/3/00,2000,5,3,2,135,420,0,0,0,0,0,0,S1744,Passed,Continued Submission of Certain Species Conservation Reports,On Motion to Suspend the Rules and Pass,S 1744 QUESTION: ON MOTION TO SUSPEND THE RULES AND PASS CONTINUED SUBMISSION OF CERTAIN SPECIES CONSERVATION REPORTS,QUESTION: ON MOTION TO SUSPEND THE RULES AND PASS CONTINUED SUBMISSION OF CERTAIN SPECIES CONSERVATION REPORTS,7,709,7,709
546,36557,106,1,746,RH1060746,"'RH1060746',","RH1060746,",5/3/00,2000,5,3,2,138,418,6,0,0,0,0,0,HR2957,Passed,Lake Pontchartrain Basin Restoration Act,On Passage,H R 2957 QUESTION: ON PASSAGE LAKE PONTCHARTRAIN BASIN RESTORATION ACT,QUESTION: ON PASSAGE LAKE PONTCHARTRAIN BASIN RESTORATION ACT,7,710,7,701
547,36561,106,1,750,RH1060750,"'RH1060750',","RH1060750,",5/4/00,2000,5,4,2,142,416,5,0,0,0,0,0,HR1106,Passed,Alternative Water Sources Act,On Passage,H R 1106 QUESTION: ON PASSAGE ALTERNATIVE WATER SOURCES ACT,QUESTION: ON PASSAGE ALTERNATIVE WATER SOURCES ACT,7,701,7,701
548,36562,106,1,751,RH1060751,"'RH1060751',","RH1060751,",5/4/00,2000,5,4,2,143,411,7,0,0,0,0,0,HR673,Passed,Florida Keys Water Quality Improvements Act,On Passage,H R 673 QUESTION: ON PASSAGE FLORIDA KEYS WATER QUALITY IMPROVEMENTS ACT,QUESTION: ON PASSAGE FLORIDA KEYS WATER QUALITY IMPROVEMENTS ACT,7,701,7,701
549,36572,106,1,761,RH1060761,"'RH1060761',","RH1060761,",5/9/00,2000,5,9,2,153,391,29,0.624,0.24,0.29,-0.003,-58.107,HR3313,Passed,Long Island Sound Restoration Act,"On Motion to Suspend the Rules and Pass, as Amended","H R 3313 QUESTION: ON MOTION TO SUSPEND THE RULES AND PASS, AS AMENDED LONG ISLAND SOUND RESTORATION ACT","QUESTION: ON MOTION TO SUSPEND THE RULES AND PASS, AS AMENDED LONG ISLAND SOUND RESTORATION ACT",7,710,7,701
550,36580,106,1,769,RH1060769,"'RH1060769',","RH1060769,",5/10/00,2000,5,10,2,161,153,273,0.231,0.149,-0.168,-0.273,-129.767,HR701,Failed,NA,On Agreeing to the Amendment,H R 701 AUTHOR(S): RADANOVICH OF CALIFORNIA AMENDMENT QUESTION: ON AGREEING TO THE AMENDMENT CONSERVATION AND REINVESTMENT ACT,QUESTION: ON AGREEING TO THE AMENDMENT CONSERVATION AND REINVESTMENT ACT,7,700,7,700
551,36581,106,1,770,RH1060770,"'RH1060770',","RH1060770,",5/10/00,2000,5,10,2,162,109,315,0.185,0.636,-0.194,-0.388,-121.497,HR701,Failed,NA,On Agreeing to the Amendment,H R 701 AUTHOR(S): TANCREDO OF COLORADO AMENDMENT QUESTION: ON AGREEING TO THE AMENDMENT CONSERVATION AND REINVESTMENT ACT,QUESTION: ON AGREEING TO THE AMENDMENT CONSERVATION AND REINVESTMENT ACT,7,700,7,700
552,36586,106,1,775,RH1060775,"'RH1060775',","RH1060775,",5/11/00,2000,5,11,2,167,142,281,0.416,-0.444,-0.148,-0.155,-169.301,HR701,Failed,NA,On Agreeing to the Amendment,H R 701 AUTHOR(S): CHAMBLISS OF GEORGIA AMENDMENT QUESTION: ON AGREEING TO THE AMENDMENT CONSERVATION AND REINVESTMENT ACT,QUESTION: ON AGREEING TO THE AMENDMENT CONSERVATION AND REINVESTMENT ACT,7,700,7,700
553,36587,106,1,776,RH1060776,"'RH1060776',","RH1060776,",5/11/00,2000,5,11,2,168,166,259,0.194,0.302,-0.205,-0.173,-103.859,HR701,Failed,NA,On Agreeing to the Amendment,H R 701 AUTHOR(S): CHENOWETH-HAGE OF IDAHO AMENDMENT QUESTION: ON AGREEING TO THE AMENDMENT CONSERVATION AND REINVESTMENT ACT,AUTHOR(S): CHENOWETH-HAGE OF IDAHO AMENDMENT QUESTION: ON AGREEING TO THE AMENDMENT CONSERVATION AND REINVESTMENT ACT,7,700,7,700
554,36589,106,1,778,RH1060778,"'RH1060778',","RH1060778,",5/11/00,2000,5,11,2,170,187,238,0.208,-0.154,-0.182,-0.347,-114.414,HR701,Failed,NA,On Agreeing to the Amendment,H R 701 AUTHOR(S): SWEENEY OF NEW YORK AMENDMENT QUESTION: ON AGREEING TO THE AMENDMENT CONSERVATION AND REINVESTMENT ACT,QUESTION: ON AGREEING TO THE AMENDMENT CONSERVATION AND REINVESTMENT ACT,7,711,7,711
555,36592,106,1,781,RH1060781,"'RH1060781',","RH1060781,",5/11/00,2000,5,11,2,173,107,317,0.207,0.604,-0.173,-0.338,-130.501,HR701,Failed,NA,On Agreeing to the Amendment,H R 701 AUTHOR(S): CHENOWETH-HAGE OF IDAHO AMENDMENT QUESTION: ON AGREEING TO THE AMENDMENT CONSERVATION AND REINVESTMENT ACT,AUTHOR(S): CHENOWETH-HAGE OF IDAHO AMENDMENT QUESTION: ON AGREEING TO THE AMENDMENT CONSERVATION AND REINVESTMENT ACT,7,700,7,700
556,36595,106,1,784,RH1060784,"'RH1060784',","RH1060784,",5/11/00,2000,5,11,2,176,56,365,0.326,0.945,-0.167,-0.273,-118.082,HR701,Failed,NA,On Agreeing to the Amendment,"H R 701 AUTHOR(S): OSE OF CALIFORNIA AMENDMENT, AS MODIFIED QUESTION: ON AGREEING TO THE AMENDMENT CONSERVATION AND REINVESTMENT ACT","AUTHOR(S): OSE OF CALIFORNIA AMENDMENT, AS MODIFIED QUESTION: ON AGREEING TO THE AMENDMENT CONSERVATION AND REINVESTMENT ACT",7,700,7,700
557,36596,106,1,785,RH1060785,"'RH1060785',","RH1060785,",5/11/00,2000,5,11,2,177,126,291,0.298,0.184,-0.178,-0.296,-128.216,HR701,Failed,NA,On Agreeing to the Amendment,H R 701 AUTHOR(S): THORNBERRY OF TEXAS SUBSTITUTE AMENDMENT QUESTION: ON AGREEING TO THE AMENDMENT CONSERVATION AND REINVESTMENT ACT,QUESTION: ON AGREEING TO THE AMENDMENT CONSERVATION AND REINVESTMENT ACT,7,700,7,700
558,36597,106,1,786,RH1060786,"'RH1060786',","RH1060786,",5/11/00,2000,5,11,2,178,413,3,0,0,0,0,0,HR701,Passed,Conservation and Reinvestment Act,On Motion to Recommit with Instructions,H R 701 QUESTION: ON MOTION TO RECOMMIT WITH INSTRUCTIONS CONSERVATION AND REINVESTMENT ACT,QUESTION: ON MOTION TO RECOMMIT WITH INSTRUCTIONS CONSERVATION AND REINVESTMENT ACT,7,700,7,700
559,36598,106,1,787,RH1060787,"'RH1060787',","RH1060787,",5/11/00,2000,5,11,2,179,315,102,0.328,0.392,0.139,0.236,-151.2,HR701,Passed,Conservation and Reinvestment Act,On Passage,H R 701 QUESTION: ON PASSAGE CONSERVATION AND REINVESTMENT ACT,QUESTION: ON PASSAGE CONSERVATION AND REINVESTMENT ACT,7,700,7,700
560,36636,106,1,825,RH1060825,"'RH1060825',","RH1060825,",5/23/00,2000,5,23,2,217,400,13,0.638,-0.616,0.233,-0.335,-36.908,HR297,Passed,Lewis and Clark Rural Water System Act,"On Motion to Suspend the Rules and Pass, as Amended","H R 297 QUESTION: ON MOTION TO SUSPEND THE RULES AND PASS, AS AMENDED LEWIS AND CLARK RURAL WATER SYSTEM ACT","QUESTION: ON MOTION TO SUSPEND THE RULES AND PASS, AS AMENDED LEWIS AND CLARK RURAL WATER SYSTEM ACT",7,701,7,701
561,36654,106,1,844,RH1060844,"'RH1060844',","RH1060844,",6/6/00,2000,6,6,2,237,390,1,0,0,0,0,0,HR3535,Passed,Shark Finning Prohibition Act,"Suspend the Rules and Pass, As Amended","H R 3535 QUESTION: SUSPEND THE RULES AND PASS, AS AMENDED SHARK FINNING PROHIBITION ACT","QUESTION: SUSPEND THE RULES AND PASS, AS AMENDED SHARK FINNING PROHIBITION ACT",7,709,7,709
562,36655,106,1,845,RH1060845,"'RH1060845',","RH1060845,",6/7/00,2000,6,7,2,238,212,211,0.034,0.499,-0.29,0.019,-32.467,HR3605,Agreed to,NA,On Agreeing to the Amendment,H R 3605 AUTHOR(S): BOEHLERT (NY) SUBSTITUTE TO UDALL (CO) AMENDMENT QUESTION: ON AGREEING TO THE AMENDMENT SAN RAFAEL LEGACY DISTRICT,AUTHOR(S): BOEHLERT (NY) SUBSTITUTE TO UDALL (CO) AMENDMENT QUESTION: ON AGREEING TO THE AMENDMENT SAN RAFAEL LEGACY DISTRICT,7,709,7,709
563,36656,106,1,846,RH1060846,"'RH1060846',","RH1060846,",6/7/00,2000,6,7,2,239,228,194,0.076,0.233,0.286,0.326,-54.966,HR3605,Agreed to,NA,On Agreeing to the Amendment,H R 3605 AUTHOR(S): INSLEE OF WASHINGTON AMENDMENT QUESTION: ON AGREEING TO THE AMENDMENT SAN RAFAEL LEGACY DISTRICT,QUESTION: ON AGREEING TO THE AMENDMENT SAN RAFAEL LEGACY DISTRICT,7,709,7,709
564,36657,106,1,847,RH1060847,"'RH1060847',","RH1060847,",6/7/00,2000,6,7,2,240,210,214,0.01,0.553,-0.276,-0.077,-44.896,HR3605,Failed,NA,On Agreeing to the Amendment,H R 3605 AUTHOR(S): BOEHLERT (NY) SUBSTITUTE TO HOLT (NJ) AMENDMENT QUESTION: ON AGREEING TO THE AMENDMENT SAN RAFAEL LEGACY DISTRICT,AUTHOR(S): BOEHLERT (NY) SUBSTITUTE TO HOLT (NJ) AMENDMENT QUESTION: ON AGREEING TO THE AMENDMENT SAN RAFAEL LEGACY DISTRICT,7,709,7,709
565,36661,106,1,851,RH1060851,"'RH1060851',","RH1060851,",6/7/00,2000,6,7,2,244,421,1,0,0,0,0,0,HR4435,Passed,North Carolina Coastal Barrier Resources,"Suspend the Rules and Pass, As Amended","H R 4435 QUESTION: SUSPEND THE RULES AND PASS, AS AMENDED NORTH CAROLINA COASTAL BARRIER RESOURCES","QUESTION: SUSPEND THE RULES AND PASS, AS AMENDED NORTH CAROLINA COASTAL BARRIER RESOURCES",7,710,7,701
566,36662,106,1,852,RH1060852,"'RH1060852',","RH1060852,",6/7/00,2000,6,7,2,245,406,14,0.657,0.479,0.279,0.238,-41.093,HR3176,Passed,Kealia Pond National Wildlife Refuge,Suspend the Rules and Pass,H R 3176 QUESTION: SUSPEND THE RULES AND PASS KEALIA POND NATIONAL WILDLIFE REFUGE,QUESTION: SUSPEND THE RULES AND PASS KEALIA POND NATIONAL WILDLIFE REFUGE,7,709,7,709
567,36690,106,1,884,RH1060884,"'RH1060884',","RH1060884,",6/14/00,2000,6,14,2,277,173,249,-0.03,-0.1,0.134,0.81,-134.553,HR4578,Failed,NA,On Agreeing to the Amendment,H R 4578 AUTHOR(S): WU OF OREGON AMENDMENT QUESTION: ON AGREEING TO THE AMENDMENT DEPARTMENT OF THE INTERIOR APPROPRIATIONS FOR FY 2001,QUESTION: ON AGREEING TO THE AMENDMENT DEPARTMENT OF THE INTERIOR APPROPRIATIONS FOR FY 2001,7,709,7,709
568,36716,106,1,910,RH1060910,"'RH1060910',","RH1060910,",6/21/00,2000,6,21,2,304,208,216,-0.005,0.073,0.238,0.655,-82.109,HR4635,Failed,NA,On Agreeing to the Amendment,H R 4635 AUTHOR(S): HINCHEY OF NEW YORK AMENDMENT QUESTION: ON AGREEING TO THE AMENDMENT DEPARTMENTS OF VETERANS AFFAIRS AND HOUSING AND URBAN DEVELOPMENT APPROPRIATIONS FOR FY 2001,QUESTION: ON AGREEING TO THE AMENDMENT DEPARTMENTS OF VETERANS AFFAIRS AND HOUSING AND URBAN DEVELOPMENT APPROPRIATIONS FOR FY 2001,7,701,7,701
569,36717,106,1,911,RH1060911,"'RH1060911',","RH1060911,",6/21/00,2000,6,21,2,305,225,199,0.205,-0.203,-0.142,-0.735,-141.531,HR4635,Agreed to,NA,On Agreeing to the Amendment,H R 4635 AUTHOR(S): COLLINS OF GEORGIA AMENDMENT QUESTION: ON AGREEING TO THE AMENDMENT DEPARTMENTS OF VETERANS AFFAIRS AND HOUSING AND URBAN DEVELOPMENT APPROPRIATIONS FOR FY 2001,QUESTION: ON AGREEING TO THE AMENDMENT DEPARTMENTS OF VETERANS AFFAIRS AND HOUSING AND URBAN DEVELOPMENT APPROPRIATIONS FOR FY 2001,7,705,7,705
570,36740,106,1,934,RH1060934,"'RH1060934',","RH1060934,",6/26/00,2000,6,26,2,328,384,22,0.647,0.041,0.343,0.047,-42.778,S148,Passed,Neotropical Migratory Bird Conservation Act,"Motion to Suspend the Rules and Pass, as Amended","S 148 QUESTION: MOTION TO SUSPEND THE RULES AND PASS, AS AMENDED NEOTROPICAL MIGRATORY BIRD CONSERVATION ACT","QUESTION: MOTION TO SUSPEND THE RULES AND PASS, AS AMENDED NEOTROPICAL MIGRATORY BIRD CONSERVATION ACT",7,709,7,709
571,36741,106,1,935,RH1060935,"'RH1060935',","RH1060935,",6/26/00,2000,6,26,2,329,393,12,0.738,0.033,1.24,-0.487,-26.329,HR4408,Passed,To reauthorize the Atlantic Striped Bass Conservation Act,"Motion to Suspend the Rules and Pass, as Amended","H R 4408 QUESTION: MOTION TO SUSPEND THE RULES AND PASS, AS AMENDED TO REAUTHORIZE THE ATLANTIC STRIPED BASS CONSERVATION ACT","QUESTION: MOTION TO SUSPEND THE RULES AND PASS, AS AMENDED TO REAUTHORIZE THE ATLANTIC STRIPED BASS CONSERVATION ACT",7,709,7,709
572,36788,106,1,986,RH1060986,"'RH1060986',","RH1060986,",7/11/00,2000,7,11,2,380,403,15,0.53,0.848,0.271,0.348,-45.018,HR4442,Passed,National Wildlife Refuge System Centennial Act,"On Motion to Suspend the Rules and Pass, as Amended","H R 4442 QUESTION: ON MOTION TO SUSPEND THE RULES AND PASS, AS AMENDED NATIONAL WILDLIFE REFUGE SYSTEM CENTENNIAL ACT","QUESTION: ON MOTION TO SUSPEND THE RULES AND PASS, AS AMENDED NATIONAL WILDLIFE REFUGE SYSTEM CENTENNIAL ACT",7,709,7,709
573,36789,106,1,987,RH1060987,"'RH1060987',","RH1060987,",7/11/00,2000,7,11,2,381,387,28,0.395,0.919,0.218,0.398,-69.112,HRES415,Passed,Expressing the sense of the House of Representatives that there should be a National Ocean Day,"On Motion to Suspend the Rules and Agree, as Amended","H RES 415 QUESTION: ON MOTION TO SUSPEND THE RULES AND AGREE, AS AMENDED EXPRESSING THE SENSE OF THE HOUSE OF REPRESENTATIVES THAT THERE SHOULD BE A NATIONAL OCEAN DAY","QUESTION: ON MOTION TO SUSPEND THE RULES AND AGREE, AS AMENDED EXPRESSING THE SENSE OF THE HOUSE OF REPRESENTATIVES THAT THERE SHOULD BE A NATIONAL OCEAN DAY",7,710,7,701
574,36790,106,1,988,RH1060988,"'RH1060988',","RH1060988,",7/11/00,2000,7,11,2,382,190,228,-0.115,0.031,0.091,0.601,-178.998,HR4461,Failed,NA,On Agreeing to the Amendment,H R 4461 AUTHOR(S): DEFAZIO OF OREGON AMENDMENT QUESTION: ON AGREEING TO THE AMENDMENT AGRICULTURE AND RURAL DEVELOPMENT APPROPRIATIONS FOR FY 2001,QUESTION: ON AGREEING TO THE AMENDMENT AGRICULTURE AND RURAL DEVELOPMENT APPROPRIATIONS FOR FY 2001,7,709,7,709
575,37348,107,1,158,RH1070158,"'RH1070158',","RH1070158,",6/13/01,2001,6,13,1,159,418,6,0,0,0,0,0,HR1157,Passed,Pacific Salmon Recovery Act,On Passage,NA,H.R. 1157: Pacific Salmon Recovery Act (On Passage),7,709,7,709
576,37388,107,1,198,RH1070198,"'RH1070198',","RH1070198,",6/28/01,2001,6,28,1,199,39,372,0.699,-0.127,-0.16,0.26,-111.875,HR2311,Failed,NA,On Agreeing to the Amendment,NA,An amendment considered as adopted pursuant to the provisions of H. Res. 180. The amendment strikes section 103 which directs the Secretary of the Army to include an alternatives analysis of a multipurpose Auburn Dam as a part of the Sacramento District's,7,711,7,711
577,37390,107,1,200,RH1070200,"'RH1070200',","RH1070200,",6/28/01,2001,6,28,1,201,163,258,-0.274,0.129,0.176,0.562,-113.373,HR2311,Failed,NA,On Agreeing to the Amendment,NA,H.Amdt. 124: Amendment sought to delete section 105 of the bill which allows certain beach replenishment projects to proceed with a cost share ratio of 65 percent Federal share/35 percent local share. amending H.R. 2311 [107th]: Energy and Water Developme,7,710,7,701
578,37475,107,1,286,RH1070286,"'RH1070286',","RH1070286,",7/27/01,2001,7,27,1,288,218,189,-0.096,0.945,0.368,0.399,-49.399,HR2620,Agreed to,NA,On Agreeing to the Amendment,NA,"H.Amdt. 261: Amendment prohibits funds in the bill from being used to delay the national primary drinking water regulation for Arsenic published on January 22, 2001 in the Federal Register or to propose or finalize a rule to increase the levels of arsenic",7,701,7,701
579,37476,107,1,287,RH1070287,"'RH1070287',","RH1070287,",7/27/01,2001,7,27,1,289,182,214,-0.077,0.017,0.234,0.235,-57.787,HR2620,Failed,NA,On Agreeing to the Amendment,NA,H.Amdt. 262: Amendment sought to increase EPA funding by $25 million for the EPA Office of Compliance and Enforcement with offests made to other salaries and expenses accounts in the bill. amending H.R. 2620 [107th]: Departments of Veterans Affairs and Ho,7,700,7,700
580,37480,107,1,291,RH1070291,"'RH1070291',","RH1070291,",7/30/01,2001,7,30,1,293,99,325,-0.363,-0.932,0.069,0.13,-220.295,HR2620,Failed,NA,On Agreeing to the Amendment,NA,"H.Amdt. 268: Amendment increases EPA funding for enhanced beach water monitoring programs by $3 million. amending H.R. 2620 [107th]: Departments of Veterans Affairs and Housing and Urban Development, and Independent Agencies Appropriations Act, 2002 (On A",7,710,7,701
581,37481,107,1,292,RH1070292,"'RH1070292',","RH1070292,",7/30/01,2001,7,30,1,294,190,231,0.184,-0.838,0.118,0.156,-184.08,HR2620,Failed,NA,On Agreeing to the Amendment,NA,"H.Amdt. 270: Amendment, as modified, increases funding for registering and assessing pesticides by $3 million. amending H.R. 2620 [107th]: Departments of Veterans Affairs and Housing and Urban Development, and Independent Agencies Appropriations Act, 2002",7,704,7,704
582,37500,107,1,311,RH1070311,"'RH1070311',","RH1070311,",8/1/01,2001,8,1,1,313,125,300,-0.392,-0.193,0.062,0.345,-220.478,HR4,Failed,NA,On Agreeing to the Amendment,NA,"H.Amdt. 291: Amendment sought to grant California a waiver of the reformulated gas rules of the Clean Air Act requiring 2 percent oxygen, only if its reformulation will achieve equivalent or greater emissions reductions. amending H.R. 4 [107th]: Energy Po",7,705,7,705
583,37503,107,1,314,RH1070314,"'RH1070314',","RH1070314,",8/1/01,2001,8,1,1,316,228,201,-0.131,0.177,-0.144,-0.459,-133.911,HR4,Agreed to,NA,On Agreeing to the Amendment,NA,"H.Amdt. 297: Amendment implements a 2,000-acre limitation on the total surface area that may be covered by oil and gas production operations in the Arctic National Wildlife Refuge's Coastal Plain. amending H.R. 4 [107th]: Energy Policy Act of 2002 (On Agr",7,709,7,709
584,37556,107,1,367,RH1070367,"'RH1070367',","RH1070367,",10/4/01,2001,10,4,1,370,296,121,0.457,-0.809,0.102,0.003,-224.755,HR2646,Agreed to,NA,On Agreeing to the Amendment,NA,H.Amdt. 349: An amendment numbered 23 printed in the Congressional Record to create the Conservation Corridor Program. amending H.R. 2646 [107th]: Farm Security and Rural Investment Act of 2002 (On Agreeing to the Amendment),7,711,7,711
585,37574,107,1,385,RH1070385,"'RH1070385',","RH1070385,",10/16/01,2001,10,16,1,389,382,32,0.477,0.57,0.176,0.461,-75.313,HR2272,Passed,Coral Reef and Coastal Marine Conservation Act,"On Motion to Suspend the Rules and Pass, as Amended",NA,H.R. 2272: Coral Reef and Coastal Marine Conservation Act of 2001 (under suspension of the rules),7,710,7,701
586,38033,107,1,588,RH1070588,"'RH1070588',","RH1070588,",4/9/02,2002,4,9,2,82,396,6,0,0,0,0,0,HR3958,Passed,Bear River Migratory Bird Refuge Settlement Act,"On Motion to Suspend the Rules and Pass, as Amended",NA,H.R. 3958: Bear River Migratory Bird Refuge Settlement Act of 2002 (under suspension of the rules),7,709,7,709
587,38083,107,1,638,RH1070638,"'RH1070638',","RH1070638,",5/8/02,2002,5,8,2,132,308,105,-0.171,-0.578,-0.106,-0.258,-160.677,HJRES87,Passed,Yucca Mountain Repository Site Approval Act,On Consideration of the Resolution,NA,On Consideration of the Resolution: H J RES 87 Yucca Mountain Repository Site Approval Act,7,704,7,704
588,38084,107,1,639,RH1070639,"'RH1070639',","RH1070639,",5/8/02,2002,5,8,2,133,306,117,-0.307,-0.261,-0.117,-0.204,-169.051,HJRES87,Passed,Yucca Mountain Repository Site Approval Act,On Passage,NA,H.J.Res. 87: Yucca Mountain Development resolution (On Passage),7,704,7,704
589,38200,107,1,755,RH1070755,"'RH1070755',","RH1070755,",6/24/02,2002,6,24,2,249,375,0,0,0,0,0,0,HR3937,Passed,"To revoke a Public Land Order with respect to certain lands erroneously included in the Cibola National Wildlife Refuge, California","On Motion to Suspend the Rules and Pass, as Amended",NA,"H.R. 3937: To revoke a Public Land Order with respect to certain lands erroneously included in the Cibola National Wildlife Refuge, California. (under suspension of the rules)",7,709,7,709
590,38234,107,1,789,RH1070789,"'RH1070789',","RH1070789,",7/8/02,2002,7,8,2,283,340,9,0.67,-0.378,0.283,-0.547,-19.582,HR4609,Passed,Rathdrum Prairie Spokane Valley Aquifer Study Act,On Motion to Suspend the Rules and Pass,NA,"H.R. 4609: To direct the Secretary of the Interior to conduct a comprehensive study of the Rathdrum Prairie/Spokane Valley Aquifer, located in Idaho and Washington. (under suspension of the rules)",7,701,7,701
591,38267,107,1,822,RH1070822,"'RH1070822',","RH1070822,",7/17/02,2002,7,17,2,316,201,223,0.01,-0.007,0.216,0.522,-82.188,HR5093,Failed,NA,On Agreeing to the Amendment,NA,H.Amdt. 541: Amendment sought to add a new section at the end of the bill providing that none of the funds in the bill may be used to enter into any new commercial agricultural lease on the Lower Klamath and Tule Lake National Wildlife Refuges in the Stat,7,709,7,709
592,38333,107,1,888,RH1070888,"'RH1070888',","RH1070888,",9/10/02,2002,9,10,2,382,377,0,0,0,0,0,0,HR3880,Passed,Temporary Waiver for New York Areas for Clean Air Transportation Conformity and Metropolitan Planning Requirements,"On Motion to Suspend the Rules and Pass, as Amended",NA,H.R. 3880: To provide a temporary waiver from certain transportation conformity requirements and metropolitan transportation planning requirements under the Clean Air Act and under other laws for certain areas in New York where the planning offices and re,7,705,7,705
593,38924,108,1,68,RH1080068,"'RH1080068',","RH1080068,",3/19/03,2003,3,19,1,69,424,0,0,0,0,0,0,HR417,Passed,"To Revoke a Public Land Order with Respect to Certain Lands Erroneously Included in the Cibola National Wildlife Refuge, California",On Motion to Suspend the Rules and Pass,NA,"On Passage - House - H.R. 417 To Revoke a Public Land Order with Respect to Certain Lands Erroneously Included in the Cibola National Wildlife Refuge, California - Under Suspension of the Rules",7,709,7,709
594,38925,108,1,69,RH1080069,"'RH1080069',","RH1080069,",3/19/03,2003,3,19,1,70,414,6,0,0,0,0,0,HR699,Passed,Comprehensive Study of the Rathdrum Prairie/Spokane Valley Aquifer,On Motion to Suspend the Rules and Pass,NA,On Passage - House - H.R. 699 Comprehensive Study of the Rathdrum Prairie/Spokane Valley Aquifer - Under Suspension of the Rules,7,701,7,701
595,38940,108,1,84,RH1080084,"'RH1080084',","RH1080084,",3/25/03,2003,3,25,1,85,411,13,0.838,0.172,1.448,1.3,-41.987,HR961,Passed,Upper Mississippi River Basin Protection Act,On Motion to Suspend the Rules and Pass,NA,On Passage - House - H.R. 961 Upper Mississippi River Basin Protection Act - Under Suspension of the Rules,7,711,7,711
596,38989,108,1,133,RH1080133,"'RH1080133',","RH1080133,",4/10/03,2003,4,10,1,134,226,202,-0.083,0.207,-0.155,-0.426,-118.864,HR6,Agreed to,NA,On Agreeing to the Amendment,NA,"H.Amdt. 67: Amendment places a 2,000 acre limit on oil exploration on the Coastal Plain in the Alaska National Wildlife Refuge. amending H.R. 6 [108th]: Energy Policy Act of 2003",7,709,7,709
597,38990,108,1,134,RH1080134,"'RH1080134',","RH1080134,",4/10/03,2003,4,10,1,135,197,228,0.157,-0.162,0.231,0.909,-85.504,HR6,Failed,NA,On Agreeing to the Amendment,NA,H.Amdt. 69: Amendment sought to strike sections in the bill that allows oil drilling in the Arctic National Wildlife Refuge. amending H.R. 6 [108th]: Energy Policy Act of 2003,7,709,7,709
598,39024,108,1,168,RH1080168,"'RH1080168',","RH1080168,",5/7/03,2003,5,7,1,169,413,2,0,0,0,0,0,HR866,Passed,Wastewater Treatment Works Security Act,On Motion to Suspend the Rules and Pass,NA,On Passage - House - H.R. 866 Wastewater Treatment Works Security Act - Under Suspension of the Rules,7,704,7,704
599,39060,108,1,204,RH1080204,"'RH1080204',","RH1080204,",5/21/03,2003,5,21,1,205,252,175,-0.309,0.884,-0.342,-0.366,-54.356,HR1588,Agreed to,NA,On Agreeing to the Amendment,NA,; and replaces section 318(a) concerning Marine Mammal Protection Act to defi,7,709,7,709
600,39234,108,1,378,RH1080378,"'RH1080378',","RH1080378,",7/17/03,2003,7,17,1,380,197,228,0.155,-0.394,0.186,0.324,-97.276,HR2691,Failed,NA,On Agreeing to the Amendment,NA,H.Amdt. 261: Amendment sought to prohibit any funding to be used to enter into any new commercial agricultural lease on the Lower Klamath and Tule Lake National Wildlife Refuge in the States of Oregon and California that permits the growing of row crops o,7,709,7,709
601,39308,108,1,452,RH1080452,"'RH1080452',","RH1080452,",7/25/03,2003,7,25,1,454,114,309,0.231,-0.637,0.112,0.612,-143.095,HR2861,Failed,NA,On Agreeing to the Amendment,NA,"H.Amdt. 345: Amendment sought to increase funding for the EPA Hazardous Substance Superfund by $114 million and reduce NASA funding by an equal amount. amending H.R. 2861 [108th]: Departments of Veterans Affairs and Housing and Urban Development, and Ind",7,704,7,704
602,39488,108,1,632,RH1080632,"'RH1080632',","RH1080632,",11/19/03,2003,11,19,1,634,419,0,0,0,0,0,0,HR1006,Passed,Captive Wildlife Safety Act,"On Motion to Suspend the Rules and Pass, as Amended",NA,On Passage - House - H.R. 1006 Captive Wildlife Safety Act - Under Suspension of the Rules,7,709,7,709
603,39900,108,1,748,RH1080748,"'RH1080748',","RH1080748,",3/23/04,2004,3,23,2,74,401,10,0,0,0,0,0,HR2408,Passed,National Wildlife Refuge Volunteer Act of 2003,"On Motion to Suspend the Rules and Pass, as Amended",NA,On Passage - House - H.R. 2408 National Wildlife Refuge Volunteer Act of 2003 - Under Suspension of the Rules,7,709,7,709
604,39947,108,1,916,RH1080916,"'RH1080916',","RH1080916,",6/15/04,2004,6,15,2,242,229,186,0.378,-0.914,-0.279,-0.611,-89.97,HR4513,Passed,"To provide that in preparing an environmental assessment or environmental impact statement required under section 102 of the National Environmental Policy Act of 1969 with respect to any action authorizing a renewable energy project, no Federal agency is required to identify alternative project locations etc...",On Passage,NA,"On Passage - House - H.R. 4513 To provide that in preparing an environmental assessment or environmental impact statement required under section 102 of the National Environmental Policy Act of 1969 with respect to any action authorizing a renewable energy project, no Federal agency is required to identify alternative project locations etc...",7,709,7,709
605,40331,108,1,795,RH1080795,"'RH1080795',","RH1080795,",4/21/04,2004,4,21,2,121,402,14,0.726,0.253,1.202,1.538,-42.178,HR3970,Passed,Green Chemistry Research and Development Act,"On Motion to Suspend the Rules and Pass, as Amended",NA,On Passage - House - H.R. 3970 Green Chemistry Research and Development Act - Under Suspension of the Rules,7,704,7,704
606,40812,109,1,501,RH1090501,"'RH1090501',","RH1090501,",9/29/05,2005,9,29,1,502,252,171,0.05,-0.999,-0.339,-0.324,-52.145,HRES470,Passed,"Providing for consideration of the bill (H.R. 3824) to amend and reauthorize the Endangered Species Act of 1973 to provide greater results conserving and recovering listed species, and for other purposes",On Agreeing to the Resolution,NA,"On Passage - H.Res. 470 Providing for consideration of the bill (H.R. 3824) to amend and reauthorize the Endangered Species Act of 1973 to provide greater results conserving and recovering listed species, and for other purposes",7,709,7,709
607,40815,109,1,505,RH1090505,"'RH1090505',","RH1090505,",9/29/05,2005,9,29,1,506,229,193,0.168,-0.178,-0.636,-2.595,-75.611,HR3824,Passed,Threatened and Endangered Species Recovery Act,On Passage,NA,On Passage - House - H.R. 3824 Threatened and Endangered Species Recovery Act,7,709,7,709
608,40939,109,1,629,RH1090629,"'RH1090629',","RH1090629,",12/14/05,2005,12,14,1,631,103,327,-0.58,-0.792,-0.078,0.741,-191.491,HRES599,Failed,Establishing the Task Force on Ocean Policy,On Motion to Suspend the Rules and Agree,NA,On Passage - House - H.Res. 599 Establishing the Task Force on Ocean Policy - Under Suspension of the Rules,7,710,7,701
609,41086,109,1,79,RH1090079,"'RH1090079',","RH1090079,",3/16/05,2005,3,16,1,80,431,1,0,0,0,0,0,HR1270,Passed,To amend the Internal Revenue Code of 1986 to extend the Leaking Underground Storage Tank Trust Fund financing rate,On Motion to Suspend the Rules and Pass,NA,On Passage - House - H.R. 1270 To amend the Internal Revenue Code of 1986 to extend the Leaking Underground Storage Tank Trust Fund financing rate - Under Suspension of the Rules,7,711,7,711
610,41136,109,1,129,RH1090129,"'RH1090129',","RH1090129,",4/21/05,2005,4,21,1,130,185,243,-0.154,0.397,0.296,0.21,-44.469,HR6,Failed,"H.Amdt.98: Amendment sought to codify Executive Order 12898 titled, """"""""Federal Actions to Address Environmental Justice in Minority Populations and Low Income Populations""""""""; provide a definition of """"""""environmental justice""""""""; establish offices of environmental justice in appropriate agencies; and reestablish the Interagency Federal Working Group on Environmental Justice.",On Agreeing to the Amendment,NA,"H.Amdt.98: Amendment sought to codify Executive Order 12898 titled, """"""""Federal Actions to Address Environmental Justice in Minority Populations and Low Income Populations""""""""; provide a definition of """"""""environmental justice""""""""; establish offices of environmental justice in appropriate agencies; and reestablish the Interagency Federal Working Group on Environmental Justice.",7,700,7,700
611,41138,109,1,131,RH1090131,"'RH1090131',","RH1090131,",4/21/05,2005,4,21,1,132,249,183,0.004,-0.104,-0.147,-0.46,-122.597,HR6,Passed,"Energy Policy Act of 2005 - that would overhaul the nation's energy policy and provide for approximately $8 billion in energy-related tax incentives. It also would authorize the Interior Department to hold a lease sale for oil and gas exploration, development ...",On Passage,NA,"Passage of the bill (Energy Policy Act of 2005) that would overhaul the nation's energy policy and provide for approximately $8 billion in energy-related tax incentives. It also would authorize the Interior Department to hold a lease sale for oil and gas exploration, development ...",7,709,7,709
612,41182,109,1,175,RH1090175,"'RH1090175',","RH1090175,",5/17/05,2005,5,17,1,176,225,198,0.129,0.194,0.185,0.155,-97.349,HR2360,Agreed to,H.Amdt.135: Amendment increases funding for State and local grant programs by $50 million in order to enhance the security of chemical plants.,On Agreeing to the Amendment,NA,H.Amdt.135: Amendment increases funding for State and local grant programs by $50 million in order to enhance the security of chemical plants.,7,704,7,704
613,41199,109,1,192,RH1090192,"'RH1090192',","RH1090192,",5/19/05,2005,5,19,1,193,76,344,-0.344,0.939,0.034,-0.236,-197.83,HR2361,Failed,H.Amdt.175: Amendment sought to increase funding for the EPA's Hazardous Substance Superfund by $130 million.,On Agreeing to the Amendment,NA,H.Amdt.175: Amendment sought to increase funding for the EPA's Hazardous Substance Superfund by $130 million.,7,704,7,704
614,41200,109,1,193,RH1090193,"'RH1090193',","RH1090193,",5/19/05,2005,5,19,1,194,186,235,0.057,-0.998,0.21,0.102,-86.05,HR2361,Failed,H.Amdt.178: Amendment sought to increase funding for the Clean Water State Revolving Fund by $100 million.,On Agreeing to the Amendment,NA,H.Amdt.178: Amendment sought to increase funding for the Clean Water State Revolving Fund by $100 million.,7,701,7,701
615,41407,109,1,504,RH1090504,"'RH1090504',","RH1090504,",9/29/05,2005,9,29,1,505,206,216,0.185,-0.153,0.293,0.871,-67.696,HR3824,Failed,NA,On Agreeing to the Amendment,NA,Amendment that would reauthorize the Endangered Species Act through 2010 and make changes to the species recovery plan process.,7,709,7,709
616,41796,109,1,815,RH1090815,"'RH1090815',","RH1090815,",5/17/06,2006,5,17,2,147,189,236,0.202,-0.232,0.319,1.405,-76.044,HR4200,Failed,H.Amdt.824: Amendment sought to strike all waivers of existing conservation laws in the bill; and require compliance with the National Environmental Policy Act.,On Agreeing to the Amendment,NA,H.Amdt.824: Amendment sought to strike all waivers of existing conservation laws in the bill; and require compliance with the National Environmental Policy Act.,7,700,7,700
617,41814,109,1,833,RH1090833,"'RH1090833',","RH1090833,",5/18/06,2006,5,18,2,165,231,187,-0.004,0.351,0.214,0.665,-96.975,HR5386,Agreed to,"H.Amdt.844: Amendment added that None of the funds made available in this Act may be used to promulgate in final form, issue, implement, or enforce the Environmental Protection Agency's Toxics Release Inventory Burden Reduction Proposed Rule published in the Federal Register on October 4, 2005 (Volume 70, Number 191) at pages 57822 and following or the Toxics Release Inventory 2006 Burden Reduction Proposed Rule published in the Federal Register on October 4, 2005 (Volume 70, Number 191) at pages 57871 through 57872.",On Agreeing to the Amendment,NA,"H.Amdt.844: Amendment added that None of the funds made available in this Act may be used to promulgate in final form, issue, implement, or enforce the Environmental Protection Agency's Toxics Release Inventory Burden Reduction Proposed Rule published in the Federal Register on October 4, 2005 (Volume 70, Number 191) at pages 57822 and following or the Toxics Release Inventory 2006 Burden Reduction Proposed Rule published in the Federal Register on October 4, 2005 (Volume 70, Number 191) at pages 57871 through 57872.",7,704,7,704
618,41818,109,1,837,RH1090837,"'RH1090837',","RH1090837,",5/18/06,2006,5,18,2,169,222,198,0.213,-0.077,0.326,0.922,-64.49,HR5386,Agreed to,H.Amdt.854: Amendment prevents the Administrator of the Environmental Protection Agency from implementing or enforcing the wetlands policy guidance issued in a joint memorandum of EPA and the Corps of Engineers in 2003.,On Agreeing to the Amendment,NA,H.Amdt.854: Amendment prevents the Administrator of the Environmental Protection Agency from implementing or enforcing the wetlands policy guidance issued in a joint memorandum of EPA and the Corps of Engineers in 2003.,7,710,7,701
619,41837,109,1,856,RH1090856,"'RH1090856',","RH1090856,",5/23/06,2006,5,23,2,188,185,235,0.36,-0.294,0.042,0.311,-247.496,HR5384,Failed,H.Amdt.897: Amendment sought to prohibit funds in the bill from being used to implement the limitation in section 720 of the bill concerning the wetlands reserve program; and to reduce other funding in the bill by $82 million.,On Agreeing to the Amendment,NA,H.Amdt.897: Amendment sought to prohibit funds in the bill from being used to implement the limitation in section 720 of the bill concerning the wetlands reserve program; and to reduce other funding in the bill by $82 million.,7,710,7,701
620,41849,109,1,868,RH1090868,"'RH1090868',","RH1090868,",5/24/06,2006,5,24,2,200,147,271,-0.16,-0.579,0.133,0.096,-149.336,HR5427,Failed,"H.Amdt.919: Amendment added that None of the funds made available by this Act may be used by the Office of Civilian Radioactive Waste Management to administer the """"""""Yucca Mountain Youth Zone"""""""" website.",On Agreeing to the Amendment,NA,"H.Amdt.919: Amendment added that None of the funds made available by this Act may be used by the Office of Civilian Radioactive Waste Management to administer the """"""""Yucca Mountain Youth Zone"""""""" website.",7,704,7,704
621,41989,109,1,1026,RH1091026,"'RH1091026',","RH1091026,",7/10/06,2006,7,10,2,358,366,1,0,0,0,0,0,HR2563,Passed,"To authorize the Secretary of the Interior to conduct feasibility studies to address certain water shortages within the Snake, Boise, and Payette River systems in Idaho, and for other purposes","On Motion to Suspend the Rules and Pass, as Amended",NA,"On Passage - House - To authorize the Secretary of the Interior to conduct studies to address certain water shortages within the Snake, Boise, and Payette River systems in Idaho,",7,711,7,711
622,42025,109,1,1062,RH1091062,"'RH1091062',","RH1091062,",7/24/06,2006,7,24,2,394,358,4,0,0,0,0,0,S1496,Passed,To direct the Secretary of the Interior to conduct a pilot program under which up to 15 States may issue electronic Federal migratory bird hunting stamps,On Motion to Suspend the Rules and Pass,NA,On Passage - House - To direct the Secretary of the Interior to conduct a pilot program under which up to 15 States may issue electronic Federal migratory bird hunting stamps.,7,709,7,709
623,42102,109,1,1139,RH1091139,"'RH1091139',","RH1091139,",9/25/06,2006,9,25,2,471,223,167,-0.133,-0.196,-0.178,0.087,-80.499,HR5059,Failed,New Hampshire Wilderness Act,On Motion to Suspend the Rules and Pass,NA,On Passage - House -New Hampshire Wilderness Act,7,709,7,709
624,42103,109,1,1140,RH1091140,"'RH1091140',","RH1091140,",9/25/06,2006,9,25,2,472,220,169,-0.262,-0.965,-0.236,0.172,-78.128,HR5062,Failed,New Hampshire Wilderness Act,On Motion to Suspend the Rules and Pass,NA,On Passage - House -New Hampshire Wilderness Act,7,709,7,709
625,42215,109,1,940,RH1090940,"'RH1090940',","RH1090940,",6/13/06,2006,6,13,2,272,218,207,0.103,0.536,0.261,0.089,-57.831,HR5576,Agreed to,H.Amdt.1023: Amendment provides $2.97 million for the loan guarantee program authorized in section 108 of the Housing and Community Development Act of 1974.,On Agreeing to the Amendment,NA,Amendment: Amendment increases funding for the Office of Lead Hazard Control by $35 million.,7,708,7,708
626,42675,110,1,39,RH1100039,"'RH1100039',","RH1100039,",1/18/07,2007,1,18,1,40,264,163,0.202,0.142,0.242,0.298,-73.835,HR6,Passed,Creating Long-Term Energy Alternatives for the Nation Act,On Passage,NA,"An Act to move the United States toward greater energy independence and security, to increase the production of clean renewable fuels, to protect consumers, to increase the efficiency of products, buildings, and vehicles, to promote research on and deploy",7,705,7,705
627,42713,110,1,77,RH1100077,"'RH1100077',","RH1100077,",2/7/07,2007,2,7,1,78,426,2,0,0,0,0,0,HR365,Passed,Methamphetamine Remediation Research Act,On Motion to Suspend the Rules and Pass,NA,"To provide for a research program for remediation of closed methamphetamine production laboratories, and for other purposes.",7,704,7,704
628,42758,110,1,122,RH1100122,"'RH1100122',","RH1100122,",3/7/07,2007,3,7,1,123,165,258,0.239,0.18,-0.231,0.087,-79.411,HR569,Failed,H.Amdt.25: An amendment numbered 1 printed in the Congressional Record to add a new section to the bill requiring offsets.,On Agreeing to the Amendment,NA,H.Amdt.25: An amendment numbered 1 printed in the Congressional Record to add a new section to the bill requiring offsets.,7,701,7,701
629,42759,110,1,123,RH1100123,"'RH1100123',","RH1100123,",3/7/07,2007,3,7,1,124,425,0,0,0,0,0,0,HR569,Passed,Water Quality Investment Act,On Motion to Recommit with Instructions,NA,On Motion to Recommit with Instructions: H R 569 Water Quality Investment Act,7,701,7,701
630,42760,110,1,124,RH1100124,"'RH1100124',","RH1100124,",3/7/07,2007,3,7,1,125,367,58,0.511,0.258,0.492,0.282,-59.139,HR569,Passed,Water Quality Investment Act,On Passage,NA,To amend the Federal Water Pollution Control Act to authorize appropriations for sewer overflow control grants.,7,703,7,703
631,42763,110,1,127,RH1100127,"'RH1100127',","RH1100127,",3/8/07,2007,3,8,1,128,175,252,0.193,0.204,-0.249,0.024,-61.445,HR700,Failed,H.Amdt.30: An amendment numbered 1 printed in the Congressional Record to add a new section at the end of the bill to require offsets.,On Agreeing to the Amendment,NA,H.Amdt.30: An amendment numbered 1 printed in the Congressional Record to add a new section at the end of the bill to require offsets.,7,701,7,701
632,42764,110,1,128,RH1100128,"'RH1100128',","RH1100128,",3/8/07,2007,3,8,1,129,427,0,0,0,0,0,0,HR700,Passed,To amend the Federal Water Pollution Control Act to extend the pilot program for alternative water source projects.,On Motion to Recommit with Instructions,NA,On Motion to Recommit with Instructions: H R 700 To amend the Federal Water Pollution Control Act to extend the pilot program for alternative water source projects.,7,701,7,701
633,42765,110,1,129,RH1100129,"'RH1100129',","RH1100129,",3/8/07,2007,3,8,1,130,368,59,0.513,0.247,0.662,0.349,-57.697,HR700,Passed,To amend the Federal Water Pollution Control Act to extend the pilot program for alternative water source projects.,On Passage,NA,H.R. 700: Healthy Communities Water Supply Act of 2007,7,701,7,701
634,42767,110,1,131,RH1100131,"'RH1100131',","RH1100131,",3/9/07,2007,3,9,1,132,229,179,0.095,0.754,0.277,0.01,-40.828,HRES229,Passed,"Providing for consideration of the bill (H.R. 720) to amend the Federal Water Pollution Control Act to authorize appropriations for State water pollution control revolving funds, and for other purposes",On Agreeing to the Resolution,NA,"Providing for consideration of the bill (H.R. 720) to amend the Federal Water Pollution Control Act to authorize appropriations for State water pollution control revolving funds, and for other purposes.",7,700,7,700
635,42768,110,1,132,RH1100132,"'RH1100132',","RH1100132,",3/9/07,2007,3,9,1,133,140,276,0.293,0.17,-0.348,-0.267,-64.161,HR720,Failed,H.Amdt. 35: Amendment sought to to strike the Davis-Bacon provision of the bill.,On Agreeing to the Amendment,NA,H.Amdt. 35: Amendment sought to to strike the Davis-Bacon provision of the bill.,7,701,7,701
636,42769,110,1,133,RH1100133,"'RH1100133',","RH1100133,",3/9/07,2007,3,9,1,134,359,56,-0.517,-0.007,-0.22,0,-111.13,HR720,Passed,Water Quality Financing Act of 2007,On Motion to Recommit with Instructions,NA,On Motion to Recommit with Instructions: H R 720 Water Quality Financing Act of 2007,7,701,7,701
637,42770,110,1,134,RH1100134,"'RH1100134',","RH1100134,",3/9/07,2007,3,9,1,135,303,108,0.38,0.143,0.365,0.325,-70.894,HR720,Passed,Water Quality Financing Act of 2007,On Passage,NA,"To amend the Federal Water Pollution Control Act to authorize appropriations for State water pollution control revolving funds, and for other purposes.",7,700,7,700
638,42822,110,1,186,RH1100186,"'RH1100186',","RH1100186,",3/26/07,2007,3,26,1,187,359,48,0.262,0.892,0.224,0.546,-83.513,HR802,Passed,Maritime Pollution Prevention Act,"On Motion to Suspend the Rules and Pass, as Amended",NA,To amend the Act to Prevent Pollution from Ships to implement MARPOL Annex VI.,7,705,7,705
639,42830,110,1,194,RH1100194,"'RH1100194',","RH1100194,",3/27/07,2007,3,27,1,195,233,187,0.044,0.999,0.305,0.112,-41.804,HR1401,Agreed to,"H.Amdt.60: Manager's amendment consists of the text contained in House Report 110-74 and printed on pages H3123-H3126 in the Congressional Record for March 27, 2007.",On Agreeing to the Amendment,NA,H.Amdt.62: An amendment numbered 3 printed in House Report 110-74 to establish a program to coordinate with state and local governments to enable minimize the need for transportation of toxic inhalation hazardous materials by rail.,7,704,7,704
640,42834,110,1,198,RH1100198,"'RH1100198',","RH1100198,",3/27/07,2007,3,27,1,199,234,184,0.019,1,0.316,0.144,-37.257,HR1401,Agreed to,"H.Amdt.60: Manager's amendment consists of the text contained in House Report 110-74 and printed on pages H3123-H3126 in the Congressional Record for March 27, 2007.",On Agreeing to the Amendment,NA,H.Amdt.62: An amendment numbered 3 printed in House Report 110-74 to establish a program to coordinate with state and local governments to enable minimize the need for transportation of toxic inhalation hazardous materials by rail.,7,704,7,704
641,42850,110,1,214,RH1100214,"'RH1100214',","RH1100214,",4/17/07,2007,4,17,1,215,393,22,0.568,0.671,1.129,1.624,-48.425,HRES196,Passed,Supporting the goals and ideals of World Water Day,On Motion to Suspend the Rules and Agree,NA,H. Res. 196: Supporting the goals and ideals of World Water Day,7,701,7,701
642,42972,110,1,336,RH1100336,"'RH1100336',","RH1100336,",5/11/07,2007,5,11,1,337,185,229,0.025,0.425,-0.977,-1.24,-34.134,HR2082,Failed,H.Amdt.174: Amendment sought to strike section 407 which requires the Director of National Intelligence to submit to Congress a national intelligence estimate on the anticipated geopolitical effects of global climate change and the implications of such effects on the national security of the United States.,On Agreeing to the Amendment,NA,H.Amdt.174: Amendment sought to strike section 407 which requires the Director of National Intelligence to submit to Congress a national intelligence estimate on the anticipated geopolitical effects of global climate change and the implications of such effects on the national security of the United States.,7,705,7,705
643,43145,110,1,510,RH1100510,"'RH1100510',","RH1100510,",6/20/07,2007,6,20,1,516,79,347,-0.261,-0.601,0.076,0.322,-164.987,HR2641,Failed,H.Amdt.327: Amendment sought to delete funding for the Yucca Mountain nuclear waste disposal program.,On Agreeing to the Amendment,NA,H.Amdt.327: Amendment sought to delete funding for the Yucca Mountain nuclear waste disposal program.,7,704,7,704
644,43184,110,1,549,RH1100549,"'RH1100549',","RH1100549,",6/26/07,2007,6,26,1,555,153,269,0.133,0.499,-0.667,-1.227,-52.226,HR2643,Failed,"H.Amdt.416: Amendment sought to strike section 501 which states as the sense of Congress that there should be enacted a comprehensive and effective national program of mandatory, market-based limits and incentives on emissions of greenhouse gases that slow, stop, and reverse the growth of such emissions at a rate and in a manner that (1) will not significantly harm the United States economy and (2) will encourage comparable action by other nations that are major trading partners and key contributors to global emissions.",On Agreeing to the Amendment,NA,"H.Amdt.416: Amendment sought to strike section 501 which states as the sense of Congress that there should be enacted a comprehensive and effective national program of mandatory, market-based limits and incentives on emissions of greenhouse gases that slow, stop, and reverse the growth of such emissions at a rate and in a manner that (1) will not significantly harm the United States economy and (2) will encourage comparable action by other nations that are major trading partners and key contributors to global emissions.",7,705,7,705
645,43185,110,1,550,RH1100550,"'RH1100550',","RH1100550,",6/26/07,2007,6,26,1,556,248,177,0.312,-0.368,0.273,0.498,-67.6,HR2643,Agreed to,H.Amdt.418: Amendment prohibits funds in the bill from being used to promulgate or implement a proposed EPA regulation concerning air pollution emission standards for major sources of pollution.,On Agreeing to the Amendment,NA,H.Amdt.418: Amendment prohibits funds in the bill from being used to promulgate or implement a proposed EPA regulation concerning air pollution emission standards for major sources of pollution.,7,705,7,705
646,43187,110,1,552,RH1100552,"'RH1100552',","RH1100552,",6/26/07,2007,6,26,1,558,171,254,0.125,0.196,-0.22,-0.579,-88.735,HR2643,Failed,H.Amdt.423: An amendment to prohibit use of funds for the continued operation of the Mexican Wolf Recovery program.,On Agreeing to the Amendment,NA,H.Amdt.423: An amendment to prohibit use of funds for the continued operation of the Mexican Wolf Recovery program.,7,709,7,709
647,43195,110,1,560,RH1100560,"'RH1100560',","RH1100560,",6/27/07,2007,6,27,1,566,97,325,0.458,0.166,-0.234,0.205,-100.186,HR2643,Failed,H.Amdt.434: An amendment to prohibit funds to be used for the Conte Anadromous Fish Laboratory.,On Agreeing to the Amendment,NA,H.Amdt.434: An amendment to prohibit funds to be used for the Conte Anadromous Fish Laboratory.,7,709,7,709
648,43202,110,1,567,RH1100567,"'RH1100567',","RH1100567,",6/27/07,2007,6,27,1,573,186,240,0.057,-0.131,0.143,0.701,-131.497,HR2643,Failed,"H.Amdt.447: An amendment numbered 17 printed in the Congressional Record to prohibit use of funds in the bill to issue any permit for, or otherwise approve or allow, importation of any polar bear or polar bear part.",On Agreeing to the Amendment,NA,"H.Amdt.447: An amendment numbered 17 printed in the Congressional Record to prohibit use of funds in the bill to issue any permit for, or otherwise approve or allow, importation of any polar bear or polar bear part.",7,709,7,709
649,43326,110,1,691,RH1100691,"'RH1100691',","RH1100691,",7/24/07,2007,7,24,1,697,138,279,0.301,-0.226,-0.225,0.023,-92.795,HR3074,Failed,"H.Amdt.612: Amendment sought to limit the use of funds to used to support Amtrak's route with the highest loss, measured by passenger per mile cost as based on the National Railroad Passenger Corporation's September 2006 Financial Performance of Routes Report.",On Agreeing to the Amendment,NA,"H.Amdt.612: Amendment sought to limit the use of funds to used to support Amtrak's route with the highest loss, measured by passenger per mile cost as based on the National Railroad Passenger Corporation's September 2006 Financial Performance of Routes Report.",7,708,7,708
650,43348,110,1,713,RH1100713,"'RH1100713',","RH1100713,",7/25/07,2007,7,25,1,719,387,26,0.44,0.757,0.24,0.502,-60.435,HCONRES187,Passed,Expressing the sense of Congress regarding the dumping of industrial waste into the Great Lakes.,On Motion to Suspend the Rules and Agree,NA,Expressing the sense of Congress regarding the dumping of industrial waste into the Great Lakes,7,704,7,704
651,43757,110,1,1122,RH1101122,"'RH1101122',","RH1101122,",12/5/07,2007,12,5,1,1130,358,55,0.42,0.769,0.257,0.279,-84.252,HR236,Passed,North Bay Water Reuse Program Act of 2007,"On Motion to Suspend the Rules and Pass, as Amended",NA,"To authorize the Secretary of the Interior to create a Bureau of Reclamation partnership with the North Bay Water Reuse Authority and other regional partners to achieve objectives relating to water supply, water quality, and environmental restoration.",7,711,7,711
652,44204,110,1,1331,RH1101331,"'RH1101331',","RH1101331,",4/2/08,2008,4,2,2,156,411,10,0,0,0,0,0,HR5501,Agreed to,"H.Amdt.976: Amendment directed the Coordinator of United States Government Activities to Combat HIV/AIDS Globally and the Administrator of the United States Agency for International Development to expand their plan for strengthening health systems of host countries by allowing for postsecondary educational institutions, particularly in Africa, to collaborate with United States postsecondary educational institutions and specifically historically black colleges and universities.",On Agreeing to the Amendment,NA,"H.Amdt.976: Amendment directed the Coordinator of United States Government Activities to Combat HIV/AIDS Globally and the Administrator of the United States Agency for International Development to expand their plan for strengthening health systems of host countries by allowing for postsecondary educational institutions, particularly in Africa, to collaborate with United States postsecondary educational institutions and specifically historically black colleges and universities.",7,701,7,701
653,44212,110,1,1339,RH1101339,"'RH1101339',","RH1101339,",4/9/08,2008,4,9,2,164,220,190,-0.032,-0.008,1.057,-0.468,-11.562,HRES1084,Passed,"Providing for consideration of the bill H.R. 2016, to establish the National Landscape Conservation System, and for other purposes",On Ordering the Previous Question,NA,"On Ordering the Previous Question: H RES 1084 Providing for consideration of the bill H.R. 2016, to establish the National Landscape Conservation System, and for other purposes",7,711,7,711
654,44213,110,1,1340,RH1101340,"'RH1101340',","RH1101340,",4/9/08,2008,4,9,2,165,220,188,0.042,0.999,0.55,-0.017,-8.581,HRES1084,Passed,"Providing for consideration of the bill H.R. 2016, to establish the National Landscape Conservation System, and for other purposes",On Agreeing to the Resolution,NA,"Providing for consideration of the bill (H.R. 2016) to establish the National Landscape Conservation System, and for other purposes.",7,711,7,711
655,44216,110,1,1343,RH1101343,"'RH1101343',","RH1101343,",4/9/08,2008,4,9,2,168,174,243,0.244,-0.159,-0.311,-0.566,-51.756,HR2016,Failed,H.Amdt.982: Amendment sought to strike the preamble to the establishment of the National Landscape Conservation System.,On Agreeing to the Amendment,NA,H.Amdt.982: Amendment sought to strike the preamble to the establishment of the National Landscape Conservation System.,7,711,7,711
656,44221,110,1,1348,RH1101348,"'RH1101348',","RH1101348,",4/9/08,2008,4,9,2,173,208,212,-0.064,0.091,-0.241,-0.049,-58.07,HR2016,Failed,National Landscape Conservation System Act,On Motion to Recommit with Instructions,NA,"To establish the National Landscape Conservation System, and for other purposes.",7,711,7,711
657,44222,110,1,1349,RH1101349,"'RH1101349',","RH1101349,",4/9/08,2008,4,9,2,174,278,140,0.17,0.506,0.785,1.378,-58.175,HR2016,Passed,National Landscape Conservation System Act,On Passage,NA,"To establish the National Landscape Conservation System, and for other purposes.",7,711,7,711
658,44227,110,1,1354,RH1101354,"'RH1101354',","RH1101354,",4/10/08,2008,4,10,2,179,224,192,0.178,0.984,0.343,-0.297,-25.649,HRES1083,Passed,"Providing for consideration of H.R. 2537, Beach Protection Act of 2007.",On Agreeing to the Resolution,NA,"Providing for consideration of the bill (H.R. 2537) to amend the Federal Water Pollution Control Act relating to beach monitoring, and for other purposes.",7,710,7,701
659,44249,110,1,1376,RH1101376,"'RH1101376',","RH1101376,",4/16/08,2008,4,16,2,201,215,193,-0.011,-0.205,0.283,-0.132,-21.341,HR2537,Passed,Beach Protection Act,Sustaining the Ruling of the Chair,NA,Sustaining the Ruling of the Chair: H R 2537 Beach Protection Act,7,710,7,701
660,44383,110,1,1510,RH1101510,"'RH1101510',","RH1101510,",5/20/08,2008,5,20,2,335,294,119,0.316,0.234,0.281,0.515,-79.949,HR1464,Passed,Great Cats and Rare Canids Act of 2007,"On Motion to Suspend the Rules and Pass, as Amended",NA,To assist in the conservation of rare felids and rare canids by supporting and providing financial resources for the conservation programs of nations within the range of rare felid and rare canid populations and projects of persons with demonstrated exper,7,709,7,709
661,44384,110,1,1511,RH1101511,"'RH1101511',","RH1101511,",5/20/08,2008,5,20,2,336,374,39,0.565,0.606,0.354,0.121,-57.669,HR2649,Passed,Lake Hodges Surface Water Improvement and Reclamation Act of 2008,"On Motion to Suspend the Rules and Pass, as Amended",NA,To make amendments to the Reclamation Projects Authorization and Adjustment Act of 1992.,7,711,7,711
662,44393,110,1,1520,RH1101520,"'RH1101520',","RH1101520,",5/21/08,2008,5,21,2,345,304,118,0.367,0.146,0.369,0.437,-70.292,HR1771,Passed,Crane Conservation Act of 2008,"On Motion to Suspend the Rules and Pass, as Amended",NA,Crane Conservation Act of 2008,7,709,7,709
663,44417,110,1,1544,RH1101544,"'RH1101544',","RH1101544,",6/3/08,2008,6,3,2,369,364,0,0,0,0,0,0,HRES1114,Passed,Supporting the goals and ideals of the Arbor Day Foundation and National Arbor Day,On Motion to Suspend the Rules and Agree,NA,Supporting the goals and ideals of the Arbor Day Foundation and National Arbor Day,7,709,7,709
664,44423,110,1,1550,RH1101550,"'RH1101550',","RH1101550,",6/4/08,2008,6,4,2,375,394,17,-0.244,-0.97,-0.1,-0.536,-59.724,HR3021,Agreed to,H.Amdt.1070: Amendment establishes a moratorium on using federal funds to purchase carbon offsets with the funding authorized in the bill.,On Agreeing to the Amendment,NA,H.Amdt.1070: Amendment establishes a moratorium on using federal funds to purchase carbon offsets with the funding authorized in the bill.,7,705,7,705
665,44425,110,1,1552,RH1101552,"'RH1101552',","RH1101552,",6/4/08,2008,6,4,2,377,263,153,0.203,0.577,0.257,0.172,-72.898,HR3021,Agreed to,"H.Amdt.1074: Amendment provides that schools and local educational agencies receiving grants under this bill shall report, if they installed flooring, on whether it was (1) low- or no-VOC (Volatile Organic Compounds) flooring, (2) made from sustainable materials, and (3) cost effective",On Agreeing to the Amendment,NA,"H.Amdt.1074: Amendment provides that schools and local educational agencies receiving grants under this bill shall report, if they installed flooring, on whether it was (1) low- or no-VOC (Volatile Organic Compounds) flooring, (2) made from sustainable materials, and (3) cost effective",7,700,7,700
666,44443,110,1,1570,RH1101570,"'RH1101570',","RH1101570,",6/10/08,2008,6,10,2,395,411,0,0,0,0,0,0,HCONRES318,Passed,Supporting the goals and ideals of the International Year of Sanitation,"On Motion to Suspend the Rules and Agree, as Amended",NA,Supporting the goals and ideals of the International Year of Sanitation,7,700,7,700
667,44461,110,1,1588,RH1101588,"'RH1101588',","RH1101588,",6/12/08,2008,6,12,2,413,406,0,0,0,0,0,0,S2146,Passed,"Authorizing the Administrator of the Environmental Protection Agency to accept, as part of a settlement, diesel emission reduction Supplemental Environmental Projects, and for other purposes.","On Motion to Suspend the Rules and Pass, as Amended",NA,"A bill to authorize the Administrator of the Environmental Protection Agency to accept, as part of a settlement, diesel emission reduction Supplemental Environmental Projects, and for other purposes.",7,705,7,705
668,44462,110,1,1589,RH1101589,"'RH1101589',","RH1101589,",6/17/08,2008,6,17,2,414,302,96,0.222,0.62,0.358,0.751,-77.99,HR2964,Passed,Captive Primate Safety Act,"On Motion to Suspend the Rules and Pass, as Amended",NA,"To amend the Lacey Act Amendments of 1981 to treat nonhuman primates as prohibited wildlife species under that Act, to make corrections in the provisions relating to captive wildlife offenses under that Act, and for other purposes.",7,709,7,709
669,44661,110,1,1788,RH1101788,"'RH1101788',","RH1101788,",9/18/08,2008,9,18,2,613,172,230,0.1,0.355,-0.771,-0.587,-14.343,HR3036,Failed,No Child Left Inside Act of 2008,On Motion to Recommit with Instructions,NA,"To reauthorize and enhance the National Environmental Education Act, and for other purposes.",7,799,7,799
670,44662,110,1,1789,RH1101789,"'RH1101789',","RH1101789,",9/18/08,2008,9,18,2,614,293,109,0.372,0.051,0.33,0.533,-70.939,HR3036,Passed,No Child Left Inside Act of 2008,On Passage,NA,"To reauthorize and enhance the National Environmental Education Act, and for other purposes.",7,799,7,799
671,44663,110,1,1790,RH1101790,"'RH1101790',","RH1101790,",9/18/08,2008,9,18,2,615,371,20,0.605,0.341,0.892,0.935,-30.565,HR6460,Passed,Great Lakes Legacy Reauthorization Act of 2008,"On Motion to Suspend the Rules and Pass, as Amended",NA,"To amend the Federal Water Pollution Control Act to provide for the remediation of sediment contamination in areas of concern, and for other purposes.",7,711,7,711
672,44665,110,1,1792,RH1101792,"'RH1101792',","RH1101792,",9/22/08,2008,9,22,2,617,313,59,0.401,0.646,1.155,1.376,-73.876,HR1907,Passed,Coastal and Estuarine Land Conservation Program Act,"On Motion to Suspend the Rules and Pass, as Amended",NA,"To authorize the acquisition of land and interests in land from willing sellers to improve the conservation of, and to enhance the ecological values and functions of, coastal and estuarine areas to benefit both the environment and the economies of coastal",7,710,7,701
673,44713,110,1,1840,RH1101840,"'RH1101840',","RH1101840,",9/28/08,2008,9,28,2,665,411,9,0,0,0,0,0,HR6460,Passed,Great Lakes Legacy Reauthorization Act of 2008,Suspend the Rules and Concur in the Senate Amendment,NA,"S.Amdt.5655: To amend the Federal Water Pollution Control Act to provide for the remediation of sediment contamination in areas of concern, and for other purposes.",7,701,7,701
674,44717,110,1,1844,RH1101844,"'RH1101844',","RH1101844,",9/29/08,2008,9,29,2,669,393,5,0,0,0,0,0,S906,Passed,"To prohibit the sale, distribution,transfer, and export of elemental mercury, and for other purposes",On Motion to Suspend the Rules and Pass,NA,"A bill to prohibit the sale, distribution, transfer, and export of elemental mercury, and for other purposes.",7,704,7,704
675,45144,111,1,76,RH1110076,"'RH1110076',","RH1110076,",2/24/09,2009,2,24,1,77,402,16,0.777,0.521,0.564,-0.539,-26.717,HR637,Passed,South Orange County Recycled Water Enhancement Act,On Motion to Suspend the Rules and Pass,NA,"To amend the Lacey Act Amendments of 1981 to treat nonhuman primates as prohibited wildlife species under that Act, to make corrections in the provisions relating to captive wildlife offenses under that Act, and for other purposes.",7,709,7,709
676,45145,111,1,77,RH1110077,"'RH1110077',","RH1110077,",2/24/09,2009,2,24,1,78,420,0,0,0,0,0,0,HRES83,Passed,Recognizing the significance of Black History Month,On Motion to Suspend the Rules and Agree,NA,"To authorize the Secretary, in cooperation with the City of San Juan Capistrano, California, to participate in the design, planning, and construction of an advanced water treatment plant facility and recycled water system, and for other purposes.",7,701,7,701
677,45191,111,1,123,RH1110123,"'RH1110123',","RH1110123,",3/12/09,2009,3,12,1,124,391,10,0,0,0,0,0,HRES224,Passed,"Supporting the designation of Pi Day, and for other purposes",On Motion to Suspend the Rules and Agree,NA,"To amend the Federal Water Pollution Control Act to authorize appropriations for State water pollution control revolving funds, and for other purposes.",7,701,7,701
678,45227,111,1,159,RH1110159,"'RH1110159',","RH1110159,",3/26/09,2009,3,26,1,160,413,2,0,0,0,0,0,HR1404,Agreed to,H.Amdt.57: Amendment directs the allocation of funding in the bill to account for forest areas nation-wide that have been greatly damaged by infestation of invasive insects and which have high potential to burn quickly.,On Agreeing to the Amendment,NA,H.Amdt.57: Amendment directs the allocation of funding in the bill to account for forest areas nation-wide that have been greatly damaged by infestation of invasive insects and which have high potential to burn quickly.,7,709,7,709
679,45260,111,1,192,RH1110192,"'RH1110192',","RH1110192,",4/21/09,2009,4,21,1,193,288,116,0.303,0.237,0.801,1.443,-54.505,HR388,Passed,Crane Conservation Act of 2009,On Motion to Suspend the Rules and Pass,NA,"To assist in the conservation of cranes by supporting and providing, through projects of persons and organizations with expertise in crane conservation, financial resources for the conservation programs of countries the activities of which directly or ind",7,709,7,709
680,45261,111,1,193,RH1110193,"'RH1110193',","RH1110193,",4/21/09,2009,4,21,1,194,290,118,0.221,0.44,0.793,1.562,-59.539,HR411,Passed,Great Cats and Rare Canids Act of 2009,"On Motion to Suspend the Rules and Pass, as Amended",NA,To assist in the conservation of rare felids and rare canids by supporting and providing financial resources for the conservation programs of nations within the range of rare felid and rare canid populations and projects of persons with demonstrated exper,7,709,7,709
681,45262,111,1,194,RH1110194,"'RH1110194',","RH1110194,",4/21/09,2009,4,21,1,195,362,43,0.546,0.245,1.108,1.094,-62.55,HR1219,Passed,Lake Hodges Surface Water Improvement and Reclamation Act of 2009,On Motion to Suspend the Rules and Pass,NA,To make amendments to the Reclamation Projects Authorization and Adjustment Act of 1992.,7,701,7,701
682,45267,111,1,199,RH1110199,"'RH1110199',","RH1110199,",4/23/09,2009,4,23,1,200,419,0,0,0,0,0,0,HR1145,Agreed to,"H.Amdt.77: Amendment adds to the water research outcomes a study of the impacts of natural disasters, such as floods, hurricanes, and tornadoes on water resources.",On Agreeing to the Amendment,NA,"H.Amdt.77: Amendment adds to the water research outcomes a study of the impacts of natural disasters, such as floods, hurricanes, and tornadoes on water resources.",7,798,7,798
683,45324,111,1,256,RH1110256,"'RH1110256',","RH1110256,",5/14/09,2009,5,14,1,257,428,0,0,0,0,0,0,HR2187,Agreed to,"H.Amdt.132: Amendment includes reducing the incidence and effects of asthma and other respiratory illnesses in children among the voluntary guidelines for high performing school buildings. Amendment also adds reducing the incidence and effects of asthma and other respiratory illnesses to the list of demonstrable and expected benefits and includes the reduction and elimination of human exposure to airborne particles such as dust, sand, and pollens among the approved uses for grant funds used by local educational agencies.",On Agreeing to the Amendment,NA,"H.Amdt.132: Amendment includes reducing the incidence and effects of asthma and other respiratory illnesses in children among the voluntary guidelines for high performing school buildings. Amendment also adds reducing the incidence and effects of asthma and other respiratory illnesses to the list of demonstrable and expected benefits and includes the reduction and elimination of human exposure to airborne particles such as dust, sand, and pollens among the approved uses for grant funds used by local educational agencies.",7,708,7,708
684,45535,111,1,467,RH1110467,"'RH1110467',","RH1110467,",6/26/09,2009,6,26,1,469,170,257,0.099,0.215,-0.256,-0.277,-53.444,HR2996,Failed,H.Amdt.280: Amendment sought to decrease the funding included in the Interior and Environment Appropriations Act for the Environmental Protection Agency by 38% to reduce spending to 2009 levels.,On Agreeing to the Amendment,NA,H.Amdt.280: Amendment sought to decrease the funding included in the Interior and Environment Appropriations Act for the Environmental Protection Agency by 38% to reduce spending to 2009 levels.,7,700,7,700
685,45616,111,1,548,RH1110548,"'RH1110548',","RH1110548,",7/16/09,2009,7,16,1,550,400,0,0,0,0,0,0,HR2188,Passed,Joint Ventures for Bird Habitat Conservation Act,"On Motion to Suspend the Rules and Pass, as Amended",NA,Joint Ventures for Bird Habitat Conservation Act of 2009,7,709,7,709
686,45640,111,1,572,RH1110572,"'RH1110572',","RH1110572,",7/17/09,2009,7,17,1,574,232,188,0,-0.035,0.285,0.216,-45.523,HRES653,Passed,"Rule providing for the consideration of H.R. 1018, the Restore Our American Mustangs Act",On Ordering the Previous Question,NA,"On Ordering the Previous Question: H RES 653 Rule providing for the consideration of H.R. 1018, the Restore Our American Mustangs Act",7,709,7,709
687,45641,111,1,573,RH1110573,"'RH1110573',","RH1110573,",7/17/09,2009,7,17,1,575,236,186,0.124,-0.95,0.283,0.165,-59.53,HRES653,Passed,"Rule providing for the consideration of H.R. 1018, the Restore Our American Mustangs Act",On Agreeing to the Resolution,NA,"Providing for consideration of the bill (H.R. 1018) to amend the Wild Free-Roaming Horses and Burros Act to improve the management and long-term health of wild free-roaming horses and burros, and for other purposes.",7,709,7,709
688,45643,111,1,575,RH1110575,"'RH1110575',","RH1110575,",7/17/09,2009,7,17,1,577,239,185,0.055,0.078,0.134,0.476,-142.894,HR1018,Passed,Restore Our American Mustangs Act,On Passage,NA,"To amend the Wild Free-Roaming Horses and Burros Act to improve the management and long-term health of wild free-roaming horses and burros, and for other purposes.",7,709,7,709
689,45649,111,1,581,RH1110581,"'RH1110581',","RH1110581,",7/17/09,2009,7,17,1,583,89,332,0.46,0.16,-0.221,0.192,-95.256,HR3183,Failed,H.Amdt.333: Amendment sought to strike the $3 million earmark for the Consortium for Plant Biotechnology Research.,On Agreeing to the Amendment,NA,H.Amdt.333: Amendment sought to strike the $3 million earmark for the Consortium for Plant Biotechnology Research.,7,798,7,798
690,45663,111,1,595,RH1110595,"'RH1110595',","RH1110595,",7/21/09,2009,7,21,1,597,330,96,0.425,0.46,0.228,0.025,-100.359,HR2729,Passed,"To authorize the designation of National Environmental Research Parks by the Secretary of Energy, and for other purposes","On Motion to Suspend the Rules and Pass, as Amended",NA,"To authorize the designation of National Environmental Research Parks by the Secretary of Energy, and for other purposes.",7,798,7,798
691,45717,111,1,649,RH1110649,"'RH1110649',","RH1110649,",7/28/09,2009,7,28,1,651,316,107,0.422,-0.007,0.285,0.429,-79.52,HR556,Passed,Southern Sea Otter Recovery and Research Act,"On Motion to Suspend the Rules and Pass, as Amended",NA,Southern Sea Otter Recovery and Research Act,7,709,7,709
692,45718,111,1,650,RH1110650,"'RH1110650',","RH1110650,",7/28/09,2009,7,28,1,652,354,72,0.485,0.178,0.249,0.286,-91.34,HR509,Passed,To reauthorize the Marine Turtle Conservation Act of 2004,"On Motion to Suspend the Rules and Pass, as Amended",NA,Marine Turtle Conservation Reauthorization Act of 2009,7,709,7,709
693,45748,111,1,680,RH1110680,"'RH1110680',","RH1110680,",7/31/09,2009,7,31,1,682,316,109,0.359,0.343,0.136,0.101,-150.788,HR3435,Passed,Making supplemental appropriations for fiscal year 2009 for the Consumer Assistance to Recycle and Save Program,On Motion to Suspend the Rules and Pass,NA,Making supplemental appropriations for fiscal year 2009 for the Consumer Assistance to Recycle and Save Program.,7,707,7,707
694,45806,111,1,738,RH1110738,"'RH1110738',","RH1110738,",9/29/09,2009,9,29,1,740,286,107,0.193,0.627,0.225,0.387,-88.26,HR905,Passed,Thunder Bay National Marine Sanctuary and Underwater Preserve Boundary Modification Act,"On Motion to Suspend the Rules and Pass, as Amended",NA,Thunder Bay National Marine Sanctuary and Underwater Preserve Boundary Modification Act,7,710,7,701
695,45809,111,1,741,RH1110741,"'RH1110741',","RH1110741,",9/30/09,2009,9,30,1,743,240,170,0.053,0.999,0.54,0.157,-14.321,HR2442,Failed,Bay Area Regional Water Recycling Program Expansion Act,"On Motion to Suspend the Rules and Pass, as Amended",NA,Bay Area Regional Water Recycling Program Expansion Act of 2009,7,701,7,701
696,45810,111,1,742,RH1110742,"'RH1110742',","RH1110742,",9/30/09,2009,9,30,1,744,338,78,0.386,0.448,1.086,1.596,-86.187,HR1771,Passed,"Chesapeake Bay Science, Education, and Ecosystem Enhancement Act","On Motion to Suspend the Rules and Pass, as Amended",NA,"Chesapeake Bay Science, Education, and Ecosystem Enhancement Act of 2009",7,710,7,701
697,45811,111,1,743,RH1110743,"'RH1110743',","RH1110743,",9/30/09,2009,9,30,1,745,418,1,0,0,0,0,0,HR1053,Passed,Chesapeake Bay Accountability and Recovery Act,"On Motion to Suspend the Rules and Pass, as Amended",NA,Chesapeake Bay Accountability and Recovery Act of 2009,7,710,7,701
698,45826,111,1,758,RH1110758,"'RH1110758',","RH1110758,",10/7/09,2009,10,7,1,760,325,93,0.282,0.399,0.257,0.695,-91.623,HRES701,Passed,To recognize the Dyke March Wildlife Preserve as a unique and precious ecosystem,On Motion to Suspend the Rules and Agree,NA,To recognize the Dyke Marsh Wildlife Preserve as a unique and precious ecosystem.,7,709,7,709
699,45852,111,1,784,RH1110784,"'RH1110784',","RH1110784,",10/15/09,2009,10,15,1,786,237,178,-0.025,-0.151,0.313,-0.161,-24.818,HRES830,Passed,"Providing for consideration of the bill (H.R. 2442) to amend the Reclamation Wastewater and Groundwater Study and Facilities Act to expand the Bay Area Regional Water Recycling Program, and for other purposes",On Ordering the Previous Question,NA,"Providing for consideration of the bill (H.R. 2442) to amend the Reclamation Wastewater and Groundwater Study and Facilities Act to expand the Bay Area Regional Water Recycling Program, and for other purposes",7,701,7,701
700,45853,111,1,785,RH1110785,"'RH1110785',","RH1110785,",10/15/09,2009,10,15,1,787,221,193,-0.066,-0.03,0.425,0.323,-37.443,HRES830,Passed,"Providing for consideration of the bill (H.R. 2442) to amend the Reclamation Wastewater and Groundwater Study and Facilities Act to expand the Bay Area Regional Water Recycling Program, and for other purposes",On Agreeing to the Resolution,NA,"Providing for consideration of the bill (H.R. 2442) to amend the Reclamation Wastewater and Groundwater Study and Facilities Act to expand the Bay Area Regional Water Recycling Program, and for other purposes.",7,701,7,701
701,45922,111,1,854,RH1110854,"'RH1110854',","RH1110854,",11/5/09,2009,11,5,1,856,241,180,-0.007,-0.107,0.361,-0.058,-20.848,HRES885,Passed,"Providing for consideration of the bill (H.R. 2868) to amend the Homeland Security Act of 2002 to extend, modify, and recodify the authority of the Secretary of Homeland Security to enhance security and protect against acts of terrorism against chemical facilities, and for other purposes",On Ordering the Previous Question,NA,"Providing for consideration of the bill (H.R. 2868) to amend the Homeland Security Act of 2002 to extend, modify, and recodify the authority of the Secretary of Homeland Security to enhance security and protect against acts of terrorism against chemical facilities, and for other purposes",7,799,7,799
702,45923,111,1,855,RH1110855,"'RH1110855',","RH1110855,",11/5/09,2009,11,5,1,857,233,182,-0.046,-0.005,0.517,0.019,-20.917,HRES885,Passed,"Providing for consideration of the bill (H.R. 2868) to amend the Homeland Security Act of 2002 to extend, modify, and recodify the authority of the Secretary of Homeland Security to enhance security and protect against acts of terrorism against chemical facilities, and for other purposes",On Agreeing to the Resolution,NA,"Providing for consideration of the bill (H.R. 2868) to amend the Homeland Security Act of 2002 to extend, modify, and recodify the authority of the Secretary of Homeland Security to enhance security and protect against acts of terrorism against chemical facilities, and for other purposes",7,799,7,799
703,45935,111,1,867,RH1110867,"'RH1110867',","RH1110867,",11/6/09,2009,11,6,1,869,249,168,0.103,0.188,0.756,-0.175,-2.454,HR2868,Agreed to,H.Amdt.499: Amendment makes a number of technical and conforming corrections.,On Agreeing to the Amendment,NA,H.Amdt.499: Amendment makes a number of technical and conforming corrections.,7,799,7,799
704,45936,111,1,868,RH1110868,"'RH1110868',","RH1110868,",11/6/09,2009,11,6,1,870,165,257,-0.108,0.994,-0.186,-0.211,-110.437,HR2868,Failed,"H.Amdt.500: Amendment sought to insert provisions in the bill which allow the new Federal chemical facility regulations enacted by this bill to preempt state and local laws that """"""""""""""""hinder, pose obstacles to, or frustrate the purpose of the federal program"""""""""""""""".",On Agreeing to the Amendment,NA,"H.Amdt.500: Amendment sought to insert provisions in the bill which allow the new Federal chemical facility regulations enacted by this bill to preempt state and local laws that """"""""""""""""hinder, pose obstacles to, or frustrate the purpose of the federal program"""""""""""""""".",7,704,7,704
705,45937,111,1,869,RH1110869,"'RH1110869',","RH1110869,",11/6/09,2009,11,6,1,871,186,236,0.095,-0.79,-0.403,-0.309,-38.97,HR2868,Failed,"H.Amdt.502: Amendment sought to strike Title I, affecting chemical facilities, and replace it with an extension of the Department of Homeland Security's current regulatory authority under section 550(b) of the Department of Homeland Security Appropriations Act, 2007.",On Agreeing to the Amendment,NA,"H.Amdt.502: Amendment sought to strike Title I, affecting chemical facilities, and replace it with an extension of the Department of Homeland Security's current regulatory authority under section 550(b) of the Department of Homeland Security Appropriations Act, 2007.",7,799,7,799
706,45939,111,1,871,RH1110871,"'RH1110871',","RH1110871,",11/6/09,2009,11,6,1,873,196,227,-0.054,-0.051,-0.254,-0.171,-62.816,HR2868,Failed,H.Amdt.506: Amendment sought to strike the citizen enforcement section of the bill.,On Agreeing to the Amendment,NA,H.Amdt.506: Amendment sought to strike the citizen enforcement section of the bill.,7,799,7,799
707,45940,111,1,872,RH1110872,"'RH1110872',","RH1110872,",11/6/09,2009,11,6,1,874,189,236,-0.039,0.09,-0.26,-0.065,-50.75,HR2868,Failed,Chemical Facility Anti-Terrorism Act of 2009,On Motion to Recommit with Instructions,NA,Chemical Facility Anti-Terrorism Act of 2009,7,799,7,799
708,45941,111,1,873,RH1110873,"'RH1110873',","RH1110873,",11/6/09,2009,11,6,1,875,230,193,0.152,-0.87,0.408,0.433,-45.869,HR2868,Passed,Chemical Facility Anti-Terrorism Act of 2009,On Passage,NA,Continuing Chemical Facilities Antiterrorism Security Act of 2010,7,799,7,799
709,46379,111,1,989,RH1110989,"'RH1110989',","RH1110989,",1/13/10,2010,1,13,2,3,379,0,0,0,0,0,0,HRES1002,Passed,"Honoring the life and work of Dr. Martin Luther King, Jr. and encouraging the continued commitment to the Martin Luther King, Jr. Day as a national day of service",On Motion to Suspend the Rules and Agree,NA,Supporting the initiatives of Chicago Wilderness and the Children's Outdoor Bill of Rights,7,700,7,700
710,46467,111,1,1077,RH1111077,"'RH1111077',","RH1111077,",3/4/10,2010,3,4,2,91,375,1,0,0,0,0,0,HRES1079,Passed,Congratulating the National Football League Champion New Orleans Saints for winning Super Bowl XLIV and for bringing New Orleans its first Lombardi Trophy in franchise history,"On Motion to Suspend the Rules and Agree, as Amended",NA,"Harmful Algal Blooms and Hypoxia Research and Control Amendments Act of 2010 To establish a National Harmful Algal Bloom and Hypoxia Program, to develop and coordinate a comprehensive and integrated strategy to address harmful algal blooms and hypoxia, am",7,710,7,701
711,46484,111,1,1094,RH1111094,"'RH1111094',","RH1111094,",3/12/10,2010,3,12,2,109,251,103,0.1,0.6,0.191,0.401,-81.467,HR3650,Passed,Harmful Algal Blooms and Hypoxia Research and Control Amendments Act,On Passage,NA,Harmful Algal Blooms and Hypoxia Research and Control Amendments Act of 2010,7,710,7,701
712,46512,111,1,1122,RH1111122,"'RH1111122',","RH1111122,",3/19/10,2010,3,19,2,137,289,121,0.113,0.994,0.191,0.22,-105.816,HR3671,Passed,Upper Mississippi River Basin Protection Act,On Motion to Suspend the Rules and Pass,NA,Upper Mississippi River Basin Protection Act,7,710,7,701
713,46579,111,1,1189,RH1111189,"'RH1111189',","RH1111189,",4/15/10,2010,4,15,2,204,235,171,0.009,0.041,0.667,-0.972,-6.982,HRES1248,Passed,"Providing for consideration of the bill (H.R. 4715), Clean Estuaries Act of 2010 and waiving a requirement of clause 6(a) of rule XIII with respect to consideration of certain resolutions reported from the Committee on Rules, and providing for consideration of motions to suspend the rules",On Agreeing to the Resolution,NA,"Providing for consideration of the bill (H.R. 4715) to amend the Federal Water Pollution Control Act to reauthorize the National Estuary Program, and for other purposes, waiving a requirement of clause 6(a) of rule XIII with respect to consideration of certain resolutions reported from the Committee on Rules, and providing for consideration of motions to suspend the rules",7,710,7,701
714,46582,111,1,1192,RH1111192,"'RH1111192',","RH1111192,",4/15/10,2010,4,15,2,207,291,109,0.33,0.191,0.242,0.385,-80.663,HR4715,Agreed to,H.Amdt.600: Amendment ensures that comprehensive conservation and management plans address the impacts and potential effects of sea level change.,On Agreeing to the Amendment,NA,H.Amdt.600: Amendment ensures that comprehensive conservation and management plans address the impacts and potential effects of sea level change.,7,710,7,701
715,46583,111,1,1193,RH1111193,"'RH1111193',","RH1111193,",4/15/10,2010,4,15,2,208,192,214,-0.15,0.027,-0.965,0.296,-42.702,HR4715,Failed,"To amend the Federal Water Pollution Control Act to reauthorize the National Estuary Program, and for other purposes.",On Motion to Recommit with Instructions,NA,"To amend the Federal Water Pollution Control Act to reauthorize the National Estuary Program, and for other purposes.",7,710,7,701
716,46584,111,1,1194,RH1111194,"'RH1111194',","RH1111194,",4/15/10,2010,4,15,2,209,278,128,0.249,0.228,1,1.627,-61.98,HR4715,Passed,"To amend the Federal Water Pollution Control Act to reauthorize the National Estuary Program, and for other purposes.",On Passage,NA,"To amend the Federal Water Pollution Control Act to reauthorize the National Estuary Program, and for other purposes.",7,710,7,701
717,46716,111,1,1326,RH1111326,"'RH1111326',","RH1111326,",6/9/10,2010,6,9,2,341,241,170,0.425,-0.645,0.256,0.555,-93.126,HRES989,Failed,"Expressing the sense of the House of Representatives that the United States should adopt national policies and pursue international agreements to prevent ocean acidification, to study the impacts of ocean acidification, and to address the effects of ocean acidification on marine ecosystems and coastal economies",On Motion to Suspend the Rules and Agree,NA,"Expressing the sense of the House of Representatives that the United States should adopt national policies and pursue international agreements to prevent ocean acidification, to study the impacts of ocean acidification, and to address the effects of ocean acidification on marine ecosystems and coastal economies",7,710,7,701
718,46729,111,1,1339,RH1111339,"'RH1111339',","RH1111339,",6/10/10,2010,6,10,2,354,410,0,0,0,0,0,0,S3473,Passed,To amend the Oil Pollution Act of 1990 to authorize advances from Oil Spill Liability Trust Fund for the Deepwater Horizon oil spill,On Motion to Suspend the Rules and Pass,NA,A bill to amend the Oil Pollution Act of 1990 to authorize advances from Oil Spill Liability Trust Fund for the Deepwater Horizon oil spill.,7,710,7,701
719,46731,111,1,1341,RH1111341,"'RH1111341',","RH1111341,",6/14/10,2010,6,14,2,356,360,0,0,0,0,0,0,HRES1409,Passed,"Expressing support for designation of June 20, 2010, as """"""""American Eagle Day"""""""", and celebrating the recovery and restoration of the bald eagle, the national symbol of the United States",On Motion to Suspend the Rules and Agree,NA,"Expressing support for designation of June 20, 2010, as """"""""American Eagle Day"""""""", and celebrating the recovery and restoration of the bald eagle, the national symbol of the United States",7,709,7,709
720,46757,111,1,1367,RH1111367,"'RH1111367',","RH1111367,",6/23/10,2010,6,23,2,382,420,1,0,0,0,0,0,HR5481,Passed,To give subpoena power to the National Commission on the BP Deepwater Horizon Oil Spill and Offshore Drilling,"On Motion to Suspend the Rules and Pass, as Amended",NA,To give subpoena power to the National Commission on the BP Deepwater Horizon Oil Spill and Offshore Drilling.,7,710,7,701
721,46792,111,1,1402,RH1111402,"'RH1111402',","RH1111402,",7/1/10,2010,7,1,2,417,412,0,0,0,0,0,0,HRES1460,Passed,Recognizing the important role pollinators play in supporting the ecosystem and supporting the goals and ideals of National Pollinator Week,On Motion to Suspend the Rules and Agree,NA,Recognizing the important role pollinators play in supporting the ecosystem and supporting the goals and ideals of National Pollinator Week.,7,709,7,709
722,46851,111,1,1461,RH1111461,"'RH1111461',","RH1111461,",7/28/10,2010,7,28,2,478,416,0,0,0,0,0,0,HRES1543,Passed,"Honoring the educational significance of Dr. Jane Goodall's work on this the 50th anniversary of the beginning of her work in Tanzania, Africa",On Motion to Suspend the Rules and Agree,NA,"Honoring the educational significance of Dr. Jane Goodall's work on this the 50th anniversary of the beginning of her work in Tanzania, Africa",7,709,7,709
723,46883,111,1,1493,RH1111493,"'RH1111493',","RH1111493,",7/30/10,2010,7,30,2,510,254,149,0.247,-0.279,0.347,0.478,-39.688,HR3534,Agreed to,"H.Amdt.771: Amendment requires that, following initial clean-up of a spill, the National Resources Damages Act trustee gives equal and full consideration to all statutorily prescribed natural resource damage remedies to ensure that acquisition of non-impacted land is considered an equal remedy and not given lower priority as is currently provided in statute.",On Agreeing to the Amendment,NA,"H.Amdt.771: Amendment requires that, following initial clean-up of a spill, the National Resources Damages Act trustee gives equal and full consideration to all statutorily prescribed natural resource damage remedies to ensure that acquisition of non-impacted land is considered an equal remedy and not given lower priority as is currently provided in statute.",7,710,7,701
724,47029,111,1,1639,RH1111639,"'RH1111639',","RH1111639,",12/17/10,2010,12,17,2,656,226,109,0.049,0.857,0.255,0.406,-67.267,S3874,Passed,Reduction of Lead in Drinking Water Act,On Motion to Suspend the Rules and Pass,NA,A bill to amend the Safe Drinking Water Act to reduce lead in drinking water.,7,701,7,701
725,47335,112,1,60,RH1120060,"'RH1120060',","RH1120060,",2/16/11,2011,2,16,1,62,73,352,-0.545,-0.299,0.132,0.003,-187.282,HR1,Failed,H.Amdt.43: Amendment sought to increase the funding for the North American Wetlands Conservation Act by $50 million with the offset being a $50 million reduction in the EPA Diesel Emissions Program.,On Agreeing to the Amendment,NA,H.Amdt.43: Amendment sought to increase the funding for the North American Wetlands Conservation Act by $50 million with the offset being a $50 million reduction in the EPA Diesel Emissions Program.,7,710,7,701
726,47336,112,1,61,RH1120061,"'RH1120061',","RH1120061,",2/16/11,2011,2,16,1,63,199,230,0.406,-0.858,-0.238,-0.215,-111.467,HR1,Failed,H.Amdt.45: Amendment sought to reduce the EPA's Science and Technology account by $64.1 million and apply the amount to the spending reduction account.,On Agreeing to the Amendment,NA,H.Amdt.45: Amendment sought to reduce the EPA's Science and Technology account by $64.1 million and apply the amount to the spending reduction account.,7,798,7,798
727,47337,112,1,62,RH1120062,"'RH1120062',","RH1120062,",2/16/11,2011,2,16,1,64,239,185,0.048,0.023,-0.273,-0.615,-44.38,HR1,Agreed to,"H.Amdt.47: Amendment reduces the EPA's Environmental Programs and Management (Greenhouse Gas Registry) account by $8,458,000 and applies the amount to the spending reduction account.",On Agreeing to the Amendment,NA,"H.Amdt.47: Amendment reduces the EPA's Environmental Programs and Management (Greenhouse Gas Registry) account by $8,458,000 and applies the amount to the spending reduction account.",7,705,7,705
728,47359,112,1,84,RH1120084,"'RH1120084',","RH1120084,",2/17/11,2011,2,17,1,86,250,177,0.015,-0.058,-0.286,-0.868,-42.327,HR1,Agreed to,"H.Amdt.88: An amendment numbered 165 printed in the Congressional Record to prohibit the use of funds to be used to implement, administer, or enforce the rule entitled """"""""""""""""National Emission Standards for Hazardous Air Pollutants From the Portland Cement Manufacturing Industry and Standards of Performance for Portland Cement Plants"""""""" published by the Environmental Protection Agency on September 9, 2010 (75 Fed. Reg. 54970 et seq.).",On Agreeing to the Amendment,NA,"H.Amdt.88: An amendment numbered 165 printed in the Congressional Record to prohibit the use of funds to be used to implement, administer, or enforce the rule entitled """"""""""""""""National Emission Standards for Hazardous Air Pollutants From the Portland Cement Manufacturing Industry and Standards of Performance for Portland Cement Plants"""""""" published by the Environmental Protection Agency on September 9, 2010 (75 Fed. Reg. 54970 et seq.).",7,705,7,705
729,47367,112,1,92,RH1120092,"'RH1120092',","RH1120092,",2/18/11,2011,2,18,1,94,243,185,-0.103,0.306,-0.424,-1.168,-35.725,HR1,Agreed to,"H.Amdt.96: An amendment numbered 533 printed in the Congressional Record to prohibit use of funds by the Environmental Appeals Board to consider, review, reject, remand, or otherwise invalidate any permit issued for Outer Continental Shelf sources located offshore of the States along the Arctic Coast under section 328(a) of the Clean Air Act (42 U.S.C. 7627(a)).",On Agreeing to the Amendment,NA,"H.Amdt.96: An amendment numbered 533 printed in the Congressional Record to prohibit use of funds by the Environmental Appeals Board to consider, review, reject, remand, or otherwise invalidate any permit issued for Outer Continental Shelf sources located offshore of the States along the Arctic Coast under section 328(a) of the Clean Air Act (42 U.S.C. 7627(a)).",7,700,7,700
730,47369,112,1,94,RH1120094,"'RH1120094',","RH1120094,",2/18/11,2011,2,18,1,96,249,177,0.032,-0.166,-0.857,-1.65,-27.582,HR1,Agreed to,"H.Amdt.101: Amendment prohibits the use of funds by the EPA to implement, administer, or enforce any statutory or regulatory requirement pertaining to emissions of greenhouse gases.",On Agreeing to the Amendment,NA,"H.Amdt.101: Amendment prohibits the use of funds by the EPA to implement, administer, or enforce any statutory or regulatory requirement pertaining to emissions of greenhouse gases.",7,705,7,705
731,47379,112,1,104,RH1120104,"'RH1120104',","RH1120104,",2/18/11,2011,2,18,1,106,74,348,0.652,-0.172,-0.139,0.074,-168.365,HR1,Failed,H.Amdt.116: An amendment numbered 246 printed in the Congressional Record to prohibit the use of funds for beach replenishment projects by the Army Corps of Engineers.,On Agreeing to the Amendment,NA,H.Amdt.116: An amendment numbered 246 printed in the Congressional Record to prohibit the use of funds for beach replenishment projects by the Army Corps of Engineers.,7,711,7,711
732,47393,112,1,118,RH1120118,"'RH1120118',","RH1120118,",2/18/11,2011,2,18,1,120,230,195,-0.075,0.505,-0.229,-0.398,-61.429,HR1,Agreed to,"H.Amdt.136: An amendment numbered 467 printed in the Congressional Record to prohibit the use of funds in H.R. 1 from being used to develop, promulgate, evaluate, implement, provide oversight to, or backstop total maximum daily loads or watershed implementation plans",On Agreeing to the Amendment,NA,"H.Amdt.136: An amendment numbered 467 printed in the Congressional Record to prohibit the use of funds in H.R. 1 from being used to develop, promulgate, evaluate, implement, provide oversight to, or backstop total maximum daily loads or watershed implementation plans",7,711,7,711
733,47396,112,1,121,RH1120121,"'RH1120121',","RH1120121,",2/18/11,2011,2,18,1,123,237,189,0.127,-0.098,-0.199,-0.616,-72.569,HR1,Agreed to,"H.Amdt.143: An amendment numbered 13 printed in the Congressional Record to prohibit the use of funds in H.R. 1 from being used to implement, administer, or enforce the rule entitled """"""""""""""""Water Quality Standards for the State of Florida's Lakes and Flowing Waters"""""""""""""""" publis",On Agreeing to the Amendment,NA,"H.Amdt.143: An amendment numbered 13 printed in the Congressional Record to prohibit the use of funds in H.R. 1 from being used to implement, administer, or enforce the rule entitled """"""""""""""""Water Quality Standards for the State of Florida's Lakes and Flowing Waters"""""""""""""""" publis",7,710,7,701
734,47405,112,1,130,RH1120130,"'RH1120130',","RH1120130,",2/19/11,2011,2,19,1,132,244,179,0.145,-0.402,-0.285,-0.504,-34.411,HR1,Agreed to,H.Amdt.154: An amendment numbered 149 printed in the Congressional Record to prohibit the use of funds for contributions to the Intergovernmental Panel on Climate Change (IPCC).,On Agreeing to the Amendment,NA,H.Amdt.154: An amendment numbered 149 printed in the Congressional Record to prohibit the use of funds for contributions to the Intergovernmental Panel on Climate Change (IPCC).,7,705,7,705
735,47408,112,1,133,RH1120133,"'RH1120133',","RH1120133,",2/19/11,2011,2,19,1,135,240,182,0.15,-0.179,-0.204,-0.6,-67.908,HR1,Agreed to,H.Amdt.157: Amendment prohibits the use of funds by the Administrator of the EPA to revoke permits for the use of defined areas as disposal sites.,On Agreeing to the Amendment,NA,H.Amdt.157: Amendment prohibits the use of funds by the Administrator of the EPA to revoke permits for the use of defined areas as disposal sites.,7,703,7,703
736,47409,112,1,134,RH1120134,"'RH1120134',","RH1120134,",2/19/11,2011,2,19,1,136,239,183,0.029,0.044,-0.194,-0.619,-77.273,HR1,Agreed to,"H.Amdt.158: An amendment numbered 217 printed in the Congressional Record to prohibit the use of funds by EPA to develop, propose, finalize, implement, administer, or enforce any regulation that identifies or lists fossil fuel combustion waste as hazardous waste subj",On Agreeing to the Amendment,NA,"H.Amdt.158: An amendment numbered 217 printed in the Congressional Record to prohibit the use of funds by EPA to develop, propose, finalize, implement, administer, or enforce any regulation that identifies or lists fossil fuel combustion waste as hazardous waste subj",7,704,7,704
737,47413,112,1,138,RH1120138,"'RH1120138',","RH1120138,",2/19/11,2011,2,19,1,140,255,168,0.025,-0.247,-0.246,-0.519,-46.832,HR1,Agreed to,H.Amdt.164: An amendment numbered 174 printed in the Congressional Record to prohibit the use of funds for the Yucca Mountain Nuclear Waste Repository.,On Agreeing to the Amendment,NA,H.Amdt.164: An amendment numbered 174 printed in the Congressional Record to prohibit the use of funds for the Yucca Mountain Nuclear Waste Repository.,7,704,7,704
738,47414,112,1,139,RH1120139,"'RH1120139',","RH1120139,",2/19/11,2011,2,19,1,141,239,183,-0.061,0.43,-0.688,-0.895,-12.097,HR1,Agreed to,"H.Amdt.165: At the end of the bill (before the short title), insert the following: SEC. ___. None of the funds made available by this Act may be used to pay the salary of any officer or employee of the Department of Health and Human Services, the Department of Labor, or the Department of the Treasury who takes any action to specify or define, through regulations, guidelines, or otherwise, essential benefits under section 1302 of the Patient Protection and Affordable Care Act (42 U.S.C. 18022).",On Agreeing to the Amendment,NA,"H.Amdt.165: At the end of the bill (before the short title), insert the following: SEC. ___. None of the funds made available by this Act may be used to pay the salary of any officer or employee of the Department of Health and Human Services, the Department of Labor, or the Department of the Treasury who takes any action to specify or define, through regulations, guidelines, or otherwise, essential benefits under section 1302 of the Patient Protection and Affordable Care Act (42 U.S.C. 18022).",7,705,7,705
739,47479,112,1,204,RH1120204,"'RH1120204',","RH1120204,",3/31/11,2011,3,31,1,206,292,130,-0.342,0.224,-0.278,-0.227,-82.32,HR872,Passed,"To amend the Federal Insecticide, Fungicide, and Rodenticide Act and the Federal Water Pollution Control Act to clarify Congressional intent regarding the regulation of the use of pesticides in or near navigable waters, and for other purposes","On Motion to Suspend the Rules and Pass, as Amended",NA,"To amend the Federal Insecticide, Fungicide, and Rodenticide Act and the Federal Water Pollution Control Act to clarify Congressional intent regarding the regulation of the use of pesticides in or near navigable waters, and for other purposes.",7,710,7,701
740,47488,112,1,213,RH1120213,"'RH1120213',","RH1120213,",4/1/11,2011,4,1,1,215,178,243,-0.121,0.993,0.204,0.058,-85.113,HR658,Failed,H.Amdt.236: Amendment sought to allow the Bob Hope and Van Nuys Airports in southern California to adopt curfews from 10 p.m. to 7 a.m. in order to alleviate air traffic noise for residents of the San Fernando Valley.,On Agreeing to the Amendment,NA,H.Amdt.236: Amendment sought to allow the Bob Hope and Van Nuys Airports in southern California to adopt curfews from 10 p.m. to 7 a.m. in order to alleviate air traffic noise for residents of the San Fernando Valley.,7,705,7,705
741,47503,112,1,228,RH1120228,"'RH1120228',","RH1120228,",4/6/11,2011,4,6,1,230,266,158,0.09,0.996,-0.197,0.232,-96.438,HRES203,Passed,"Providing for consideration of (H.R. 910) to amend the Clean Air Act to prohibit the Administrator of the Environmental Protection Agency from promulgating any regulation concerning, taking action relating to, or taking into consideration the emission of a greenhouse gas to address climate change, for other purposes",On Ordering the Previous Question,NA,"On Ordering the Previous Question: H RES 203 Providing for consideration of (H.R. 910) to amend the Clean Air Act to prohibit the Administrator of the Environmental Protection Agency from promulgating any regulation concerning, taking action relating to,",7,705,7,705
742,47504,112,1,229,RH1120229,"'RH1120229',","RH1120229,",4/6/11,2011,4,6,1,231,250,172,-0.071,-0.004,-0.634,-0.922,-14.96,HRES203,Passed,"Providing for consideration of (H.R. 910) to amend the Clean Air Act to prohibit the Administrator of the Environmental Protection Agency from promulgating any regulation concerning, taking action relating to, or taking into consideration the emission of a greenhouse gas to address climate change, for other purposes",On Agreeing to the Resolution,NA,"Providing for consideration of the bill (H.R. 910) to amend the Clean Air Act to prohibit the Administrator of the Environmental Protection Agency from promulgating any regulation concerning, taking action relating to, or taking into consideration the emi",7,705,7,705
743,47506,112,1,231,RH1120231,"'RH1120231',","RH1120231,",4/6/11,2011,4,6,1,233,161,259,-0.174,0.079,0.633,1.243,-23.18,HR910,Failed,H.Amdt.240: Amendment sought to require an EPA study to determine the long term impact of a complete ban on their authority to regulate greenhouse gases.,On Agreeing to the Amendment,NA,H.Amdt.240: Amendment sought to require an EPA study to determine the long term impact of a complete ban on their authority to regulate greenhouse gases.,7,798,7,798
744,47507,112,1,232,RH1120232,"'RH1120232',","RH1120232,",4/6/11,2011,4,6,1,234,157,266,-0.297,0.539,1.107,1.304,-47.697,HR910,Failed,H.Amdt.241: Amendment sought to insert a new section to provide considerations and procedures in finalizing greenhouse gas regulations.,On Agreeing to the Amendment,NA,H.Amdt.241: Amendment sought to insert a new section to provide considerations and procedures in finalizing greenhouse gas regulations.,7,705,7,705
745,47508,112,1,233,RH1120233,"'RH1120233',","RH1120233,",4/6/11,2011,4,6,1,235,182,240,-0.146,0.549,0.319,0.571,-34.284,HR910,Failed,H.Amdt.244: Amendment sought to affirm that state-run greenhouse gas programs would not be affected by the bill.,On Agreeing to the Amendment,NA,H.Amdt.244: Amendment sought to affirm that state-run greenhouse gas programs would not be affected by the bill.,7,705,7,705
746,47509,112,1,234,RH1120234,"'RH1120234',","RH1120234,",4/6/11,2011,4,6,1,236,184,240,0.068,-0.217,0.413,0.394,-13.367,HR910,Failed,"H.Amdt.245: Amendment sought to add a new section with respect to Congressional Acceptance of Scientific Findings: Congress accepts the scientific findings of the Environmental Protection Agency that climate changes is occurring, is caused largely by human activities, and poses significant risks for public health and welfare.",On Agreeing to the Amendment,NA,"H.Amdt.245: Amendment sought to add a new section with respect to Congressional Acceptance of Scientific Findings: Congress accepts the scientific findings of the Environmental Protection Agency that climate changes is occurring, is caused largely by human activities, and poses significant risks for public health and welfare.",7,705,7,705
747,47510,112,1,235,RH1120235,"'RH1120235',","RH1120235,",4/6/11,2011,4,6,1,237,168,257,-0.256,0.428,0.545,1.207,-21.444,HR910,Failed,H.Amdt.247: Amendment sought to ensure that the EPA can continue to protect the American people from adverse effects of global climate change.,On Agreeing to the Amendment,NA,H.Amdt.247: Amendment sought to ensure that the EPA can continue to protect the American people from adverse effects of global climate change.,7,705,7,705
748,47512,112,1,237,RH1120237,"'RH1120237',","RH1120237,",4/6/11,2011,4,6,1,239,165,260,-0.011,-0.211,0.62,1.491,-20.412,HR910,Failed,"H.Amdt.249: Amendment sought to prevent the provisions of this act from going into effect until the EPA Administrator, in consultation with the Secretary of Defense, certifies that the consequences of not regulating greenhouse gas emissions, and its subsequent impact on climate change, including the potential to create sustained natural and humanitarian disasters and the ability to likely foster political instability where societal demands exceed the capacity of governments to cope, do not jeopardize American security interests at home or abroad.",On Agreeing to the Amendment,NA,"H.Amdt.249: Amendment sought to prevent the provisions of this act from going into effect until the EPA Administrator, in consultation with the Secretary of Defense, certifies that the consequences of not regulating greenhouse gas emissions, and its subsequent impact on climate change, including the potential to create sustained natural and humanitarian disasters and the ability to likely foster political instability where societal demands exceed the capacity of governments to cope, do not jeopardize American security interests at home or abroad.",7,705,7,705
749,47513,112,1,238,RH1120238,"'RH1120238',","RH1120238,",4/6/11,2011,4,6,1,240,173,250,-0.091,0.423,0.209,-0.004,-59.133,HR910,Failed,"H.Amdt.250: Amendment sought to include a study to determine whether regulations of the Environmental Protection Agency under the Clean Air Act to address climate change, if not repealed or otherwise made unauthorized by section 2 of the bill, would cause greenhouse gas leakage and reduce the international competitiveness of United States producers of energy-intensive products.",On Agreeing to the Amendment,NA,"H.Amdt.250: Amendment sought to include a study to determine whether regulations of the Environmental Protection Agency under the Clean Air Act to address climate change, if not repealed or otherwise made unauthorized by section 2 of the bill, would cause greenhouse gas leakage and reduce the international competitiveness of United States producers of energy-intensive products.",7,705,7,705
750,47514,112,1,239,RH1120239,"'RH1120239',","RH1120239,",4/6/11,2011,4,6,1,241,160,264,0.271,-0.919,0.279,0.603,-58.077,HR910,Failed,"H.Amdt.251: Amendment sought to insert a complete new text which codifies the EPA's Tailoring Rule in order to protect farms, small businesses, and small- and medium-sized stationary sources from greenhouse gas regulation.",On Agreeing to the Amendment,NA,"H.Amdt.251: Amendment sought to insert a complete new text which codifies the EPA's Tailoring Rule in order to protect farms, small businesses, and small- and medium-sized stationary sources from greenhouse gas regulation.",7,705,7,705
751,47521,112,1,246,RH1120246,"'RH1120246',","RH1120246,",4/7/11,2011,4,7,1,248,175,251,0.097,-0.699,0.404,0.577,-23.895,HR910,Failed,Energy Tax Prevention Act of 2011,On Motion to Recommit with Instructions,NA,"To amend the Clean Air Act to prohibit the Administrator of the Environmental Protection Agency from promulgating any regulation concerning, taking action relating to, or taking into consideration the emission of a greenhouse gas to address climate change",7,705,7,705
752,47522,112,1,247,RH1120247,"'RH1120247',","RH1120247,",4/7/11,2011,4,7,1,249,255,172,-0.165,0.161,-0.618,-1.224,-17.679,HR910,Passed,Energy Tax Prevention Act of 2011,On Passage,NA,"To amend the Clean Air Act to prohibit the Administrator of the Environmental Protection Agency from promulgating any regulation concerning, taking action relating to, or taking into consideration the emission of a greenhouse gas to address climate change",7,705,7,705
753,47568,112,1,293,RH1120293,"'RH1120293',","RH1120293,",5/5/11,2011,5,5,1,295,174,240,0.046,-0.021,0.318,0.896,-37.509,HR1230,Failed,"H,Amdt.268: Amendment sought to strike provisions in the bill that would """"""""""""""""deem"""""""""""""""" the safety and environmental review done in 2007, prior to the BP spill, sufficient for new offshore oil and gas leasing. The amendment would have allowed lease sales to go forward, but would require new environmental and safety reviews for the period following the BP spill.",On Agreeing to the Amendment,NA,"H,Amdt.268: Amendment sought to strike provisions in the bill that would """"""""""""""""deem"""""""""""""""" the safety and environmental review done in 2007, prior to the BP spill, sufficient for new offshore oil and gas leasing. The amendment would have allowed lease sales to go forward, but would require new environmental and safety reviews for the period following the BP spill.",7,710,7,701
754,47574,112,1,299,RH1120299,"'RH1120299',","RH1120299,",5/10/11,2011,5,10,1,301,176,237,-0.029,0.153,0.436,1.38,-39.715,HR1229,Failed,H.Amdt.272: Amendment sought to set minimum standards for blowout preventers; require new standards on safe well design and cementing to ensure multiple redundant barriers within the well against uncontrolled oil or gas flow leading to a blowout; require independent third party certification of blowout preventers and well designs; and to ensure that the Department of Interior can institute better alternatives for increased safety as they become available.,On Agreeing to the Amendment,NA,H.Amdt.272: Amendment sought to set minimum standards for blowout preventers; require new standards on safe well design and cementing to ensure multiple redundant barriers within the well against uncontrolled oil or gas flow leading to a blowout; require independent third party certification of blowout preventers and well designs; and to ensure that the Department of Interior can institute better alternatives for increased safety as they become available.,7,710,7,701
755,47588,112,1,313,RH1120313,"'RH1120313',","RH1120313,",5/12/11,2011,5,12,1,315,195,223,0.206,-0.154,0.423,1.08,-36.676,HR1231,Failed,H.Amdt.284: Amendment sought to require that all applicants for a drilling permit under a lease issued pursuant to the bill would have to submit a worst-case scenario oil spill containment and clean-up plan.,On Agreeing to the Amendment,NA,H.Amdt.284: Amendment sought to require that all applicants for a drilling permit under a lease issued pursuant to the bill would have to submit a worst-case scenario oil spill containment and clean-up plan.,7,710,7,701
756,47723,112,1,448,RH1120448,"'RH1120448',","RH1120448,",6/16/11,2011,6,16,1,450,288,132,0.158,0.987,0.147,0.242,-163.081,HR2112,Agreed to,H.Amdt.470: Amendment provides $3 million for preventive measures under the Watershed Protection and Flood Prevention Act and the Soil Conservation and Domestic Allotment Act.,On Agreeing to the Amendment,NA,H.Amdt.470: Amendment provides $3 million for preventive measures under the Watershed Protection and Flood Prevention Act and the Soil Conservation and Domestic Allotment Act.,7,711,7,711
757,47736,112,1,461,RH1120461,"'RH1120461',","RH1120461,",6/22/11,2011,6,22,1,463,215,189,-0.093,0.996,-0.246,-0.164,-51.309,HRES316,Passed,"Providing for consideration of the bill (H.R. 2021) to amend the Clean Air Act regarding air pollution from Outer Continental Shelf activities, and providing for consideration of the bill (H.R. 1249) to amend title 35, United States Code, to provide for patent reform",On Question of Consideration of the Resolution,NA,"Providing for consideration of the bill (H.R. 2021) to amend the Clean Air Act regarding air pollution from Outer Continental Shelf activities, and providing for consideration of the bill (H.R. 1249) to amend title 35, United States Code, to provide for p",7,705,7,705
758,47737,112,1,462,RH1120462,"'RH1120462',","RH1120462,",6/22/11,2011,6,22,1,464,230,184,-0.02,-0.021,-0.74,-0.223,-5.454,HRES316,Passed,"Providing for consideration of the bill (H.R. 2021) to amend the Clean Air Act regarding air pollution from Outer Continental Shelf activities, and providing for consideration of the bill (H.R. 1249) to amend title 35, United States Code, to provide for patent reform",On Ordering the Previous Question,NA,"Providing for consideration of the bill (H.R. 2021) to amend the Clean Air Act regarding air pollution from Outer Continental Shelf activities, and providing for consideration of the bill (H.R. 1249) to amend title 35, United States Code, to provide for p",7,705,7,705
759,47738,112,1,463,RH1120463,"'RH1120463',","RH1120463,",6/22/11,2011,6,22,1,465,239,186,-0.157,0.547,-0.221,-0.298,-59.625,HRES316,Passed,"Providing for consideration of the bill (H.R. 2021) to amend the Clean Air Act regarding air pollution from Outer Continental Shelf activities, and providing for consideration of the bill (H.R. 1249) to amend title 35, United States Code, to provide for patent reform",On Agreeing to the Resolution,NA,"Providing for consideration of the bill (H.R. 2021) to amend the Clean Air Act regarding air pollution from Outer Continental Shelf activities, and providing for consideration of the bill (H.R. 1249) to amend title 35, United States Code, to provide for p",7,705,7,705
760,47740,112,1,465,RH1120465,"'RH1120465',","RH1120465,",6/22/11,2011,6,22,1,467,176,248,0.313,-0.949,0.372,0.731,-42.676,HR2021,Failed,Amendment sought to strike section 2 of the bill which would amend the Clean Air Act to force emissions from any offshore source to be measured only at the corresponding onshore location.,On Agreeing to the Amendment,NA,Amendment sought to strike section 2 of the bill which would amend the Clean Air Act to force emissions from any offshore source to be measured only at the corresponding onshore location.,7,705,7,705
761,47741,112,1,466,RH1120466,"'RH1120466',","RH1120466,",6/22/11,2011,6,22,1,468,167,254,0.167,-0.591,0.335,0.818,-43.619,HR2021,Failed,Amendment sought to give the EPA the authority to regulate the emissions of offshore drilling support vessels.,On Agreeing to the Amendment,NA,Amendment sought to give the EPA the authority to regulate the emissions of offshore drilling support vessels.,7,705,7,705
762,47745,112,1,470,RH1120470,"'RH1120470',","RH1120470,",6/22/11,2011,6,22,1,472,173,251,0.055,-0.202,0.291,0.805,-40.173,HR2021,Failed,Amendment sought to strike a provision of the bill which removes the ability of the Environmental Appeals Board to remand or deny the issuance of clean air permits for offshore energy exploration and extraction.,On Agreeing to the Amendment,NA,Amendment sought to strike a provision of the bill which removes the ability of the Environmental Appeals Board to remand or deny the issuance of clean air permits for offshore energy exploration and extraction.,7,705,7,705
763,47747,112,1,472,RH1120472,"'RH1120472',","RH1120472,",6/22/11,2011,6,22,1,474,180,242,-0.13,0.256,0.224,0.57,-60.412,HR2021,Failed,Amendment sought to add a section allowing States with delegated authority to enact local air quality protections for offshore drilling.,On Agreeing to the Amendment,NA,Amendment sought to add a section allowing States with delegated authority to enact local air quality protections for offshore drilling.,7,705,7,705
764,47750,112,1,475,RH1120475,"'RH1120475',","RH1120475,",6/22/11,2011,6,22,1,477,177,245,-0.03,-0.214,1.015,1.198,-22.019,HR2021,Failed,Jobs and Energy Permitting Act of 2011,On Motion to Recommit with Instructions,NA,To amend the Clean Air Act regarding air pollution from Outer Continental Shelf activities.,7,705,7,705
765,47751,112,1,476,RH1120476,"'RH1120476',","RH1120476,",6/22/11,2011,6,22,1,478,253,166,-0.022,-0.129,-0.257,-0.688,-44.504,HR2021,Passed,Jobs and Energy Permitting Act of 2011,On Passage,NA,To amend the Clean Air Act regarding air pollution from Outer Continental Shelf activities.,7,705,7,705
766,47767,112,1,493,RH1120493,"'RH1120493',","RH1120493,",7/6/11,2011,7,6,1,496,87,328,0.758,0.22,-0.206,0.848,-158.181,HR2219,Failed,"Amendment sought to reduce the operating budget of the Office of the Defense Secretary by $216,556,400 and to apply the savings to the spending reduction account.",On Agreeing to the Amendment,NA,Amendment sought to increase funding for the Strategic Environmental Research and Development Program (SERDP) by $10 million offset by a reduction in funds for defense-wide accounts by a similar amount.,7,798,7,798
767,47831,112,1,638,RH1120638,"'RH1120638',","RH1120638,",7/26/11,2011,7,26,1,641,164,261,-0.277,0.387,0.287,0.598,-41.929,HR1938,Failed,NA,On Agreeing to the Amendment,NA,Amendment sought to strike paragraph 15 of the findings section which says that analysis using EPA models shows that the Keystone XL pipeline will result in no significant change in total United States or global greenhouse gas emissions.,7,705,7,705
768,47876,112,1,644,RH1120644,"'RH1120644',","RH1120644,",7/26/11,2011,7,26,1,647,163,263,0.173,-0.648,0.792,1.9,-47.362,HR1938,Failed,NA,On Agreeing to the Amendment,NA,Amendment sought to require a study on the health impacts of increased air pollution in communities surrounding the refineries that will transport diluted bitumen through the proposed Keystone XL pipeline before any approval of the pipeline could be grant,7,705,7,705
769,47880,112,1,648,RH1120648,"'RH1120648',","RH1120648,",7/27/11,2011,7,27,1,651,173,251,-0.213,0.289,0.154,0.313,-119.444,HR2584,Failed,NA,On Agreeing to the Amendment,NA,Amendment sought to reduce funding for the Bureau of Land Management by $10 million and increase funding for EPA's Great Lakes Restoration Initiative by a similar amount for the purpose of stopping Asian carp from migrating into the Great Lakes.,7,709,7,709
770,47882,112,1,649,RH1120649,"'RH1120649',","RH1120649,",7/27/11,2011,7,27,1,652,224,202,0.074,0.434,0.587,1.5,-60.072,HR2584,Agreed to,NA,On Agreeing to the Amendment,NA,Amendment strikes the proviso which blocks the Fish and Wildlife Service from listing candidate species as either threatened or endangered as well as the designation of the critical habitat necessary for species recovery.,7,709,7,709
771,47885,112,1,652,RH1120652,"'RH1120652',","RH1120652,",7/27/11,2011,7,27,1,655,137,291,-0.323,0.946,0.038,-0.077,-271.991,HR2584,Failed,NA,On Agreeing to the Amendment,NA,Amendment sought to reduce funding for the Office of the Secretary by $24.7 million and to increase funding for the Great Lakes Restoration Initiative by a similar amount.,7,710,7,701
772,47886,112,1,653,RH1120653,"'RH1120653',","RH1120653,",7/27/11,2011,7,27,1,656,237,189,-0.387,-0.922,-0.061,0.059,-268.921,HR2584,Agreed to,NA,On Agreeing to the Amendment,NA,"Amendment to reduce funding for the Office of the Secretary by $8,291,000 and to increase funding for the Forest Health Management Account by a similar amount.",7,709,7,709
773,47887,112,1,654,RH1120654,"'RH1120654',","RH1120654,",7/27/11,2011,7,27,1,657,215,213,0.132,0.194,-0.202,-0.26,-75.763,HR2584,Agreed to,NA,On Agreeing to the Amendment,NA,"Amendment, as modified, reduces funding for the Office of the Secretary by $420,000.",7,700,7,700
774,47889,112,1,656,RH1120656,"'RH1120656',","RH1120656,",7/27/11,2011,7,27,1,659,174,250,-0.101,0.1,0.241,0.742,-53.94,HR2584,Failed,NA,On Agreeing to the Amendment,NA,"Amendment sought to strike section 119 from the bill which exempts from judicial review any final rule of the Secretary of the Interior that delists wolves in Wyoming or the Western Great Lakes States, provided the Fish and Wildlife Service has entered in",7,709,7,709
775,47890,112,1,657,RH1120657,"'RH1120657',","RH1120657,",7/27/11,2011,7,27,1,660,220,206,0.191,-0.974,-0.078,-0.042,-236.41,HR2584,Agreed to,NA,On Agreeing to the Amendment,NA,Amendments en bloc reduce the Science and Technology research and development account under EPA by $20 million; increase the Environmental Programs and Management account by $13 million; increase the funding for specified Geographic Programs by $50 millio,7,700,7,700
776,47891,112,1,658,RH1120658,"'RH1120658',","RH1120658,",7/27/11,2011,7,27,1,661,235,191,0.222,-0.362,-0.226,-0.455,-58.911,HR2584,Agreed to,NA,On Agreeing to the Amendment,NA,"Amendment reduces the funding for the EPA's greenhouse gas registry program by $6,246,000 and applies the savings to the spending reduction account.",7,705,7,705
777,47893,112,1,659,RH1120659,"'RH1120659',","RH1120659,",7/27/11,2011,7,27,1,662,193,232,0.036,0.999,0.089,-0.014,-222.974,HR2584,Failed,NA,On Agreeing to the Amendment,NA,Amendment sought to reduce funding for the EPA Buildings and Facilities account by $10 million and increase funding for the Diesel Emissions Reduction Act (DERA) by $5 million.,7,700,7,700
778,47895,112,1,661,RH1120661,"'RH1120661',","RH1120661,",7/28/11,2011,7,28,1,664,114,314,0.48,0.089,-1.267,-0.346,-111.841,HR2584,Failed,NA,On Agreeing to the Amendment,NA,Amendment sought to reduce funding for the Diesel Emissions Reduction (DERA) program by $30 million and to apply the savings to the spending reduction account.,7,705,7,705
779,47896,112,1,662,RH1120662,"'RH1120662',","RH1120662,",7/28/11,2011,7,28,1,665,168,258,-0.187,0.952,0.184,0.058,-116.549,HR2584,Failed,NA,On Agreeing to the Amendment,NA,Amendment sought to increase funding for state pollution control and prevention grants by $5 million and to reduce funding for the Capitol Improvement and Maintenance fund by a similar amount.,7,705,7,705
780,47898,112,1,664,RH1120664,"'RH1120664',","RH1120664,",7/28/11,2011,7,28,1,667,130,295,0.774,0.281,-0.09,0.245,-240.353,HR2584,Failed,NA,On Agreeing to the Amendment,NA,Amendment sought to increase funding for the Collaborative Forest Landscape Restoration Program by $10 million and to decrease funding for the Wildland Fire Management-Hazardous Fuel Account by $16.6 million.,7,709,7,709
781,47899,112,1,665,RH1120665,"'RH1120665',","RH1120665,",7/28/11,2011,7,28,1,668,198,227,0.261,0.014,-0.916,-1.909,-76.156,HR2584,Failed,NA,On Agreeing to the Amendment,NA,"Amendment sought to eliminate the $2,661,000 in funding for reception and representation expenses for the Council on Environmental Quality and to apply the savings to the spending reduction account.",7,799,7,799
782,47959,112,1,719,RH1120719,"'RH1120719',","RH1120719,",9/22/11,2011,9,22,1,723,237,184,-0.016,0.257,-0.723,0.361,-1.911,HRES406,Passed,"Providing for consideration of the bill (H.R. 2401) to require analyses of the cumulative and incremental impacts of certain rules and actions of the Environmental Protection Agency, and for other purposes",On Ordering the Previous Question,NA,"Providing for consideration of the bill (H.R. 2401) to require analyses of the cumulative and incremental impacts of certain rules and actions of the Environmental Protection Agency, and for other purposes.",7,700,7,700
783,47960,112,1,720,RH1120720,"'RH1120720',","RH1120720,",9/22/11,2011,9,22,1,724,245,175,-0.092,0.111,-1.099,-0.826,-19.343,HRES406,Passed,"Providing for consideration of the bill (H.R. 2401) to require analyses of the cumulative and incremental impacts of certain rules and actions of the Environmental Protection Agency, and for other purposes",On Agreeing to the Resolution,NA,"Providing for consideration of the bill (H.R. 2401) to require analyses of the cumulative and incremental impacts of certain rules and actions of the Environmental Protection Agency, and for other purposes.",7,700,7,700
784,47971,112,1,729,RH1120729,"'RH1120729',","RH1120729,",9/23/11,2011,9,23,1,733,269,150,-0.216,0.06,-0.251,-0.623,-56.302,HR2401,Agreed to,NA,On Agreeing to the Amendment,NA,Amendment adds the U.S. Environmental Protection Agency's (EPA) National Emission Standards for Hazardous Air Pollutants (NESHAP) from the Portland Cement Manufacturing Industry and Standards of Performance for Portland Cement Plants to the Covered Rules,7,705,7,705
785,47972,112,1,730,RH1120730,"'RH1120730',","RH1120730,",9/23/11,2011,9,23,1,734,165,254,-0.142,0.083,0.628,1.144,-18.499,HR2401,Failed,NA,On Agreeing to the Amendment,NA,Amendment sought to exclude from the committee's jurisdiction all rules and regulations that undergo a cost-benefit analysis as a part of existing regulatory requirements.,7,700,7,700
786,47975,112,1,733,RH1120733,"'RH1120733',","RH1120733,",9/23/11,2011,9,23,1,737,234,188,0,0.164,-0.353,-1.181,-46.666,HR2401,Agreed to,NA,On Agreeing to the Amendment,NA,"Amendment provides that the Cross State Air Pollution Rule has no legal force or effect, and directs EPA to continue to apply the Clean Air Interstate Rule (CAIR) for at least 3 years until after the study in the underlying bill is complete. Amendment als",7,705,7,705
787,47976,112,1,734,RH1120734,"'RH1120734',","RH1120734,",9/23/11,2011,9,23,1,738,227,192,0.044,0.22,-0.264,-0.421,-41.304,HR2401,Agreed to,NA,On Agreeing to the Amendment,NA,Amendment requires the EPA's administrator to consider the implementation costs and feasibility of compliance when setting National Ambient Air Quality Standards (NAAQS).,7,705,7,705
788,47977,112,1,735,RH1120735,"'RH1120735',","RH1120735,",9/23/11,2011,9,23,1,739,181,237,0.09,-0.255,0.215,0.27,-51.958,HR2401,Failed,NA,On Agreeing to the Amendment,NA,"Amendment sought to strike the offset provision of H.R. 2401, which would reduce funding to the Diesel Emission Reductions Act.",7,705,7,705
789,47978,112,1,736,RH1120736,"'RH1120736',","RH1120736,",9/23/11,2011,9,23,1,740,180,233,0.001,-0.768,1.058,0.001,-7.833,HR2401,Failed,"To require analyses of the cumulative and incremental impacts of certain rules and actions of the Environmental Protection Agency, and for other purposes",On Motion to Recommit with Instructions,NA,"To require analyses of the cumulative and incremental impacts of certain rules and actions of the Environmental Protection Agency, and for other purposes.",7,798,7,798
790,47979,112,1,737,RH1120737,"'RH1120737',","RH1120737,",9/23/11,2011,9,23,1,741,249,169,-0.098,0.114,-0.587,-1.69,-24.557,HR2401,Passed,"To require analyses of the cumulative and incremental impacts of certain rules and actions of the Environmental Protection Agency, and for other purposes",On Passage,NA,"To require analyses of the cumulative and incremental impacts of certain rules and actions of the Environmental Protection Agency, and for other purposes.",7,798,7,798
791,47985,112,1,742,RH1120742,"'RH1120742',","RH1120742,",10/4/11,2011,10,4,1,746,257,165,-0.161,0.167,-1.205,-1.169,-41.017,HRES419,Passed,"Providing for consideration of H.R. 2681, to provide additional time for the EPA to issue standards for cement manufacturing facilities, and for consideration of H.R. 2250, to provide additional time for the EPA to issue standards for industrial, commercial, and institutional boilers, process heaters, and incinerators",On Agreeing to the Resolution,NA,"Providing for consideration of the bill (H.R. 2681) to provide additional time for the Administrator of the Environmental Protection Agency to issue achievable standards for cement manufacturing facilities, and for other purposes, and providing for consid",7,700,7,700
792,47986,112,1,743,RH1120743,"'RH1120743',","RH1120743,",10/5/11,2011,10,5,1,747,166,246,-0.007,0.067,0.311,0.77,-33.071,HR2681,Failed,NA,On Agreeing to the Amendment,NA,An amendment numbered 11 printed in the Congressional Record to add a section which instructs the EPA Administrator to not delay actions to reduce emissions from any cement kiln if such emissions are harming brain development or causing learning disabilit,7,705,7,705
793,47987,112,1,744,RH1120744,"'RH1120744',","RH1120744,",10/5/11,2011,10,5,1,748,162,251,-0.18,0.293,0.365,0.89,-27.341,HR2681,Failed,NA,On Agreeing to the Amendment,NA,"Amendment sought to add a clarification that section 5 of the bill was intended to supplement the provisions of, and not be construed to supersede the Clean Air Act.",7,705,7,705
794,47988,112,1,745,RH1120745,"'RH1120745',","RH1120745,",10/5/11,2011,10,5,1,749,158,254,-0.141,0.089,0.625,1.271,-20.816,HR2681,Failed,NA,On Agreeing to the Amendment,NA,Amendment sought to add a section which includes findings for health costs and benefits of EPA's mercury and air toxics cleanup standards for large cement plants.,7,705,7,705
795,47989,112,1,746,RH1120746,"'RH1120746',","RH1120746,",10/5/11,2011,10,5,1,750,175,248,-0.167,0.494,0.32,0.455,-28.415,HR2681,Failed,NA,On Agreeing to the Amendment,NA,An amendment numbered 1 printed in the Congressional Record to add a new section that finds that mercury released into the ambient air from cement kilns addressed by the rules listed in section 2(b) of this Act is a potent neurotoxin that can damage the d,7,705,7,705
796,47990,112,1,747,RH1120747,"'RH1120747',","RH1120747,",10/5/11,2011,10,5,1,751,167,254,-0.109,0.087,0.601,1.558,-19.273,HR2681,Failed,NA,On Agreeing to the Amendment,NA,"Amendment sought to require the Director of the Office of Management and Budget, in consultation with EPA's Chief Financial Officer and the Comptroller General of GAO and CBO, to determine whether the bill authorizes the appropriation of funds to implemen",7,700,7,700
797,47991,112,1,748,RH1120748,"'RH1120748',","RH1120748,",10/5/11,2011,10,5,1,752,169,254,-0.099,0.095,0.732,1.651,-24.475,HR2681,Failed,NA,On Agreeing to the Amendment,NA,Amendment sought insert a finding into the bill which would state that EPA's cement kiln rules are expected to reduce mercury depositions in the eastern and western United States.,7,704,7,704
798,47993,112,1,749,RH1120749,"'RH1120749',","RH1120749,",10/5/11,2011,10,5,1,753,166,253,-0.046,-0.101,0.632,1.266,-16.856,HR2681,Failed,NA,On Agreeing to the Amendment,NA,Amendment sought to add new sections containing findings that would prevent the bill from going into effect if it interferes with the HHS goal of reducing children's exposure to mercury.,7,704,7,704
799,47994,112,1,750,RH1120750,"'RH1120750',","RH1120750,",10/5/11,2011,10,5,1,754,162,262,-0.183,0.156,0.642,1.63,-25.818,HR2681,Failed,NA,On Agreeing to the Amendment,NA,Amendment sought to provide that compliance with EPA rules should occur no later than 3 years after the rules have finalized.,7,700,7,700
800,48000,112,1,756,RH1120756,"'RH1120756',","RH1120756,",10/6/11,2011,10,6,1,760,172,248,-0.136,0.272,1.093,1.526,-31.891,HR2681,Failed,NA,On Agreeing to the Amendment,NA,Amendment sought to insert provisions requiring that the EPA Administrator consider the potential reductions in the number of illness-related absences from work when establishing a compliance date for the cement kiln rule.,7,705,7,705
801,48001,112,1,757,RH1120757,"'RH1120757',","RH1120757,",10/6/11,2011,10,6,1,761,162,257,-0.198,0.198,0.624,1.199,-17.259,HR2681,Failed,NA,On Agreeing to the Amendment,NA,"Amendment sought to insert provisions which clarify that if the Administrator should determine that there was a compelling reason to extend the compliance date, such an extension could in no case go beyond the date which is 5 years after the effective dat",7,700,7,700
802,48004,112,1,759,RH1120759,"'RH1120759',","RH1120759,",10/6/11,2011,10,6,1,763,176,247,-0.011,-0.114,1.034,1.299,-19.815,HR2681,Failed,"To provide additional time for the Administrator of the Environmental Protection Agency to issue achievable standards for cement manufacturing facilities, and for other purposes",On Motion to Recommit with Instructions,NA,"To provide additional time for the Administrator of the Environmental Protection Agency to issue achievable standards for cement manufacturing facilities, and for other purposes.",7,700,7,700
803,48005,112,1,760,RH1120760,"'RH1120760',","RH1120760,",10/6/11,2011,10,6,1,764,262,161,-0.035,-0.156,-0.86,-2.097,-41.17,HR2681,Passed,"To provide additional time for the Administrator of the Environmental Protection Agency to issue achievable standards for cement manufacturing facilities, and for other purposes",On Passage,NA,"To provide additional time for the Administrator of the Environmental Protection Agency to issue achievable standards for cement manufacturing facilities, and for other purposes.",7,700,7,700
804,48007,112,1,762,RH1120762,"'RH1120762',","RH1120762,",10/6/11,2011,10,6,1,766,167,243,0.057,-0.332,0.319,0.634,-31.171,HR2250,Failed,NA,On Agreeing to the Amendment,NA,An amendment numbered 9 printed in the Congressional Record to insert a section for the protection of infants and children.,7,700,7,700
805,48008,112,1,763,RH1120763,"'RH1120763',","RH1120763,",10/6/11,2011,10,6,1,767,156,242,-0.078,-0.096,0.331,0.72,-30.907,HR2250,Failed,NA,On Agreeing to the Amendment,NA,Amendment sought to add provisions which clarify that section 5 of the bill was intended to supplement and not supersede the Clean Air Act.,7,705,7,705
806,48009,112,1,764,RH1120764,"'RH1120764',","RH1120764,",10/6/11,2011,10,6,1,768,151,255,0.107,-0.675,0.609,1.369,-39.082,HR2250,Failed,NA,On Agreeing to the Amendment,NA,Amendment sought to require that the current boiler rules and regulations must stay in effect for the ten metropolitan areas of the United States with the worst air quality.,7,705,7,705
807,48010,112,1,765,RH1120765,"'RH1120765',","RH1120765,",10/6/11,2011,10,6,1,769,153,254,-0.258,0.309,0.297,0.558,-39.937,HR2250,Failed,NA,On Agreeing to the Amendment,NA,Amendment sought to add a finding to the bill which illustrates the health benefits of EPA's mercury and air toxic cleanup standards for industrial boilers and incinerators.,7,704,7,704
808,48011,112,1,766,RH1120766,"'RH1120766',","RH1120766,",10/6/11,2011,10,6,1,770,147,251,-0.329,0.828,1.139,1.113,-50.203,HR2250,Failed,NA,On Agreeing to the Amendment,NA,"Amendment sought to establish a date for compliance with standards and requirements in accordance with the Clean Air Act and allows the Administrator to provide an extension for such compliance up to one year, but in no case beyond the date that is 5 year",7,705,7,705
809,48015,112,1,769,RH1120769,"'RH1120769',","RH1120769,",10/11/11,2011,10,11,1,773,168,250,0.125,-0.467,0.851,1.697,-31.347,HR2250,Failed,NA,On Agreeing to the Amendment,NA,"An amendment umbered 18 printed in the Congressional Record to add a section which directs the EPA Administrator to implement the rules included in this Act to reduce emissions from waste incinerators or industrial boilers at chemical facilities, oil refi",7,705,7,705
810,48016,112,1,770,RH1120770,"'RH1120770',","RH1120770,",10/11/11,2011,10,11,1,774,166,252,0.115,-0.523,0.286,0.541,-38.267,HR2250,Failed,NA,On Agreeing to the Amendment,NA,"An amendment numbered 7 printed in the Congressional Record to insert a section stating that the Administrator shall not delay actions to reduce emissions from waste incinerators or industrial boilers at chemical facilities, oil refineries, or large manuf",7,705,7,705
811,48017,112,1,771,RH1120771,"'RH1120771',","RH1120771,",10/11/11,2011,10,11,1,775,157,260,-0.16,0.022,0.567,1.199,-23.751,HR2250,Failed,NA,On Agreeing to the Amendment,NA,"An amendment numbered 2 printed in the Congressional Record to insert a finding by Congress that the impact of EPA's rules would create 2,200 net additional jobs.",7,700,7,700
812,48018,112,1,772,RH1120772,"'RH1120772',","RH1120772,",10/11/11,2011,10,11,1,776,169,249,-0.103,0.127,0.255,0.411,-39.051,HR2250,Failed,NA,On Agreeing to the Amendment,NA,An amendment numbered 1 printed in the Congressional Record to insert a finding by Congress that mercury is a potent neurotoxin that can damage the development of an infant's brain.,7,708,7,708
813,48019,112,1,773,RH1120773,"'RH1120773',","RH1120773,",10/11/11,2011,10,11,1,777,154,261,-0.098,-0.16,0.562,1.235,-23.392,HR2250,Failed,NA,On Agreeing to the Amendment,NA,"Amendment sought to insert provisions which allow for a shortening of the 5-year delay contained in the bill if the Administrator finds that more than 1,000 jobs have been created under the regulation.",7,700,7,700
814,48030,112,1,783,RH1120783,"'RH1120783',","RH1120783,",10/13/11,2011,10,13,1,787,174,250,-0.153,0.383,0.257,0.35,-39.815,HR2250,Failed,NA,On Agreeing to the Amendment,NA,Amendment sought to require the EPA Administrator to take into account the potential reductions in the number of illness-related absences from work due to respiratory or other illnesses when the EPA is setting compliance deadlines,7,700,7,700
815,48033,112,1,786,RH1120786,"'RH1120786',","RH1120786,",10/13/11,2011,10,13,1,790,170,246,-0.104,0.145,1.163,1.192,-28.581,HR2250,Failed,"To provide additional time for the Administrator of the Environmental Protection Agency to issue achievable standards for industrial, commercial, and institutional boilers, process heaters, and incinerators, and for other purposes",On Motion to Recommit with Instructions,NA,"On Motion to Recommit with Instructions: H R 2250 To provide additional time for the Administrator of the Environmental Protection Agency to issue achievable standards for industrial, commercial, and institutional boilers, process heaters, and incinerator",7,700,7,700
816,48034,112,1,787,RH1120787,"'RH1120787',","RH1120787,",10/13/11,2011,10,13,1,791,275,142,-0.025,-0.303,-0.594,-1.959,-39.826,HR2250,Passed,"To provide additional time for the Administrator of the Environmental Protection Agency to issue achievable standards for industrial, commercial, and institutional boilers, process heaters, and incinerators, and for other purposes",On Passage,NA,"To provide additional time for the Administrator of the Environmental Protection Agency to issue achievable standards for industrial, commercial, and institutional boilers, process heaters, and incinerators, and for other purposes.",7,700,7,700
817,48037,112,1,789,RH1120789,"'RH1120789',","RH1120789,",10/14/11,2011,10,14,1,793,244,163,-0.142,0.305,-1.232,-0.551,-27.721,HRES431,Passed,"Providing for consideration of H.R. 2273, Coal Residuals Reuse and Management Act",On Agreeing to the Resolution,NA,"H.Res. 431 (112th): Providing for consideration of the bill (H.R. 2273) to amend subtitle D of the Solid Waste Disposal Act to facilitate recovery and beneficial use, and provide for the proper management and disposal, of materials generated by the combus",7,703,7,703
818,48038,112,1,790,RH1120790,"'RH1120790',","RH1120790,",10/14/11,2011,10,14,1,794,171,236,0.069,-0.125,0.351,0.765,-26.075,HR2273,Failed,NA,On Agreeing to the Amendment,NA,Amendment sought to require State programs to meet a legal standard of protection to ensure that human health and the environment are fully and properly protected.,7,700,7,700
819,48039,112,1,791,RH1120791,"'RH1120791',","RH1120791,",10/14/11,2011,10,14,1,795,173,231,-0.091,0.321,0.641,1.271,-23.72,HR2273,Failed,NA,On Agreeing to the Amendment,NA,"Amendment sought to establish a time frame for bringing existing surface impoundments into compliance with revised criteria for design, groundwater monitoring, and corrective action; to maintain state flexibility to opt-out (with certification) and to pro",7,701,7,701
820,48040,112,1,792,RH1120792,"'RH1120792',","RH1120792,",10/14/11,2011,10,14,1,796,185,223,0.086,0.113,0.59,1.335,-29.351,HR2273,Failed,NA,On Agreeing to the Amendment,NA,"Amendment sought to require that before a State can waive any of the criteria under the bill, the State must first notify the public and the EPA and offer the opportunity for public comment.",7,700,7,700
821,48043,112,1,795,RH1120795,"'RH1120795',","RH1120795,",10/14/11,2011,10,14,1,799,172,238,0.062,-0.438,0.682,0.751,-11.47,HR2273,Failed,"To amend subtitle D of the Solid Waste Disposal Act to facilitate recovery and beneficial use, and provide for the proper management and disposal, of materials generated by the combustion of coal and other fossil fuels",On Motion to Recommit with Instructions,NA,"On Motion to Recommit with Instructions: H R 2273 To amend subtitle D of the Solid Waste Disposal Act to facilitate recovery and beneficial use, and provide for the proper management and disposal, of materials generated by the combustion of coal and other",7,707,7,707
822,48044,112,1,796,RH1120796,"'RH1120796',","RH1120796,",10/14/11,2011,10,14,1,800,267,144,0.295,-0.667,-0.268,-0.956,-68.76,HR2273,Passed,"To amend subtitle D of the Solid Waste Disposal Act to facilitate recovery and beneficial use, and provide for the proper management and disposal, of materials generated by the combustion of coal and other fossil fuels",On Passage,NA,"To amend subtitle D of the Solid Waste Disposal Act to facilitate recovery and beneficial use, and provide for the proper management and disposal, of materials generated by the combustion of coal and other fossil fuels.",7,707,7,707
823,48084,112,1,831,RH1120831,"'RH1120831',","RH1120831,",11/4/11,2011,11,4,1,835,174,225,-0.149,0.336,0.18,0.441,-83.581,HR2838,Failed,NA,On Agreeing to the Amendment,NA,Amendment sought to provide states the authority to impose more protective operational requirements on the discharge of ballast water within state resource waters.,7,710,7,701
824,48085,112,1,832,RH1120832,"'RH1120832',","RH1120832,",11/4/11,2011,11,4,1,836,161,237,0.048,-0.168,0.131,0.37,-113.622,HR2838,Failed,NA,On Agreeing to the Amendment,NA,Amendment sought to strike language in the bill which would require States to adopt weaker international ballast water standards as a ceiling for regulatory efforts.,7,710,7,701
825,48103,112,1,561,RH1120561,"'RH1120561',","RH1120561,",7/13/11,2011,7,13,1,564,250,171,0.034,-0.354,-0.654,-1.015,-16.748,HRES347,Passed,Providing for consideration of the bill (H.R. 2018) to amend the Federal Water Pollution Control Act to preserve the authority of each State to make determinations relating to the State,On Agreeing to the Resolution,NA,Providing for consideration of the bill (H.R. 2018) to amend the Federal Water Pollution Control Act to preserve the authority of each State to make determinations relating to the State,7,701,7,701
826,48114,112,1,562,RH1120562,"'RH1120562',","RH1120562,",7/13/11,2011,7,13,1,565,170,252,-0.059,-0.045,0.633,1.281,-14.483,HR2018,Failed,Amendment sought to allow the EPA to continue to have the authority to set standards for NPDES Permit programs by striking section 2.,On Agreeing to the Amendment,NA,Amendment sought to allow the EPA to continue to have the authority to set standards for NPDES Permit programs by striking section 2.,7,701,7,701
827,48125,112,1,563,RH1120563,"'RH1120563',","RH1120563,",7/13/11,2011,7,13,1,566,268,152,-0.274,0.227,-0.884,-1.657,-51.817,HR2018,Agreed to,Amendment requires the EPA to analyze the impact of certain covered actions on employment levels and economic activity and requires public notice and a hearing in those instances where a covered action has more than a de minimis impact on employment or ec,On Agreeing to the Amendment,NA,Amendment requires the EPA to analyze the impact of certain covered actions on employment levels and economic activity and requires public notice and a hearing in those instances where a covered action has more than a de minimis impact on employment or ec,7,700,7,700
828,48136,112,1,564,RH1120564,"'RH1120564',","RH1120564,",7/13/11,2011,7,13,1,567,191,231,0.27,-0.27,0.406,1.264,-43.701,HR2018,Failed,Amendment sought to exclude from this act permit holders who are on the significant non-compliance list.,On Agreeing to the Amendment,NA,Amendment sought to exclude from this act permit holders who are on the significant non-compliance list.,7,701,7,701
829,48147,112,1,565,RH1120565,"'RH1120565',","RH1120565,",7/13/11,2011,7,13,1,568,181,240,-0.044,0.177,0.338,1.06,-44.85,HR2018,Failed,Amendment sought to align federal funding with the scope of federal clean water regulations.,On Agreeing to the Amendment,NA,Amendment sought to align federal funding with the scope of federal clean water regulations.,7,701,7,701
830,48157,112,1,898,RH1120898,"'RH1120898',","RH1120898,",12/8/11,2011,12,8,1,902,241,173,-0.103,0.407,-1.063,-0.281,-14.629,HRES487,Passed,"Providing for consideration of H.R. 1633, the Farm Dust Regulation Prevention Act of 2011",On Ordering the Previous Question,NA,"Providing for consideration of the bill (H.R. 1633) to establish a temporary prohibition against revising any national ambient air quality standard applicable to coarse particulate matter, to limit Federal regulation of nuisance dust in areas in which suc",7,705,7,705
831,48158,112,1,566,RH1120566,"'RH1120566',","RH1120566,",7/13/11,2011,7,13,1,569,183,237,0.039,0.043,0.601,1.736,-29.848,HR2018,Failed,"Amendment sought to exclude from coverage under the bill, any waters that EPA determines provide flood protection for communities, are a valuable fish and wildlife habitat that provides benefits to the economy, or are coastal recreational waters.",On Agreeing to the Amendment,NA,"Amendment sought to exclude from coverage under the bill, any waters that EPA determines provide flood protection for communities, are a valuable fish and wildlife habitat that provides benefits to the economy, or are coastal recreational waters.",7,700,7,700
832,48159,112,1,899,RH1120899,"'RH1120899',","RH1120899,",12/8/11,2011,12,8,1,903,249,161,-0.178,0.01,-0.562,-0.263,-23.33,HRES487,Passed,"Providing for consideration of H.R. 1633, the Farm Dust Regulation Prevention Act of 2011",On Agreeing to the Resolution,NA,"Providing for consideration of the bill (H.R. 1633) to establish a temporary prohibition against revising any national ambient air quality standard applicable to coarse particulate matter, to limit Federal regulation of nuisance dust in areas in which suc",7,705,7,705
833,48162,112,1,902,RH1120902,"'RH1120902',","RH1120902,",12/8/11,2011,12,8,1,906,150,255,-0.241,0.143,0.71,1.037,-20.091,HR1633,Failed,NA,On Agreeing to the Amendment,NA,"Amendment sought to clarify that nothing in the bill precludes the EPA Administrator from enforcing National Ambient Air Quality Standards (NAAQS) for PM2.5 and sought to delete section 3, which would allow the EPA to regulate """"""""""""""""nuisance dust"""""""""""""""" in areas whe",7,705,7,705
834,48163,112,1,903,RH1120903,"'RH1120903',","RH1120903,",12/8/11,2011,12,8,1,907,159,250,-0.26,0.365,0.366,0.713,-28.285,HR1633,Failed,NA,On Agreeing to the Amendment,NA,"Amendment sought to allow the EPA the authority under the Clean Air Act to step in and take action to reduce dangerous particle pollution if state, local, or tribal laws are not sufficient to protect public health.",7,705,7,705
835,48164,112,1,904,RH1120904,"'RH1120904',","RH1120904,",12/8/11,2011,12,8,1,908,165,249,-0.126,0.143,0.626,1.298,-23.055,HR1633,Failed,NA,On Agreeing to the Amendment,NA,Amendment sought to ensure that particulate matter containing arsenic and other heavy metals that are hazardous to human health is not defined as nuisance dust and remains subject to the Clean Air Act.,7,705,7,705
836,48165,112,1,905,RH1120905,"'RH1120905',","RH1120905,",12/8/11,2011,12,8,1,909,158,257,-0.044,-0.205,0.259,0.537,-42.631,HR1633,Failed,NA,On Agreeing to the Amendment,NA,Amendment sought to require that particulate pollution produced from mining activities is not defined as nuisance dust and remains subject to the Clean Air Act.,7,705,7,705
837,48166,112,1,906,RH1120906,"'RH1120906',","RH1120906,",12/8/11,2011,12,8,1,910,170,247,0.078,-0.237,0.229,0.513,-52.665,HR1633,Failed,NA,On Agreeing to the Amendment,NA,"At the end of the bill, add the following section: SEC. 4. REPORT ON EFFECT ON JOBS. Not later than 180 days after the date of enactment of this Act, the Administrator of the Environmental Protection Agency shall transmit to Congress a report estimating t",7,705,7,705
838,48167,112,1,907,RH1120907,"'RH1120907',","RH1120907,",12/8/11,2011,12,8,1,911,166,252,-0.201,0.318,0.667,1.034,-14.093,HR1633,Failed,"To establish a temporary prohibition against revising any national ambient air quality standard applicable to coarse particulate matter, to limit Federal regulation of nuisance dust in areas in which such dust is regulated under State, tribal, or local law, and for other purposes",On Motion to Recommit with Instructions,NA,"To establish a temporary prohibition against revising any national ambient air quality standard applicable to coarse particulate matter, to limit Federal regulation of nuisance dust in areas in which such dust is regulated under State, tribal, or local la",7,705,7,705
839,48168,112,1,908,RH1120908,"'RH1120908',","RH1120908,",12/8/11,2011,12,8,1,912,268,150,-0.276,0.173,-0.629,-1.283,-31.643,HR1633,Passed,"To establish a temporary prohibition against revising any national ambient air quality standard applicable to coarse particulate matter, to limit Federal regulation of nuisance dust in areas in which such dust is regulated under State, tribal, or local law, and for other purposes",On Passage,NA,"To establish a temporary prohibition against revising any national ambient air quality standard applicable to coarse particulate matter, to limit Federal regulation of nuisance dust in areas in which such dust is regulated under State, tribal, or local la",7,705,7,705
840,48180,112,1,568,RH1120568,"'RH1120568',","RH1120568,",7/13/11,2011,7,13,1,571,167,254,-0.102,-0.001,0.842,1.641,-25.684,HR2018,Failed,Amendment sought to strike all after the enacting clause.,On Agreeing to the Amendment,NA,Amendment sought to strike all after the enacting clause.,7,701,7,701
841,48192,112,1,569,RH1120569,"'RH1120569',","RH1120569,",7/13/11,2011,7,13,1,572,188,238,0.024,0,1.192,-0.197,-9.803,HR2018,Failed,"To amend the Federal Water Pollution Control Act to preserve the authority of each State to make determinations relating to the States water quality standards, and for other purposes",On Motion to Recommit with Instructions,NA,"To amend the Federal Water Pollution Control Act to preserve the authority of each State to make determinations relating to the State's water quality standards, and for other purposes.",7,701,7,701
842,48203,112,1,570,RH1120570,"'RH1120570',","RH1120570,",7/13/11,2011,7,13,1,573,239,184,-0.065,0.195,-0.337,-1.158,-48.231,HR2018,Passed,"To amend the Federal Water Pollution Control Act to preserve the authority of each State to make determinations relating to the States water quality standards, and for other purposes",On Passage,NA,"To amend the Federal Water Pollution Control Act to preserve the authority of each State to make determinations relating to the State's water quality standards, and for other purposes.",7,701,7,701
843,48211,112,1,571,RH1120571,"'RH1120571',","RH1120571,",7/14/11,2011,7,14,1,574,168,257,-0.164,0.98,0.207,0.043,-95.007,HR2354,Failed,"To amend the Federal Water Pollution Control Act to preserve the authority of each State to make determinations relating to the State's water quality standards, and for other purposes.",On Agreeing to the Amendment,NA,Amendment sought to increase the Non-Defense Environmental Cleanup account under the Department of Energy by $10 million and reduce the Weapons Activities account under the National Nuclear Security Administration by a similar amount.,7,704,7,704
844,48236,112,1,594,RH1120594,"'RH1120594',","RH1120594,",7/15/11,2011,7,15,1,597,68,351,0.612,-0.094,-0.18,0.163,-122.505,HR2354,Failed,An amendment to reduce each amount made available by this bill by 1 percent.,On Agreeing to the Amendment,NA,"Amendment sought to prohibit the use of funds for the purpose of providing loan guarantees for """"""""""""""""carbon capture and sequestration projects"""""""""""""""".",7,705,7,705
845,48480,112,1,1536,RH1121536,"'RH1121536',","RH1121536,",9/21/12,2012,9,21,2,593,178,229,-0.109,0.373,0.388,0.821,-27.051,HR3409,Failed,NA,On Agreeing to the Amendment,NA,Amendment sought to strike the language that would repeal EPA's scientific finding that carbon pollution endangers the public health and welfare.,7,798,7,798
846,48483,112,1,1539,RH1121539,"'RH1121539',","RH1121539,",9/21/12,2012,9,21,2,596,164,247,0.048,-0.268,0.358,0.944,-30.36,HR3409,Failed,NA,On Agreeing to the Amendment,NA,Amendment sought to strike section 503 of the committee print which limits agency comment periods on water quality permits to 30 days with no possibility of extension.,7,701,7,701
847,48484,112,1,1540,RH1121540,"'RH1121540',","RH1121540,",9/21/12,2012,9,21,2,597,247,163,-0.026,-0.108,-0.233,-0.622,-47.693,HR3409,Agreed to,NA,On Agreeing to the Amendment,NA,Amendment prohibits the EPA from retroactively invalidating permits after they have been issued.,7,700,7,700
848,48487,112,1,1543,RH1121543,"'RH1121543',","RH1121543,",9/21/12,2012,9,21,2,600,228,183,0.159,-0.144,-0.384,-1.034,-36.054,HR3409,Agreed to,NA,On Agreeing to the Amendment,NA,Amendment ensures that States continue to have control over regional haze regulations by limiting EPA's ability to override States' management of regional haze and allowing States to implement their own regional haze management plans.,7,705,7,705
849,48671,112,1,1024,RH1121024,"'RH1121024',","RH1121024,",2/29/12,2012,2,29,2,80,241,178,-0.034,0.133,-1.115,-0.986,-16.553,HRES566,Passed,"Providing for consideration of the bill (H.R. 1837) to address certain water-related concerns on the San Joaquin River, and for other purposes",On Ordering the Previous Question,NA,"On Ordering the Previous Question: H RES 566 Providing for consideration of the bill (H.R. 1837) to address certain water-related concerns on the San Joaquin River, and for other purposes",7,710,7,701
850,48672,112,1,1025,RH1121025,"'RH1121025',","RH1121025,",2/29/12,2012,2,29,2,81,245,173,-0.073,0.026,-0.72,-0.735,-11.839,HRES566,Passed,"Providing for consideration of the bill (H.R. 1837) to address certain water-related concerns on the San Joaquin River, and for other purposes",On Agreeing to the Resolution,NA,"H.Res. 566 (112th): Providing for consideration of the bill (H.R. 1837) to address certain water-related concerns on the San Joaquin River, and for other purposes.",7,710,7,701
851,48675,112,1,1028,RH1121028,"'RH1121028',","RH1121028,",2/29/12,2012,2,29,2,84,178,242,0.045,-0.112,0.673,1.001,-12.374,HR1837,Failed,NA,On Agreeing to the Amendment,NA,"Amendment sought to prevent provisions of the bill from taking effect until it has been determined that it will not harm the quality or safety of drinking water supplies for residents of California's Delta region (Contra Costa, Sacramento, San Joaquin, So",7,701,7,701
852,48680,112,1,1033,RH1121033,"'RH1121033',","RH1121033,",2/29/12,2012,2,29,2,89,180,244,-0.104,0.335,0.69,1.077,-15.875,HR1837,Failed,NA,On Agreeing to the Amendment,NA,Amendment sought to replace provisions in H.R. 1837 that override state law with a provision upholding state law and requiring use of the best available science.,7,710,7,701
853,48681,112,1,1034,RH1121034,"'RH1121034',","RH1121034,",2/29/12,2012,2,29,2,90,178,248,-0.117,0.267,0.708,0.726,-11.448,HR1837,Failed,Sacramento-San Joaquin Valley Water Reliability Act,On Motion to Recommit with Instructions,NA,On Motion to Recommit with Instructions: H R 1837 Sacramento-San Joaquin Valley Water Reliability Act,7,710,7,701
854,48682,112,1,1035,RH1121035,"'RH1121035',","RH1121035,",2/29/12,2012,2,29,2,91,246,175,-0.225,0.646,-0.41,-0.577,-21.361,HR1837,Passed,Sacramento-San Joaquin Valley Water Reliability Act,On Passage,NA,"To address certain water-related concerns on the San Joaquin River, and for other purposes.",7,710,7,701
855,48745,112,1,1099,RH1121099,"'RH1121099',","RH1121099,",4/17/12,2012,4,17,2,155,235,179,0.05,0.314,-1.123,0.467,-7.543,HRES614,Passed,"Providing for consideration of the bill (H.R. 4089) to protect and enhance opportunities for recreational hunting, fishing and shooting, and for other purposes",On Ordering the Previous Question,NA,"On Ordering the Previous Question: H RES 614 Providing for consideration of the bill (H.R. 4089) to protect and enhance opportunities for recreational hunting, fishing and shooting, and for other purposes",7,709,7,709
856,48746,112,1,1100,RH1121100,"'RH1121100',","RH1121100,",4/17/12,2012,4,17,2,156,228,184,0.117,0.95,-1.224,0.254,-24.756,HRES614,Passed,"Providing for consideration of the bill (H.R. 4089) to protect and enhance opportunities for recreational hunting, fishing and shooting, and for other purposes",On Agreeing to the Resolution,NA,"Providing for consideration of the bill (H.R. 4089) to protect and enhance opportunities for recreational hunting, fishing and shooting, and for other purposes.",7,709,7,709
857,48750,112,1,1104,RH1121104,"'RH1121104',","RH1121104,",4/17/12,2012,4,17,2,160,155,262,-0.188,0.084,0.247,1.044,-68.91,HR4089,Failed,NA,On Agreeing to the Amendment,NA,Amendment sought to strike title III of the bill which allows the importation of endangered polar bear trophies from Canada by hunters who killed the bears despite warnings that importation of the bears would likely be illegal.,7,709,7,709
858,48753,112,1,1107,RH1121107,"'RH1121107',","RH1121107,",4/17/12,2012,4,17,2,163,160,261,-0.308,0.541,0.856,1.27,-28.531,HR4089,Failed,Sportsmens Heritage Act of 2012,On Motion to Recommit with Instructions,NA,On Motion to Recommit with Instructions: H R 4089 Sportsmen,7,709,7,709
859,48754,112,1,1108,RH1121108,"'RH1121108',","RH1121108,",4/17/12,2012,4,17,2,164,274,146,-0.054,-0.237,-0.43,-1.44,-51.589,HR4089,Passed,Sportsmens Heritage Act of 2012,On Passage,NA,"To protect and enhance opportunities for recreational hunting, fishing and shooting.",7,709,7,709
860,48758,112,1,1112,RH1121112,"'RH1121112',","RH1121112,",4/18/12,2012,4,18,2,168,255,165,-0.268,0.463,-0.526,-1.134,-20.221,HR4348,Agreed to,NA,On Agreeing to the Amendment,NA,Amendment adds to the bill the environmental streamlining provisions from Title III of the American Energy and Infrastructure Jobs Act (H.R. 7).,7,700,7,700
861,48801,112,1,1155,RH1121155,"'RH1121155',","RH1121155,",5/8/12,2012,5,8,2,211,168,239,0.407,-0.356,-0.19,-0.178,-134.446,HR5326,Failed,NA,On Agreeing to the Amendment,NA,Amendment sought to reduce funds for the Pacific Coastal Salmon Recovery program by $15 million and to apply the savings to the spending reduction account.,7,709,7,709
862,48914,112,1,1268,RH1121268,"'RH1121268',","RH1121268,",6/6/12,2012,6,6,2,324,150,260,-0.199,0.18,0.169,0.18,-98.858,HR5325,Failed,NA,On Agreeing to the Amendment,NA,Amendment sought to increase the funds available for the Texas Coastal Restoration by $10 million and to reduce the funds available for the modernization of the nuclear weapons stockpile by a similar amount.,7,710,7,701
863,48982,112,1,1336,RH1121336,"'RH1121336',","RH1121336,",6/21/12,2012,6,21,2,393,164,249,-0.05,-0.021,0.563,1.339,-21.908,HR4480,Failed,NA,On Agreeing to the Amendment,NA,"Amendment sought to provide that the rules described in section 205(a) shall not be delayed if the pollution that would be controlled by the rules contributes to asthma attacks, acute and chronic bronchitis, heart attacks, cancer, birth defects, neurologi",7,705,7,705
864,48983,112,1,1337,RH1121337,"'RH1121337',","RH1121337,",6/21/12,2012,6,21,2,394,177,242,0.122,-0.241,0.429,0.966,-25.5,HR4480,Failed,NA,On Agreeing to the Amendment,NA,"Amendment sought to define the term """"""""""""""""public health"""""""""""""""" in the Clean Air Act.",7,705,7,705
865,48984,112,1,1338,RH1121338,"'RH1121338',","RH1121338,",6/21/12,2012,6,21,2,395,174,244,0.415,-0.867,0.378,0.888,-52.2,HR4480,Failed,NA,On Agreeing to the Amendment,NA,Amendment sought to strike section 206 of the bill which would require the consideration of feasibility and costs in revising or supplementing national ambient air quality standards for ozone.,7,705,7,705
866,49012,112,1,1366,RH1121366,"'RH1121366',","RH1121366,",6/26/12,2012,6,26,2,423,138,265,0.41,-0.005,-1.332,0.247,-110.303,HR5972,Failed,NA,On Agreeing to the Amendment,NA,"Amendment sought to reduce funds for safety inspectors with the Pipeline and Hazardous Materials Safety Administration by $1,670,000 and to apply the savings to the spending reduction account.",7,704,7,704
867,49036,112,1,1390,RH1121390,"'RH1121390',","RH1121390,",6/29/12,2012,6,29,2,447,234,191,-0.131,0.468,-0.283,-0.733,-55.043,HR5972,Agreed to,NA,On Agreeing to the Amendment,NA,"An amendment to prohibit the use of funds to be used by the Secretary of Transportation to implement, administer, or enforce the Migratory Bird Treaty Act, Executive Order No. 13186.",7,709,7,709
868,49093,112,1,1447,RH1121447,"'RH1121447',","RH1121447,",7/25/12,2012,7,25,2,504,163,253,0.427,-0.819,0.318,0.903,-59.572,HR6082,Failed,NA,On Agreeing to the Amendment,NA,Amendment sought to strike section 6 which requires the Secretary of the Interior to conduct a single multi-sale environmental impact statement for all of the new areas opened for drilling by the bill.,7,700,7,700
869,49103,112,1,1457,RH1121457,"'RH1121457',","RH1121457,",7/25/12,2012,7,25,2,514,188,231,0.104,0.036,0.712,1.719,-43.588,HR4078,Failed,NA,On Agreeing to the Amendment,NA,"Amendment sought to provide an exception to the underlying legislation, permitting agencies to make regulatory actions intended to ensure safe drinking water.",7,701,7,701
870,49121,112,1,1475,RH1121475,"'RH1121475',","RH1121475,",7/26/12,2012,7,26,2,532,245,171,0.003,-0.025,-0.266,-0.645,-37.948,HR4078,Agreed to,NA,On Agreeing to the Amendment,NA,Amendment sought to keep the U.S. Securities and Exchange Commission (SEC) from enforcing or issuing interpretive guidance on climate change.,7,705,7,705
871,49348,113,1,15,RH1130015,"'RH1130015',","RH1130015,",1/15/13,2013,1,15,1,16,221,197,0.23,-0.35,-0.223,-0.374,-55.703,HR152,Agreed to,NA,On Agreeing to the Amendment,NA,"An amendment numbered 2 printed in Part C of House Report 113-1 to strike $150,000,000 for Regional Ocean Partnership grants.",7,710,7,701
872,49501,113,1,168,RH1130168,"'RH1130168',","RH1130168,",5/22/13,2013,5,22,1,169,246,168,-0.315,0.377,-0.701,-1.395,-38.769,HR3,Agreed to,NA,On Agreeing to the Amendment,NA,Amendment adds to the findings in Section 2 highlighting the State Department's scientific and environmental findings which conclude that the Keystone XL pipeline is a safe and environmentally sound project.,7,700,7,700
873,49502,113,1,169,RH1130169,"'RH1130169',","RH1130169,",5/22/13,2013,5,22,1,170,146,269,-0.146,-0.16,0.829,2.348,-76.812,HR3,Failed,NA,On Agreeing to the Amendment,NA,Amendment sought to add a finding that the reliance on oil sands crudes for transportation fuels would likely result in an increase in incremental greenhouse gas emissions in the United States equivalent to approximately that of 4.3 million passenger vehicles. The amendment also sought to provide that the bill would not go into effect unless the President found that TransCanada or tar sands producers could fully offset the additional greenhouse gas emissions produced annually.,7,705,7,705
874,49503,113,1,170,RH1130170,"'RH1130170',","RH1130170,",5/22/13,2013,5,22,1,171,177,239,0.197,-0.536,0.266,0.702,-49.791,HR3,Failed,NA,On Agreeing to the Amendment,NA,Amendment sought to require the completion of a study on the health impacts of increased air pollution in communities surrounding the refineries that will transport diluted bitumen through the proposed Keystone XL pipeline prior to its operation.,7,705,7,705
875,49507,113,1,174,RH1130174,"'RH1130174',","RH1130174,",5/22/13,2013,5,22,1,175,182,234,-0.057,-0.26,0.79,1.065,-21.349,HR3,Failed,NA,On Agreeing to the Amendment,NA,Amendment sought to lengthen the time period for filing a claim under the Act from 60 days to 1 year.,7,710,7,701
876,49508,113,1,175,RH1130175,"'RH1130175',","RH1130175,",5/22/13,2013,5,22,1,176,185,231,-0.017,-0.059,0.311,0.679,-28.61,HR3,Failed,NA,On Agreeing to the Amendment,NA,"Amendment sought to require the GAO to conduct a study and prepare a report of the Keystone XL pipeline to determine the total projected costs of pipeline spill cleanup, including the potential impacts of a petroleum spill on public health and the environment and the quantity and quality of water available for agricultural and municipal purposes.",7,710,7,701
877,49593,113,1,260,RH1130260,"'RH1130260',","RH1130260,",6/19/13,2013,6,19,1,261,273,149,0.127,0.833,0.96,1.922,-123.294,HR1947,Agreed to,NA,On Agreeing to the Amendment,NA,"Amendment improves federal coordination in addressing the documented decline of managed and native pollinators and promotes the long-term viability of honey bee, wild bees, and other beneficial insects in agriculture.",7,709,7,709
878,49602,113,1,269,RH1130269,"'RH1130269',","RH1130269,",6/20/13,2013,6,20,1,270,206,219,-0.075,0.885,0.144,0.117,-139.292,HR1947,Failed,NA,On Agreeing to the Amendment,NA,"Amendment sought to modify the Forest Legacy program to allow qualified third party, non-governmental entities to hold the conservation easements financed with Forest Legacy revenue.",7,709,7,709
879,49627,113,1,294,RH1130294,"'RH1130294',","RH1130294,",6/27/13,2013,6,27,1,295,188,233,-0.032,0.064,0.544,1.44,-18.558,HR2231,Failed,NA,On Agreeing to the Amendment,NA,An amendment numbered 2 printed in Part B of House Report 113-131 to strike section 204 because it eliminates environmental evaluation typically provided by an Environmental Impact Study (EIS) and because conducting a single multisale EIS for decisions with different timelines creates unnecessary conflicts in the EIS process.,7,700,7,700
880,49643,113,1,310,RH1130310,"'RH1130310',","RH1130310,",7/9/13,2013,7,9,1,311,177,236,-0.177,0.217,0.585,1.269,-19.869,HR2609,Failed,NA,On Agreeing to the Amendment,NA,An amendment numbered 1 printed in the Congressional Record to strike section 107 of the bill which prohibits the use of funds to implement regulations pertaining to the definition of waters under the jurisdiction of the Federal Water Pollution Control Act.,7,710,7,701
881,49644,113,1,311,RH1130311,"'RH1130311',","RH1130311,",7/9/13,2013,7,9,1,312,188,226,-0.153,0.31,0.394,1.183,-28.796,HR2609,Failed,NA,On Agreeing to the Amendment,NA,An amendment numbered 2 printed in the Congressional Record to strike section 112 which pertains to the definition of fill material or discharge of fill material for the purposes of the Federal Water Pollution Control Act.,7,710,7,701
882,49761,113,1,428,RH1130428,"'RH1130428',","RH1130428,",8/1/13,2013,8,1,1,429,182,224,-0.036,0.089,0.62,1.169,-11.375,HR1582,Failed,NA,On Agreeing to the Amendment,NA,Amendment sought to prevent section 2 of the bill from applying to rules related to protecting air and water quality.,7,700,7,700
883,49762,113,1,429,RH1130429,"'RH1130429',","RH1130429,",8/1/13,2013,8,1,1,430,234,178,0.242,-0.564,-0.235,-0.571,-53.896,HR1582,Agreed to,NA,On Agreeing to the Amendment,NA,"Amendment prohibits the EPA from using the """"""""""""""""social cost of carbon"""""""""""""""" valuation for any energy-related rule that costs more than $1 billion unless and until a Federal law is enacted authorizing such use.",7,705,7,705
884,49769,113,1,436,RH1130436,"'RH1130436',","RH1130436,",8/2/13,2013,8,2,1,437,237,176,0.007,-0.319,-0.623,-1.148,-17.095,HR367,Agreed to,NA,On Agreeing to the Amendment,NA,Amendment requires the Administration to receive approval from Congress before implementing a carbon tax.,7,705,7,705
885,49822,113,1,489,RH1130489,"'RH1130489',","RH1130489,",9/26/13,2013,9,26,1,490,191,217,-0.147,0.989,1.03,1.258,-23.583,HR687,Failed,NA,On Agreeing to the Amendment,NA,"Amendment sought to protect water quality and water quantity for the people living and working near this proposed mine, given estimates that mining operations will consume the equivalent of the annual water supply for.",7,701,7,701
886,49886,113,1,553,RH1130553,"'RH1130553',","RH1130553,",10/23/13,2013,10,23,1,554,225,194,-0.126,0.992,-1.052,-0.805,-14.58,HRES385,Passed,"Providing for consideration of H.R. 3080, the Water Resources Reform and Development Act of 2013",On Ordering the Previous Question,NA,"H.Res. 385 (113th): Providing for consideration of the bill (H.R. 3080) to provide for improvements to the rivers and harbors of the United States, to provide for the conservation and development of water and related resources, and for other purposes.",7,710,7,701
887,49887,113,1,554,RH1130554,"'RH1130554',","RH1130554,",10/23/13,2013,10,23,1,555,271,147,-0.249,-0.096,-0.209,0.039,-101.891,HRES385,Passed,"Providing for consideration of H.R. 3080, the Water Resources Reform and Development Act of 2013",On Agreeing to the Resolution,NA,"H.Res. 385 (113th): Providing for consideration of the bill (H.R. 3080) to provide for improvements to the rivers and harbors of the United States, to provide for the conservation and development of water and related resources, and for other purposes.",7,710,7,701
888,49889,113,1,556,RH1130556,"'RH1130556',","RH1130556,",10/23/13,2013,10,23,1,557,225,193,0.003,0.115,-0.253,-0.515,-37.838,HR3080,Agreed to,NA,On Agreeing to the Amendment,NA,"Amendment prohibits programs or actions authorized under this Act from further implementation of coastal and marine spatial planning and ecosystem-based management components under Executive Order 13547; requires the Secretary of the Army to conduct and submit a study detailing all activities engaged in and resources expended in furtherance of Executive Order 13547; requires such study to include any budget requests for fiscal year 2014 for support of implementation of Executive Order 13547; and requires that the study be submitted to the House Committee on Transportation and Infrastructure and Senate Committee on Commerce, Science, and Transportation.",7,700,7,700
889,49892,113,1,559,RH1130559,"'RH1130559',","RH1130559,",10/23/13,2013,10,23,1,560,417,3,0,0,0,0,0,HR3080,Passed,Water Resources Reform and Development Act,On Passage,NA,"To provide for improvements to the rivers and harbors of the United States, to provide for the conservation and development of water and related resources, and for other purposes.",7,710,7,701
890,49905,113,1,572,RH1130572,"'RH1130572',","RH1130572,",11/13/13,2013,11,13,1,573,224,195,0.057,0.168,-0.753,0.391,-0.334,HRES403,Passed,"Providing for consideration of H.R. 2655, the Lawsuit Abuse Reduction Act of 2013, and providing for consideration of H.R. 982, the Furthering Asbestos Claim Transparency Act of 2013",On Ordering the Previous Question,NA,"H.Res. 403 (113th): Providing for consideration of the bill (H.R. 2655) to amend Rule 11 of the Federal Rules of Civil Procedure to improve attorney accountability, and for other purposes, and providing for consideration of the bill (H.R. 982) to amend title 11 of the United States Code to require the public disclosure by trusts established under section 524(g) of such title, of quarterly reports that contain detailed information regarding the receipt and disposition of claims for injuries based on exposure to asbestos; and for other purposes.",7,708,7,708
891,49906,113,1,573,RH1130573,"'RH1130573',","RH1130573,",11/13/13,2013,11,13,1,574,223,194,0.051,0.132,-0.75,0.342,-0.312,HRES403,Passed,"Providing for consideration of H.R. 2655, the Lawsuit Abuse Reduction Act of 2013, and providing for consideration of H.R. 982, the Furthering Asbestos Claim Transparency Act of 2013",On Agreeing to the Resolution,NA,"H.Res. 403 (113th): Providing for consideration of the bill (H.R. 2655) to amend Rule 11 of the Federal Rules of Civil Procedure to improve attorney accountability, and for other purposes, and providing for consideration of the bill (H.R. 982) to amend title 11 of the United States Code to require the public disclosure by trusts established under section 524(g) of such title, of quarterly reports that contain detailed information regarding the receipt and disposition of claims for injuries based on exposure to asbestos; and for other purposes.",7,708,7,708
892,49907,113,1,574,RH1130574,"'RH1130574',","RH1130574,",11/13/13,2013,11,13,1,575,198,223,-0.132,0.944,0.603,0.67,-11.351,HR982,Failed,NA,On Agreeing to the Amendment,NA,"Amendment sought to exempt from provisions of the bill, asbestos trusts with internal anti-fraud procedures.",7,708,7,708
893,49908,113,1,575,RH1130575,"'RH1130575',","RH1130575,",11/13/13,2013,11,13,1,576,194,226,-0.073,0.391,0.713,0.538,-5.412,HR982,Failed,NA,On Agreeing to the Amendment,NA,Amendment sought to protect public health and safety by adding a requirement that any party seeking payment information from a trust must also make available information relevant to such action that pertains to public health or safety.,7,708,7,708
894,49909,113,1,576,RH1130576,"'RH1130576',","RH1130576,",11/13/13,2013,11,13,1,577,195,226,-0.07,0.363,0.717,0.539,-5.401,HR982,Failed,NA,On Agreeing to the Amendment,NA,Amendment sought to apply the transparency rules in the bill equally to asbestos industry defendants by requiring asbestos companies to report information about the location of their asbestos-containing products and also sought to provide an exception for trade secrets.,7,708,7,708
895,49910,113,1,577,RH1130577,"'RH1130577',","RH1130577,",11/13/13,2013,11,13,1,578,197,224,-0.043,0.455,0.723,0.341,-2.604,HR982,Failed,Furthering Asbestos Claim Transparency (FACT) Act of 2013,On Motion to Recommit with Instructions,NA,"To amend title 11 of the United States Code to require the public disclosure by trusts established under section 524(g) of such title, of quarterly reports that contain detailed information regarding the receipt and disposition of claims for injuries based on exposure to asbestos; and for other purposes.",7,708,7,708
896,49911,113,1,578,RH1130578,"'RH1130578',","RH1130578,",11/13/13,2013,11,13,1,579,221,199,-0.096,0.488,-0.247,-0.401,-40.402,HR982,Passed,Furthering Asbestos Claim Transparency (FACT) Act of 2013,On Passage,NA,"To amend title 11 of the United States Code to require the public disclosure by trusts established under section 524(g) of such title, of quarterly reports that contain detailed information regarding the receipt and disposition of claims for injuries based on exposure to asbestos; and for other purposes.",7,708,7,708
897,49914,113,1,581,RH1130581,"'RH1130581',","RH1130581,",11/14/13,2013,11,14,1,582,347,76,0.586,0.039,1.252,1.041,-107.198,HR3080,Passed,Water Resources Reform and Development Act,On Motion to Instruct Conferees,NA,"To provide for improvements to the rivers and harbors of the United States, to provide for the conservation and development of water and related resources, and for other purposes.",7,710,7,701
898,49927,113,1,594,RH1130594,"'RH1130594',","RH1130594,",11/20/13,2013,11,20,1,595,194,228,0.083,-0.559,0.665,0.74,-8.86,HR1965,Failed,NA,On Agreeing to the Amendment,NA,"Amendment sought to allow the Secretary of the Interior to continue to review actions that generally qualify for Categorical Exclusions to NEPA for possible Extraordinary Circumstances (e.g. Violations of a Federal law, or a State, local, or tribal law or requirement) which would then supersede the Categorical Exclusion and require further NEPA review.",7,700,7,700
899,49945,113,1,612,RH1130612,"'RH1130612',","RH1130612,",12/2/13,2013,12,2,1,613,384,0,0,0,0,0,0,HR3588,Passed,Community Fire Safety Act of 2013,On Motion to Suspend the Rules and Pass,NA,"To amend the Safe Drinking Water Act to exempt fire hydrants from the prohibition on the use of lead pipes, fittings, fixtures, solder, and flux.",7,701,7,701
900,50223,113,1,644,RH1130644,"'RH1130644',","RH1130644,",1/9/14,2014,1,9,2,5,226,191,0.057,0.173,-0.754,0.399,-0.334,HRES455,Passed,"Providing for consideration of H.R. 2279, Reducing Excessive Deadline Obligations Act of 2013; consideration of H.R. 3362, to require transparency in the operation of Health Benefit Exchanges; and consideration of H.R. 3811, to require notification of breaches of personal information through Health Benefit Exchanges",On Ordering the Previous Question,NA,"This vote was related to a resolution introduced by Rep. Michael Burgess [R-TX26] on January 8, 2014, H.Res. 455 (113th): Providing for consideration of the bill (H.R. 2279) to amend the Solid Waste Disposal Act relating to review of regulations under such Act and to amend the Comprehensive Environmental Response, Compensation, and Liability Act of 1980 r.",7,703,7,703
901,50224,113,1,645,RH1130645,"'RH1130645',","RH1130645,",1/9/14,2014,1,9,2,6,223,186,-0.048,0.45,-0.706,-0.379,-3.324,HRES455,Passed,"Providing for consideration of H.R. 2279, Reducing Excessive Deadline Obligations Act of 2013; consideration of H.R. 3362, to require transparency in the operation of Health Benefit Exchanges; and consideration of H.R. 3811, to require notification of breaches of personal information through Health Benefit Exchanges",On Agreeing to the Resolution,NA,"Providing for consideration of the bill (H.R. 2279) to amend the Solid Waste Disposal Act relating to review of regulations under such Act and to amend the Comprehensive Environmental Response, Compensation, and Liability Act of 1980",7,703,7,703
902,50225,113,1,646,RH1130646,"'RH1130646',","RH1130646,",1/9/14,2014,1,9,2,7,189,228,0.04,-0.044,0.657,0.899,-7.81,HR2279,Failed,NA,On Agreeing to the Amendment,NA,This was a vote to approve or reject amendment H.Amdt. 528 (113th) (Kyrsten Sinema) to H.R. 2279 (113th). The title of the amendment is H.Amdt. 528 (Sinema) to H.R. 2279: Amendment sought to strike language that would expand eligibility for the National Priorities List (NPL) in Section 204 which is overseen by the Environmental Protection Agency and sought to reinstate language that direc.,7,700,7,700
903,50226,113,1,647,RH1130647,"'RH1130647',","RH1130647,",1/9/14,2014,1,9,2,8,190,227,0.039,0.043,0.622,1.045,-10.975,HR2279,Failed,NA,On Agreeing to the Amendment,NA,"This vote was related to a bill introduced by Sen. Cory Gardner [R-CO] on June 6, 2013, H.R. 2279 (113th): Reducing Excessive Deadline Obligations Act of 2013.",7,703,7,703
904,50227,113,1,648,RH1130648,"'RH1130648',","RH1130648,",1/9/14,2014,1,9,2,9,188,225,0.073,0.461,0.747,-0.349,-0.324,HR2279,Failed,Reducing Excessive Deadline Obligations Act of 2013,On Motion to Recommit with Instructions,NA,"This vote was related to a bill introduced by Sen. Cory Gardner [R-CO] on June 6, 2013, H.R. 2279 (113th): Reducing Excessive Deadline Obligations Act of 2013.",7,703,7,703
905,50228,113,1,649,RH1130649,"'RH1130649',","RH1130649,",1/9/14,2014,1,9,2,10,225,188,0.125,-0.184,-0.448,-1.021,-17.541,HR2279,Passed,Reducing Excessive Deadline Obligations Act of 2013,On Passage,NA,"This vote was related to a bill introduced by Sen. Cory Gardner [R-CO] on June 6, 2013, H.R. 2279 (113th): Reducing Excessive Deadline Obligations Act of 2013.",7,703,7,703
906,50262,113,1,683,RH1130683,"'RH1130683',","RH1130683,",2/5/14,2014,2,5,2,44,194,226,-0.132,0.477,0.688,1.037,-7.345,HR3964,Failed,NA,On Agreeing to the Amendment,NA,"This was a vote to approve or reject amendment H.Amdt. 545 (113th) (Ami Bera) to H.R. 3964 (113th). The title of the amendment is H.Amdt. 545 (Bera) to H.R. 3964: Amendment sought to delay implementation of the act until it is determined that it will not have a negative impact on the quantity, quality, and safety of drinking water in the California Delta region..",7,701,7,701
907,50265,113,1,686,RH1130686,"'RH1130686',","RH1130686,",2/5/14,2014,2,5,2,47,193,230,-0.156,0.513,0.671,0.95,-10.324,HR3964,Failed,NA,On Agreeing to the Amendment,NA,This was a vote to approve or reject amendment H.Amdt. 549 (113th) (Jerry McNerney) to H.R. 3964 (113th). The title of the amendment is H.Amdt. 549 (McNerney) to H.R. 3964: Amendment sought to prevent several provisions of the Act from taking effect until it is determined that it will not harm water quality or water availability for agricultural producers in California's Delta region (Con.,7,701,7,701
908,50266,113,1,687,RH1130687,"'RH1130687',","RH1130687,",2/5/14,2014,2,5,2,48,192,231,-0.182,0.613,0.797,0.98,-13.552,HR3964,Failed,NA,On Agreeing to the Amendment,NA,This was a vote to approve or reject amendment H.Amdt. 550 (113th) (Scott Peters) to H.R. 3964 (113th). The title of the amendment is H.Amdt. 550 (Peters) to H.R. 3964: Amendment sought to stipulate that the bill cannot go into effect until the Secretary confirms that the act does not adversely affect any community's water supply or water budget..,7,701,7,701
909,50267,113,1,688,RH1130688,"'RH1130688',","RH1130688,",2/5/14,2014,2,5,2,49,191,231,0.021,-0.311,0.692,0.896,-7.603,HR3964,Failed,Sacramento-San Joaquin Valley Emergency Water Delivery Act,On Motion to Recommit with Instructions,NA,"This vote was related to a bill introduced by Rep. David Valadao [R-CA21] on January 29, 2014, H.R. 3964 (113th): Sacramento-San Joaquin Valley Emergency Water Delivery Act: To address certain water-related concerns in the Sacramento-San Joaquin Valley, and for other purposes.",7,701,7,701
910,50268,113,1,689,RH1130689,"'RH1130689',","RH1130689,",2/5/14,2014,2,5,2,50,229,191,-0.29,0.926,-0.431,-0.594,-23.043,HR3964,Passed,Sacramento-San Joaquin Valley Emergency Water Delivery Act,On Passage,NA,"This was a vote to pass H.R. 3964 (113th) in the House: To address certain water-related concerns in the Sacramento-San Joaquin Valley, and for other purposes.",7,701,7,701
911,50289,113,1,711,RH1130711,"'RH1130711',","RH1130711,",2/27/14,2014,2,27,2,72,181,235,0.059,-0.209,0.343,0.861,-25.417,HR2804,Failed,NA,On Agreeing to the Amendment,NA,This was a vote to approve or reject amendment H.Amdt. 565 (113th) (Gerald Connolly) to H.R. 2804 (113th). The title of the amendment is H.Amdt. 565 (Connolly) to H.R. 2804: Amendment sought to insert an exception for any rule pertaining to air quality or water quality..,7,700,7,700
912,50310,113,1,732,RH1130732,"'RH1130732',","RH1130732,",3/5/14,2014,3,5,2,93,221,184,0.076,0.401,-0.745,0.328,-0.316,HRES497,Passed,"Providing for consideration of H.R. 3826, Electricity Security and Affordability Act, and providing for consideration of H.R. 4118, Suspending the Individual Mandate Penalty Law Equals Fairness Act",On Ordering the Previous Question,NA,"This vote was related to a resolution introduced by Rep. Michael Burgess [R-TX26] on March 4, 2014, H.Res. 497 (113th): Providing for consideration of the bill (H.R. 3826) to provide direction to the Administrator of the Environmental Protection Agency regarding the establishment of standards for emissions of any greenhouse gas from fossil fuel-fired el.",7,705,7,705
913,50311,113,1,733,RH1130733,"'RH1130733',","RH1130733,",3/5/14,2014,3,5,2,94,228,182,-0.065,0.055,-0.923,-0.654,-10.324,HRES497,Passed,"Providing for consideration of H.R. 3826, Electricity Security and Affordability Act, and providing for consideration of H.R. 4118, Suspending the Individual Mandate Penalty Law Equals Fairness Act",On Agreeing to the Resolution,NA,"This was a vote to agree to H.Res. 497 (113th) in the House. This resolution sets the rules for debate for another bill, such as limiting who can submit an amendment and setting floor debate time.",7,705,7,705
914,50318,113,1,740,RH1130740,"'RH1130740',","RH1130740,",3/6/14,2014,3,6,2,101,230,184,-0.081,0.153,-0.612,-1.494,-12.025,HR3826,Agreed to,NA,On Agreeing to the Amendment,NA,This was a vote to approve or reject amendment H.Amdt. 576 (113th) (Lamar Smith) to H.R. 3826 (113th). The title of the amendment is H.Amdt. 576 (Smith) to H.R. 3826: Amendment sought to require EPA to rely on proven technologies when it sets rules for any power plant..,7,705,7,705
915,50319,113,1,741,RH1130741,"'RH1130741',","RH1130741,",3/6/14,2014,3,6,2,102,184,228,-0.156,0.362,0.529,1.16,-19.283,HR3826,Failed,NA,On Agreeing to the Amendment,NA,This was a vote to approve or reject amendment H.Amdt. 577 (113th) (Lois Capps) to H.R. 3826 (113th). The title of the amendment is H.Amdt. 577 (Capps) to H.R. 3826: Amendment sought to allow the EPA to consider all pollution control technologies being used in the United States or elsewhere when setting new power plant emission standards,7,705,7,705
916,50320,113,1,742,RH1130742,"'RH1130742',","RH1130742,",3/6/14,2014,3,6,2,103,190,221,-0.181,0.719,0.517,0.876,-15.629,HR3826,Failed,NA,On Agreeing to the Amendment,NA,"This was a vote to approve or reject amendment H.Amdt. 581 (113th) (Janice Jan Schakowsky) to H.R. 3826 (113th). The title of the amendment is H.Amdt. 581 (Schakowsky) to H.R. 3826: To accept the scientific finding of the EPA that greenhouse gas pollution is """"""""""""""""contributing to long-lasting changes in our climate that can have a range of negative effects""""""""""""""""",7,705,7,705
917,50321,113,1,743,RH1130743,"'RH1130743',","RH1130743,",3/6/14,2014,3,6,2,104,178,231,0.02,-0.278,0.61,1.124,-13.675,HR3826,Failed,NA,On Agreeing to the Amendment,NA,This was a vote to approve or reject amendment H.Amdt. 583 (113th) (Henry Waxman) to H.R. 3826 (113th). The title of the amendment is H.Amdt. 583 (Waxman) to H.R. 3826: Amendment sought to add a section setting effective date guidelines,7,705,7,705
918,50322,113,1,744,RH1130744,"'RH1130744',","RH1130744,",3/6/14,2014,3,6,2,105,184,223,-0.002,0.333,1.263,-0.529,-18.188,HR3826,Failed,Electricity Security and Affordability Act,On Motion to Recommit with Instructions,NA,"On Motion to Recommit with Instructions: H R 3826 Electricity Security and Affordability Act: To provide direction to the Administrator of the Environmental Protection Agency regarding the establishment of standards for emissions of any greenhouse gas from fossil fuel-fired electric utility generating units, and for other purposes.",7,705,7,705
919,50323,113,1,745,RH1130745,"'RH1130745',","RH1130745,",3/6/14,2014,3,6,2,106,229,183,-0.017,0.016,-0.523,-1.568,-19.977,HR3826,Passed,Electricity Security and Affordability Act,On Passage,NA,"This was a vote to pass H.R. 3826 (113th) in the House. Electricity Security and Affordability Act: To provide direction to the Administrator of the Environmental Protection Agency regarding the establishment of standards for emissions of any greenhouse gas from fossil fuel-fired electric utility generating units, and for other purposes.",7,705,7,705
920,50325,113,1,747,RH1130747,"'RH1130747',","RH1130747,",3/6/14,2014,3,6,2,108,180,228,-0.098,0.095,0.588,1.407,-15.102,HR2641,Failed,NA,On Agreeing to the Amendment,NA,"This was a vote to approve or reject amendment H.Amdt. 584 (113th) (Sheila Jackson Lee) to H.R. 2641 (113th). The title of the amendment is H.Amdt. 584 (Jackson Lee) to H.R. 2641: Amendment sought to strike the """"""""""""""""deemed approved"""""""""""""""" language in the bill for any project for which an agency does not meet the deadlines outlined in the bill",7,700,7,700
921,50326,113,1,748,RH1130748,"'RH1130748',","RH1130748,",3/6/14,2014,3,6,2,109,222,188,-0.242,0.886,-0.483,-0.727,-19.339,HR2641,Agreed to,NA,On Agreeing to the Amendment,NA,"This was a vote to approve or reject amendment H.Amdt. 585 (113th) (David McKinley) to H.R. 2641 (113th). The title of the amendment is H.Amdt. 585 (McKinley) to H.R. 2641: Amendment prohibits agencies from taking into account the """"""""""""""""social cost of carbon"""""""""""""""" from the """"""""""""""""Technical Support Document",7,705,7,705
922,50328,113,1,750,RH1130750,"'RH1130750',","RH1130750,",3/6/14,2014,3,6,2,111,192,217,-0.065,0.399,0.321,0.506,-24.076,HR2641,Failed,NA,On Agreeing to the Amendment,NA,This was a vote to approve or reject amendment H.Amdt. 588 (113th) (Henry Hank Johnson Jr.) to H.R. 2641 (113th). The title of the amendment is H.Amdt. 588 (Johnson) to H.R. 2641: Amendment sought to clarify that nothing in the bill will change or limit any law or regulation allowing for public comment or participation in an agency decision making process,7,700,7,700
923,50329,113,1,751,RH1130751,"'RH1130751',","RH1130751,",3/6/14,2014,3,6,2,112,190,217,0.08,0.499,0.749,-0.354,-0.378,HR2641,Failed,Responsibly And Professionally Invigorating Development (RAPID) Act of 2013,On Motion to Recommit with Instructions,NA,"On Motion to Recommit with Instructions: H R 2641 Responsibly And Professionally Invigorating Development (RAPID) Act of 2013: To provide for improved coordination of agency actions in the preparation and adoption of environmental documents for permitting determinations, and for other purposes.",7,700,7,700
924,50330,113,1,752,RH1130752,"'RH1130752',","RH1130752,",3/6/14,2014,3,6,2,113,229,179,-0.036,-0.22,-0.652,-1.159,-14.263,HR2641,Passed,Responsibly And Professionally Invigorating Development (RAPID) Act of 2013,On Passage,NA,"To provide for improved coordination of agency actions in the preparation and adoption of environmental documents for permitting determinations, and for other purposes.",7,700,7,700
925,50355,113,1,777,RH1130777,"'RH1130777',","RH1130777,",3/25/14,2014,3,25,2,138,188,231,-0.052,0.146,0.598,1.301,-14.569,HR2824,Failed,NA,On Agreeing to the Amendment,NA,"This was a vote to approve or reject amendment H.Amdt. 599 (113th) (Alan Lowenthal) to H.R. 2824 (113th). The title of the amendment is H.Amdt. 599 (Lowenthal) to H.R. 2824: Amendment sought to require States to implement the June 30, 1983 Office of Surface Mining Reclamation and Enforcement stream buffer zone rule, unless a State has a program with greater stream protection",7,711,7,711
926,50356,113,1,778,RH1130778,"'RH1130778',","RH1130778,",3/25/14,2014,3,25,2,139,196,225,-0.162,0.5,0.379,0.893,-29.083,HR2824,Failed,NA,On Agreeing to the Amendment,NA,This was a vote to approve or reject amendment H.Amdt. 600 (113th) (Matthew Cartwright) to H.R. 2824 (113th). The title of the amendment is H.Amdt. 600 (Cartwright) to H.R. 2824: Amendment sought to ensure that States maintain the ability to issue their own stream buffer rules,7,711,7,711
927,50357,113,1,779,RH1130779,"'RH1130779',","RH1130779,",3/25/14,2014,3,25,2,140,197,224,0.056,0.222,0.315,0.154,-12.665,HR2824,Failed,"To amend the Surface Mining Control and Reclamation Act of 1977 to stop the ongoing waste by the Department of the Interior of taxpayer resources and implement the final rule on excess spoil, mining waste, and buffers for perennial and intermittent streams, and for other purposes",On Motion to Recommit with Instructions,NA,"On Motion to Recommit with Instructions: H R 2824 To amend the Surface Mining Control and Reclamation Act of 1977 to stop the ongoing waste by the Department of the Interior of taxpayer resources and implement the final rule on excess spoil, mining waste, and buffers for perennial and intermittent streams, and for other purposes",7,711,7,711
928,50358,113,1,780,RH1130780,"'RH1130780',","RH1130780,",3/25/14,2014,3,25,2,141,229,192,0.133,-0.166,-0.371,-1.187,-30.041,HR2824,Passed,"To amend the Surface Mining Control and Reclamation Act of 1977 to stop the ongoing waste by the Department of the Interior of taxpayer resources and implement the final rule on excess spoil, mining waste, and buffers for perennial and intermittent streams, and for other purposes",On Passage,NA,"To amend the Surface Mining Control and Reclamation Act of 1977 to stop the ongoing waste by the Department of the Interior of taxpayer resources and implement the final rule on excess spoil, mining waste, and buffers for perennial and intermittent streams, and for other purposes.",7,711,7,711
929,50448,113,1,870,RH1130870,"'RH1130870',","RH1130870,",5/22/14,2014,5,22,2,231,231,192,-0.135,0.481,-0.369,-0.677,-20.327,HR4435,Agreed to,NA,On Agreeing to the Amendment,NA,"Amendment prohibits use of funds by the Administration to conduct its anti-fossil fuel climate change agenda, which includes the National Climate Assessment, the IPCC report, the UN's Agenda 21, and the Social Cost of .",7,705,7,705
930,50484,113,1,906,RH1130906,"'RH1130906',","RH1130906,",5/30/14,2014,5,30,2,267,226,179,0.258,-0.709,-0.425,-0.839,-24.977,HR4660,Agreed to,NA,On Agreeing to the Amendment,NA,Amendment prohibits the use of funds to negotiate or enter into a trade agreement that establishes a limit on greenhouse gas emissions. The limitation described in the section shall not apply in the case of the administration of a tax or tariff.,7,705,7,705
931,50520,113,1,942,RH1130942,"'RH1130942',","RH1130942,",6/11/14,2014,6,11,2,304,148,276,-0.356,0.148,0.13,0.371,-169.012,HR4800,Failed,NA,On Agreeing to the Amendment,NA,To ensure that $50 million will be available for the emergency conservation program under the Agricultural Credit Act of 1978.,7,711,7,711
932,50521,113,1,943,RH1130943,"'RH1130943',","RH1130943,",6/11/14,2014,6,11,2,305,119,303,0.407,-0.473,-0.188,0.134,-133.77,HR4800,Failed,NA,On Agreeing to the Amendment,NA,To reduce funding for the Watershed Rehabilitation Program by $10 million and to apply the savings to the spending reduction account,7,711,7,711
933,50522,113,1,944,RH1130944,"'RH1130944',","RH1130944,",6/11/14,2014,6,11,2,306,62,358,0.63,-0.595,-1.084,-0.18,-138.842,HR4800,Failed,NA,On Agreeing to the Amendment,NA,To reduce funding for the Watershed Rehabilitation Program by $25 million and to apply the savings to the spending reduction account.,7,711,7,711
934,50566,113,1,988,RH1130988,"'RH1130988',","RH1130988,",6/24/14,2014,6,24,2,350,176,233,-0.062,0.025,0.562,1.516,-15.012,HR3301,Failed,NA,On Agreeing to the Amendment,NA,Amendment to ensure that the complete length of cross- border projects would be subject to full environmental review under the National Environmental Policy Act.,7,700,7,700
935,50598,113,1,1020,RH1131020,"'RH1131020',","RH1131020,",7/10/14,2014,7,10,2,382,75,344,-0.341,-0.566,0.141,0.253,-134.732,HR4923,Failed,NA,On Agreeing to the Amendment,NA,Amendment numbered 15 printed in the Congressional Record to strike the funds for the Yucca Mountain Nuclear Waste Disposal Plan and apply the amount ($150 million) to the spending reduction account.,7,704,7,704
936,50605,113,1,1027,RH1131027,"'RH1131027',","RH1131027,",7/10/14,2014,7,10,2,389,227,191,-0.081,0.325,-0.665,-1.019,-9.666,HR4923,Agreed to,NA,On Agreeing to the Amendment,NA,"Amendment to add a new section prohibiting the use of funds to prepare, propose, or promulgate any regulation or guidance that references or relies on, the analysis contained in specified documents, on the subject of the Social Cost of Carbon.",7,705,7,705
937,50606,113,1,1028,RH1131028,"'RH1131028',","RH1131028,",7/10/14,2014,7,10,2,390,232,187,0.054,-0.092,-0.446,-0.929,-13.061,HR4923,Agreed to,NA,On Agreeing to the Amendment,NA,"Amendment prohibits the use of funds by the Department of Energy to apply the report entitled """"""""""""""""Life Cycle Greenhouse Gas Perspective on Exporting Liquefied Natural Gas from the United States"""""""""""""""" in any public interest determination under the Natural Gas Act.",7,705,7,705
938,50610,113,1,1032,RH1131032,"'RH1131032',","RH1131032,",7/10/14,2014,7,10,2,394,239,182,0.007,-0.962,-0.251,-0.106,-51.921,HR4923,Agreed to,NA,On Agreeing to the Amendment,NA,Amendment prohibits the use of funds to regulate activites identified in subparagraphs (A) and (C) of section 404(f)(1) of the Federal Water Pollution Control Act or to limit the exemption in section 404(f)(1)(A) of the Federal Water Pollution Control Act to established or ongoing operations.,7,701,7,701
939,50613,113,1,1035,RH1131035,"'RH1131035',","RH1131035,",7/10/14,2014,7,10,2,397,229,188,-0.135,0.35,-0.65,-1.197,-9.005,HR4923,Agreed to,NA,On Agreeing to the Amendment,NA,"An amendment to prohibit use of funds to design, implement, administer or carry out specified assessments regarding climate change.",7,705,7,705
940,50615,113,1,1037,RH1131037,"'RH1131037',","RH1131037,",7/10/14,2014,7,10,2,399,226,194,-0.121,0.56,-0.814,-1.338,-17.168,HR4923,Agreed to,NA,On Agreeing to the Amendment,NA,An amendment to prohibit use of funds for the Department of Energy's Climate Model Development and Validation program.,7,705,7,705
941,50672,113,1,1093,RH1131093,"'RH1131093',","RH1131093,",7/28/14,2014,7,28,2,455,253,148,-0.193,-0.084,-1.044,-1.744,-62.945,HR935,Failed,"To amend the Federal Insecticide, Fungicide, and Rodenticide Act and the Federal Water Pollution Control Act to clarify Congressional intent regarding the regulation of the use of pesticides in or near navigable waters, and for other purposes",On Motion to Suspend the Rules and Pass,NA,"To amend the Federal Insecticide, Fungicide, and Rodenticide Act and the Federal Water Pollution Control Act to clarify Congressional intent regarding the regulation of the use of pesticides in or near navigable waters, and for other purposes.",7,710,7,701
942,50675,113,1,1096,RH1131096,"'RH1131096',","RH1131096,",7/29/14,2014,7,29,2,458,224,192,0.055,0.301,-0.727,0.234,-0.317,HRES693,Passed,"Providing for consideration of the bill (H.R. 4315) to amend the Endangered Species Act of 1973 to require publication on the Internet of the basis for determinations that species are endangered species or threatened species, and for other purposes",On Ordering the Previous Question,NA,"Providing for consideration of the bill (H.R. 4315) to amend the Endangered Species Act of 1973 to require publication on the Internet of the basis for determinations that species are endangered species or threatened species, and for other purposes",7,709,7,709
943,50676,113,1,1097,RH1131097,"'RH1131097',","RH1131097,",7/29/14,2014,7,29,2,459,225,192,-0.017,0.175,-1.197,0.185,-10.87,HRES693,Passed,"Providing for consideration of the bill (H.R. 4315) to amend the Endangered Species Act of 1973 to require publication on the Internet of the basis for determinations that species are endangered species or threatened species, and for other purposes",On Agreeing to the Resolution,NA,"Providing for consideration of the bill (H.R. 4315) to amend the Endangered Species Act of 1973 to require publication on the Internet of the basis for determinations that species are endangered species or threatened species, and for other purposes",7,709,7,709
944,50679,113,1,1100,RH1131100,"'RH1131100',","RH1131100,",7/29/14,2014,7,29,2,462,197,225,0.168,0.731,0.729,-0.45,-5.318,HR4315,Failed,21st Century Endangered Species Transparency Act,On Motion to Recommit with Instructions,NA,"To amend the Endangered Species Act of 1973 to require publication on the Internet of the basis for determinations that species are endangered species or threatened species, and for other purposes.",7,709,7,709
945,50680,113,1,1101,RH1131101,"'RH1131101',","RH1131101,",7/29/14,2014,7,29,2,463,233,190,0.155,-0.227,-0.292,-0.975,-45.206,HR4315,Passed,21st Century Endangered Species Transparency Act,On Passage,NA,"To amend the Endangered Species Act of 1973 to require publication on the Internet of the basis for determinations that species are endangered species or threatened species, and for other purposes.",7,709,7,709
946,50686,113,1,1107,RH1131107,"'RH1131107',","RH1131107,",7/31/14,2014,7,31,2,469,195,233,0.007,-0.24,0.846,0.747,-8.739,HR935,Failed,"To amend the Federal Insecticide, Fungicide, and Rodenticide Act and the Federal Water Pollution Control Act to clarify Congressional intent regarding the regulation of the use of pesticides in or near navigable waters, and for other purposes",On Motion to Recommit with Instructions,NA,"To amend the Federal Insecticide, Fungicide, and Rodenticide Act and the Federal Water Pollution Control Act to clarify Congressional intent regarding the regulation of the use of pesticides in or near navigable waters, and for other purposes.",7,710,7,701
947,50687,113,1,1108,RH1131108,"'RH1131108',","RH1131108,",7/31/14,2014,7,31,2,470,267,161,-0.221,-0.013,-1.15,-1.217,-62.808,HR935,Passed,"To amend the Federal Insecticide, Fungicide, and Rodenticide Act and the Federal Water Pollution Control Act to clarify Congressional intent regarding the regulation of the use of pesticides in or near navigable waters, and for other purposes",On Passage,NA,"To amend the Federal Insecticide, Fungicide, and Rodenticide Act and the Federal Water Pollution Control Act to clarify Congressional intent regarding the regulation of the use of pesticides in or near navigable waters, and for other purposes.",7,710,7,701
948,50703,113,1,1124,RH1131124,"'RH1131124',","RH1131124,",9/9/14,2014,9,9,2,486,163,248,-0.027,-0.198,0.223,0.572,-56.535,HR5078,Failed,NA,On Agreeing to the Amendment,NA,Amendment sought to provide policy provisions that the Secretary and Administrator would be prohibited from including in a final rule.,7,710,7,701
949,50704,113,1,1125,RH1131125,"'RH1131125',","RH1131125,",9/9/14,2014,9,9,2,487,170,240,0.009,-0.217,0.616,1.446,-16.112,HR5078,Failed,NA,On Agreeing to the Amendment,NA,Amendment sought to limit the impact of the underlying bill if the administration determined that the bill was likely to (1) increase the interstate movements of pollutants through surface waters; (2) increase the costs incurred by a downstream State to maintain or achieve approved water quality standards for that State; and (3) cause or contribute to the impairment of the surface or coastal waters of another State,7,710,7,701
950,50705,113,1,1126,RH1131126,"'RH1131126',","RH1131126,",9/9/14,2014,9,9,2,488,177,235,0.029,-0.33,0.647,1.057,-14.534,HR5078,Failed,Waters of the United States Regulatory Overreach Protection Act,On Motion to Recommit with Instructions,NA,"To preserve existing rights and responsibilities with respect to waters of the United States, and for other purposes.",7,710,7,701
951,50706,113,1,1127,RH1131127,"'RH1131127',","RH1131127,",9/9/14,2014,9,9,2,489,262,152,0.159,-0.501,-0.334,-1.226,-57.13,HR5078,Passed,Waters of the United States Regulatory Overreach Protection Act,On Passage,NA,"To preserve existing rights and responsibilities with respect to waters of the United States, and for other purposes.",7,710,7,701
952,50737,113,1,1159,RH1131159,"'RH1131159',","RH1131159,",11/18/14,2014,11,18,2,521,225,190,0.047,0.202,-0.728,0.21,-0.3,HRES756,Passed,Providing for consideration of the bill (H.R. 1422) EPA Science Advisory Board Reform Act; providing for consideration of the bill (H.R. 4012) Secret Science Reform Act; and providing for consideration of the bill (H.R. 4795) Promoting New Manufacturing Act,On Ordering the Previous Question,NA,"Providing for consideration of the bill (H.R. 1422) to amend the Environmental Research, Development, and Demonstration Authorization Act of 1978 to provide for Scientific Advisory Board member qualifications, public participation, and for other purposes; providing for consideration of the bill (H.R. 4012 The Secret Science Reform Act) to prohibit the Environmental Protection Agency from proposing, finalizing, or disseminating regulations or assessments based upon science that is not transparent or reproducible; providing for consideration of the bill (H.R. 4795 Promoting New Manufacturing Act) to promote new manufacturing in the United States by providing for greater transparency and timeliness in obtaining necessary permits, and for other purposes; and providing for proceedings during the period from November 21, 2014, through November 28, 2014.",7,700,7,700
953,50738,113,1,1160,RH1131160,"'RH1131160',","RH1131160,",11/18/14,2014,11,18,2,522,227,192,0.064,0.503,-0.731,0.235,-0.369,HRES756,Passed,Providing for consideration of the bill (H.R. 1422) EPA Science Advisory Board Reform Act; providing for consideration of the bill (H.R. 4012) Secret Science Reform Act; and providing for consideration of the bill (H.R. 4795) Promoting New Manufacturing Act,On Agreeing to the Resolution,NA,"Providing for consideration of the bill (H.R. 1422) to amend the Environmental Research, Development, and Demonstration Authorization Act of 1978 to provide for Scientific Advisory Board member qualifications, public participation, and for other purposes; providing for consideration of the bill (H.R. 4012 The Secret Science Reform Act) to prohibit the Environmental Protection Agency from proposing, finalizing, or disseminating regulations or assessments based upon science that is not transparent or reproducible; providing for consideration of the bill (H.R. 4795 Promoting New Manufacturing Act) to promote new manufacturing in the United States by providing for greater transparency and timeliness in obtaining necessary permits, and for other purposes; and providing for proceedings during the period from November 21, 2014, through November 28, 2014.",7,700,7,700
954,50739,113,1,1161,RH1131161,"'RH1131161',","RH1131161,",11/18/14,2014,11,18,2,523,232,184,-0.137,0.155,-0.531,-0.671,-16.369,HR1422,Agreed to,NA,On Agreeing to the Amendment,NA,"To amend the Environmental Research, Development, and Demonstration Authorization Act of 1978 to reiterate the independence of the Science Advisory Board, clarifies pre-existing language, and other purposes.",7,798,7,798
955,50740,113,1,1162,RH1131162,"'RH1131162',","RH1131162,",11/18/14,2014,11,18,2,524,195,225,-0.011,0.512,0.988,0.602,-5.973,HR1422,Failed,EPA Science Advisory Board Reform Act,On Motion to Recommit with Instructions,NA,"To amend the Environmental Research, Development, and Demonstration Authorization Act of 1978 to provide for Scientific Advisory Board member qualifications, public participation, and for other purposes.",7,798,7,798
956,50741,113,1,1163,RH1131163,"'RH1131163',","RH1131163,",11/18/14,2014,11,18,2,525,229,191,-0.099,0.331,-0.644,-1.069,-9.378,HR1422,Passed,EPA Science Advisory Board Reform Act,On Passage,NA,"To amend the Environmental Research, Development, and Demonstration Authorization Act of 1978 to provide for Scientific Advisory Board member qualifications, public participation, and for other purposes.",7,798,7,798
957,50742,113,1,1164,RH1131164,"'RH1131164',","RH1131164,",11/19/14,2014,11,19,2,526,194,230,0.068,-0.164,0.914,0.951,-8.994,HR4012,Failed,NA,On Agreeing to the Amendment,NA,"To prohibit the Environmental Protection Agency from proposing, finalizing, or disseminating regulations or assessments based upon science that is not transparent or reproducible.",7,700,7,700
958,50743,113,1,1165,RH1131165,"'RH1131165',","RH1131165,",11/19/14,2014,11,19,2,527,196,230,0.054,0.293,0.724,-0.243,-0.312,HR4012,Failed,Secret Science Reform Act of 2014,On Motion to Recommit with Instructions,NA,"To prohibit the Environmental Protection Agency from proposing, finalizing, or disseminating regulations or assessments based upon science that is not transparent or reproducible.",7,700,7,700
959,50744,113,1,1166,RH1131166,"'RH1131166',","RH1131166,",11/19/14,2014,11,19,2,528,237,190,-0.205,0.656,-1.022,-1.254,-22.841,HR4012,Passed,Secret Science Reform Act of 2014,On Passage,NA,"To prohibit the Environmental Protection Agency from proposing, finalizing, or disseminating regulations or assessments based upon science that is not transparent or reproducible.",7,700,7,700
960,50745,113,1,1167,RH1131167,"'RH1131167',","RH1131167,",11/20/14,2014,11,20,2,529,183,225,-0.056,0.218,0.65,1.062,-7.804,HR4795,Failed,NA,On Agreeing to the Amendment,NA,"Amending the Promoting New Manufacturing Act (HR4795) to include language stating that outdated air quality standards would not apply toward a preconstruction permit if the permitting agency determines that applying it would increase air pollution, slow permitting, or increase regulatory uncertainty.",7,705,7,705
961,50746,113,1,1168,RH1131168,"'RH1131168',","RH1131168,",11/20/14,2014,11,20,2,530,189,223,0.037,0.005,0.746,-0.211,-0.284,HR4795,Failed,Promoting New Manufacturing Act,On Motion to Recommit with Instructions,NA,"To promote new manufacturing in the United States by requiring the EPA to publish information on preconstruction permits for facilities that can produce at least 100 tons of air pollutants per year, and other transparency measures with respect to air pollution.",7,705,7,705
962,50747,113,1,1169,RH1131169,"'RH1131169',","RH1131169,",11/20/14,2014,11,20,2,531,238,172,0.009,-0.339,-0.774,-1.648,-30.104,HR4795,Passed,Promoting New Manufacturing Act,On Passage,NA,"To promote new manufacturing in the United States by requiring the EPA to publish information on preconstruction permits for facilities that can produce at least 100 tons of air pollutants per year, and other transparency measures with respect to air pollution.",7,705,7,705
963,50752,113,1,1174,RH1131174,"'RH1131174',","RH1131174,",12/2/14,2014,12,2,2,536,410,7,0,0,0,0,0,HR3572,Passed,To revise the boundaries of certain John H. Chafee Coastal Barrier Resources System units in North Carolina,"On Motion to Suspend the Rules and Pass, as Amended",NA,To revise the boundaries of certain John H. Chafee Coastal Barrier Resources System units.,7,710,7,701
