id,congress,chamber,rollnumber,voteview_id,date,year,month,day,session,clerk_rollnumber,yea_count,nay_count,nominate_mid_1,nominate_mid_2,nominate_spread_1,nominate_spread_2,nominate_log_likelihood,bill_number,vote_result,vote_desc,vote_question,dtl_desc,pap_description,pap_majortopic,pap_subtopic,majortopic,subtopic
9541,92,2,908,RS0920908,10/4/72,1972,10,4,NA,NA,74,0,0,0,0,0,0,S2770,NA,NA,NA,"TO AGREE TO CONFERENCE REPORT ON S. 2770, PROPOSED FEDERAL WATER POLLUTION CONTROL ACT AMENDMENTS OF 1972.","TO AGREE TO CONFERENCE REPORT ON S. 2770, PROPOSED FEDERAL WATER POLLUTION CONTROL ACT AMENDMENTS OF 1972.",7,701,7,701
9563,92,2,931,RS0920931,10/12/72,1972,10,12,NA,NA,31,47,-0.536,0.844,0.201,0.424,-39.365,S3342,NA,NA,NA,"TO AMEND S. 3342, PROPOSED ENVIRONMENTAL NOISE CONTROL ACT OF 1972, SO AS TO REQUIRE EPA TO PUBLISH REGULATIONS ESTABLISHING LEVELS OF CUMULATIVE NOISE EXPOSURE FOR AIRPORTS WHICH ARE ADEQUATE TO PROTECT THE PUBLIC HEALTH.","TO AMEND S. 3342, PROPOSED ENVIRONMENTAL NOISE CONTROL ACT OF 1972, SO AS TO REQUIRE EPA TO PUBLISH REGULATIONS ESTABLISHING LEVELS OF CUMULATIVE NOISE EXPOSURE FOR AIR- PORTS WHICH ARE ADEQUATE TO PROTECT THE PUBLIC HEALTH.",7,705,7,705
9564,92,2,932,RS0920932,10/12/72,1972,10,12,NA,NA,30,45,-0.278,0.609,0.154,0.122,-40.137,S3342,NA,NA,NA,TO AMEND S. 3342 SO AS TO STRENGTHEN AUTHORITY OF LOCAL GOVERNMENTS TO ADOPT MORE STRINGENT CONTROLS ON MATTERS RELATING TO NOISE POLLUTION.,TO AMEND S. 3342 SO AS TO STRENGTHEN AUTHORITY OF LOCAL GOVERNMENTS TO ADOPT MORE STRINGENT CONTROLS ON MATTERS RELATING TO NOISE POLLUTION.,7,705,7,705
9569,92,2,937,RS0920937,10/13/72,1972,10,13,NA,NA,62,17,0.27,0.943,0.067,0.13,-42.087,S3342,NA,NA,NA,TO AMEND S. 3342 BY BARRING THE LANDING OF SUPERSONIC CIVIL AIRCRAFT WITHIN U.S. JURISDICTION UNLESS IT COMPLIES WITH FAA NOISE LEVEL STANDARDS FOR SUBSONIC AIRCRAFT.,TO AMEND S. 3342 BY BARRING THE LANDING OF SUPERSONIC CIVIL AIRCRAFT WITHIN U.S. JURISDICTION UNLESS IT COMPLIES WITH FAA NOISE LEVEL STANDARDS FOR SUBSONIC AIRCRAFT.,7,705,7,705
9570,92,2,938,RS0920938,10/13/72,1972,10,13,NA,NA,75,5,-0.941,-0.339,-0.194,0.219,-18.165,S3342,NA,NA,NA,TO PASS S. 3342.,TO PASS S. 3342.,7,705,7,705
9581,92,2,950,RS0920950,10/14/72,1972,10,14,NA,NA,29,22,0.045,-0.152,0.205,0.112,-19.673,HR1478,NA,NA,NA,"TO CONCUR IN HOUSE AMENDMENTS WITH AMENDMENTS TO H.R. 1478, A BILL TO RESTRICT THE DISTRIBUTION AND USE OF CHEMICALS FOUND TO BE TOXIC AND HAZARDOUS PRODUCTS.","TO CONCUR IN HOUSE AMENDMENTS WITH AMENDMENTS TO H.R. 1478, A BILL TO RESTRICT THE DISTRIBUTION AND USE OF CHEMICALS FOUND TO BE TOXIC AND HAZARDOUS PRODUCTS.",7,704,7,704
9586,92,2,955,RS0920955,10/17/72,1972,10,17,NA,NA,52,12,-0.057,0.997,0.342,0.606,-15.618,S2770,NA,NA,NA,TO OVERRIDE THE PRESIDENTIAL VETO OF S. 2770 PROPOSED FEDERAL WATER POLLUTION CONTROL ACT AMENDMENTS OF 1972.,TO OVERRIDE THE PRESIDENTIAL VETO OF S. 2770 PROPOSED FEDERAL WATER POLLUTION CONTROL ACT AMENDMENTS OF 1972.,7,701,7,701
9622,92,2,846,RS0920846,9/19/72,1972,9,19,NA,NA,14,61,-0.585,0.787,0.268,0.37,-25.736,S652,NA,NA,NA,TO AMEND S. 652 SO AS TO ASSURE THAT PUBLIC OR PRIVATE DEVELOPMENT WOULD NOT BE PERMITTED UNLESS IT CONFORMS WITH REQUIREMENTS OF THE CLEAN AIR ACT AND FEDERAL WATER POLLUTION CONTROL ACT.,TO AMEND S. 632 SO AS TO ASSURE THAT PUBLIC OR PRIVATE DEVELOPMENT WOULD NOT BE PERMITTED UNLESS IT CONFORMS WITH REQUIREMENTS OF THE CLEAN AIR ACT AND FEDERAL WATER POLLU- TION CONTROL ACT.,7,700,7,700
9844,93,2,197,RS0930197,6/20/73,1973,6,20,NA,NA,38,59,0.064,-0.156,-0.261,-0.386,-25.487,S268,NA,NA,NA,TO AMEND S. 268 TO GIVE THE STATE THE RIGHT TO DESIGNATE AND DEFINE AREAS OF CRITICAL ENVIRONMENTAL CONCERN.,TO AMEND S. 268 TO GIVE THE STATE THE RIGHT TO DESIGNATE AND DEFINE AREAS OF CRITICAL ENVIRONMENTAL CONCERN.,7,700,7,700
9848,93,2,199,RS0930199,6/20/73,1973,6,20,NA,NA,65,33,-0.128,0.981,0.518,0.659,-16.024,S268,NA,NA,NA,"TO AMEND S. 268 TO INSURE THAT STATE LAND-USE PROGRAMS ARE COORDINATED WITH THE REGULATORY ACTIVITIES OF ALL STATE AGENCIES ENFORCING AIR, WATER, NOISE, OR OTHER POLLUTION STANDARDS.","TO AMEND S. 268 TO INSURE THAT STATE LAND-USE PROGRAMS ARE COORDINATED WITH THE REGULATORY ACTIVITIES OF ALL STATE AGENCIES ENFORCING AIR, WATER, NOISE, OR OTHER POLLUTION STANDARDS.",7,700,7,700
9854,93,2,200,RS0930200,6/20/73,1973,6,20,NA,NA,14,76,0.428,-0.036,-0.304,0.33,-18.793,S268,NA,NA,NA,"TO AMEND S. 268 TO INCLUDE """"""""""""""""COASTAL WETLANDS, MARSHES, AND OTHER LANDS INUNDATED BY THE TIDES AS SIGNIFICANT ESTUARIES WITHIN THE DEFINITION OF """"""""""""""""FRAGILE OR HISTORIC LANDS.""""""""""""""""",NA,7,710,7,701
9858,93,2,202,RS0930202,6/21/73,1973,6,21,NA,NA,20,63,-0.123,0.992,-0.361,-0.713,-16.22,S268,NA,NA,NA,"TO AMEND S. 268 TO REDEFINE THE TERM """"""""""""""""AREAS OF CRITICAL ENVIRONMENTAL CONCERN"""""""""""""""".",.,7,700,7,700
9947,93,2,244,RS0930244,6/28/73,1973,6,28,NA,NA,48,44,-0.153,-0.988,0.166,-0.072,-37.27,HR8619,NA,NA,NA,"TO TABLE FONG AMENDMENT TO H.R. 8619, A BILL APPROPRIATING FUNDS FOR AGRICULTURE, ENVIRONMENT, AND CONSUMER PROTECTION FOR FISCAL 1974. THE AMENDMENT WOULD RESTORE $323,000 FOR EXPENSES OF THE NATIONAL INDUSTRIAL POLLUTION CONTROL COUNCIL.","TO TABLE FONG AMENDMENT TO H.R. 8619, A BILL APPROPRIATING FUNDS FOR AGRICULTURE, ENVIRONMENT, AND CONSUMER PROTECTION FOR FISCAL 1974. THE AMENDMENT WOULD RESTORE $323,000 FOR EXPENSES OF THE NATIONAL INDUSTRIAL POLLUTION CONTROL COUNCIL.",7,700,7,700
9959,93,2,25,RS0930025,3/1/73,1973,3,1,NA,NA,25,59,0.188,-0.009,-0.206,0.08,-21.449,HR2107,NA,NA,NA,"TO AMEND H.R. 2107, A BILL TO REQUIRE THE SECRETARY OF AGRICULTURE TO CARRY OUT THE RURAL ENVIRONMENTAL ASSISTANCE PROGRAMS, BY DELETING THE SO-CALLED NONPERMANENT FEATURES OF THE RURAL ENVIRONMENTAL ASSISTANCE PROGRAM.","TO AMEND H.R. 2107, A BILL TO REQUIRE THE SECRETARY OF AGRICULTURE TO CARRY OUT THE RURAL ENVIRONMENTAL ASSISTANCE PROGRAMS, BY DELETING THE SO-CALLED NONPERMANENT FEATURES OF THE RURAL ENVIRONMENTAL ASSISTANCE PROGRAM.",7,799,7,799
9981,93,2,26,RS0930026,3/1/73,1973,3,1,NA,NA,71,10,0.29,-0.957,0.236,-0.166,-20.41,HR2107,NA,NA,NA,"TO PASS H.R. 2107, A BILL TO REQUIRE THE SECRETARY OF AGRICULTURE TO CARRY OUT THE RURAL ENVIRONMENTAL ASSISTANCE PROGRAMS.","TO PASS H.R. 2107, A BILL TO REQUIRE THE SECRETARY OF AGRICULTURE TO CARRY OUT THE RURAL ENVIRONMENTAL ASSISTANCE PROGRAMS.",7,799,7,799
10098,93,2,312,RS0930312,7/24/73,1973,7,24,NA,NA,60,33,-0.196,-0.223,-0.098,-0.301,-46.197,S1983,NA,NA,NA,"TO AMEND S. 1983, A BILL PROVIDING FOR THE CONSERVATION, PROTECTION, AND PROPAGATION OF ENDANGERED SPECIES, TO GIVE THE SECRETARY DISCRETIONARY AUTHORITY TO TAKE ACTION TO PROVIDE ADEQUATE PROTECTION FOR SPECIES WHERE HE FINDS THAT A STATE DOES NOT PREVENT THE TAKING OF A SPECIES LISTED BY HIM AS ENDANGERED.","TO AMEND S. 1983, A BILL PROVIDING FOR THE CONSERVATION, PROTECTION, AND PROPAGATION OF ENDANGERED SPECIES, TO GIVE THE SECRETARY DISCRETIONARY AUTHORITY TO TAKE ACTION TO PROVIDE ADEQUATE PROTECTION FOR SPECIES WHERE HE FINDS THAT A STATE DOES NOT PREV",7,709,7,709
10100,93,2,313,RS0930313,7/24/73,1973,7,24,NA,NA,92,0,0,0,0,0,0,S1983,NA,NA,NA,"TO PASS S. 1983. A BILL PROVIDING FOR THE CONSERVATION, PROTECTION AND PROPOGATION OF ENDANGERED SPECIES.","TO PASS S. 1983. A BILL PROVIDING FOR THE CONSERVATION, PROTECTION AND PROPOGATION OF ENDANGERED SPECIES.",7,709,7,709
10429,93,2,470,RS0930470,11/15/73,1973,11,15,NA,NA,83,2,0,0,0,0,0,S2589,NA,NA,NA,TO AMEND S. 2589 BY ADDING A NEW TITLE IV TO AUTHORIZE TEMPORARY SUSPENSION OF ANY EMISSION LIMITATION RELATED TO CONTROL OF POLLUTANTS RESULTING FROM FUEL BURNING.,TO AMEND S. 2589 BY ADDING A NEW TITLE IV TO AUTHORIZE TEMPORARY SUSPENSION OF ANY EMISSION LIMITATION RELATED TO CONTROL OF POLLUTANTS RESULTING FROM FUEL BURNING.,7,705,7,705
10575,93,2,54,RS0930054,3/22/73,1973,3,22,NA,NA,23,66,0.216,-0.064,-0.404,-0.031,-12.461,HR3298,NA,NA,NA,"TO AMEND H.R. 3298, A BILL RESTORING ORIGINAL CONGRESSIONAL INTENT WITH RESPECT TO THE RURAL WATER AND SEWER GRANT PROGRAM UNDER THE CONSOLIDATED FARM AND RURAL DEVELOPMENT ACT, BY PROVIDING FUNDING FOR THOSE WATER AND WASTE DISPOSAL APPLICANTS WHO """"""""""""""""HAVE A MORAL, IF NOT LEGAL COMMITMENT FROM THE GOVERNMENT.""""""""""""""""",H,7,700,7,700
10587,93,2,55,RS0930055,3/22/73,1973,3,22,NA,NA,66,22,0.288,0.068,0.209,-0.107,-22.619,HR3298,NA,NA,NA,"TO PASS H.R. 3298, A BILL RESTORING ORIGINAL CONGRESSIONAL INTENT WITH RESPECT TO THE RURAL WATER AND SEWER GRANT PROGRAM UNDER THE CONSOLIDATED FARM AND RURAL DEVELOPMENT ACT.","TO PASS H.R. 3298, A BILL RESTORING ORIGINAL CONGRESSIONAL INTENT WITH RESPECT TO THE RURAL WATER AND SEWER GRANT PRO- GRAM UNDER THE CONSOLIDATED FARM AND RURAL DEVELOPMENT ACT.",7,700,7,700
10603,93,2,564,RS0930564,12/17/73,1973,12,17,NA,NA,19,67,-0.053,0.999,-0.194,-0.386,-24.212,S2772,NA,NA,NA,"TO AMEND S. 2772, THE PROPOSED CLEAN AIR ACT AMENDMENTS OF 1973, BY SUBSTITUTING A BILL TO EXTEND THE 1975 INTERIM AUTO EMISSION STANDARDS FOR 2 YEARS.","TO AMEND S. 2772, THE PROPOSED CLEAN AIR ACT AMENDMENTS OF 1973, BY SUBSTITUTING A BILL TO EXTEND THE 1975 INTERIM AUTO EMISSION STANDARDS FOR 2 YEARS.",7,705,7,705
10604,93,2,565,RS0930565,12/17/73,1973,12,17,NA,NA,85,0,0,0,0,0,0,S2772,NA,NA,NA,"TO PASS S. 2772, THE PROPOSED CLEAN AIR ACT AMENDMENTS OF 1973, EXTENDING THE 1975 INTERIM AUTO EMISSION STANDARDS FOR 1 YEAR.","TO PASS S. 2772, THE PROPOSED CLEAN AIR ACT AMENDMENTS OF 1973, EXTENDING THE 1975 INTERIM AUTO EMISSION STANDARDS FOR 1 YEAR.",7,705,7,705
10827,93,2,1031,RS0931031,10/8/74,1974,10,8,NA,NA,21,49,0.138,-0.056,-0.172,-0.206,-24.183,HR11537,NA,NA,NA,"TO RECOMMIT THE CONFERENCE REPORT ON H.R. 11537, EXTENDING AND EXPANDING AUTHORITY FOR CARRYING OUT CONSERVATION AND REHABILITATION PROGRAMS ON MILITARY RESERVATIONS.","TO RECOMMIT THE CONFERENCE REPORT ON H.R. 11537, EXTENDING AND EXPANDING AUTHORITY FOR CARRYING OUT CONSERVATION AND REHABILITATION PROGRAMS ON MILITARY RESERVATIONS.",7,700,7,700
10968,93,2,1130,RS0931130,12/18/74,1974,12,18,NA,NA,26,68,-0.293,-0.382,0.048,0.322,-46.571,S3839,NA,NA,NA,"TO AMEND S. 3839, A BILL INCREASING FROM $300 MILLION TO $1 BILLION THE LEVEL OF ANNUAL AUTHORIZATIONS OF THE LAND AND WATER CONSERVATION FUND, SO AS TO INCREASE THE SHARE OF SUCH FUNDS FOR THE MORE POPULOUS STATES.","TO AMEND S. 3839, A BILL INCREASING FROM $300 MILLION TO $1 BILLION THE LEVEL OF ANNUAL AUTHORIZATIONS OF THE LAND AND WATER CONSERVATION FUND, SO AS TO INCREASE THE SHARE OF SUCH FUNDS FOR THE MORE POPULOUS STATES.",7,711,7,711
10969,93,2,1131,RS0931131,12/18/74,1974,12,18,NA,NA,35,60,-0.19,0.956,-0.222,-0.341,-28.563,S3839,NA,NA,NA,"TO AMEND S. 3839, A BILL INCREASING FROM $300 MILLION TO $1 BILLION THE LEVELS OF ANNUAL AUTHORIZATIONS OF THE LAND AND WATER CONSERVATION FUND, BY REDUCING THE $650 MILLION THE LEVEL OF ANNUAL AUTHORIZATIONS.","TO AMEND S. 3839, A BILL INCREASING FROM $300 MILLION TO $1 BILLION THE LEVELS OF ANNUAL AUTHORIZATIONS OF THE LAND AND WATER CONSERVATION FUND, BY REDUCING THE $650 MILLION THE LEVEL OF ANNUAL AUTHORIZATIONS.",7,711,7,711
11449,93,2,812,RS0930812,6/4/74,1974,6,4,NA,NA,43,38,-0.098,0.302,-0.312,0.059,-13.579,S2846,NA,NA,NA,"TO AMEND S.2846, TO ASSURE AN ADEQUATE SUPPLY OF CHLORINE NECESSARY FOR SAFE DRINKING WATER AND WASTE WATER TREATMENT, BY PROVIDING SUBSTITUTE LANGUAGE FOR THE DEFINITION OF """"""""""""""""PURPOSES NECESSARY TO PROTECT THE PUBLIC HEALTH"""""""""""""""" AS IT RELATES TO THE USE OF CHLORINE IN TREATING DRINKING AND WASTE WATER.",AS IT RELATES TO THE USE OF C,7,701,7,701
11496,93,2,836,RS0930836,6/12/74,1974,6,12,NA,NA,40,50,0.058,-0.281,-0.168,-0.19,-35.588,HR14434,NA,NA,NA,"ON DECIDING THE QUESTION RAISED BY SEN. FONG: IS AN AMENDMENT TO H.R. 14434, A BILL MAKING APPROPRIATIONS FOR ENERGY RESEARCH AND DEVELOPMENT FOR FISCAL 1975, GERMANE AND RELEVANT? THE AMENDMENT AUTHORIZES THE EPA TO TRANSFER FUNDS TO OTHER FEDERAL AGENCIES FOR ENERGY RESEARCH AND DEVELOPMENT THAT IT MAY NOT BE IN A POSITION TO SUPPLY OR OBTAIN BY CONTRACT.","ON DECIDING THE QUESTION RAISED BY SEN. FONG: IS AN AMENDMENT TO H.R. 14434, A BILL MAKING APPROPRIATIONS FOR ENERGY RESEARCH AND DEVELOPMENT FOR FISCAL 1975, GERMANE AND RELEVANT? THE AMENDMENT AUTHORIZES THE EPA TO TRANSFER FUNDS TO OTHER FEDERAL AGE",7,700,7,700
11627,93,2,902,RS0930902,7/22/74,1974,7,22,NA,NA,45,43,-0.115,0.035,-0.128,-0.297,-41.611,HR15472,NA,NA,NA,"TO TABLE NELSON AMENDMENT TO H.R. 15472, APPROPRIATING AN ADDITIONAL $700 MILLION FOR FEDERAL SHARE OF COSTS OF CONSTRUCTION OF WASTE WATER TREATMENT WORKS.","TO TABLE NELSON AMENDMENT TO H.R. 15472, APPROPRIATING AN ADDITIONAL $700 MILLION FOR FEDERAL SHARE OF COSTS OF CONSTRUCTION OF WASTE WATER TREATMENT WORKS.",7,703,7,703
11781,93,2,982,RS0930982,9/18/74,1974,9,18,NA,NA,73,18,0.344,-0.611,0.146,-0.07,-31.456,S3221,NA,NA,NA,"TO AMEND S.3221, A BILL TO PROVIDE FOR THE ORDERLY EXPLORATION OF ENERGY RESOURCES OF THE OUTER CONTINENTAL SHELF, BY DEFINING RESPONSIBILITIES OF THE NATIONAL OCEANIC AND ATMOSPHERIC ADMINISTRATION AND THE COAST GUARD FOR COASTAL ZONE MANAGEMENT AND DEVELOPMENT.","TO AMEND S.3221, A BILL TO PROVIDE FOR THE ORDERLY EXPLORATION OF ENERGY RESOURCES OF THE OUTER CONTINENTAL SHELF, BY DEFINING RESPONSIBILITIES OF THE NATIONAL OCEANIC AND ATMOSPHERIC ADMINISTRATION AND THE COAST GUARD FOR COASTAL ZONE MANAGEMENT AND DE",7,710,7,701
12251,94,2,288,RS0940288,7/16/75,1975,7,16,NA,NA,30,62,-0.714,-0.7,0.095,-0.146,-52.543,S586,NA,NA,NA,"TO AMEND S. 586, THE PROPOSED COASTAL ZONE MANAGEMENT ACT AMENDMENTS OF 1975, BY LIMITING AID FOR PLANNING OR IMPACT AID FOR THE EFFECTS OF OFF-SHORE ENERGY DEVELOPMENT OR ENERGY PRODUCING ACTIVITIES FOR IMPACT RELATED DIRECTLY TO SUCH OFFSHORE ACTIVITY. SEN. BUMPER STATED THAT AS BILL IS PRESENTLY WRITTEN, A COASTAL STATE MAY RECEIVE IMPACT AND PLANNING AID FOR EFFECTS OF ENERGY DEVELOPMENT OR PRODUCTION ANYWHERE IN THE STATE.","TO AMEND S. 586, THE PROPOSED COASTAL ZONE MANAGEMENT ACT AMENDMENTS OF 1975, BY LIMITING AID FOR PLANNING OR IMPACT AID FOR THE EFFECTS OF OFF-SHORE ENERGY DEVELOPMENT OR ENERGY PRODUCING ACTIVITIES FOR IMPACT RELATED DIRECTLY TO SUCH OFFSHORE ACTIVITY",7,710,7,701
12253,94,2,289,RS0940289,7/16/75,1975,7,16,NA,NA,63,28,-0.706,-0.396,-0.081,0.123,-51.443,S586,NA,NA,NA,TO TABLE SEN. BUMPER'S MOTION TO RECONSIDER THE VOTE BY WHICH HIS AMENDMENT TO S. 586 (SEE VAR. 298) WAS REJECTED.,TO TABLE SEN. BUMPER'S MOTION TO RECONSIDER THE VOTE BY WHICH HIS AMENDMENT TO S. 586 (SEE VAR. 298) WAS REJECTED.,7,710,7,701
12257,94,2,290,RS0940290,7/16/75,1975,7,16,NA,NA,30,59,-0.669,-0.743,0.107,-0.155,-49.396,S586,NA,NA,NA,"TO AMEND S. 586 SO AS TO ELIMINATE FROM DEFINITION OF """"""""""""""""ENERGY FACILITES"""""""""""""""" SUCH FACILITIES USED PRIMARILY FOR MANUFACTURE OR ASSEMBLY OF EQUIPMENT.",SUCH FACILITIES USED PRIMARILY FOR MANUFACTURE OR ASSEMBLY OF EQUIPMENT.,7,710,7,701
12259,94,2,291,RS0940291,7/16/75,1975,7,16,NA,NA,73,15,0.428,-0.904,0.214,0.104,-24.62,S586,NA,NA,NA,TO PASS S. 586.,TO PASS S. 586.,7,710,7,701
12353,94,2,336,RS0940336,7/26/75,1975,7,26,NA,NA,40,40,0.014,-0.343,-0.202,-0.423,-27.524,HR8070,NA,NA,NA,"TO TABLE MONDALE AMENDMENT TO H.R. 8070, A BILL MAKING APPROPRIATIONS FOR HUD; SAID AMENDMENT APPROPRIATING AN ADDITIONAL $10 MILLION FOR PROGRAM TO ELIMINATE POLLUTION FROM FRESHWATER LAKES.","TO TABLE MONDALE AMENDMENT TO H.R. 8070, A BILL MAKING APPROPRIATIONS FOR HUD; SAID AMENDMENT APPROPRIATING AN ADDITIONAL $10 MILLION FOR PROGRAM TO ELIMINATE POLLUTION FROM FRESHWATER LAKES.",7,701,7,701
12366,94,2,343,RS0940343,7/29/75,1975,7,29,NA,NA,35,59,-0.709,0.238,0.083,0.602,-44.725,S1587,NA,NA,NA,"TO TABLE TALMADGE AMENDMENT TO S.1587, AUTHORIZING FUNDS FOR ANTIRECESSIONARY PUBLIC WORKS PROGRAMS FOR FISCAL 1976; THE AMENDMENT WOULD CHANGE THE FORMULA USED TO ALLOCATE AMONG THE SEVERAL STATES APPROXIMATELY $9 BILLION IN IMPOUNDED WATER POLLUTION CONTROL FUNDS.","TO TABLE TALMADGE AMENDMENT TO S.1587, AUTHORIZING FUNDS FOR ANTIRECESSIONARY PUBLIC WORKS PROGRAMS FOR FISCAL 1976; THE AMENDMENT WOULD CHANGE THE FORMULA USED TO ALLOCATE AMONG THE SEVERAL STATES APPROXIMATELY $9 BILLION IN IMPOUNDED WATER POLLUTION C",7,701,7,701
12368,94,2,344,RS0940344,7/29/75,1975,7,29,NA,NA,60,35,-0.81,0.352,-0.109,-0.747,-44.992,S1587,NA,NA,NA,TO AMEND S. 1587 BY CHANGING THE FORMULA USED TO ALLOCATE AMONG THE SEVERAL STATES APPROXIMATELY $9 BILLION IN PREVIOUSLY IMPOUNDED WATER POLLUTION CONTROL FUNDS.,TO AMEND S. 1587 BY CHANGING THE FORMULA USED TO ALLOCATE AMONG THE SEVERAL STATES APPROXIMATELY $9 BILLION IN PREVIOUSLY IMPOUNDED WATER POLLUTION CONTROL FUNDS.,7,701,7,701
12651,94,2,482,RS0940482,11/12/75,1975,11,12,NA,NA,89,0,0,0,0,0,0,HR8841,NA,NA,NA,"TO PASS H.R. 8841, A BILL TO EXTEND FOR 2 YEARS THE AUTHORITY OF THE ENVIRONMENTAL PROTECTION AGENCY TO REGULATE PESTICIDES AND RELATED CHEMICALS.","TO PASS H.R. 8841, A BILL TO EXTEND FOR 2 YEARS THE AUTHORITY OF THE ENVIRONMENTAL PROTECTION AGENCY TO REGULATE PESTICIDES AND RELATED CHEMICALS.",7,704,7,704
13143,94,2,1036,RS0941036,7/28/76,1976,7,28,NA,NA,45,51,0.069,-0.08,-0.08,-0.457,-43.389,S3219,NA,NA,NA,"TO AGREE TO A SUBSTITUTE AMENDMENT FOR THE BAKER AMENDMENT (SEE R.C. 426) TO S. 3219, THE PROPOSED CLEAN AIR ACT AMENDMENTS OF 1976. THE BENTSEN AMENDMENT REDUCES THE PERFORMANCE WARRANTY ON AUTO EMISSION CONTROL SYSTEM FROM 5 YEARS OR 50,000 MILES TO 18 MONTHS OR 18,000 MILES, WHICHEVER COMES FIRST.","TO AGREE TO A SUBSTITUTE AMENDMENT FOR THE BAKER AMENDMENT (SEE R.C. 426) TO S. 3219, THE PROPOSED CLEAN AIR ACT AMENDMENTS OF 1976. THE BENTSEN AMENDMENT REDUCES THE PERFORMANCE WARRANTY ON AUTO EMISSION CONTROL SYSTEM FROM 5 YEARS OR 50,000 MILES TO",7,705,7,705
13200,94,2,1065,RS0941065,8/3/76,1976,8,3,NA,NA,17,74,0.028,0.775,-0.549,-1.002,-10.673,S3219,NA,NA,NA,"TO AMEND THE MOSS AMENDMENT (SEE RC 455) TO S. 3219, BY PROVIDING THAT DURING THE PERIOD OF PROPOSED STUDY NOTHING IN THE CLEAN AIR ACT SHALL BE CONSTRUED TO REQUIRE THE ESTABLISHMENT OF FEDERAL STANDARDS MORE STRINGENT THAN PRIMARY AND SECONDARY AIR QUALITY STANDARDS.","TO AMEND THE MOSS AMENDMENT (SEE RC 455) TO S. 3219, BY PROVIDING THAT DURING THE PERIOD OF PROPOSED STUDY NOTHING IN THE CLEAN AIR ACT SHALL BE CONSTRUED TO REQUIRE THE ESTABLISHMENT OF FEDERAL STANDARDS MORE STRINGENT THAN PRIMARY AND SECONDARY AIR",7,705,7,705
13202,94,2,1066,RS0941066,8/3/76,1976,8,3,NA,NA,31,63,-0.318,0.616,-0.116,-0.565,-35.58,S3219,NA,NA,NA,"TO AMEND S. 3219, BY DELETING SECTION 6 AND DIRECTING THE NATIONAL COMMISSION ON AIR QUALITY TO CONDUCT A 1-YEAR STUDY OF THE OVERALL EFFECTS OF PREVENTING SIGNIFICANT DETERIORATION OF AIR QUALITY.","TO AMEND S. 3219, BY DELETING SECTION 6 AND DIRECTING THE NATIONAL COMMISSION ON AIR QUALITY TO CONDUCT A 1-YEAR STUDY OF THE OVERALL EFFECTS OF PREVENTING SIGNIFICANT DETERIORATION OF AIR QUALITY.",7,705,7,705
13210,94,2,1070,RS0941070,8/3/76,1976,8,3,NA,NA,30,57,0.055,-0.995,0.181,0.353,-36.502,HR10612,NA,NA,NA,"TO AMEND H.R. 10612, BY DENYING DEDUCTIONS FOR CERTAIN EXPENSES OF AUTOMOBILES WHICH DO NOT MEET AVERAGE FUEL ECONOMY STANDARDS.","TO AMEND H.R. 10612, BY DENYING DEDUCTIONS FOR CERTAIN EXPENSES OF AUTOMOBILES WHICH DO NOT MEET AVERAGE FUEL ECONOMY STANDARDS.",7,705,7,705
13222,94,2,1076,RS0941076,8/4/76,1976,8,4,NA,NA,23,59,0.072,0.275,-0.143,-0.596,-25.178,S3219,NA,NA,NA,TO AMEND THE RANDOLPH AMENDMENT (SEE R.C. 466) TO S. 3219 BY DELAYING ENACTMENT OF SECTION 6 FOR 1 YEAR DURING WHICH THE COMMISSION ON AIR QUALITY WOULD STUDY THE OVERALL EFFECT OF SUCH A SECTION.,TO AMEND THE RANDOLPH AMENDMENT (SEE R.C. 466) TO S. 3219 BY DELAYING ENACTMENT OF SECTION 6 FOR 1 YEAR DURING WHICH THE COMMISSION ON AIR QUALITY WOULD STUDY THE OVERALL EFFECT OF SUCH A SECTION.,7,705,7,705
13224,94,2,1077,RS0941077,8/4/76,1976,8,4,NA,NA,83,1,0,0,0,0,0,S3219,NA,NA,NA,"TO AMEND S. 3219, BY PROVIDING FOR THE ENACTMENT OF SECTION 6, REQUIRING THE PREVENTION OF SIGNIFICANT DETERIORATION OF AIR QUALITY AND ESTABLISHING A COMMISSION TO STUDY THE EFFECTS OF ITS IMPLEMENTATION.","TO AMEND S. 3219, BY PROVIDING FOR THE ENACTMENT OF SECTION 6, REQUIRING THE PREVENTION OF SIGNIFICANT DETERIORATION OF AIR QUALITY AND ESTABLISHING A COMMISSION TO STUDY THE EFFECTS OF ITS IMPLEMENTATION.",7,705,7,705
13226,94,2,1078,RS0941078,8/4/76,1976,8,4,NA,NA,26,65,-0.568,0.664,0.349,0.695,-32.239,S3219,NA,NA,NA,"TO AMEND S. 3219, BY MODIFYING THE DEFINITION OF """"""""""""""""INCREMENTS"""""""""""""""" TO ALLOWED INCREASES IN POLLUTION LEVELS TO INCLUDE INCREMENTS IN POLLUTION FROM ALL SOURCES, INCLUDING """"""""""""""""NON-MAJOR"""""""""""""""" ONES.",ONES.,7,705,7,705
13228,94,2,1079,RS0941079,8/4/76,1976,8,4,NA,NA,35,56,0.05,-0.622,0.173,0.452,-34.274,S3219,NA,NA,NA,"TO AMEND S. 3219, BY INCLUDING IN CLASS I CATEGORY, WHERE THE LEAST AMOUNT OF POLLUTION IS ALLOWED, THOSE NATIONAL MONUMENTS IN EXCESS OF 10,000 ACRES WHICH ARE MANAGED BY THE NPS.","TO AMEND S. 3219, BY INCLUDING IN CLASS I CATEGORY, WHERE THE LEAST AMOUNT OF POLLUTION IS ALLOWED, THOSE NATIONAL MONUMENTS IN EXCESS OF 10,000 ACRES WHICH ARE MANAGED BY THE NPS.",7,705,7,705
13245,94,2,1088,RS0941088,8/4/76,1976,8,4,NA,NA,34,36,0.33,-0.728,-0.104,-0.295,-38.576,HR10612,NA,NA,NA,"TO TABLE THE HART (COLO.) AMENDMENT TO H.R. 10612. THE HART AMENDMENT, IN THE NATURE OF A SUBSTITUTE FOR SECTION 2006, RE: CREDIT FOR PURCHASES OF MATTER WHICH CAN BE RECYCLED, PROVIDES FOR A STUDY OF RECYCLING INCENTIVES IN LIEU OF LANGUAGE PROVIDING TAX CREDITS FOR RECYCLERS OF SOLID WASTE SYSTEMS.","TO TABLE THE HART (COLO.) AMENDMENT TO H.R. 10612. THE HART AMENDMENT, IN THE NATURE OF A SUBSTITUTE FOR SECTION 2006, RE: CREDIT FOR PURCHASES OF MATTER WHICH CAN BE RECYCLED, PROVIDES FOR A STUDY OF RECYCLING INCENTIVES IN LIEU OF LANGUAGE PROVIDING",7,707,7,707
13247,94,2,1089,RS0941089,8/5/76,1976,8,5,NA,NA,30,61,-0.31,0.089,0.243,0.443,-31.416,S3219,NA,NA,NA,"TO AMEND S. 3219, BY REQUIRING AUTOMOBILE MANUFACTURES TO COMPLY WITH STATUTORY ESTABLISHED AUTOMOBILE EMISSION STANDARDS IN 1979 RATHER THAN 1980.","TO AMEND S. 3219, BY REQUIRING AUTOMOBILE MANUFACTURES TO COMPLY WITH STATUTORY ESTABLISHED AUTOMOBILE EMISSION STANDARDS IN 1979 RATHER THAN 1980.",7,705,7,705
13249,94,2,1090,RS0941090,8/5/76,1976,8,5,NA,NA,33,58,-0.157,-0.274,0.222,0.412,-31.291,S3219,NA,NA,NA,"TO AMEND S. 3219, BY RETAINING THE NITROGEN OXIDE EMISSION STANDARD OF 0.4 GRAMS PER MILE FOR AUTOMOBILES INSTEAD OF RELAXING STANDARD TO 1.0 GRAMS PER MILE.","TO AMEND S. 3219, BY RETAINING THE NITROGEN OXIDE EMISSION STANDARD OF 0.4 GRAMS PER MILE FOR AUTOMOBILES INSTEAD OF RELAXING STANDARD TO 1.0 GRAMS PER MILE.",7,705,7,705
13251,94,2,1091,RS0941091,8/5/76,1976,8,5,NA,NA,28,64,-0.457,0.484,0.179,0.287,-39.76,S3219,NA,NA,NA,"TO AMEND S. 3219, BY BANNING THE USE OF AEROSAL CONTAINERS CONTAINING HALOCARBONS AFTER JANUARY 1, 1978 UNLESS IT IS DETERMINED THAT THEIR USE IS NOT HARMFUL TO HEALTH OR PUBLIC WELFARE.","TO AMEND S. 3219, BY BANNING THE USE OF AEROSAL CONTAINERS CONTAINING HALOCARBONS AFTER JANUARY 1, 1978 UNLESS IT IS DETERMINED THAT THEIR USE IS NOT HARMFUL TO HEALTH OR PUBLIC WELFARE.",7,705,7,705
13253,94,2,1092,RS0941092,8/5/76,1976,8,5,NA,NA,20,70,0.214,0.115,-0.365,-0.592,-12.561,S3219,NA,NA,NA,"TO AMEND S. 3219, BY PERMITTING STATES TO ADOPT MORE STRINGENT STANDARDS IN ORDER TO PROTECT CERTAIN LANDS FROM POLLUTION.","TO AMEND S. 3219, BY PERMITTING STATES TO ADOPT MORE STRINGENT STANDARDS IN ORDER TO PROTECT CERTAIN LANDS FROM POLLUTION.",7,705,7,705
13255,94,2,1093,RS0941093,8/5/76,1976,8,5,NA,NA,78,13,0.551,-0.498,0.282,0.447,-17.313,S3219,NA,NA,NA,TO PASS S. 3219.,TO PASS S. 3219.,7,705,7,705
13293,94,2,1112,RS0941112,8/6/76,1976,8,6,NA,NA,50,30,0.173,0.985,0.011,0.067,-57.267,HR10612,NA,NA,NA,"TO TABLE THE GRAVEL AMENDMENT, ALLOWING A TAX CREDIT FOR PURCHASES OF MATERIAL FOR RECYCLING, TO H.R. 10612.","TO TABLE THE GRAVEL AMENDMENT, ALLOWING A TAX CREDIT FOR PURCHASES OF MATERIAL FOR RECYCLING, TO H.R. 10612.",7,707,7,707
13404,94,2,1171,RS0941171,9/1/76,1976,9,1,NA,NA,39,38,-0.105,-0.016,-0.235,-0.694,-23.006,S2710,NA,NA,NA,"TO AMEND S. 2710, WATER POLLUTION CONTROL AMENDMENTS, BY GIVING THE CORPS OF ARMY ENGINEERS PRIMARY RESPONSIBILITY TO ISSUE PERMITS FOR DREDGE OR FILL MATERIALS IN AREAS ADJACENT TO NAVIGABLE WATERS.","TO AMEND S. 2710, WATER POLLUTION CONTROL AMENDMENTS, BY GIVING THE CORPS OF ARMY ENGINEERS PRIMARY RESPONSIBILITY TO ISSUE PERMITS FOR DREDGE OR FILL MATERIALS IN AREAS ADJACENT TO NAVIGABLE WATERS.",7,701,7,701
13406,94,2,1172,RS0941172,9/1/76,1976,9,1,NA,NA,34,35,-0.101,0.093,-0.192,-0.731,-21.639,S2710,NA,NA,NA,TO TABLE A MOTION TO RECONSIDER THE VOTE BY WHICH THE SENATE AGREED TO THE TOWER AMENDMENT (SEE R.C. 560) TO S. 2710.,TO TABLE A MOTION TO RECONSIDER THE VOTE BY WHICH THE SENATE AGREED TO THE TOWER AMENDMENT (SEE R.C. 560) TO S. 2710.,7,701,7,701
13408,94,2,1173,RS0941173,9/1/76,1976,9,1,NA,NA,41,38,-0.134,0.081,0.182,0.661,-26.815,S2710,NA,NA,NA,TO RECONSIDER THE VOTE BY WHICH THE SENATE AGREED TO THE TOWER AMENDMENT (SEE R.C. 560) TO S. 2710.,TO RECONSIDER THE VOTE BY WHICH THE SENATE AGREED TO THE TOWER AMENDMENT (SEE R.C. 560) TO S. 2710.,7,701,7,701
13410,94,2,1174,RS0941174,9/1/76,1976,9,1,NA,NA,39,40,-0.088,-0.055,-0.252,-0.73,-23.014,S2710,NA,NA,NA,"TO AGREE, ON A SECOND VOTE, TO THE TOWER AMENDMENT (SEE R.C. 560) TO S. 2710.","TO AGREE, ON A SECOND VOTE, TO THE TOWER AMENDMENT (SEE R.C. 560) TO S. 2710.",7,701,7,701
13583,94,2,1273,RS0941273,9/28/76,1976,9,28,NA,NA,74,0,0,0,0,0,0,HR15445,NA,NA,NA,TO PASS H.R. 15445 PROVIDING FOR THE CONSERVATION AND PRESERVATION OF WHALES.,TO PASS H.R. 15445 PROVIDING FOR THE CONSERVATION AND PRESERVATION OF WHALES.,7,709,7,709
